phenomenon;['reng', 'regen', 'regn'];Reng is a flissiga Niedaschlog vom Himme.
phenomenon;['gfrea', 'frost'];Gfrea oda Frost gibts wann de Lufttemperatua untan Gfreapunkt vo Wossa foit.
physical-body;['komet', 'schwoafstean'];A Komet oda Schwoafstean is a kloana Himmeskeapa, wo zumindest zeitweis vo oana Gashuin umgebm is und an Gasschwoaf hod.
physical-body;['meteoroid'];Meteoroidn san kloane Objekte vom Sunsystem af oana Umlaffbahn um de Sun, vo dena a poa de Eadboh kreizn.
physical-body;['aitzal', 'aizal', 'alzerl', 'teilchen'];A Aitzal is in da Physik a winze kloans Objekt in an System.
physical-body;['elementaraitzal', 'elementarteilchen'];Elementaraitzal san de kloanstn bekanntn Baustoana vo da Materie.
physical-body;['photon'];Photonen hoassn de Aitzal, aus dene wäis Läit (gr.
physical-body;['elektron'];As Elektron is a da negative Ladungsträger von Atomen.
physical-body;['mond', 'erdmond', 'erdnmond'];Da Mond is da oanzige natialiche Satellit vo da Eadn.
physical-body;['asteroid', 'kloaplanetn', 'planetoiden'];Asteroidn, Kloaplanetn oda Planetoiden san kloane Himmeskeapa, wo si af keplerschn Umlaffbohna um de Sun bewegn.
physical-body;['alpha centauri'];Alpha Centauri is a etwa 4,34 Lichtjoahr entfernts Doppesternsystem im Sternbuid Centaurus, des wo am sidlichn Sternhimme z segn is.
physical-body;['wödall', 'univeasum', 'des wödall', 'universum', 'weltall'];Unta Wödall oda Univeasum vastähd ma de gsaumte Materie und Energie, vom elementarn Aitzal [Teilchen] bis za de Galaxien.
physical-body;['eadn', 'wäidkugl', 'ead', 'erde', 'erdn'];De Eadn is mid ana duachschnittlichn Entfeanung vo da Sun vo 149,6 Milliona km aus da dritte Planet im Sunsystem.
physical-body;['arcturus'];Arcturus is a Oat in Simbabwe.
physical-body;['mars', '♂'];Da Mars is, vo da Sun aus gsegn, da viate Planet in unsam Sunsystem und da aissare Nochba vo da Eadn.
physical-body;['ceres', '(1) ceres'];Ceres is a Zweagplanet und mit am Equatorduachmessa vo 975 km des gresste Objekt im Asteroidn-Haptgiatl.
physical-body;['merkur'];Da Merkur is mit am Duachmessa vo knapp 4880 km da kloanste und mit oana duachschnittlichn Entfeanung vo da Sun vo eppa 58 Muillionen km da sunnexte und somit aa da schnejste Planet im Sunsystem.
physical-object;['gummistiefe', 'gummistiefel', 'gummistiefl'];Gummistiefe san Schuah, de wo bis zu de Wadln oda Knia genga.
physical-object;['radl', 'foaradl'];A Radl, oda Foaradl, is a aspurigs Foazeig mit zwa Radln, des wos mit Musklkroft betriem wiad.
physical-object;['wognbuag', 'wognburg'];Wognburg, dt.Wagenburg, bschreibt de Gschicht vo de Wognburgn und vo wems augwendt wuan san.
physical-object;['luger-p08'];De Luger-P08 oda Pistoin 08 is a Pistoin, de wo vom Östareicha Georg J. Luger konstruiat worn is.
physical-object;['auto'];A Auto is a Wogn, dea wo mid an Motor otriebn wead und zan Transport vo Menschn, Viechan und Lostn deant.
physical-object;['rogl'];A Rogl hoaßt se in Rengschbuach und aa no in a boa andane Fleckan in da Owapfoiz und manchmoi aa in Niedabayern so eppse wia a Einkaufsdüdn, owa aa eppse zum Vabacka vo Guazln, kloane Sachan undsoweida.
physical-object;['giadl'];A Giadl
physical-object;['mountainbike', 'beagradl'];A Beagradl oda Mountainbike is im Normalfoi a Foarradl mid dem wo ma an Beag afe foahn ko oda aa wieda obe.
physical-object;['segelboot'];A Segelboot is a Spoatboot, des in easta Linie duach Windkroft betriebn werd.
physical-object;['biafloschn'];A Biafloschn is a Behejta zun Konservian vo Bia.
physical-object;['trompetn', 'trompete'];De Trompetn is a Instrument zan Musimocha.
physical-object;['bewegliche bruck', 'bewegliche brücke'];A beweglich Bruck is a Bruck, dean Trogweak ois Gonzes oda in Tein bewegt wean ko.
physical-object;['pemsl'];A Pemsl oda Pemsdl
physical-object;['puff'];A Puff is a Hüttn oda a Tö davo, wo Weiba a gaches Gschbusi mit dena åfanga, de eana gscheit Schmattes gebn.
physical-object;['zuawaziaga', 'teleobjektiv'];In da Fotografie is a Zuawaziaga a Synonym fia a Teleobjektiv.
physical-object;['hobe', 'hobel', 'hobl'];Da Hobe oda Hobl is a Werkzeig zum Bearbaatn vo Hoiz.
physical-object;['scheibdrucha', 'schubkarre'];A Scheibdrucha oda Scheibdruchn, aa Radldrog, is in da Regl a Wagl mid oan Radl und zwoa Griff on da gengiwaliengdn Seitn, mid dena s vo oana Peason gfiahd wead.
physical-object;['gödtåschn', 'gödtoschn', 'geldbeutel', 'geldtasche', 'portemonnaie', 'geldbörse'];A Gödtoschn, weanarisch Gödtaschl, aa Börsl, Portmonnää, Gejdbeidl, is a Taschl, wo ma sei Göd einituat, damit mas net valiat und damits praktisch zsaumghoidn wead, woduach ma aa glei waaß, wiavü ma grod hot.
physical-object;['civic centre'];Civic Centre is a Oat in Simbabwe.
physical-object;['abtei'];A Abtei is a Klosta, wo regulea a Abt oda a Abtissin voastähd.
physical-object;['soaffa', 'saff', 'seife', 'soaf'];A Soaffa oda Soaf is a Soiz vo ana Fettsaire.
physical-object;['leiberl'];A Leiberl is a Hemad mit kuaze Äamen und an rundn oda V-feamign Ausschnitt, owa ohne Krogn, Toschn oda Knepf.
physical-object;['pudlhaubn'];A Pudlhaubn oda Pudlhaum
physical-object;['woxmoigreim'];A Woxmoigreim, aa Woxgreim, Fättstift oda Fättgreim, isa Utensill zan Moina oda Schreim.
physical-object;['drahdiwaberl', 'draadiwawal'];A Drahdiwaberl oda Drahdiwawal, aa Dralla is a Spüzeig, des wos auf ana Untalog um a senkrechte Axn draht wiad und do a Weu de Ausrichtung hoid und aufm Untagrund umadumwaundat.
physical-object;['bleamedopf'];A Bleamedopf, in Estareich sogt ma aa Blumansteckl
physical-object;['kirbn', 'zega'];A Kirbn is a geflochtener Behölter, moastns aus am hoizernen, biagsamen Material zum Transpot oda Lagern von Sachern.
physical-object;['kirbn', 'zega'];A Zega oda Zeger
physical-object;['bloachsempara', 'giasskanna', 'giaßkanna', 'gießkanne'];Bloachsempara is a Giaßkanna.
physical-object;['schuah', 'schuach'];A Schuah, aa Schuach (vom oidhochd.
physical-object;['häferl', 'hafal', 'haferl', 'häfal'];A Häferl, aa Haferl oda Häfal is a klaana Kochtopf odar a Schoin mit an Hengl.Häferln wean vua oim zum Dringn vo woame oda haasse Drangln wia Kafää, Gaugau oda Tää vawendt.
physical-object;['schaa', 'schere'];A Schaa is a Weakzeig zun Zaschneidn vo vaschiednan Materiai.
physical-object;['zeidung', 'zeitung'];As Woat Zeidung woa uaspringli da Begriff fia a bliabige Nochricht . da Begriff hod jedoch im Laff van 18.
physical-object;['museen'];In Museen hom Olle wödweidn Museen Plotz.
physical-object;['schnäbäsn', 'schnääbesn', 'schneebesen'];A Schnääbesn oda Schnääruadn is is a Kuchlgerät, mid dem flissige und hoibflissige Zuadadn schaumig afgschlogn oda fein vamischt wean.
physical-object;['magnet'];A Magnet is a Stickl aus an Materiäu, des andre magnetische Materiäulien zuawezaaht oder weggastesst.
physical-object;['brauarei', 'brauerei'];A Brauarei is a Betrieb bzw.
physical-object;['diandlgwand', 'dirndl', 'dirndlgwand'];A Diandlgwand, aa Diandl, Dirndl oda Deandl, is a Gwand, wo si vo da Art nach am traditionelln Gwand vo am Diandl richt.
physical-object;['pfluag', 'pflug'];A Pfluag
physical-object;['tomahawk'];Da Tomahawk is de traditionelle Streitaxt und a Oizweck-Weakzeig vo de Indiana gwen.
physical-object;['pipm', 'pipp', 'wasserhahn'];Pipm ódr Pipp isch die Pezeichnung fir an Prunnenroahr unt fir an Wåssrhåhn, aa fir an Håhn pan Weinfåss ódr irgnt a Håhn fir Flissigkeitn
physical-object;['münzrohling'];Dea Münzrohling, aa Ronde oda Schrötling, is des unprägte Metallstick, des zum Prägn von Münzn vawendt wad.
physical-object;['rock'];A Rock wor im Middloita a Obagwand mit Earmen fia boade Gschlechta Heit moants im Boarischn moast Fraungwand oda a Monnagwand.
physical-object;['fiada', 'kiddlschiazn', 'schurz'];Da Fiada
physical-object;['hemat', 'hemd'];A Hemat is a Gwand.
physical-object;['handy', 'mobuitelefon'];A Handy oda Mobuitelefon is a drogboas Telefon, des wo iwa Mobuifunknetz Sproch, Texte und sogoa a Datn ausdauschn ko.
physical-object;['grompm', 'picki', 'spitzhock'];A Grompm, aa Spitzhock oda Picki gnennt, is a Handweakzeig, mid dem wo af Stoa, Feis oda stoanign Bodn gorbat wern ko.
physical-object;['wirtshaus'];A Wirtshaus oda af Boarisch a Wirtschaft is a Ort, wo ma wos zum Ess'n und Dringa griagd.
physical-object;['synagogn', 'synagoge'];A Synagogn is a jidischa Vasaumlungs- und Sakralbau fias Bätn, fias Studium vau de heulign Schriftn und fia de Schulung.
physical-object;['kopfduach', 'kopfdiachl', 'kopftuch'];A Kopfduach is a Stickl Stoff, wo am Schädl drong wead.
physical-object;['tastatua', 'tastatur'];A Tastatua brauchd a jeda, dea mid'm Computer oabatn wui.
physical-object;['eiskostn', 'eisschrank', 'kühlschrank'];Da Eiskostn oda Eisschrank is a mechanischa Kostn zun Aufbewoahrn vo Lemsmiddl, de wo leicht schlecht wean.
physical-object;['feitl', 'feitel'];A Feitl oda Feitel
physical-object;['hoizweakstoff'];Hoizweakstoff is a Weakstoff, dea wos duach Zaklanan vo Hoiz und aunschliassands Zaumaduan vo anzlnan Bestaundteun eazeigt wiad.
physical-object;['broadhogg', 'breitbeil'];De Broadhogg is a Hogg oda Hagge zum Beorwatn vo Rundhoiz.
physical-object;['buag', 'burg'];A Buag is im weidan Sinn a gschlossana Weahbau, dea wo se bis in de Fruahgschicht zruckvafoing losst.
physical-object;['violoncello', 'stehgeign', 'cello'];De Stehgeign oda des Violoncello, aa kuaz Cello is a aus vaschiedene Hoizortn gfertigts Streichinstrument aus da Viola-da-braccio-Famij.
physical-object;['monokl', 'einglas', 'monokel'];Des Monokl, ma kau aa Einglas song, is a Sehhüüf, de wos nua aa Glasl hod und ned zwaa, wia de heit iwlichn Brüün.
physical-object;['kamera'];Kamera is dea Begriff, dea am heifigstn fia an Photoapparat bnutzt werd.
physical-object;['dampflok', 'damflok'];A Dampflok is a Lok, de mid Wossadampf odrim werd.
physical-object;['wigwam'];Wigwam nennt ma de Hittn vo bestimmtn Vejkan vo de nordamerikanischn Indiana.
physical-object;['toboggan'];A Toboggan is a Schlittn ohne Kufn, wo vo de noadamerikanischn Indiana in Kanada entwicklt woan is.
physical-object;['reechn'];A Reechn
physical-object;['schame'];A Schame
physical-object;['gilet', 'schilee', 'schilettl'];As Gilet, aa Schilee oda Schilettl,
physical-object;['beischltelefon', 'stethoskop'];A Beischltelefon oda Stethoskop is im engan Sinn a medizinischs Gerät, des wos Geraische im Brustkoab bessa heaboa mocht.
physical-object;['sawmills', 'sägewerk'];Sawmills is a Oat in Simbabwe.
physical-object;['zitha', 'zither'];D Zitha is a bekannts Voiksmusi-Instrument in de Oipnlända.
physical-object;['drumme', 'trommel'];A Drumme
physical-object;['wigwam'];Wigwam nennt ma de Hittn vo bestimmtn Vejkan vo de nordamerikanischn Indiana.
physical-object;['tipi'];Tipi nennt ma s Zejt vo de noadamerikanischn Indiana.
physical-object;['the gazette'];The GazettE oda a Gazette gnennt, is a japanische Visual-Kei-Rockband.
physical-object;['brün', 'brüün', 'spekuliereisn', 'brille'];A Brüün is a Gstö, mit dem Leid, de schlechd seng, wieda bessa seng kinan.
physical-object;['esstabal', 'essstäbchen', 'esstabaln'];Esstabal (dt.
physical-object;['gong'];A Gong is a runds Musiinstrument.
physical-object;['glocknspui', 'glockenspiel'];A Glocknspui is a Stobspui aus da Gruppm vo de Metoiophone.
physical-object;['autokennzeichn', 'kfz-kennzeichen', 'kennzeichn', 'kfz-kennzeichn', 'kfz-kénnzeichn', 'kfz-schuidl', 'kraftfahrzeugkennzeichen', 'nummernschild', 'nummerntafel', 'targa'];A Autokennzeichn is a Registrierungsnumma, de wos a jeda, der wos a Auto oda a ondas Groftfohrzeig fohrd, vom zuaständing Stroßnvakeasomt griagt.
physical-object;['botschamperl', 'botschámperl', 'nachttopf'];A Botschamperl is a gräßane Schissl mit am Hengl, in dem Mandl un Weibal in da Nacht eahna Gschäftl varichtn kennan.
physical-object;['compact disc', 'cd', 'compact disk'];De Compact Disc (kurz: CD, engl.
physical-object;['kuche', 'küche'];A Kuche oda Kuchl, aa Kuhe, is a Raum oda a Tei vo an Raum, wo ma kocht und Essn mocht.
physical-object;['tallit'];A Tallit oda Tallith is a jidischa Gebetsumhaung.
physical-object;['passaschiaschiff', 'passagierschiff'];A Passaschiaschiff oda Foahgostschiff is a Wossafoahzeig vo spezieja Konstrukzion, Ausristung und Eihrichtung za da Bfeadrung und Vasoagung vo Peasona af Binnenwossastroßn, af Gstodgwassan oda iwa Sää
physical-object;['glabberl', 'sandaln'];Glabberl oda Sandaln san Sommaschua.
physical-object;['tabak-trafik'];Tabak-Trafikn gibts nua in Estareich.
physical-object;['swagger stick'];A Swagger stick oda Offiziassteckal wead vo Offizian ois Symboi vo eanara Autorität trogn.
physical-object;['radl', 'fahrrad', 'foaradl', 'rad'];A Radl oda Rod is a kroasrunda Gegnstand, dea wo si um a Axn draan ko.
physical-object;['glarinettn', 'klarinette', 'klarinettn'];D' Glarinettn ghead zu de tipisch boarischn Musikinschtrumente, de in da boarischn Voiksmusi midspuin.
physical-object;['toupet'];A Toupet is a Hoartei bzw.
physical-object;['fotznhobe', 'fotzhobl', 'mundharmonika'];Da Fotznhobe oda da Fotzhobl oda de Fotzorgl is a Musiginschtrument, des wo midm Mai blosn wead.
physical-object;['speis', 'speisekammer'];A Speis is a klaana Raum, dea wos ois Vuarotskauma fia Speisn und Drangln gnutzt wiad.
physical-object;['mokasin', 'mokassin'];Da Mokasin is a Schuah, dea wo aus woachn Leda gmocht is.
physical-object;['haglstegga', 'haglstäga'];Da Haglstegga, boarisch deitsch Hagelstecken
physical-object;['zeichnkoin', 'zeichenkohle'];A Zeichnkoin bstehd aus vakoide Hoizstabal, bzw.
physical-object;['droadkåstn', 'troadkasten'];A Droadkostn is a hüzana Bau, wiar a Schdodl oda a Schaian, wo fria bai de Bauan s'Droad aiglogat woan is.
physical-object;['klampfen', 'gitarr', 'gitarre', 'gitarrn', 'klampfe', 'klampfm', 'klampfn'];A Klampfen, aa Gitarrn, is a Lautninstrument.
physical-object;['tuam', 'turm', 'türme'];A Tuam
physical-object;['kleaolog', 'glairolog', 'kläranlage'];A Kleaolog oda Kleaaulog is a Olog, de wo as Obwossa reiniga duat.
physical-object;['hoidal', 'reißnagel'];A Hoidal oda Reißnogl
physical-object;['kondom'];A Kondom is a dünna Gummi, den wos ma ban Gschlechtsvakea iwan errigiatn Zipfe stroaft.
physical-object;['haubn'];A Haubn oda Haum is a Gwand fian Schädl.
physical-object;['ruadaleiberl'];A Ruadaleiberl is a Hemad ohne Äamen, ohne Krogn, Toschn oda Knepf.
physical-object;['uah', 'uhr'];A Uah is a Inschtrument, wo de Zeid ozoagn oda a Zeidspann messn duad.
physical-object;['hau', 'haindl', 'hainl'];A Hau, aa Haindl oda Hainl, is a Weakzeig zua Bodnbeorwatung fia Fejd und Goartn.
physical-object;['blusn', 'bluse'];A Blusn is a eha lose sitzads Obagwand, wo heit nua no vo Deandln und Fraun zan Kiddl oda zua Hosn drong wead.
physical-object;['traunsfoamatoa', 'trafo', 'transformator'];A Traunsfoamatoa oda kuaz Trafo bsteht aus zwoa Spuin, de mit an Eisnkean mitaranaund vabundn san.
physical-object;['traunsfoamatoa', 'trafo', 'transformator'];A Traunsfoamatoa oda kuaz Trafo bsteht aus zwoa Spuin, de mit an Eisnkean mitaranaund vabundn san.
physical-object;['totempfoi', 'totempfahl'];A Totempfoi is a monumentale Skujptua, de wo aus an grossn Baamstomm gschnitzt und nacha ogmoit wead.
physical-object;['amulett'];A Amulett is a Gegnstod, dem o magische Kräfte zuagschriem wean.
physical-object;['bulldog', 'bullog', 'schleppa', 'traktor'];A Bulldog, aa Traktor oda Schleppa is a Zugmaschin, de wo am Ofang vom 20.
physical-object;['maibaam', 'maibam', 'maibaum'];A Maibaam is a gschmickta Baam bzw.
physical-object;['degl'];A Degl
physical-object;['budanfassl', 'butterfass'];A Budanfassl is a Behejta, in den da obgschepfde Rahm gem und oschliaßnd zua Budan gstompfd oda gschlong wead.
physical-object;['schofar'];Da Schofar oda s Schofarheandl, jidd.
physical-object;['kiddl', 'kittel', 'kittl'];A Kiddl wor im Boarischn uaspringle a jeds Gwand, des wo iban Hemad und iba da Blusn drogn worn is.
physical-object;['semafor', 'winkeralphabet'];Des Semafor deant zua optischn Nochrichtniwamittlung zwischn Schiffn.
physical-object;['spuizeig', 'spielzeug'];Spuizeig san Sachan, de wo zan Spuin vawendt wean.
physical-object;['zuawaziaga', 'feanroa', 'fernrohr', 'refraktor'];A Zuawaziaga oda Feanroa is a optisches Inschtrument, wo Sochan de wo weit wegga san, vui gressa ausschaugn losst.
physical-object;['hogg', 'hogga', 'hoggn', 'hagge', 'axt', 'hacke', 'åxt'];A Hogg, aa Hogga oda Hoggn, is a oids Weakzeig zan spoitn, zatein und forma vo Hoiz.
physical-object;['traunsfoamatoa', 'trafo', 'transformator'];A Traunsfoamatoa oda kuaz Trafo bsteht aus zwoa Spuin, de mit an Eisnkean mitaranaund vabundn san.
physical-object;['kondensatoa', 'kondensator'];A Kondensatoa
physical-object;['sans', 'sansn', 'sengsn', 'sense'];A Sans is a Werkzeig zum Mahn vo Gras und Droad.
physical-object;['biaschtn', 'bembsl'];A Biaschtn oda a Biaschtl
physical-object;['zuawaziaga', 'reflektor', 'teleskop'];A Zuawaziaga, aa Reflektor oda Teleskop, is a optischs Gerät fia d Astronomie.
physical-object;['musiginschtrument', 'musiinschtrument', 'musikinstrument'];A Musiinschtrument is a Gegnstand mid dem wo ma Musi macha ko.
physical-object;['loft', 'unterdåch', 'dachboden'];Der Pegriff Unterdåch wert in Óst- unt Sidtiról, mit Ausnåhm van Vinschgau, zun Toal aa in Nórdtiról verwéndet.
physical-object;['loft', 'unterdåch', 'dachboden'];A Loft is a Wohnung in an friaan Geweabe- bzw.
physical-object;['janka', 'jacke', 'janker', 'joppe'];Da Janka oder de Joppn is a Obagwand und entspricht da breissischn Jackn.
physical-object;['bumbareddn'];A Bumbareddn is genarej a Hosn fian Intimbereich.
physical-object;['ottoman', 'couch', 'kanapee', 'kautsch', 'sofa'];A Ottoman, a Kanapee, Sofa oda Kautsch gnennt, is a Mebestickl, auf dem se bequem oana hileng oda mearare hisitzn kina.
physical-object;['liacht', 'licht'];S' Liacht is dea Tei vo da elektromagnetischn Strahlung, den a Mensch mim Aug seng ko.
physical-object;['kunstliacht', 'kunstlicht'];Kunstliacht is Liacht, wos duach kinstliche Liachtquejn eazeigd wead, im Gengsoz zum Dogesliacht.
physical-object;['stoffschluß'];A Stoffschluß is in da Technik a Vabindung vo zwoa Teile, de zsammahoidn, wei atomaren oder molekularn Kräft wirkn.
physical-object;['kuglloga'];A Kuglloga is a Variantn vom Wäizloga.
physical-object;['blendn'];De Blendn is a Bauteil vo Objektive.
physical-object;['gwand', 'gewand', 'gwanda', 'gwaund', 'gwånd', 'kleidung'];Gwand oda Gwanda is da Sammebegriff fia olle Stoffe, wo in Keapa vom Menschn eng einhuin und eam ois Schutz und Ausdrucksmiddl deana.
physical-object;['zuawaziaga', 'fernglas', 'binokular', 'feanglasl', 'fäidstecha', 'gucka', 'opanglasln'];Zuawaziaga ois Feanglasl, aa Gucka oda Binokular gnennt, bestengan im Prinzip aus zwoa zammbautn Feanroa, wo ma mit boade Augn gleizeiti duachschaun ko.
physical-object;['wärmepumpn'];A Wärmepumpn pumpt thermische Energie vo am niedrign Temperaturniveau auf a hoachs.
physical-object;['lorgnon'];Des Lorgnon
physical-object;['braka', 'pracker'];A Braka is Weakzaig mid dem ma an Debich sauwa griagt in dem ma in Schdaub und de Müm aussa brakt.
physical-object;['gåbe', 'gåfi'];Des Internetz oda kuaz Netz, aa Internet, is a wejdweits Netzweak aus vui vaschiedanan Rechnanetzweakn, iwa de wo Datn austauscht wean kena.
physical-object;['eadboahra', 'erdbohrer'];A Eadboahra is a Weakzeig, um Eadlecha ausz'hem.
physical-object;['radl', 'foaradl'];A Radl, oda Foaradl, is a aspurigs Foazeig mit zwa Radln, des wos mit Musklkroft betriem wiad.
physical-object;['bschdegg', 'besteck', 'bstegg'];S'Bschdegg is a wichtiga Bestaundtei vu am jedm Essn.
physical-object;['reindl', 'bräter', 'rein'];A Reindl oda Rein is a flochs rechteckads oda runds Kochgschia mit zwoa Hengln.
physical-object;['gwetschn', 'ziach', 'akkordeon', 'diatonische', 'quetschn', 'ziehharmonika'];Vorlage:Infobox Musikinstrument/Wartung/Parameter Klangbeispiel fehltDe Gwetschn oda Ziach gheat zu de tipisch boarischn Musikinschtrumente, de in da boarischn Voiksmusi a wichtige Roin spuin.
physical-object;['westn'];A Westn (dt.
physical-object;['bierzäit', 'biazejt', 'bierzelt', 'biazeit'];A Bierzejt is wos, wo ma si neihocka ko und nachad a Bier vo da Bedienung griagt und wennst mechst, nachad glei a so vui, das di, auf oan Schlog von da Bank obadraht.
physical-object;['zuaweziaga', 'zuawaziaga', 'zuawezaara'];Zuaweziaga oda Zuawezaara san optische Geräte, de wo oam Sachan, de weid weg han, näha herziagn.
physical-object;['ringlspü', 'ringlspüü', 'ringelspiel'];A Ringlspüü, aa Ringlgspüü oda Ringlspui
physical-object;['laser', 'light amplification by stimulated emission of radiation'];LASER is a englische Abkirzung fia Light Amplification by Stimulated Emission of Radiation.
physical-object;['sumpfkoich', 'koichfoarb', 'sumpfkalk'];A Sumpfkoich oda Gruamkoich
physical-object;['woidzither', 'cister', 'waldzither', 'zister', 'zitter', 'cyther', 'hoizzither'];De Woidzither, is a Zupfinstrument aus da Familie vo de Lautn.
physical-object;['nochthemmad', 'nåchthemmad', 'nachthemd', 'nochtgwand', 'nochtpfoadl'];A Nochthemmad oda Nochtgwand is a Gwand, wos noamalaweis zum Schloufa oozajgt.
physical-object;['huad', 'hut'];A Huad is a Gwand fian Schädl mid ana umlaffadn Krempn.
physical-object;['bundeslodn', 'bundeslade'];De Bundeslodn, aa Bundeslade, woa a Truchn, de wos vaum Voik Israel ois Kuitgengstaund gnutzt wuan is.
physical-object;['lok'];A Lok oda aa: Lokomotiv is a Foahzeig, wos af Schina foad und sejm koi Ausfliagla oda Kuffan midnimmd.
physical-object;['busbahnhof'];ABusbahnhof aa Omnibusbahhof, Bushof oda Busterminal, is a greaßare Hoitesteinanlog, de ois - meist zentroia - Vaknüpfungspunkt vo vaschiedane Buslinien deant.
physical-object;['hittn', 'hütte', 'hüttn'];A Hittn is im Untaschied zan Haus a oafochs, kloans Gebaide, des wo untaschiedlichn Zweckn deana ko.
physical-object;['e-gitarren', 'e-gitar'];E-Gitarren stähd fia "elektrische Gitarren", oiso a elektrisch vasteakde Gitarren.
physical-object;['zwicka', 'zwicker'];Da Zwicka is a Brüün ohne Bigl.
physical-object;['pergl', 'pergola', 'weinlaube'];Die Pergl isch in die Sidtiroulr Weinpaugepiate a långs Grischt aus Hólz, dés als Stitz fir dr Weinréb nótwéndig isch, weil die Réb a Klettrpflånz isch unt nét van alloan steahn kånn.
physical-object;['synagogn', 'synagoge'];A Synagogn is a jidischa Vasaumlungs- und Sakralbau fias Bätn, fias Studium vau de heulign Schriftn und fia de Schulung.
physical-object;['wuchtl'];A Wuchtl is da Boi fias Fuaßboispü.
physical-object;['tuba'];De Tuba is a typisch boarisches Instrument.
physical-object;['zindhäizl'];A Zindhejzl, Schdreichhejzl oda aa Schwäfehejzl, isa Hoizschdabal zan Ozindn vo an Feia.
physical-object;['dize'];A Dize, Duzl, Duttl, Lulla oda Zuzl
physical-object;['dexel', 'dechsel', 'dachsbeil', 'querbeil)'];De Dexel oda Dechsel is a Weakzeig zua Hoizbeorbatung.
physical-object;['befestigungswesn'];Im Bfestigungswesn
physical-object;['dresor'];A Dresor is a stabis Behältniss, des d sichan Vawahrung vo Gegenständn, meist vo beträchtlichem Weat oda Sensibilität, dint.
physical-object;['glubbal', 'glubberl', 'wäscheklammer'];A Glubbal, aa Glupperl oda Kluppm is a Klamma zan Weschafhenga.
physical-object;['internet', 'internetz', 'netz', 'intanet'];Des Internetz oda kuaz Netz, aa Internet, is a wejdweits Netzweak aus vui vaschiedanan Rechnanetzweakn, iwa de wo Datn austauscht wean kena.
physical-object;['gschicht vom busnhoida', 'büstenhalter'];Da Busnhoida kuaz BH, is a Untawäsch, de wos de Brust untaschtizn soi.
political-geographic-object;['moaktgmoa', 'markt', 'marktgemeinde', 'marktrecht', 'moaktgemeinde', 'moaktgmeind', 'mårktrecht'];A Moaktgmoa is a Gmoa mit Moaktrecht.
political-geographic-object;['rumänien', 'românia', 'rumenien'];Vorlage:Infobox Staat/Wartung/NAMEVorlage:Infobox Staat/Wartung/BILD-WAPPEN-BREITE Rumänien is a Republik in Middleiropa, de 850 km vo da Pannonischen Tiefebene bis zum Schwoazn Meer longt.
political-geographic-object;['jugoslawien', 'ex-jugoslawien', 'juchuslowien'];Jugoslawien is vo 1918/1929 bis 2003/2006 a Stoot in Mittl- und Sidosteuropa in untaschiedlicha territoriala und politischa Form gwesn.
political-geographic-object;['bronx'];De Bronx is da neadlichste vo de fimf Stodbeziake vo da Stod New York.
political-geographic-object;['florenz', 'firenze'];Florenz is de Haptstod vo da Toskana.
political-geographic-object;['kioto', 'kyoto'];Kioto (jap.
political-geographic-object;['lyon', 'leyden'];Lyon [ljɔ̃] is de Haptstod vo da Region Auvergne-Rhône-Alpes und vom Métropole Lyon im Ostn vo Frankreich.
political-geographic-object;['ciudad juárez', 'el paso del norte'];Juárez Stod is a Stod im mexikanischn Bundesstoot Chihuahua.
political-geographic-object;['punta arenas'];Punta Arenas is a Stod im eißastn Sidn vo Chile.
political-geographic-object;['ho-chi-minh-stadt', 'ho-chi-minh-stod', 'saigon'];De Ho-Chi-Minh-Stod (dt.
political-geographic-object;['marseille', 'massilien'];Marseille is de wichtigste franzesische und de drittgresste eiropäische Hofnstod.
political-geographic-object;['nizza', 'nice'];Nizza (franz.: Nice [ˈnis], okzit.
political-geographic-object;['leipzig'];Leipzig is a kroasfreie Stod am Freistoot Sachsn.
political-geographic-object;['niamberg', 'nüanbeag', 'nürnberg'];Niamberg is a Groußstod in Bayern.
political-geographic-object;['los angeles'];Los Angeles is a Stod im Bundesstoot Kalifornien in da USA. Sie liegt am Pazifischem Ozean und am Fluss Los Angeles.
political-geographic-object;['stuggart', 'stuagart', 'stuttgart'];Stuagart is de Haptstod vo Bodn-Wiattmbeag.
political-geographic-object;['breslau', 'wrocław'];Breslau is a kroasfreie Groußstod an da Oder.
political-geographic-object;['genf', 'genève'];Genf is a Stod in da Schweiz und da Haptoat vom Kanton Genf.
political-geographic-object;['sankt petersburg', 'leningrad', 'petersburg', 'petrograd', 'st. petersburg', 'sånkt bedasburg'];Sankt Petersburg (russ.
