activity;['छन्दः', 'छन्द:'];छद् इति धातुना निष्पन्नः अयं शब्दः । छन्दसः आद्यः प्रवर्तकः आचार्यः पिङ्गलः । पद्यरचनायाः शास्त्रस्य छन्दः इति नाम । श्रुतिगतिनिरूपकस्य छन्दसो गमनानुकूलतदङ्गत्वमुच्यते पाणिनीयशिक्षायां छन्दः पादौ तु वेदस्य इत्यनेन । विफुलफलकस्य वैदिकवाङ्मयस्य कृत्स्नार्थवगतिश्छन्दः अवलम्बते । लौकिकवाङ्मयस्य त्वर्थप्रतीतेस्सुलभसाधनत्वेनेदमुपकरोति । स्तुतिपूजाप्रसादजननाद्यने- कार्थकं छन्दो नैकधा व्याख्यायत । छन्दांसि छादनात् । इति निरुक्तोक्त्या वेदार्थावारकत्वेनेदं सम्प्रायुज्यतेति ज्ञायते । मृत्युभीतानां देवानां वेदं प्रविश्य छन्दोभिरावृतत्वमुच्यते । तदुक्तं छान्दोभिरच्छादयन्यदेभिच्छादयंस्तच्छन्दसां चन्दस्त्वम् इति । वेदमन्त्राणां बाहुल्येन छन्दोपनिबध्दत्वात् कालान्तरे वेदापरपर्यायत्वेन छन्दश्शब्दः प्रयुक्तः। अतो वैदिकार्थे छान्दसप्रयोगः, छन्दोभ्यः समाहृत्य समाहृत्य समाम्नाताः इति निरुक्तवाक्यञ्च तमर्थं द्रढयति.
activity;['मतम्', 'निर्वाचनं'];मतम् जनानाम् राजनीतेः अध्यात्मिकस्य मतं अस्ति।
activity;['चलच्चित्रम्', 'चलचित्रं'];मनोविनोदक्षेत्रेऽपि विज्ञानस्य प्रभावोऽविस्मरणीयः। चलचित्रं रूपकस्य एवं आधुनिकस्वरूपं विद्यते। रूपयतीति रूपकम्। तद्वपारोपातु रूपकम्।तद्रूपकमभेदो यः उपमा-उपमेययो:।उपमानोपमेययोः साम्यप्रदर्शनाय काल्पनिकोऽभेदारोपः रूपकम्।।
activity;['मृदुकन्दुक-क्रीडा', 'मृदुकन्दुक', 'soft ball', 'softball'];खेला:‎
activity;['चतुरङ्गक्रीडा', 'चतुरङ्ग', 'chaturangam', 'chess', 'चतुरङ्गम्\u200c', 'चेस्', 'चेस्स्'];चतुरङ्गक्रीडा एका बहुप्रसिद्धा पारम्परिकक्रीडा वर्तते ।
activity;['ब्याद्मिण्टन् क्रीडा', 'बेट्मिन्टन्-क्रीडा', 'badminton', 'batminton', 'पिच्छकन्दुक', 'पिच्छकन्दुकः', 'बाड्मिण्टन्-क्रीडा', 'बेटमिन्टन्', 'बेट्मिन्टन्', 'बैडमिण्टन्', 'ब्याद्मिण्टन्'];चटकिकाताडनजालिकाक्रीडा तुमुलरवक्रीडा वर्तते.
activity;['गोल्फ्-क्रीडा', 'द्रुगुलिका', 'golf', 'गाल्फ् - क्रीडा'];गोल्फ्-क्रीडा कन्दुकक्रीडायां एका विशिष्टा क्रीडा.
