amount-of-matter;['क्षीरम्', 'दुग्ध', 'क्षीर', 'पायस', 'milk', 'दुग्धम्'];एषः आहारपदार्थः प्रायः जगति सर्वत्र अस्ति एव । क्षीरम् इति अपि उच्यमानम् एतत् दुग्धम् आङ्लभाषायां Milk इति उच्यते । अयम् आहारपदार्थः न सस्यजन्यः, अपि तु प्राणिजन्यः आहारः । अन्ये प्राणिजन्याः आहाराः तामसे वा राजसिके वा आहारे अन्तर्भवन्ति । परन्तु दुग्धं न तथा । एतत् यद्यपि प्राणिजन्यं तथापि सात्त्विकः आहारः । न केवलं तावत् अपि तु दुग्धं भूलोकस्य अमृतम् इति उच्यते । परिपूर्णः आहारः इति उच्यते । शिशुतः वृद्धपर्यन्तं सर्वेषां पथ्यः आहारः अपि । यतः देहस्य सप्तानां धातूनाम् ओजः, गोक्षीरे विद्यमानाः गुणाः च समानाः । अतः एव दुग्धं जीवनीयेषु द्रव्येषु, रसानीयेषु द्रव्येषु अग्रगण्यम् अस्ति । देवपूजासु नैवेद्यरूपेण अपि उपयुज्यते दुग्धम् । पायसेषु, पञ्चगव्ये, पञ्चामृते च दुग्धं योजयन्ति.
amount-of-matter;['सिद्धपेयम्'];सिद्धपेयं नाम पेयं सज्जीकृत्य, संरक्ष्य विक्रयणं यत् क्रियते तत् पेयम् । सिद्धपेयानि तु इदानीं जगति सर्वत्र अपि सन्ति एव । भारते तु सिद्धपेयानि बहु प्रसिद्धानि सन्ति । एतत् सिद्धपेयम् आङ्ग्लभाषायां Soft Drink इति उच्यते । सिद्धपेयानां निर्माणं, विक्रयणं च महान् उद्यमः एव जातः अस्ति । महता प्रमाणेन सिद्धपेयानां निर्माणं, विक्रयणं च प्रचलति.
amount-of-matter;['नारिकेलतैलम्', 'coconut oil'];नारिकेलेन निर्मितं तैलम् एव नारिकेलतैलम् । वस्तुतः शुष्कनारिकेलेभ्यः तैलं निर्मीयते । अन्यथा नारिकेलानि शुष्कीकृत्य एव तैलस्य निर्माणं क्रियते । एतत् नारिकेलम् आङ्ग्लभाषायां Coconut इति उच्यते । तस्य तैलं Coconut oil इति उच्यते । एतत् नारिकेलतैलम् अधिकतया आहारत्वेन उपयुज्यते । तवता एव प्रमाणेन औषधत्वेन सौन्दर्यवर्धकत्वेन चापि उपयुज्यते । जगतः सर्वेषु अपि प्रदेशेषु अपि अस्य नारिकेलतैलस्य उपयोगः अस्ति एव । भारते तु अस्य नारिकेलतैलस्य उपयोगः महता प्रमाणेन क्रियते.
amount-of-matter;['जिततैलम्', 'olive oil'];फलकम्:Infobox oils
amount-of-matter;['सूर्यकान्तितैलम्', 'sunflower oil'];सूर्यकान्तिबीजैः निर्मितं तैलम् एव सूर्यकान्तितैलम् । एतत् सूर्यकान्तिसस्यम् आङ्ग्लभाषायां Sunflower इति उच्यते । तस्य तैलं Sunflower oil इति उच्यते । एतत् सूर्यकान्तितैलम् आहारत्वेन एव अधिकतया उपयुज्यते । कदाचित् औषधत्वेन सौन्दर्यवर्धकत्वेन चापि उपयुज्यते । प्रायः जगतः सर्वेषु अपि प्रदेशेषु अस्य सूर्यकान्तितैलस्य उपयोगः क्रियते एव.
amount-of-matter;['तक्रम्', 'butter milk'];भूलोकस्य अमृतम् इति प्रसिद्धम् अस्ति तक्रम् । एतत् तक्रम् आङ्ग्लभाषायां Butter milk इति उच्यते । इदम् अपि आहारपदार्थः न सस्यजन्यः अपि तु प्राणिजन्यः । तथापि इदम् अमृतसमानम् इति उच्यते । देवलोके सुखार्थं देवैः यथा अमृतं पीयते तथा भूलोके तक्रम् इति उक्तवन्तः सन्ति अस्माकं पूर्वजाः.
amount-of-matter;['द्रव्यम्', 'matter'];== द्रव्यस्य सामान्यगुनधर्माः ==
amount-of-matter;['वायुमण्डलम्', 'atmosferă'];वायुमण्डलं विभिन्नवायूनां मिश्रणम् अस्ति । एभिः वायुभिः पृथिवी आच्छादिता वर्तते । अस्मिन् वायुमण्डले मनुष्याणां जन्तूनां च जीवनाय आवश्यकवायुः ऑक्सीजन् इति प्राप्यते । पादपेभ्यः कार्बन् डाई ऑक्साइड् इति वायुः अपि वायुमण्डले प्राप्यते । वायुः वर्णहीनः, गन्धहीनः च भवति । यदा वायुः प्रवहति, तदा पवनः कथ्यते । पवनः अनुभवितुं शक्यते.
amount-of-matter;['हिङ्गु', 'हिङ्गुः', 'asafoetida', 'हिङ्गुसस्यम्'];हिङ्गु इत्यस्य आङ्ग्लभाषायां Devils Dung इति नाम । अयम् अपि आहारपदार्थः भारते अधिकप्रमाणेन उपयुज्यते । अस्य वैज्ञानिकं नाम अस्ति Ferula marthe इति । भारतस्य पाकशालायां प्रमुखं स्थानं वहति हिङ्गु । सर्वस्य कटुयुक्तस्य अपि पाकस्य सज्जीकरणस्य अनन्तरं हिङ्गु स्थापयित्वा व्यागरणं क्रियते चेत् एव पाकः समाप्तः, सेवनार्थं सिद्धः इति अर्थः । तथा प्रसिद्धम् अस्ति भारते हिङ्गु । हिङ्गुसस्यं बहूनि वर्षाणि जीवति । इदं ५-७ पादपरिमितं उन्नतं भवति । अस्य लघूनि पीतपुष्पाणि भवन्ति । अस्य काण्डस्य, मूनस्य च व्रणं कुर्वन्ति चेत् यः रसः द्रवति सः एव हिङ्गु इति कथ्यते । सामान्यतः वसन्तऋतौ सस्यस्य मूलस्य उपरि विद्यमानं त्वचं विदारयन्ति, तत्र सञ्चितं निर्यासं पृथक् कृत्वा पुनः तथैव व्रणं कुर्वन्ति.
amount-of-matter;['गुडः', 'गुड', 'jaggery'];अयम् आहारपदार्थः अपि भारते सर्वत्र उपयुज्यते एव । अयं गुडः अपि सस्यजन्यः आहारपदार्थः एव । अयं गुडः आङ्ग्लभाषायां jaggery इति वदन्ति । इक्षुरसं यदा उष्णीकुर्मः तदा अन्ते दृढः घनः च कश्चन पदार्थः प्राप्यते सः एव गुडः । इक्षुरसम् उष्णीकृत्य शुद्धीकृत्य गुडं सज्जीकुर्वन्ति । मधुरभक्ष्याणां निर्माणे गुडः एव प्रमुखं स्थानं वहति । सदा सर्वदा पाके अपि उपयुज्यते गुडः । इक्षुः किञ्चित् सस्यम् । ततः गुडस्य निर्माणं क्रियते.
biological-object;['गुल्फः', 'कुल्फ'];अयं गुल्फः अपि शरीरस्य किञ्चन अङ्गम् अस्ति । अयं गुल्फः आङ्ग्लभाषायां Ankle इति उच्यते.
biological-object;['मणिबन्धः'];अयं मणिबन्धः शरीरस्य किञ्चन अङ्गम् । अयं मणिबन्धः आङ्ग्लभाषायां wrist इति उच्यते.
biological-object;['मूत्रकोशः'];मूत्रकोशः शरीरस्य किञ्चन अङ्गम् अस्ति । मानवशरीरे द्वौ मूत्रकोशौ भवतः । मूत्रकोशः शरीरस्य अन्तर्भागे विद्यमानम् अङ्गम् अस्ति । अयं मूत्रकोशः आङ्ग्लभाषायां Kidney इति उच्यते । अयं मूत्रकोशः मूत्रस्य सङ्ग्रहणं कृत्वा बहिः प्रेषयति.
biological-object;['जिह्वा', 'रसना', 'जुहू', 'लोला'];इयं जिह्वा अपि शरीरस्य किञ्चित् अङ्गम् अस्ति । इयं जिह्वा मुखस्य अन्तः भवति । एषा जिह्वा आङ्ग्लभाषायां tongue इति उच्यते । एषा जिह्वा इन्द्रियेषु अन्यतमा अस्ति । एषा रसनेन्द्रियम् अस्ति । वयं जिह्वया एव आहाराणां रुचिम् आस्वादयितुं शक्नुमः.
biological-object;['चर्म', 'चर्मः'];चर्मणः त्वगिन्द्रियम् इति नाम । अन्येषाम् इन्द्रियाणां निर्दिष्टानि स्थानानि सन्ति । किन्तु अस्य चर्मणः न तथा निर्दिष्टं स्थानम् अस्ति । इदं चर्म देहे सर्वत्र व्याप्तम् इन्द्रियम् । इदं चर्म एव शरीरस्य रक्षणं करोति । इदं चर्म आङ्ग्लभाषायां Skin इति उच्यते.
biological-object;['काफीबीजम्', 'coffee bean'];एतत् काफीबीजं भारते अपि वर्धमानस्य काफीसस्यस्य वैशिष्ट्यम् । एतत् काफीबीजम् अपि सस्यजन्यः आहारपदार्थः । एतत् काफीबीजम् आङ्ग्लभाषायां Coffee Bean इति उच्यते । अनेन काफीबीजेन एव काफीचूर्णं निर्मीयते । तेन काफीचूर्णेन काफीपेयं निर्मीयते । तत् पेयं सर्वदा उष्णं कदाचित् शीतलं चापि पीयते । अनेन काफीचूर्णेन निर्मीयमाणं काफीपेयं जगति एव अत्यन्तं जनप्रियं पेयम् अस्ति । अनेन काफीचूर्णेन २००३ तमे वर्षे निर्यातवस्तुषू विश्वे एव षष्ठं स्थानं प्राप्तम् अस्ति । आरम्भस्य पञ्चस्थानानि क्रमशः गोधूमेन, रागीधान्येन, सोयाधान्येन, तालतैलेन, शर्करया च प्राप्तम् अस्ति.
biological-object;['धान्यानि', 'grains'];धान्येषु त्रिविधानि धान्यानि भवन्ति । केषाञ्चन धान्यानां साक्षात् तथैव उपयोगं कुर्मः । कानिचित् च दालं कृत्वा उपयोगं कुर्मः । कानिचित् धान्यानि संस्कृत्य उपयुज्यन्ते ।
biological-object;['उदरम्'];फलकम्:Infobox Anatomy
biological-object;['नाडी'];इयं नाडी शरीरस्य किञ्चन अङ्गम् अस्ति । नाड्यः बहुविधाः भवन्ति । एषा नाडी आङ्ग्लभाषायां Nerve इति उच्यते । एताः नाड्यः शरीराद्यन्तं प्रसृताः सन्ति । एताः नाड्यः शरीरस्य अन्तर्भागे भवन्ति । नाडीनां द्वारा एव समग्रे शरीरे रक्तस्य सञ्चारः भवति.
biological-object;['अङ्गुली', 'अङ्गुरि'];एषा अङ्गुली शरीरस्य किञ्चन अङ्गम् अस्ति । एषा अङ्गुली द्विधा विभज्यते । पादाङ्गुल्यः हस्ताङ्गुल्यः चेति । प्राणिनां सर्वेषाम् अपि अङ्गुल्यः भवन्ति एव । मनुष्याणां प्रायः विंशतिः अङ्गुल्यः भवन्ति । प्रतिहस्तं प्रतिपादं च पञ्च अङ्गुल्यः भवन्ति । कुत्रचित् केषाञ्चन अपवादरूपेण हस्ते वा पादे वा द्वित्राः अधिकाः अपि अङ्गुल्यः भवन्ति । एषा अङ्गुली आङ्ग्लभाषायां Finger इति उच्यते, कन्नडभाषायां च "बेरळु" इति । मानवाः अङ्गुलीषु अङ्गुलीयकम् अपि धरन्ति.
biological-object;['पक्ष्म'];पक्ष्म शरीरस्य किञ्चन अङ्गम् अस्ति । आङ्ग्लभाषायां पक्ष्म Eyelid इति उच्यते । बाह्येभ्यः अवरोधेभ्यः नेत्रस्य रक्षणं करोति पक्ष्म.
biological-object;['फुफ्फुसः'];अयं फुफ्फुसः स्यूतसदृशं शरीरस्य किञ्चन अङ्गम् अस्ति । मनुष्यशरीरेषु द्वौ फुफ्फुसौ स्तः । तौ
biological-object;['कुचः', 'वक्षस्', 'स्तन'];कुचः स्त्रीसस्तनानाम् इन्द्रियम् येन ताः स्वशिशुभ्यः दुग्धम् ददति। मनुष्यानाम् द्वौ कुचौ स्तः। अस्य द्वन्द्वस्य स्तनौ इति अपि नाम ।
biological-object;['कपोलः'];एषः कपोलः अपि शरीरस्य किञ्चन अङ्गम् अस्ति । अयं कपोलः आङ्ग्लभाषायां Cheek इति उच्यते.
biological-object;['शुष्कफलानि', 'dry fruits'];वृक्षेभ्यः लताभ्यः वा प्राप्तानि पक्वानि सरसानि फलानि बहुकालं रक्षितं न भवन्ति । अतः कानिचन फलानि आतपे छायायां वां शोषयित्वा रक्षितुं शक्यते । तत्र क्वचित् रासायनिकपदार्थाः अपि उपयुज्यन्ते । एतादृषानि शोषितपलानि भक्षणे अतीव रुचिकराणि कानिचन आयुर्वेदीयक्रमेण आरोग्यवर्धकानि अपि भवन्ति.
biological-object;['सेवफलम्', 'सेवम'];एतत् सेवफलं भारते अपि वर्धमानः कश्चन फलविशेषः । एतत् सेवफलम् अपि सस्यजन्यः आहारपदार्थः । इदं सेवफलम् आङ्ग्लभाषायां Apple इति उच्यते । एतत् सेवफलम् अकृष्टपच्यम् अपि । सेवफलं देवानां नैवेद्यार्थम् अपि उपयुज्यते । एतत् सेवफलम् अपि बहुविधं भवति ।
biological-object;['दन्तः'];अयं दन्तः अपि शरीरस्य किञ्चन अङ्गम् अस्ति । दन्तः मुखस्य अन्तः भवति । एकस्य प्राणिनः मुखे ३० अपेक्षया अधिकाः दन्ताः भवन्ति । अतः दन्ताः इत्येव प्रयोगः समीचीनः । अयं दन्तः आङ्ग्लभाषायां tooth इति उच्यते.
biological-object;['कूर्परः', 'कूर्पर'];अयं कूर्परः शरीरस्य किञ्चन अङ्गम् । अयं कूर्परः आङ्ग्लभाषायां Elbow इति उच्यते.
biological-object;['जानु', 'जानुः'];जानु ऊरुजङ्घयोः मध्ये स्थितम् अस्थिसंयुक्तम् । जानु आङ्ग्लभाषायां Knee इति उच्यते.
biological-object;['नखः', 'नख'];अयं नखः अपि शरीरस्य किञ्चन अङ्गम् अस्ति । नखाः अङ्गुलीषु भवन्ति । पादस्य अङ्गुलीषु, हस्तस्य अङ्गुलीषु चापि नखाः भवन्ति । एते नखाः आङ्ग्लभाषायां Nail इति वदन्ति । एते नखाः विभिन्नाकारकाः भवन्ति.
biological-object;['यकृत्'];मनुष्यस्य यकृत् मानवशरीरे विद्यमानं बृहत् मांसलम् अङ्गम् । तत् मानवशरीरस्य रसक्रियागारम् इत्यपि कथ्यते । तच्च अङ्गम् उदरदेशस्य दक्षिणतः शरीरमध्यदेशात् अधः च भवति । तत् यकृत् पार्श्वास्थिना आवृतं सत् रक्षितं तिष्ठति । यकृत् आङ्ग्लभाषायां Liver इति उच्यते । एतदङ्गं बाह्यस्पर्शेन ज्ञातुम् अशक्यम् । परन्तु यदि रोगेण यकृत् स्फीतं भवति तर्हि पार्श्वास्थिनः पृष्ठतः स्पर्शेन तत् ज्ञातुं शक्यम्, यदि उदरम् अन्तः नीयेत् ।
biological-object;['द्राक्षा', 'grape'];एषा द्राक्षा अपि भारते वर्धमानः फलविशेषः । इयं द्राक्षा अपि सस्यजन्यः आहारपदार्थः । एषा द्राक्षा आङ्ग्लभाषायां Grape इति उच्यते । एषा द्राक्षा न केवलं भारते अपि तु जगतः सर्वेषु देशेषु उपयुज्यते । “तापसप्रिया” इत्येतत् द्राक्षायाः अपरं नाम । एषा द्राक्षा मधुराणां भक्ष्याणां निर्माणे तथा कटूनां खाद्यानां च निर्माणे अपि उपयुज्यते । एषा द्राक्षा मुख्यतया द्विधा विभज्यते । शुष्का द्राक्षा, अशुष्का द्राक्षा च इति । अशुष्कद्राक्षा वर्णानुग्णं पुनः द्विधा विभज्यते – हरितवर्णीया, कृष्णवर्णीया च इति । अत्र उच्यमाना द्राक्षा तु शुष्का द्राक्षा एव । एषा शुष्का द्राक्षा Dryfruits इति यानि उच्यन्ते तेषां शुष्कफलानां गणे अन्तर्भवति.
biological-object;['पुष्प', 'पुष्पाणि', 'कुसुमम्', 'पुल्ल', 'प्रसूनम्', 'सुमम्', 'पुष्पम्'];पुष्पाणि अथवा कुसुमानि वृक्षाणां लतानां वा सन्तानसंवर्धकानां बीजानाम् निर्माणस्य मूलानि भवन्ति । लोके कुसुमानि सर्वजनप्रियाणि तेषां क्वचित् सौन्दर्येण क्वचित् सुगन्धेन क्वचित् उभयाभ्यां च । पुष्पाणि सस्यानां बीजोत्पादनस्य प्रक्रियायाः परागस्पर्शः गर्भीकरणस्य मूलस्थानं भवन्ति।
biological-object;['अस्थि'];इदम् अस्थि शरीरस्य किञ्चन बहुमुख्यम् अङ्गम् अस्ति । इदम् अस्थि आङ्ग्ल्भाषायां Bone इति उच्यते । एतत् अस्थि बहुविधं भवति । अस्थीनां कारणतः एव शरीरस्य कश्चन निर्दिष्टः आकारः भवति । इदम् अस्थि शरीरस्य आन्तरिकभागे भवति.
