situation;['ज्वरः', 'ज्वर'];ज्वरः रोगचिह्नेषु अन्यतमः । शरीरे सामान्यौष्णस्य अपेक्षया अधिकम् औष्ण्यं भवति चेत् ज्वरपीडितः भवति । मनष्यस्य शरीरे सामान्यतया ३७ डिग्रिपरिमाणम् औष्ण्यं भवति । अस्य परिमाणस्य अपेक्षया औष्ण्यम् अधिकं भवति शरीरे ज्वरचिन्हम् सूचयन्ति । ज्वरः वर्धते चेत् गभीरं रोगं सूचयति.
situation;['कुपोषणम्', 'कुपोषण'];कुपोषण एकः रोग अस्ति।
situation;['धूमनीहारः', 'smog'];धूमनीहारः अयं smogue इत्यस्यापभ्र्ंशः अस्ति । एषः वायुमालिन्यस्य अन्यः प्रकारः वर्तते । यन्त्रागारात् उत्सर्जितधूमः वायुमण्डलम् आच्छाद्य तत्र च दुष्प्रक्रियया तुषार इव स्वरूपं प्राप्नोति एषः धूमनीहारः । अयञ्च धूमनीहारः वायुमण्डलम् आवृत्य तिष्ठति । येन आवृत्ति-स्थले आम्लजनकस्य अभावः भवति । फलतः तत्रस्थानां जनजीवानां श्वसक्रिया अवरुध्दा भवति । धूमोच्छ्वासः यदा अधिकप्रमाणेन भवति तदा एषा प्रक्रिया आपप्स्यते ।
situation;['पर्वतारोहणक्रीडा', 'rock climbing'];पर्वतारोहणक्रीडा साहसिकक्रीडायाम् अन्यतमा क्रीडा.
situation;['विसूचिका'];विसूचिका कश्चन रोगः अस्ति।
situation;['अन्नगन्धिः', 'अन्नगन्धि', 'पेचिश'];फलकम्:Infobox symptom
situation;['मलेरियारोगः', 'शीतज्वरः', 'शीतज्वर'];मलेरिया कश्चन रोगविशेषः । एषः सांक्रामिकः रोगः भवति । प्लास्मोडियंजातीयः प्रोटोसोवन्-जीवाणुः अस्य रोगस्य कारणीभूतः जीवाणुः । पञ्चजातीयप्लास्मोडियं जीवाणवः मनुष्यस्य मलेरियारोगस्य कारणीभूताः भवन्ति । मलेरियारोगस्य तीव्रतायाः कारणीभूतः भवति प्लास्मोडियं फाल्सिपारम् जीवाणुः । सामान्यतया एषः मारणान्तिकः रोगः न । प्लास्मोडियं न्यूलेसिमक्याक् जीवाणुः मर्कटेषु मलेरियारोगस्य कारणीभूतः भवति । एषः रोगः अमेरिकाखण्डस्य केषुचित् प्रदेशेषु, एष्या, आफ्रिकादिषु उष्णवलयेषु प्रसारितः अस्ति । प्रतिवर्षं सामान्यतया ३५०-५०० दशलक्षजनाः रुग्णाः भवन्ति । दशलक्षतः त्रिंशल्लक्षपर्यन्तं जनाः अनेन रोगेण मरणं प्राप्नुवन्ति । एतेषु अधिकाः आफ्रिकाखण्डस्य उपसहाराप्रान्तस्य जनाः । तत्रापि शिशवः अधिकसङ्ख्याकाः । सामन्यतया अनाफिलिस् इति स्त्रीमशकः दशति चेत् अनेन रोगेण पीडिताः भवन्ति । अस्य रोगस्य कारणीभूताः एते मशकाः इति संशोधितम् अस्ति । रोगग्रस्तेषु मनुष्येषु रक्ताल्पता, श्वासोच्छ्वासे क्लेशः, हृदयस्पन्दनाधिक्यम् इत्यादीनि विशिष्टानि रोगलक्षणानि भवन्ति । एतैः सह ज्वर-शैत्यादीनि लक्षणानि च दृश्यन्ते.
situation;['शब्दमालिन्यम्'];ध्वनिः न्यूनाधिकः भवितुमर्हति । इयमेव भवति ध्वनेः तीब्रता । अयं हि तीब्रता यदि न्य़ूना भवति, तर्हि ध्वनिः कर्णप्रियः भवति । अर्थात् यदि अस्य तीब्रता न्यूना भवति, सामान्या वा भवति, तर्हि सः ध्वनिः कथ्यते । परं यदि तीब्रता अधिका भवति, तर्हि सः ध्वनिः गर्जनम् इति कथ्यते । अर्थात् तीब्रतरः ध्वनिः क्र्णविदारकः भवति । अतः सः ध्वनिरिति न भवितुमर्हति, स तु गर्जनं भव्ति । अपि च इदं गर्जनमेव भवति ध्वनिप्रदूषणस्य कारणम् । अपि च इदं गर्जनमेव भवति ध्वनिप्रदूषणस्य कारणम् । ध्वनिः शब्दः भवति । भवन्तः जानन्ति एव शब्दः नित्यः भवति । अस्य नाशः कदापि न भवति । अयं सदा आकाशे निवसति । अतः ये गर्जनात्मकाः ध्वनयः ते आकाशं गत्वा स्वस्थानं गृह्णन्ति । एवं प्रकारेण वायुमण्डले बहवः गर्जनात्मकाः ध्वनयः सन्निहिताः सन्ति, येन वयमपेक्षितमपि ध्वनिं श्रोतुं न परयामः । इदमेव भवति ध्वनिप्रदूषणम् ।
situation;['कर्कटरोगः', 'कर्कट रोग', 'कर्करोगः'];कर्कटरोग कश्चन रोग: अस्ति। अर्बुधः इत्यपि अस्य नाम । ईदानीतनकालेपि अस्य आयुर्वेदीया चिकित्सा केवलं परिणामदायकः अस्ति.
situation;['कुष्ठम्', 'कुष्ठरोगः', 'कुष्ठरोग', 'कुष्ठ'];कुष्ठरोगः रोगेषु अन्यतमः भवति । अयं दीर्घकालिकः रोगः । मैकोब्याक्टीरियं लेप्रेयि-जीवाणुभिः, मैकोब्याक्टीरियं लेप्रोमतोसिस् जीवाणुभिः च संक्रमितः भवति एषः रोगः । प्राथमिकस्तरे एषः रोगः पेरिफेरेल् नराणां ग्रानुलोमाटोस्-रोगः, उपरितनभागस्य श्वासेन्द्रियस्य म्युकोसारोगः च भवति । चर्मरोगः अस्य रोगस्य प्राथमिकं चिह्नं भवति । प्राथमिकस्तरे एव औषधोपचाराः यदि न क्रियन्ते तर्हि क्रमेण चर्म, नाडिः, चक्षुः, पादः इत्येतेषाम् अङ्गानां हानिः सम्भवति.
situation;['हृदयाघातः'];हृदयाघातः कश्चन हृद्रोगेषु अन्यतमः। रक्तप्रसरणे न्यूनता भवति चेत् हृदयस्य मांसखण्डाः क्षीयमाणाः भवन्ति । एतदेव हृदयाघातः इति कथयन्ति । ’करोनरि’ नामकेषु केशिकेषु एकम् केशिकम् पिहितं भवति चेत् हृदयाघातः भविष्यति । कस्मैश्चित् अपि, कदापि वा एषः रोगः आगच्छेत् । कार्ये, विश्रान्तिसमये, प्रयाणे, निद्रायाम्, भाषणसमये, आनन्दे च एषः रोगः आगच्छेत् । प्रातःकाले एषः रोगः आगच्छति इति संशोधनेन ज्ञातम् अस्ति.
situation;['बधिरता'];श्रोतुम् असमर्थता बधिरता इति कथ्यते । बधिराः श्रोतुम् श्रोत्रोपकारकयन्त्राणि धरन्ति।
situation;['क्षयरोगः', 'क्षयरोग', 'यक्ष्मा'];क्षयरोग: कश्चन रोग: अस्ति।
situation;['जानुवातः सन्धिवातश्च'];“ मम जानुद्वये सन्धिषु च पीडा भवति, अहं सन्धौ ज्वलनपीडामनु भवामि, कश्चिद्वदति मम जानुनि शोथः जायते, मम जानु रक्तवर्णं दृश्यते” इत्येवं प्रकारेण बहुधा अस्य रोगस्य विषये श्रूयते । वातजनितशरीरचालनं कष्टकरं भवति । वातरोगाः विभिन्नप्रकारकाः सन्ति । तेषु जानुवातः, सन्धिवातः, कटिवातः, हस्तग्रन्थिवातश्च प्रधानाः । बहुव्यापकत्वात् अस्य रोगस्य मूलकारणं वर्णयितुं न शक्यते । तथापि एवम् ऊहितुं शाक्यते यत् –समीचिनखाद्याभावः, स्वस्थस्य यत्नाभावः, नियमितयोगासनस्याभावः, शरीरदौर्बल्यं, कोष्ठकाठिन्यं, विश्रान्त्यभावः इत्यादीनि कारणानि । रोगः बहुप्राचीनः भवति चेत्, औषधेन अस्य उपशमः न भवितुमर्हति । हृत्पिण्डः अपि दुर्बलः भवति ।
situation;['अन्धता', 'अंधापन', 'अन्धकारः'];द्रष्टुम् असमर्थता एव अन्धता इति कथ्यते। केचन जनाः द्रष्टुं शक्नुवन्ति परम् अव्यक्तेन एव। व्याधयः क्षताः दुर्भोजनं वा अन्धताया: हेतवः। केचन जनाः उपपादेभ्यः अन्धाः । परम् अन्ये जननात् अन्धाः। केचन जनाः वर्णान्धाः सन्ति। ते विश्वस्य विविधान् वर्णान् द्रष्टुं न शक्नुवन्ति। अन्धाः ब्रैल्-लिपिम् पठितुम् समर्थाः। कुक्कुराः तान् नयन्ति। हेलेन् केल्लर्, लूयी ब्रैल् च यशस्विनौ अन्धौ स्तः।
situation;['शिरोवेदना'];‘’’शिरोवेदना’’’ कश्चन रोगः । मस्तिष्के विद्यमाना वेदना । कपालस्य अन्तर्भागे बहिर्भागेच विद्यामानाः रक्तनालाः, पटलाः, मांसखण्डाः च वेदनां मनसे सूचयन्ती । कपालस्य अन्तर्भागे बहिर्भागेच विद्यामानाः रक्तनालाः यदि आभोगायन्ते तर्हि शिरोवेदनायाति.
situation;['बधिरता'];श्रोतुम् असमर्थता बधिरता इति कथ्यते । बधिराः श्रोतुम् श्रोत्रोपकारकयन्त्राणि धरन्ति।
