non-agentive-physical-object;['tyre', 'tire'];A tyre is a raing-shaped vehicle component that covers the wheel's rim tae pertect it an enable better vehicle performance.
non-agentive-physical-object;['canal'];Canals an Navigations are man-made channels for watter, which are generally baith referred tae in the vernacular as 'canals'.
non-agentive-physical-object;['plainstane', 'pavement', 'plettiestanes'];A plainstane or pavement is a paith, for ordinar makkit oot o concrete, asphalt, brick or stane, designed for pad traffec an aft rinnin langside a gate.
non-agentive-physical-object;['sice', 'dice', 'sise', 'syce', 'syis', 'sys'];Dice are smaw thrawable objects wi multiple restin poseetions, uised for generatin random nummers.
non-agentive-physical-object;['emblem'];An emblem is an abstract or representational pictorial eemage that represents a concept, lik a moral truth, or an allegory, or a person, lik a king or saunt.
non-agentive-physical-object;['ganger crossin'];A ganger crossin or pedestrian crossin is a merkit aurie fur gangers to cross a gate.
non-agentive-physical-object;['meringue'];Meringue, is a teep o dessert, eften associatit wi French, Swiss, an Italian cuisine, made frae whipped egg whites an succar, an occasionally an acid sic as cream o tartar or a smaa amoont o vinegar.
non-agentive-physical-object;['chainel tunnel', 'chainnel tunnel'];The Chainel Tunnel, whiles kent as the Chunnel or Eurotunnel, is a 50.5 kilometre unnersea rail tunnel jynin the Unitit Kinrick an Fraunce, rinnin aneath the Inglis Chainel at the Strait o Dover, connectin Folkestone, Kent in Ingland tae Coquelles naur Calais in northren Fraunce.
non-agentive-physical-object;['soumsuit'];Soumwear is cleidin designed tae be worn bi fowk engagin in a watter-based activity or watter sports, such as soummin, divin and surfin, or sun-orientatit activities, such as sun bathin.
non-agentive-physical-object;['trews'];Trews are men's claes for the legs an lawer abdomen, a tradeetional form o Erse an Scots apparel.
non-agentive-physical-object;['uin', 'oven'];An owen is a thermally insulatit chamber uised for the heatin, bakin or dryin o a substance, an maist commonly uised for cuikin.
non-agentive-physical-object;['bra'];A bra is a form-fittin unnergarment designed tae support a woman's breasts.
non-physical-collection;['heresy'];Heresy is ony provocative belief or theory that is strangly at variance wi established beliefs or customs.
non-physical-collection;['data'];Data are tokens that can be interpretit as some kind o value.
non-physical-collection;['hinduism', 'hindism', 'hindu'];Hinduism is a releegion or frae the Indie Subcontinent.
non-physical-collection;['stereoteep', 'stereoteepin', 'stereotype'];In social psychology, a stereoteep is a thocht that can be adoptit aboot speceefic teeps o individuals or certaint ways o daein things.
non-physical-collection;['epicureanism'];Epicureanism is a seestem o filosofie based upon the teachins o Epicurus, foondit aroond 307 BC.
non-physical-collection;['feminism'];Feminism is a range o muivements an ideologies that share a common goal: tae define, establish, an achieve equal poleetical, economic, cultural, personal, an social richts for weemen.
non-physical-collection;['bauhaus'];Staatliches Bauhaus, commonly kent simply as Bauhaus, wis an airt schuil in Germany that combined crafts an the fine airts, an wis famous for the approach tae design that it publicised an taucht.
non-physical-collection;['yoga'];Yoga is a pheesical, mental, an spiritual practice or discipline that denotes a variety o schuils, practices an goals in Hinduism, Buddhism an Jainism, the best-kent bein Hatha yoga an Raja yoga.
non-physical-collection;['lexicon'];Formally, in lingueestics, a lexicon is a leid's inventory o lexemes.
non-physical-collection;['fallacy'];A fallacy is an argument that uses puir reasonin.
non-physical-collection;['determinism'];Determinism is the filosofical poseetion that for every event thare exeest condeetions that coud cause na ither event.
non-physical-collection;['semiotics', 'semiotician'];Semiotics cried semiotic studies an aw, an in the Saussurean tradeetion cried semiology
non-physical-collection;['mysticism'];Mysticism is "a constellation o distinctive practices, discourses, texts, institutions, tradeetions, an experiences aimed at human transformation, variously defined in different tradeetions."
non-physical-collection;['nihilism'];Nihilism is a filosofical doctrine that suggests the lack o belief in ane or mair reputitly meaninfu aspects o life.
non-physical-collection;['faith', 'releegion', 'releegious belief', 'releegious', 'releigion'];Releegion - whiles uised interchyngeably wi faith or belief seestem — is for ordinar defined as beliefs adae wi the supernaitural, saucrit, or divine. an the moral codes, practices, vailies, institutions an reetuals associate wi sic beliefs.
non-physical-collection;['faith', 'releegion', 'releegious belief', 'releegious', 'releigion'];Faith is defined as confidence or trust in a person, thing, deity, view, or in the doctrines or teachins o a releegion, as well as confidence based on some degree o warrant.
non-physical-collection;['romanesque airchitectur'];Romanesque airchitectur is an airchitectural style o medieval Europe characterised bi semi-circular airches.
non-physical-collection;['gothic airchitectur', 'gothic airchitecture'];Gothic airchitectur is a style o airchitectur that flourished during the heich an late medieval period.
non-physical-collection;['fleein saucer', 'unidentified flyin object'];Fleein saucer is the name gien tae a kynd o unidentified fleein object wi a disc- or saucer-shapet body, usually described as siller or metallic, whiles reported as happit wi runnin lichts or surrounded wi a glowin licht, hoverin or muivin swippert aither alane or in ticht formations wi ither seemilar craft, an exhibitin heich maneuverability.
non-physical-collection;['concept', 'concepts'];A concept is an abstraction or generalisation frae experience or the result o a transformation o existin concepts.
non-physical-collection;['shamanism'];Shamanism is a practice that involves a practitioner reachin altered states o consciousness in order tae encoonter an interact wi the spirit warld an channel these transcendental energies intae this warld.
non-physical-collection;['supersteetion'];Supersteetion is a pejorative term for any belief or practice that is conseedert irraitional: for ensaumple, if it arises frae ignorance, a misunnerstaundin o science or causality, a positive belief in fate or magic, or fear o the unkent.
non-physical-collection;['adventism', 'adventists'];Adventism is a brainch o Protestant Christianity that wis stairtit in the Unitet States in the Seicont Great Awakenin whan Baptist preacher William Miller first publicly shared his belief that the Seicont Comin o Jesus Christ wad occur at some pynt atween 1843 an 1844.
non-physical-collection;['belief'];There is no way tae speak generally aboot belief.
non-physical-collection;['pauganism', 'paganism'];Pauganism is a braid group o indigenous an historical polytheistic releegious tradeetions, mainly yon o culturs kent tae the classical warld.
non-physical-collection;['monotheism'];Monotheism is a releegious concept o thare bein juist the ae god as agin Polytheism an atheism .The best kent three kenspeckle monotheistic releegions is Christianity, Islam an Judaism, awso ca'd "Abrahamic reeligions".
non-physical-collection;['polytheism', 'polytheistic'];Polytheism refers tae the worship o or belief in multiple deities uisually assembled intae a pantheon o gods an goddesses, alang wi thair ain releegions an rituals.
non-physical-collection;['utilitarianism'];Utilitarianism is a theory in normative ethics hauldin that the best moral action is the ane that maximizes utility.
non-physical-collection;['jainism'];Jainism, or Jain Dharma, is a releegion an philosophy that's central tenets wis foondit by Mahavira, wha leeved at the same time as Siddhārtha Gautama, an Indian speeritual leader that leeved atween aboot 563 an 483 BC. Jainism is conseedert a major warld releegion.
non-physical-collection;['mahayana'];Mahāyāna is ane o twa main exeestin branches o Buddhism an a term for clessification o Buddhist philosophies an practice.
non-physical-collection;['taoism', 'daoism', 'taoist'];Taoism is a philosophical, ethical, an religious tradition of Cheenese origin that emphasizes living in harmony with the Tao.
non-physical-collection;['voyeurism'];Voyeurism is the sexual interest in or practice o spyin on fowk engaged in intimate behaviors, such as undressin, sexual activity, or ither actions uisually considered tae be o a private naitur.
non-physical-collection;['zoroastrianism'];Zoroastrianism is a releegion fae Iran, forbye mony follaers bide in Indie an ither pairts o the warld.
non-physical-collection;['lutheranism', 'lutheran', 'lutheran kirk', 'lutherans'];Lutheranism is a major branch o Protestant Christianity that identifies wi the theology o Martin Luther — a German friar, ecclesiastical reformer, an theologian.
non-physical-collection;['internaitional law'];Internaitional law is the set o rules generally regairdit an acceptit as bindin in relations atween states an atween naitions.
non-physical-collection;['jurisprudence'];Jurisprudence is the study an theory o law.
non-physical-collection;['idea', 'ideas'];In filosofie, ideas are uisually construed as mental representational eemages o some object.
non-physical-collection;['humanism', 'humanist'];Humanism is a schuil o thocht that pits the human at its mids, aroond the idea that "man is the meisur o aa things".
non-physical-collection;['egalitarianism', 'egalitarian', 'equalitarianism'];Egalitarianism —or, rarely, equalitarianism or equalism—is a trend o thocht that favors equality for aw fowk.
non-physical-collection;['pacifism'];Pacifism is opposeetion tae war, militarism, or violence.
non-physical-collection;['empiricism'];Empiricism is a theory that states that knawledge comes anly or primarily frae sensory experience.
non-physical-collection;['presbyterianism'];Presbyterianism is ae form o Protestant Christianity that disna hae ony form o heirarchy.
non-physical-collection;['anglicanism', 'anglican', 'anglicans'];Anglicanism is a tradeetion athin Christianity comprisin the Kirk o Ingland an kirks historically connectit tae it or haud seemilar beliefs, worship practices an kirk structures.
non-physical-collection;['logical positivism', 'positivism'];Positivism is a filosofical theory statin that positive knawledge is based on naitural phenomena an their properties an relations.
non-physical-collection;['logical positivism', 'positivism'];Logical positivism an logical empiricism, which thegither formed neopositivism, wid a muivement in Wastren filosofie that embraced verificationism, an approach that soucht tae legitimize filosofical discoorse on a basis shared wi the best examples o empirical sciences.
non-physical-collection;['deism', 'deist'];Deism combines a rejection o revelation an authority as a soorce o releegious knawledge wi the conclusion that reason an observation o the naitural warld are sufficient tae determine the existence o a single creator o the universe.
non-physical-collection;['meanin'];In linguistics, meanin is whit the soorce or sender expresses, communicates, or conveys in thair message tae the observer or receiver, an whit the receiver infers frae the current context.
non-physical-collection;['shinto', 'shintoism'];Shinto, an aa kannagara-no-michi, is the indigenous spirituality o Japan an the fowk o Japan.
non-physical-collection;['islam', 'islamism', 'islamic', 'islamist', 'islamists'];Islam is a monotheistic Abrahamic releegion foondit on the life an teachins o Mohammad in the VIIt century, in Arabie.
non-physical-collection;['islam', 'islamism', 'islamic', 'islamist', 'islamists'];Islamism, an aa kent as Poleetical Islam, is an Islamic revival muivement eften characterised bi moral conservatism, literalism, an the attempt "tae implement Islamic values in aw spheres o life."
non-physical-collection;['judaism', 'jew', 'jewish', 'jewish fowk', 'jews'];Judaism is ane o the first recordit monotheistic relfaiths an ane o the auldest releegious tradeetions that's aye follaed the day.
non-physical-collection;['stoicism'];Stoicism is a schuil o Hellenistic filosofie foondit in Athens bi Zeno o Citium in the early 3rd century BC. The Stoics tocht that destructive emotions resulted frae errors in judgment, an the active relationship atween cosmic determinism an human freedom, ad the belief that it is virtuous tae maintain a will that is in accord wi naitur.
non-physical-collection;['populism'];Populism is a doctrine that appeals tae the interests an conceptions o the general population, especially when contrastin ony new collective consciousness push against the prevailin status quo interests o any predominant poleetical sector.
non-physical-collection;['chairtism'];Chairtism wis a wirkin-cless muivement for poleetical reform in Breetain that existit frae 1838 tae 1857.
non-physical-collection;['perception'];Perception is the organisation, identification, an interpretation o sensory information in order tae represent an unnerstaund the environment.
non-physical-collection;['christianity', 'christian', 'christianism', 'christians'];Christianity is a monotheistic releegion foondit oan the life an teachins o Jesus o Nazareth as pitten ower in the New Testament writins o his earlie follaers.
non-physical-collection;['confucianism'];Confucianism, cried Ruism an aa, is descrived as tradeetion, a filosofie, a releegion, a humanistic or raitionalistic releegion, a wey o govrening, or simply a wey o life.
non-physical-collection;['arianism'];Arianism is the theological teachin attributit tae Arius (ca.
non-physical-collection;['protestantism', 'protestant', 'protestants'];Protestantism is the seicont lairgest form o Christianity wi collectively mair nor 900 million adherents warldwide or nearly 40% o aw Christians.
non-physical-collection;['calvinism', 'calvinist', 'reformed'];Calvinism is a major branch o Protestantism that follaes the theological tradeetion an forms o Christian practice o John Calvin an ither Reformation-era theologians.
non-physical-collection;['panorama', 'panoramic'];A panorama, is ony wide-angle view or representation o a pheesical space, whether in paintin, drawin, photografie, film, seismic images or a three-dimensional model.
non-physical-collection;['tibetan buddhism'];Tibetan Buddhism is the bouk o releegious doctrine an institutions characteristic o Buddhism in Tibet, Mongolie, Tuva, Bhutan, Kalmykie an certaint regions o the Himalayas, includin northren Nepal, an Indie.
non-physical-place;['mausoleum'];A mausoleum is a freemit free-staundin biggin constructit as a monument enclosin the interment space or burial chamber o a deceased person or fowk.
non-physical-place;['tartarus'];Tartarus, in auncient Greek meethologie, is the deep abyss that is uised as a dungeon o torment an sufferin for the wickit an as the preeson for the Titans.
non-physical-place;['midgard'];Midgard is the name for the warld inhabitit bi an kent tae humans in early Germanic cosmology, an specifically ane o the Nine Warlds in Norse meethology.
organized-collection;['galaxy'];A galaxy is a gravitationally boond seestem o starns, stellar remnants, interstellar gas, dust, an dark matter.
organized-collection;['geometric progression'];In mathematics, a geometric progression, an aw kent as a geometric sequence, is a sequence o nummers whaur ilk term efter the first is foond bi multipleein the previous ane bi a fixed, non-zero nummer cried the common ratio.
organized-collection;['data'];Data are tokens that can be interpretit as some kind o value.
organized-collection;['leebrary', 'leebrar'];A leebrar is a collection o soorces o information an seemilar resources, made accessible tae a defined commonty for reference or borraein.
organized-collection;['matrix'];In mathematics, a matrix is a rectangular array o nummers, seembols, or expressions, arranged in rowes an columns.
organized-collection;['spectrum'];A spectrum is a condeetion that is nae leemitit tae a specific set o values but can vary infinitely within a continuum.
organized-collection;['internaitional law'];Internaitional law is the set o rules generally regairdit an acceptit as bindin in relations atween states an atween naitions.
organized-collection;['jurisprudence'];Jurisprudence is the study an theory o law.
organized-collection;['veesible spectrum', 'visible spectrum'];The veesible spectrum is the portion o the electromagnetic spectrum that is veesible tae the ee.
organized-collection;['electromagnetic spectrum'];The electromagnetic spectrum is the range o aw possible frequencies o electromagnetic radiation.
organized-collective;['ethnic group', 'ethnic groop', 'ethnic groups', 'ethnicity'];An ethnic group or ethnicity is a category o fowk wha identify wi ilk ither based on common leid, auncestral, social, cultural, or naitional experiences.
organized-collective;['social group'];A social group within social sciences haes been defined as twa or mair fowk who interact wi ane anither, share seemilar characteristics, an collectively hae a sense o unity.
parameter;['eccentricity'];In mathematics, the eccentricity, denotit e or
parameter;['acceleration'];Acceleration, in pheesics, is the rate o chynge o velocity o an object wi respect tae time.
parameter;['midnicht'];Midnicht is, literally, "the mids o the nicht".
parameter;['down syndrome', "down's syndrome"];Down syndrome or Down's syndrome, forby kent as trisomy 21, is a genetic disorder caused bi the presence o aw or pairt o a third copy o chromosome 21.
parameter;['birth defect', 'congenital disorder'];A birth defect, kent as a congenital disorder an aw, is a condeetion present at birth regairdless o cause.
parameter;['velocity'];Velocity is the rate o chynge o the poseetion o an object, equivalent tae a specification o its speed an direction o motion, e.g.
parameter;['colour blindness'];Colour blindness, kent as colour veesion deficiency an aw, is the decreased ability tae see colour or differences in colour.
parameter;['onchocerciasis'];Onchocerciasis, an aw kent as river blindness, is a disease caused bi infection wi the parasitic wirm Onchocerca volvulus.
parameter;['acid rain', 'aba proja àtzida'];Acid rain is a rain or ony ither form o precipitation that is unuisually acidic, meanin that it possesses elevatit levels o hydrogen ions.
parameter;['privacy', 'preevacy'];Preevacy is the abeelity o an individual or group tae seclude themsels, or information aboot themsels, an tharebi express themsels selectively.
parameter;['day-daw', 'sunrise', 'keek o day'];Day-daw, skybrek or the creek/keek/screich o day, is the time that merks the beginnin o the gloamin afore the sun comes up.
parameter;['day-daw', 'sunrise', 'keek o day'];Sunrise or sun up is the instant at which the upper edge o the Sun appears ower the eastren horizon in the mornin.
parameter;['nuin'];Nuin is the time exactly haufwey throu the day, written 12.00 or 12:00 in the 24-hoor knock an 12:00 pm in the 12-hoor knock.
parameter;['frequency', 'period'];Frequency is the nummer o occurrences o a repeatin event per unit time.
parameter;['mortality rate'];Mortality rate, or daith rate, is a meisur o the nummer o daiths in a pairteecular population, scaled tae the size o that population, per unit o time.
parameter;['refractive index'];In optics the refractive index or index o refraction n o a substance is a dimensionless nummer that describes hou licht, or ony ither radiation, propagates throu that medium.
parameter;['aspect ratio'];The aspect ratio o an eemages describes the proportional relationship atween its width an its hicht.
parameter;['ratio'];In mathematics, a ratio is a relationship atween two numbers indicatin hou mony times the first nummer conteens the seicont.
parameter;['variance'];In probability theory an stateestics, variance is the expectation o the squared deviation o a random variable frae its mean.
parameter;['speed o licht'];The speed o licht is the speed o aw electromagnetic waws in a vaccuum.
parameter;['day-set', 'sundoun'];The day-set or sundoun, is the time whan the Sun gangs doun ablow the easins tae the Wast.
parameter;['orbital period'];The orbital period is the time taken for a gien object tae mak ane complete orbit aroond anither object.
parameter;['hertz', 'ghz', 'hz', 'mhz'];The hertz is the unit o frequency in the Internaitional Seestem o Units.
phenomenon;['chemical reaction', 'chemical reactions'];A chemical reaction is a process that leads tae the transformation o ane set o chemical substances tae anither.
phenomenon;['state o matter'];In pheesics, a state o matter is ane o the distinct furms that different phases o matter tak on.
phenomenon;['cyclone'];In meteorology, a cyclone is a muckle scale air mass that rotates aroond a strang centre o law atmospheric pressur.
phenomenon;['phase'];In the physical sciences, a phase is a region o space, atouer whilk aw physical properties o a material is essentially uniform.
phenomenon;['plasma'];Plasma is ane o the fower fundamental states o matter.
phenomenon;['waik interaction', 'waik force'];In pairticle physics, the waik interaction is ane o the fower kent fundamental interactions o naitur, alangside the strang interaction, electromagnetism, an gravitation.
phenomenon;['licht', 'electromagnetic theory o licht', 'light', 'veesible licht'];Licht is a form o energy.
phenomenon;['stress', 'tensile stress'];In continuum mechanics, stress is a pheesical quantity that expresses the internal forces that neebourin pairticles o a conteenous material exert on ilk ither, while streen is the meisur o the deformation o the material.
phenomenon;['strang interaction', 'strang force', 'strang nuclear force'];In pairticle physics, the strang interaction is ane o the fower fundamental interactions o naitur, the ithers bein electromagnetism, the waik interaction an gravitation.
phenomenon;['pouer'];In pheesics, pouer is the rate that wirk is duin or energy is transmitted, or the amoont o energy needit or uised for a gien unit o time.
phenomenon;['phase transeetion'];The term phase transeetion is maist commonly uised tae descrive transeetions atween solit, liquid an gaseous states o maiter, an, in rare cases, plasma.
phenomenon;['covalent bond'];Covalent bonds are chemical bonds atween twa non-metal atoms.
phenomenon;['hydrolysis'];Hydrolysis uisually means the cleavage o chemical bonds bi the addeetion o watter.
phenomenon;['cirrocumulus clood', 'cirrocumulus'];Cirrocumulus is ane o the three main genus-teeps o heich-altitude tropospheric cloods, the ither twa bein cirrus an cirrostratus.
phenomenon;['reek'];Reek or reik is a clood o gey wee, solit pairtikils that is made whan sumthing is brent wi a flam, sic as wid or paper.
phenomenon;['aerosol', 'aerosols'];An aerosol is a colloid o fine solit pairticles or liquid droplets, in air or anither gas.
phenomenon;['altocumulus clood', 'altocumulus'];Altocumulus is a middle-altitude clood genus that alangs tae the stratocumuliform pheesical category characterised bi globular masses or rows in layers or patches, the individual elements bein lairger an darker than those o cirrocumulus an smawer nor those o stratocumulus.
phenomenon;['cumulonimbus clood', 'cumulonimbus'];Cumulonimbus, frae the Laitin cumulus an nimbus, is a dense touerin vertical clood associatit wi thunnerstorms an atmospheric instability, formin frae watter vapor carried bi pouerfu upward air currents.
phenomenon;['electric field'];An electric field is generatit bi electrically charged pairticles an time-varyin magnetic fields.
phenomenon;['current', 'electric current', 'electrical current'];Current is the wird that's uised for the flow o electric charge meisured in Amperes.
phenomenon;['electricity', 'electric', 'electrically'];Electricity is the set o pheesical phenomena associatit wi the presence an motion o electric chairge.
phenomenon;['heat', 'heat energy'];In physics, heatin is transfer o energy frae a hotter body tae a caulder ane, ither nor bi wirk or transfer o matter.
phenomenon;['inflation'];In economics, inflation is a persistent increase in the general price level o guids an services in an economy ower a period o time.
phenomenon;['cumulus clood'];Cumulus cloods are a genus-teep o law-level clood that can hae noticeable vertical development an clearly defined edges.
phenomenon;['abiogenesis', 'oreegin o life'];Abiogenesis, or informally the oreegin o life, is the naitural process bi that life arises frae non-leevin maiter, sic s semple organic compoonds.
phenomenon;['stratus clood', 'stratus'];A stratus clood is a clood belangin tae a cless chairacterised bi horizontal layerin wi a uniform base, as opponed tae convective cloods that are as taw or tawer nor wide.
phenomenon;['zodiacal licht'];Zodiacal licht is a faint, roughly triangular, diffuse white glow seen in the nicht sky that appears tae extend up frae the vicinity o the Sun alang the ecliptic or zodiac.
phenomenon;['naitural selection'];Naitural selection is the differential survival an reproduction o individuals due tae differences in phenoteep. it is a key mechanism o evolution.
phenomenon;['nuclear fission'];In nuclear physics and nuclear chemistry, nuclear fission is either a nuclear reaction or a radioactive decay process in which the nucleus o a pairticle splits intae smawer pairts.
phenomenon;['nuclear fusion'];In nuclear physics, nuclear fusion is a nuclear reaction in which twa or mair atomic nuclei collide at a very heich speed an jyn tae form a new type o atomic nucleus.
