region;['12'];12 is the naitural nummer follaein 11 an precedin 13.
region;['16'];16 is the naitural nummer follaein 15 an precedin 17.
region;['6', 'sax'];6 is the naitural nummer follaein 5 an precedin 7.
region;['5'];5 is a nummer, numeral, an glyph.
region;['15'];15 is the naitural nummer follaein 14 an precedin 16.
region;['10'];10 is an even naitural nummer follaein 9 an precedin 11.
region;['3', '٣'];3 is a nummer, numeral, an glyph.
region;['2', 'twa'];2 is a nummer, numeral, an glyph.
region;['8'];8 is the naitural nummer follaein 7 an precedin 9.
region;['7'];7 is the naitural nummer follaein 6 an precedin 8.
region;['17'];17 is the naitural nummer follaein 16 an precedin 18.
region;['11'];11 is the naitural nummer follaein 10 an precedin 12.
region;['14'];14 is the naitural nummer follaein 13 an precedin 15.
region;['4'];4 is a nummer, numeral, an glyph.
region;['13'];13 is the naitural nummer follaein 12 an precedin 14.
region;['licht-year', 'licht-years', 'licht year', 'lichtyear'];A licht-year, an aa licht year or lichtyear, is an astronomical unit o length equal tae juist unner 10 trillion kilometres.
region;['mole'];The mole is the unit o meisurment in the Internaitional Seestem o Units for amoont o substance.
region;['forenuin'];Forenuin or morn is the time o day frae 12:00 a.m.
region;['divisor'];In mathematics a divisor o an integer
region;['million', '1000000', 'meelion', '1,000,000'];Ae million, or ae thoosand thoosand, is the naitural nummer efter 999,999 an afore 1,000,001.
region;['atomic nummer'];In chemistry an physics, the atomic nummer is the number o protons foond in the nucleus o an atom an tharefore identical tae the charge nummer o the nucleus.
region;['fraction'];A fraction represents a pairt o a whole or, mair generally, ony nummer o equal pairts.
region;['bouk modulus', 'k'];The bouk modulus o a substance is a meisur o hou incompressible/resistant tae compressibility that substance is.
region;['aleph nummer'];In mathematics, an in particular set theory, the aleph numbers are a sequence o nummers uised tae represent the cardinality o infinite sets that can be weel-ordered.
region;['1', 'ae', 'wan', 'ane'];1 is a nummer.
region;['mass nummer'];The mass nummer, an aa cried atomic mass nummer or nucleon nummer, is the tot nummer o protons an neutrons in an atomic nucleus.
region;['radian'];The radian is the staundart unit o angular measur, uised in mony auries o mathematics.
region;['steradian'];The steradian is the SI unit o solid angle.
region;['day'];A day is a unit o time.
regulation;['conservation law'];In pheesics, a conservation law states that a pairteecular measurable property o an isolatit pheesical seestem disna chynge as the seestem evolves ower time.
regulation;['richt-weeng politics', 'richt-weeng', 'richt-wing politics'];Richt-weeng politics hauld that some forms o social stratification or social inequality are inevitable, naitural, normal, or desirable, teepically defendin this poseetion on the basis o naitural law, economics or tradeetion.
regulation;['human richts'];Human richts is "richts an freedoms that aw humans is enteetelt tae".
regulation;['conservation o energy', 'first law o thermodynamics'];In pheesics, the law o conservation o energy states that the tot energy o an isolatit seestem remains constant—it is said tae be conserved ower time.
regulation;['conservation o energy', 'first law o thermodynamics'];The first law o thermodynamics is a version o the law o conservation o energy, adaptit for thermodynamic systems.
regulation;['freedom o thocht'];Freedom o thocht is the freedom o an individual tae hauld or consider a fact, viewpynt, or thocht, independent o ithers' viewpynts.
relation;['function'];In mathematics, a function is a relation atween a set o inputs an a set o permissible ootputs wi the property that ilka input is relatit tae exactly ane ootput.
relation;['function'];In mathematics, a function is a relation atween a set o inputs an a set o permissible ootputs wi the property that ilka input is relatit tae exactly ane ootput.
relation;['altitude'];Altitude or hicht is defined based on the context in which it is uised.
relation;['antithesis'];Antithesis is the fowert studio album bi technical daith metal baund Origin.
relation;['trigonometric function', 'trigonometric functions', 'cosine'];In mathematics, the trigonometric functions are functions o an angle.
relation;['sea level', 'above mean sea level'];Mean sea level is a datum representin the average hicht o the ocean's surface . uised as a staundart in reckonin land elevation.
relation;['lebensraum'];Lebensraum refers tae conceptions an policies o a form o settler colonialism connectit wi agrarianism that existed in Germany frae the 1890s tae the 1940s.
relation;['north'];North is ane o the fower main airts or airtins on a compass.
relation;['sooth'];Sooth is ane o the fower main airtins, or airts, on a compass.
relation;['east', 'aist', 'eist'];East is ane o the fower main airtins, or airts, on a compass.
relation;['wavelenth', 'swawlenth', 'wavelength'];In pheesics, the swawlenth o a sinusoidal swaw is the spatial period o the wave—the distance ower which the swaw's shape repeats.
relation;['inverse function'];In mathematics, an inverse function is a function that "reverses" anither function: gin the function f applee'd tae an inpit x gies a result o y, then appleein its inverse function g tae y gies the result x, an vice versa, i.e., f = y gin an anerly gin g = x.
relation;['parasitism', 'parasite', 'parasitic'];Parasitism is a non-mutual symbiotic relationship atween species, whaur ane species, the parasite, benefits at the expense o the ither, the host.
relation;['symbiosis', 'mutualism'];Symbiosis is close an eften lang-term interaction atween twa or mair different biological species.
relation;['symbiosis', 'mutualism'];Mutualism is the way twa organisms o different species exist in a relationship in which each individual benefits frae the activity o the ither.
relation;['commensalism'];In ecology, commensalism is a class o relationships atween twa organisms whaur ane organism benefits frae the ither wioot affectin it.
relevant-part;['pixel'];In deegital eemagin, a pixel, pel, or pictur element is a pheesical pynt in a raster eemage, or the smawest addressable element in an aw pynts addressable display device. so it is the smawest controllable element o a pictur representit on the screen.
relevant-part;['van allen radiation belt'];A Van Allen radiation belt is a zone o energetic chairged pairticles, maist o that originate frae the solar wind, that are capturt bi an held aroond a planet bi that planet's magnetic field.
relevant-part;['sunspot'];Sunspots are temporary phenomena on the photosphere o the Sun that appear veesibly as dark spots compared tae surroondin regions.
relevant-part;['skin'];Skin is the saft ooter tishie kiverin vertebrates.
relevant-part;['fuid additive'];Fuid additives are substances addit tae fuid tae preserve flavor or enhance its taste an appearance.
relevant-part;['laither'];Laither is the skin o an ainimal, uised as a material.
relevant-part;['moutash', 'mouser', 'matash'];A moutash, matash, or mouser is facial hair growed on the upper lip.
relevant-part;['pubic hair'];Pubic hair is bouk hair foond in the frontal genital aurie o adolescent an adult humans, locatit on an aroond the sex organs, the crotch, an sometimes at the tap o the inside o the thighs, in the pubic region aroond the pubis bane.
relevant-part;['epithelium'];​ Epithelium is ane o the fower basic teepes o ainimal tishie, alang wi connective tishie, muscle tishie an nervish tishie.
relevant-part;['nael'];The nael is tae the maist pairt an aur caused at birth bi the sneddin aff o the naelstring fae a newborn wean.
relevant-part;['eebrou'];The eebrou, an aa cried the eebree, bree, or brou, is an aurie o thick, delicate hairs abuin the ee that follaes the shape o the lawer margin o the brow rigs o some mammals.
relevant-part;['fur', 'pelage'];Fur is uised in reference tae the hair o animals, uisually mammals, particularly those wi extensive body hair coverage.
relevant-part;['exoskeleton'];An exoskeleton is the freemit skeleton that supports an protects an ainimal's body, in contrast tae the internal skeleton o, for example, a human.
relevant-part;['beard', 'mouser', 'moutash'];A beard is the collection o hair that grows on the chin, upper lip, cheeks or neck o humans an some non-human ainimals.
relevant-part;['epidermis'];The epidermis is componed o the ootermost layers o cells in the skin, "epi" in Greek meanin "ower" or "upon", which thegither wi the dermis forms the cutis.
relevant-part;['computer hairdware', 'computer haurdware'];Computer haurdware is the collection o pheesical elements that constitutes a computer seestem.
relevant-part;['asteroid belt', 'main-belt'];The asteroid belt is the region to the Solar System located roughly atween the orbits o the planets Maurs an Jupiter.
relevant-part;['seashell', 'seashells'];A seashell or sea shell, kent simply as a shell an aw, is a haurd, pertective ooter layer creatit bi an ainimal that leeves in the sea.
relevant-part;['bark', 'baurk'];Baurk is the ootermaist layers o stems an ruits o widdy plants.
set;['hilbert space'];The mathematical concept o a Hilbert space, named efter David Hilbert, generalizes the notion o Euclidean space.
set;['interval'];In mathematics, a interval is a set o real nummers wi the property that ony nummer that lies atween twa nummers in the set is an aa includit in the set.
set;['group'];In mathematics, a group is an algebraic structur consistin o a set o elements equipped wi an operation that combines ony twa elements tae form a third element an that satisfies fower condeetions cried the group axioms, namely closur, associativity, identity an invertibility.
set;['subset'];In mathematics, especially in set theory, a set A is a subset o a set B, or equivalently B is a superset of A, if A is "contained" inside B, that is, aw elements o A are an aa elements o B.
set;['euclidean space'];In mathematics, pairticularly in geometry, the concept o a Euclidean space encompasses Euclidean plane an the three-dimensional space o Euclidean geometry as spaces o dimensions 2 an 3 respectively.
set;['domain o a function'];In mathematics, the domain o defineetion or simply the domain o a function is the set o "input" or argument values for which the function is defined.
simple-collection;['constellation'];In modren astronomy, a constellation is a internaitionally defined aurie o the celestial sphere.
simple-collection;['auriga'];Auriga is ane o the 48 constellations leetit bi the 2nt-century astronomer Ptolemy an remains ane o the 88 modren constellations.
simple-collection;['centaurus'];Centaurus /sɛnˈtɔːrəs/ is a bricht constellation in the soothren sky.
simple-collection;['canis minor'];Canis Minor /ˌkeɪnᵻs ˈmaɪnər/ is a smaa constellation in the northren celestial hemisphere.
simple-collection;['cygnus'];Cygnus /ˈsɪɡnəs/ is a northren constellation lyin on the plane o the Milky Way, derivin its name frae the Laitinised Greek wird for swan.
simple-collection;['coma berenices'];Coma Berenices is a tradeetional asterism that haes syne been defined as ane o the 88 modren constellations.
simple-collection;['pegasus'];Pegasus is a constellation in the northren sky, named efter the winged horse Pegasus in Greek meethology.
simple-collection;['boötes'];Boötes /boʊˈoʊtiːz/ is a constellation in the northren sky, locatit atween 0° an +60° declination, an 13 an 16 oors o richt ascension on the celestial sphere.
simple-collection;['lupus'];Lupus /ˈljuːpəs/ is a constellation in the soothren sky.
simple-collection;['hydrus'];Hydrus /ˈhaɪdrəs/ is a smaa constellation in the deep soothren sky.
simple-collection;['ursa minor'];Ursa Minor, an aa kent as the Little Bear, is a constellation in the northren sky.
simple-collection;['canis major'];Canis Major /ˌkeɪnᵻs ˈmeɪdʒər/ is a constellation in the soothren celestial hemisphere.
simple-collection;['cepheus'];Cepheus is a constellation in the northren sky.
simple-collection;['crater'];Crater is a constellation.
simple-collection;['capricornus'];Capricornus /ˌkæprᵻˈkɔːrnəs/ is ane o the constellations o the zodiac.
simple-collection;['tucana'];Tucana is a constellation o starns in the southren sky, named efter the toucan, a Sooth American bird.
simple-collection;['pisces'];Pisces is a constellation o the zodiac.
simple-collection;['scorpius', '♏'];Scorpius, whiles kent as Scorpio, is ane o the constellations o the zodiac.
simple-collection;['virgo'];Virgo is ane o the constellation o the zodiac.
simple-collection;['hydra'];Hydra is the lairgest o the 88 modren constellations, measurin 1303 square degrees.
simple-collection;['ordered pair'];In mathematics, an ordered pair is a pair o mathematical objects.
simple-collection;['crux'];Crux /ˈkrʌks/ is the smawest o the 88 modren constellations, but is ane o the maist distinctive.
simple-collection;['corona borealis'];Corona Borealis /koʊˈroʊnə bɒriˈælᵻs/ is a smaa constellation in the Northren Celestial Hemisphere.
simple-collection;['hairp', 'lyra'];The hairp is the constellation Lyra.
simple-collection;['libra'];Libra /ˈliːbrə/ is a constellation o the zodiac.
simple-collection;['corvus'];Corvus is a smaa constellation in the Soothren Celestial Hemisphere.
simple-collection;['cancer'];Cancer is ane o the twelve constellations o the zodiac.
simple-collection;['aries'];Aries is ane o the constellations o the zodiac.
simple-collection;['cassiopeia'];Cassiopeia is a constellation in the northren sky, named efter the vain queen Cassiopeia in Greek meethology, who boastit aboot her unrivalled beauty.
simple-collection;['leo', '♌'];Leo /ˈliːoʊ/ is ane o the constellations o the zodiac, lyin atween Cancer tae the wast an Virgo tae the east.
simple-collection;['gemini'];Gemini is ane o the constellations o the zodiac.
simple-collection;['aquarius'];Aquarius is a constellation o the zodiac, situatit atween Capricornus an Pisces.
simple-collection;['meethologie', 'meethology', 'meeth', 'mythologie'];Meethologie leeterar meins the retellin o meeths.
simple-collection;['norse meethology', 'norse meethologie'];Norse Meethology is the name gien tae the hatter o meeths, legends an reelegious lair that's connectit tae the Auld Norse cultur.
simple-collection;['greek meethology', 'greek meethologie'];Greek meethologie is the body o meeths an teachins that belang the auncient Greeks, concernin thair gods an heroes, the naitur o the warld, an the oreegins an signeeficance o thair ain cult an ritual practices.
simple-collection;['roman meethology', 'roman meethologie', 'leet o roman gods an goddesses'];Roman meethologie is the body o tradeetional stories pertainin tae auncient Roum's legendary origins an releegious seestem, as representit in the leeteratur an visual airts o the Romans.
simple-collection;['trimurti'];The "Trimūrti" is a concept in Hinduism "in which the cosmic functions o creation, maintenance, an destruction are personified bi the forms o Brahma the creator, Vishnu the maintainer or preserver an Shiva the destroyer or transformer."
simple-collection;['universe'];The Universe is commonly defined as the totality o existence, includin planets, starns, galaxies, the contents o intergalactic space, the smawest subatomic pairticles, an aw matter an energy.
simple-collective;['duke', 'duchess'];A duke or duchess can either be a monarch rulin ower a duchy or a member o the nobility, historically o heichest rank ablo the monarch.
simple-collective;['nobility'];Nobility is a social cless that possesses mair acknowledged privileges or eminence than maist ither clesses in a society, membership thareo teepically bein hereditary.
simple-collective;['proletariat'];The proletariat is a term for the cless o wage-earners, in a caipitalist society, whase anly possession o signeeficant material value is thair labour-pouer . a member o such a cless is a proletarian.
simple-collective;['social cless', 'social class'];Social cless, as in a cless society, is a set o concepts in the social sciences an poleetical theory centered on models o social stratification in which fowk are grouped into a set o hierarchical social categories, the maist common bein the upper, middle, an lawer clesses.
simple-collective;['erse fowk'];The Erse fowk is a ethnic group that oreeginates in Ireland, an island in northwastren Europe.
simple-collective;['bluid type'];A bluid type is a classification o bluid based on the presence or absence o inherited antigenic substances on the surface o reid bluid cells.
simple-collective;['mercat'];A mercat is a place whaur fowk gang for tae coff or sell things.
simple-collective;['fandom'];A fandom is a subcultur componit o fans characterisit bi a feelin o empathy an camaraderie wi ithers wha share a common interest.
simple-collective;['inglis fowk', 'english fowk'];The Inglis are a naition an ethnic group native tae Ingland, who speak Inglis.
simple-collective;['french fowk'];The French are a naition that share a common French cultur an speak the French leid as a mither tongue.
simple-collective;['breetish fowk'];Breetish fowk are ceetizens or natives o the Unitit Kinrick, Croun dependencies, Breetish owerseas territories, an thair stryndants.
simple-collective;['kshatriya'];Kshatriya is ane o the fower varna o the Hindu society.
simple-planned-collective;['burgh'];A Burgh is an autonomous corporate entity, for ordinar a toun, an haes been in uiss in Scotland syne the 12t century.
simple-planned-collective;['human settlement', 'human dounset'];In geografie, statistics an airchaeology, a dounset, locality or populatit place is a commonty in which fowk live.
simple-planned-collective;['synod', 'kirk cooncil'];A synod /ˈsɪnəd/ heestorically is a cooncil o a kik, uisually convened tae decide an issue o doctrine, admeenistration or application.
simple-planned-collective;['internaitional coort o justice'];The Internaitional Coort o Justice is the primary judicial branch o the Unitit Naitions.
simple-planned-collective;['triumvirate'];A triumvirate is a poleetical regime dominatit bi three pouerfu individuals, each a triumvir
simple-planned-collective;['gowden horde', 'golden horde', 'kipchak khanate', 'ulus o jochi'];The Gowden Horde wis a Mongol an later Turkicized khanate, established in the 13t century, which comprised the northwastren sector o the Mongol Empire.
simple-planned-collective;['clergy'];Clergy are some o the formal leaders within certain releegions.
simple-planned-collective;['legislatur'];A legislatur is a decision-makin organization, usually associated with national government, that has the power to enact, amend and repeal laws.
simple-planned-collective;['knesset'];The Knesset (Ebreu: הַכְּנֶסֶת [haˈkneset] ( listen). lit.
simple-planned-collective;['unitit states congress', 'united states congress'];The Unitit States Congress is the bicameral legislatur o the federal govrenment o the Unitit States consistin o twa hooses: the Senate an the Hoose o Representatives.
simple-planned-collective;['hoose o commons', 'hoose o commons o the unitit kinrick', 'member o the breetish hoose o commons'];The Hoose o Commons o the Unitit Kinrick, kent semply as the Commons, is the lawer hoose o the Pairlament o the Unitit Kinrick.
simple-planned-collective;['hoose o lairds', 'hoose o lords', 'house of lords'];The Hoose o Lairds is the upper hoose o the Pairlament o the Unitit Kinrick.
simple-planned-collective;['unitit states senate', 'united states senate'];The United States Senate is a legislative chamber in the bicameral legislatur o the United States, an thegither wi the Hoose o Representatives maks up the U.S. Congress.
situation;['file transfer protocol'];File Transfer Protocol is a staundart network protocol uised tae transfer files frae ane host tae anither host ower a TCP-based network, sic as the Internet.
situation;['communications protocol', 'network protocol'];In telecommunications, a communications protocol is a seestem o deegital rules for data exchynge within or atween computers.
situation;['monopoly'];A monopoly exists when a speceefic person or enterprise is the anly supplier o a pairticular commodity.
situation;['anorexia nervosa'];Anorexia nervosa is an eatin disorder characterized bi immoderate fuid restriction, inappropriate eatin habits or rituals, obsession wi havin a thin figur, an an irrational fear o wicht gain, as well as a distortit body self-perception.if u fat
situation;['mental disorder'];A mental disorder, cried a mental illness or psychiatric disorder an aa, is a diagnosis bi a mental heal professional o a behavioural or mental pattern that mey cause sufferin or a puir ability tae function in life.
situation;['hick', 'hicker', 'hicks', 'hicksie', 'yesk'];A hick or yesk is an involuntar contraction o the diaphragm that mey repeat several times per meenit.
situation;['bachelor o airts'];Bachelor o Airts is a college degree.
situation;['contract', 'contract law'];In common law legal seestems, a contract is an agreement havin a lawfu object entered intae voluntarily bi twa or mair pairties, each o whom intends tae create ane or mair legal obligations atween them.
situation;['psoriasis'];Psoriasis is a lang-lastin autoimmune disease chairacterised bi patches o abnormal skin.
situation;['hypertension'];Hypertension, an aa kent as heich bluid pressur or arterial hypertension, is a chronic medical condeetion in which the bluid pressur in the arteries is persistently elevatit.
situation;['sexually transmittit disease', 'sexually transmitted disease'];Sexually transmittit infections, forbye reffert tae as sexually transmittit diseases an venereal disease, ir diseases that have a significant poasability af transmission atween fowk throu haivens o a sexual naitur.
situation;['defineetion', 'defineetions'];A defineetion is a statement o the meanin o a term.
situation;['scruibie'];Scruibie is a disease resultin frae a lack o vitamin C. Early symptoms include weakness, feelin tired, curly hair, and sore arms and legs.
situation;['need', 'needs'];A need is something that is necessary for organisms tae live a heal life.
situation;['war crime'];A war crime is a serious violation o the laws an customs o war givin rise tae individual criminal responsibility.
situation;['traison', 'heich traison', 'traitor'];In law, traison is creeminal dislealty tae the state.
situation;["parkinson's disease"];Parkinson's disease is a degenerative disorder o the central nervous seestem.
situation;['pairtial differential equation'];In mathematics, a pairtial differential equation is a differential equation that contains unkent multivariable functions an thair pairtial derivatives.
situation;['güdic', 'guddock', 'goadick', 'godek', 'guddick', 'riddle'];A guddock is a furm o wird puzzle designed tae test a body's ingenuity in arriving tae its solution.
situation;['cardiovascular disease', 'hert disease'];Cardiovascular disease is a cless o diseases that involve the hert or bluid veshels.
situation;['genetic disorder'];A genetic disorder is a genetic problem caused bi ane or mair abnormalities in the genome, especially a condeetion that is present frae birth.
situation;['epilepsy'];Epilepsy is a group o neurological disorders chairacterised bi epileptic seizurs.
situation;['phobia'];A phobia is a teep o anxiety disorder, defined bi a persistent fear o an object or situation.
situation;['hypothyroidism'];Hypothyroidism, eften cried unneractive thyroid or law thyroid and sometimes hypothyreosis, is a common disorder o the endocrine seestem in which the thyroid gland daes nae produce enough thyroid hormone.
situation;['expression', 'formula', 'mathematical expression', 'mathematical formula'];A expression, in Algebra, is a complouther o seembols uised for a haundlin.
situation;['expression', 'formula', 'mathematical expression', 'mathematical formula'];In science, a formula is a concise way o expressin information seembolically as in a mathematical or chemical formula.
situation;['heal'];Heal is freedom frae skaith, that is won at wi the prevention, traitment, an management o illness an the preservation o mental an pheesical weel bein throu the services gien by the medical, nouricin, an allee'd heal perfaissions.
situation;['anthrax'];Anthrax is an acute disease caused bi the bacterium Bacillus anthracis.
situation;['public law'];Public law
situation;['defamation'];Defamation—an aa calumny, vilification, an traducement—is the communication o a false statement that harms the reputation o an individual person, business, product, group, govrenment, releegion, or naition.
situation;['skin cancer'];Skin cancers are cancers that arise frae the skin.
situation;['colorectal cancer'];Colorectal cancer is the development o cancer in the colon or rectum.
situation;['aur', 'blain', 'aar', 'ar', 'scar', 'scaur'];An aur is the affcome o the biologic process o wound mendin in the skin an ither tissues o the bodie.
situation;['equation'];In mathematics, an equation is an equality containin ane or mair variables.
situation;['bipolar disorder'];Bipolar disorder, previously kent as manic depression, is a mental disorder that causes periods o depression an periods o elevatit muid.
situation;['common cauld'];Common cauld, an aa kent simply as a cauld, is a viral infectious disease o the upper respiratory tract that primarily affects the neb.
situation;['sleep', 'sleepin'];​ In ainimals, sleep is a naiturally recurrin state characterized bi altered consciousness, relatively inhibitit sensory activity an inhibition o nearly aw voluntary muscles.
situation;['chronic obstructive pulmonary disease', 'copd'];Chronic obstructive pulmonary disease is a teep o obstructive buff disease chairacterised bi lang-term puir airflow.
