biological-object;['sacrum'];In tetrapod anatomy, the sacrum is a lairge, triangular bane at the base o the spine an at the upper, back pairt o the pelvic cavity, whaur it is insertit lik a wedge atween the twa hip banes.
causal-role;['reagent', 'reactant'];A reagent /riˈeɪdʒənt/ is a "substance or compoond that is addit tae a seestem in order tae bring aboot a chemical reaction, or addit tae see if a reaction occurs."
causal-role;['toluene'];Toluene /ˈtɒluːiːn/, umwhile kent as toluol /ˈtɒluːɒl/, is a clear, watter-insoluble liquid wi the typical smell o paint thinners.
causal-role;['solvent'];A solvent is a substance that dissolves a solute, resultin in a solution.
causal-role;['risk'];Risk is potential o losin something o value.
causal-role;['surfactant'];Surfactants are compoonds that lawer the surface tension atween twa liquids or atween a liquid an a solit.
causal-role;['phenol', 'carbolic acid'];Phenol, kent as carbolic acid an aw, is an aromatic organic compoond wi the molecular formula C6H5OH.
chemical-object;['molecule'];A molecule is an electrically neutral group o twa or mair atoms held thegither bi chemical bonds.
chemical-object;['haemoglobin', 'hemoglobin'];Haemoglobin, abbreviatit Hb or Hgb, is the airn-containin oxygen-transport metalloprotein in the reid bluid cells o aw vertebrates as well as the tissues o some invertebrates.
chemical-object;['globulin'];The globulins are a faimily o globular proteins that hae heicher molecular wichts nor albumins an are insoluble in pure watter but soluble in dilute saut solutions.
chemical-object;['collagen'];Collagen /ˈkɒlədʒᵻn/ is the main structural protein in the extracellular space in the various connective tissues in ainimals.
chemical-object;['keratin'];Keratin is a faimily o fibrous structural proteins.
chemical-object;['casein'];Casein is the name for a faimily o relatit phosphoproteins.
chemical-object;['dipole'];In pheesics, thare are several kinds o dipole: An electric dipole is a separation o positive an negative charges.
chemical-object;['gluten'];Gluten is a composite o storage proteins termed prolamins an glutelins that is stored thegither wi stairch in the endosperm o various cereal grains.
chemical-object;['histone'];In biology, histones are heichly alkaline proteins foond in eukaryotic cell nuclei that package an order the DNA into structural units cried nucleosomes.
chemical-object;['albumin', 'albumins'];The albumins are a faimily o globular proteins, the maist common o which are the serum albumins.
chemical-object;['radical'];In chemistry, a radical is an atom, molecule, or ion that haes unpaired valence electrons.
chemical-object;['ion', 'anion'];An ion is an atom or molecule in which the tot nummer o electrons is nae equal tae the tot nummer o protons, givin the atom a net positive or negative electrical charge.
chemical-object;['protein', 'protein synthesis', 'proteins'];Proteins are lairge biological molecules, or macromolecules, consistin o ane or mair chains o amino acid residues.
chemical-object;['antibody', 'immunoglobulin'];An antibody, an aa kent as an immunoglobulin, is a lairge, Y-shape protein produced bi plasma cells that is uised bi the immune seestem tae identify an neutralise pathogens such as bacteria an viruses.
chemical-object;['allele'];An allele, or allel, is ane o a nummer o alternative forms o the same gene or same genetic locus.
chemical-object;['isotope'];Isotopes are variants o a pairteecular chemical element that differ in neutron nummer, awtho aw isotopes o a gien element hae the same nummer o protons in ilk atom.
chemical-object;['hydroxyl'];A hydroxyl is a chemical functional group containin an oxygen atom connectit bi a covalent bond tae a hydrogen atom.
chemical-object;['functional group'];In organic chemistry, functional groups are speceefic groups o atoms or bonds within molecules that are responsible for the characteristic chemical reactions o those molecules.
classification-system;['creestal structur'];In crystallographie, crystal structur is a description o the ordered arrangement o atoms, ions or molecules in a crystalline material.
classification-system;['html', 'hypertext markup language'];HyperText Markup Language is a markup leid uised tae create documents intendit tae bi accessed wae a wab brouser.
classification-system;['calendar'];A calendar is a seestem o organizin days for social, releegious, commercial or admeenistrative purposes.
classification-system;['terminology', 'nomenclatur'];Terminology is the study o terms an thair uise.
classification-system;['coordinate seestem', 'frame o reference'];In geometry, a coordinate seestem is a seestem which uises ane or mair nummers, or coordinates, tae uniquely determine the poseetion o a pynt or ither geometric element on a manifold such as Euclidean space.
classification-system;['poisson distreebution', 'poisson distribution'];In probability theory an stateestics, the Poisson distreebution, named efter French mathematician Siméon Denis Poisson, is a discrete probability distreebution that expresses the probability o a gien nummer o events occurrin in a fixed interval o time an/or space if thir events occur wi a kent average rate an independently o the time syne the last event.
classification-system;['normal distreebution', 'normal distribution'];In probability theory, the normal distreebution is a very common conteenous probability distreebution.
classification-system;['spacetime'];In pheesics, spacetime is ony mathematical model that combines space an time intae a single interwoven continuum.
classification-system;['islamic calendar'];The Islamic calendar, Muslim calendar or Hijri calendar is a lunar calendar consistin o 12 months in a year o 354 or 355 days.
classification-system;['julian calendar'];The Julian calendar, introduced bi Julius Caesar in 46 BC, wis a reform o the Roman calendar.
classification-system;['gregorian calendar'];The Gregorian calendar is the internationally takken ceevil calendar.
cognitive-event;['federatit state'];A federatit state is a territorial an constitutional commonty formin pairt of a federation.
cognitive-event;['libido'];Libido, colloquially kent as sex drive, is a person's oweraw sexual drive or desire for sexual activity.
cognitive-event;['oedipus complex'];The Oedipus complex is a concept o psychoanalytic theory.
cognitive-event;['pleisur', 'pleisant'];Pleisur describes the broad class o mental states that humans an ither ainimals experience as positive, enjoyable, or worth seekin.
cognitive-event;['economic policy'];Economic policy refers tae the actions that govrenments tak in the economic field.
cognitive-event;['imperialism'];Imperialism is a teep o advocacy o empire.
cognitive-event;['inferiority complex'];An inferiority complex is a lack o sel-wirth, a doubt an uncertainty, an feelins o nae meisurin up tae staundarts.
cognitive-event;['dream'];Dreams are successions o images, ideas, emotions, an sensations that occur uisually involuntarily in the mynd during certain stages o sleep.
cognitive-event;['lust'];Lust is a feelin that haes tae dae wi ettlin efter a thing, teepically sexual but it can be ettlin efter ither things lik objecks.
cognitive-event;['fear', 'fricht'];Fear is an emotion induced bi a threit perceived bi leevin entities, that causes a chynge in harn an organ function an ultimately a chynge in behaviour, sic as runnin awey, hidin or freezin frae traumatic events.
cognitive-event;['necrophilia'];Necrophilia, forby kent as necrophilism, necrolagnia, necrocoitus, necrochlesis, an thanatophilia, is a sexual attraction or sexual act involvin corpse.
cognitive-event;['emotion', 'emotions'];Emotion is, in everyday speech, a person's state o mind an instinctive responses, but scienteefic discoorse has drifted tae ither meanins an thare is no consensus on a defineetion.
cognitive-event;['happiness', 'happy'];Happiness is a mental or emotional state o well-bein defined bi positive or pleisant emotions rangin frae contentment tae intense joy.
cognitive-event;['sadness', 'sad'];Sadness is emotional pain associatit wi, or characterised bi feelins o disadvantage, loss, despair, helplessness, disappyntment an sorrae.
cognitive-event;['biopsy'];A biopsy is a medical test commonly performed bi a surgeon, interventional radiologist, or an interventional cardiologist involvin samplin o cells or tissues for examination.
cognitive-event;['cult o personality'];A cult o personality arises when an individual uises mass media, propaganda, or ither methods, tae create an idealized an heroic public image, aften through unquestionin flattery an praise.
cognitive-event;['sicht', 'secht', 'see', 'seein', 'veesual perception'];Sicht is ane o the senses.
cognitive-event;['inductive raisonin'];Inductive raisonin is a method o raisonin in thatthe premises are viewed as supplyin some evidence for the truth o the conclusion. this is in contrast tae deductive raisonin.
cognitive-event;['credit'];Credit (frae Laitin credere translation.
cognitive-event;['new deal'];The New Deal wis a series o domestic programs enacted in the Unitit States atween 1933 an 1938, an a few that came later.
cognitive-event;['fashion'];Fashion is a popular style or practice, especially in cleidin, fitwear, accessories, makeup, bouk, or furnitur.
cognitive-event;['pertectionism', 'protectionism'];In economics, pertectionism is the economic policy o restrainin trade atween kintras throu methods such as tariffs on importit guids, restrictive quotas, an a variety o ither govrenment regulations designed tae allae fair competeetion atween imports an guids an services produced domestically.
cognitive-event;['thocht', 'think', 'thochts'];Thocht can refer tae the ideas or arrangements o ideas that result frae thinkin, the act o producin thochts, or the process o producin thochts.
cognitive-event;['attention'];Attention is the behavioural an cognitive process o selectively concentratin on a discrete aspect o information, whether deemed subjective or objective, while ignorin ither perceivable information.
cognitive-event;['anthropomorphism', 'anthropomorphic', 'personification'];Anthropomorphism, or personification, is attribution o human form or ither characteristics tae onything ither nor a human being.
cognitive-event;['integral', 'definite integral', 'integral calculus'];Integration is an important concept in mathematics an, thegither wi its inverse, differentiation, is ane o the twa main operations in calculus.
cognitive-event;['derivative'];The derivative is a fundamental tuil o calculus for studyin the behavior o functions o a real variable.
cognitive-event;['taste'];Taste, gustatory perception, or gustation is the sensory impression o fuid or ither substances on the tongue an is ane o the five tradeetional senses.
cognitive-event;['heraldry'];Heraldry is the profession, study, or airt o creatin, grantin, an blazonin airms an rulin on quaistens o rank or protocol, as exercised bi an officer o airms.
cognitive-event;['naitural history'];Naitural history is the research an study o organisms includin plants or ainimals in thair environment, leanin mair towards observational nor experimental methods o study.
cognitive-event;['empathy'];Empathy is the capacity tae unnerstand whit anither person is experiencin frae within the ither person's frame o reference, ie, the capacity tae place anesel in anither's shaes.
cognitive-modal-description;['warld view', 'warldview'];A comprehensive warld view is the fundamental cognitive orientation o an individual or society encompassin the entirety o the individual or society's knawledge an pynt o view.
cognitive-modal-description;['down syndrome', "down's syndrome"];Down syndrome or Down's syndrome, forby kent as trisomy 21, is a genetic disorder caused bi the presence o aw or pairt o a third copy o chromosome 21.
cognitive-modal-description;['centrism'];In politics, centrism or the centre is a poleetical ootleuk or specific poseetion that involves acceptance or support o a balance o a degree o social equality an a degree o social hierarchy. while opponin poleetical chynges which would result in a signeeficant shift o society either strangly tae the left or the richt.
cognitive-modal-description;['conservatism'];Conservatism as a poleetical an social filosofie promotes retainin tradeetional social institutions in the context o cultur an ceevilisation.
cognitive-modal-description;['fascism'];Fascism is a radical authoritarian naitionalist poleetical ideology.
cognitive-modal-description;['socialism', 'socialist'];Socialism is the name gien tae sindrie poleitical ideas.
cognitive-modal-description;['communism', 'communist'];Communism is a sociopolitical movement that aims for a classless society structured upon communal awnership o the means o production an the end o wage labour an private property.
cognitive-modal-description;['collectivism'];Collectivism is the moral stance, poleetical filosofie, ideology, or social ootleuk that emphasizes the signeeficance o groups—thair identities, goals, richts, ootcomes, etc.—an tends tae analyze issues in thae terms.
cognitive-modal-description;['gnosticism', 'gnostic'];Gnosticism is a modren term categorising a collection o auncient releegions whose adherents shunned the material warld – which they viewed as creatit bi the demiurge – an embraced the spiritual warld.
cognitive-modal-description;['agnosticism'];Agnosticism is the view that the truth value o certaint claims—especially claims aboot the existence or non-existence o ony deity, but an' a' ither releegious an metaphysical claims—is unkent or unkenable.
cognitive-modal-description;['militarism'];Militarism is the belief or desire o a govrenment or fowk that a kintra should maintain a strang militar capability an be prepared tae uise it aggressively tae defend or promote naitional interests.
cognitive-modal-description;['ideology', 'ideologue'];An ideology is a set o conscious an/or unconscious ideas which constitute ane's goals, expectations, an actions.
cognitive-modal-description;['homophobia'];Homophobia encompasses a range o negative attitudes an feelins taewart homosexuality or fowk that are identifee'd or perceived as bein lesbian, gay, bisexual or transgender.
cognitive-modal-description;['social democracy'];Social democracy is a poleetical ideology that offeecially haes as its goal the establishment o democratic socialism through reformist an gradualist methods.
cognitive-modal-description;['meritocracy'];Meritocracy is a poleetical filosofie hauldin that pouer should be vestit in individuals awmaist exclusively based on ability an talent.
cognitive-modal-description;['atheism', 'atheist', 'atheistic', 'atheists'];Atheism is the lack o belief in onie deities.
cognitive-modal-description;['federalism'];Federalism refers tae the mixed or compoond mode o govrenment, combinin a general government wi regional govrenments in a single poleetical seestem.
cognitive-modal-description;['antisemitism', 'antisemite', 'antisemitic'];Antisemitism is prejudice against, hatred o, or discrimination against Jews as an ethnic, releegious, or racial group.
cognitive-state;['coma'];In medicine, a coma is a state o unconsciousness in which a person: canna be awakened. fails tae respond normally tae painful stimuli, licht, or soond. lacks a normal wake-sleep cycle. an daes nae initiate voluntary actions.
cognitive-state;['corporation'];A corporation is a company or group o fowk authorised tae act as a single entity an recognised as sic in law.
combinatorial-system;['syntax', 'seentax', 'syntactic'];In linguistics, syntax is "the study o the principles an processes bi which sentences are constructit in pairticular leids."
commerce-role;['commodity', 'guid', 'commodities'];In economics, a commodity is a mercatable item produced tae satisfy wants or needs.
commerce-role;['commodity', 'guid', 'commodities'];In economics, a guid is a material that satisfies human wants an provides utility, for example, tae a consumer makin a purchase.
commerce-role;['product'];In mercatin, a product is onything that can be offered tae a mercat that micht satisfy a want or need.
communication-method;['parapsychology'];Parapsychology is the study o paranormal an psychic phenomena, includin telepathy, precogneetion, clairvoyance, psychokinesis, near-daith experiences, synchronicity, reincarnation, apparitional experiences, an ither paranormal claims.
course;['waw', 'wave'];A waw is a kynd o chynge that muives frae ane place tae anither.
course;['oscillation', 'oscillate'];Oscillation is the repetitive variation, typically in time, o some measur aboot a central value or atween twa or mair different states.
course;['gravitational waw'];Gravitational waws is spacetime lippers that kythes as waws.
course;['algorithm'];In mathematics an computer science, an algorithm is a step-bi-step procedure for calculations.
course;['pyrrhic veectory', 'pyrrhic victory'];A Pyrrhic veectory is a veectory wi sic a devastatin cost that it is tantamoont tae defeat.
course;['epidemic', 'epidemics'];In epidemiology, an epidemic occurs when new cases o a certain disease, in a gien human population, an during a gien period, substantially exceed what is expectit based on recent experience.
course;['disaster', 'desastre'];A disaster is a serious disruption o the functionin o a commonty or a society involvin widespread human, material, economic or environmental losses an impacts, which exceeds the ability o the affectit commonity or society tae cope uisin its ain resoorces.
course;['lunar eclipse'];A lunar eclipse occurs when the Muin passes directly behind the Earth intae its umbra.
course;['daith', 'daiths', 'death'];Daith is the termination o aw biological functions that sustain a livin organism.
course;['solar eclipse'];As seen frae the Yird, a solar eclipse is a type o eclipse that occurs when the Muin passes atween the Sun an Yird, an the Muin fully or pairtially blocks the Sun.
course;['tide'];Tides is the risin an fawin o sea levels caused by the gravitational forces o the muin, the sun an the birlin o the yird wirkin thegither.
dependent-place;['orbital inclination'];Inclination in general is the angle atween a reference plane an anither plane or axis of direction.
dependent-place;['richt ascension'];Richt ascension is the angular distance measured eastle alang the celestial equator frae the vernal equinox tae the oor circle o the pynt in quaisten.
dependent-place;['declination', 'ecliptic coordinate seestem'];In astronomy, declination is ane o the twa angles that locate a pynt on the celestial sphere in the equatorial coordinate seestem, the ither bein oor angle.
dependent-place;['declination', 'ecliptic coordinate seestem'];The ecliptic coordinate seestem is a celestial coordinate seestem commonly used for representin the poseetions an orbits o Solar Seestem objects.
dependent-place;['tokamak'];A tokamak is a device uisin a magnetic field tae confine a plasma in the shape o a torus.
dependent-place;['mausoleum'];A mausoleum is a freemit free-staundin biggin constructit as a monument enclosin the interment space or burial chamber o a deceased person or fowk.
dependent-place;['san andreas fault'];The San Andreas Fault is a continental transform fault that extends roughly 810 miles through Californie in the Unitit States.
dependent-place;['stoma', 'stomata'];In botany, a stoma, cried a stomate an aw, is a pore, foond in the epidermis o leafs, stems, an ither organs, that facilitates gas exchynge.
dependent-place;['infaw'];An infaw is a place whaur twa or mair gates forgaither.
dependent-place;['focus'];In geometrical optics, a focus, an aw cried an eemage pynt, is the pynt whaur licht rays oreeginatin frae a pynt on the object converge.
dependent-place;['roondaboot'];A roondaboot is a teep o circular infaw whaur traffec is alloued tae flowe in wan direction aroond a centre island, an the richt o wey is maistlins gied tae vehicles awready in the roondaboot.
dependent-place;['vacuum'];Vacuum is space that is devoid o matter.
dependent-place;['cave'];A cave or cavern is a hollae place in the grund, especially naitural unnergrund space muckle enough for a human tae enter.
dependent-place;['pupil'];The pupil is a black hole locatit in the centre o the iris o the ee that allous licht tae strick the retina.
dependent-place;['richt angle'];In geometry an trigonometry, a richt angle is an angle that bisects the angle formed bi twa halves o a straicht line.
dependent-place;['muntain pass'];A moontain pass is a route throu a moontain range or ower a ridge.
dependent-place;['troposphere', 'troposfera'];The troposphere is the lawest portion o Yird's atmosphere.
dependent-place;['epidermis'];The epidermis is componed o the ootermost layers o cells in the skin, "epi" in Greek meanin "ower" or "upon", which thegither wi the dermis forms the cutis.
dependent-place;['exosphere'];The exosphere is a thin, atmosphere-lik volume surroondin a planet or naitural satellite whaur molecules are gravitationally boond tae that bouk, but whaur the density is too law for them tae behave as a gas bi collidin wi ilk ither.
dependent-place;['atomic nucleus', 'atomic nuclei'];The nucleus is the very dense region consistin o protons an neutrons at the centre o an atom.
dependent-place;['lithosphere'];The lithosphere is the rigid ootermaist shell o a rocky planet defined on the basis o the mechanical properties.
dependent-place;['angle'];In geometry, an angle is the figure furmed bi twa rays, cried the sides o the angle, sharin a common endpoint, cried the vertex o the angle.
dependent-place;['hydrosphere'];The hydrosphere in pheesical geografie describes the combined mass o watter foond on, unner, an ower the surface o a planet.
ecological-collective;['warld', 'world'];The Warld is a proper noon for the planet Yird frae a human pynt o view, as a place that human beins bides in.
ecological-collective;['flora', 'plant', 'plantae', 'plants', 'plaunt', 'plaunts', 'vegetabilia'];Plants are ane o five big groups o leevin things.
ecological-collective;['flora', 'plant', 'plantae', 'plants', 'plaunt', 'plaunts', 'vegetabilia'];Flora is the plant life occurrin in a pairticular region or time, generally the naiturally occurrin or indigenous—native plant life.
ecological-collective;['forest', 'wälder'];A forest, an aa referred tae as a wid or the wids, is an aurie wi a heich density o trees.
event;['el niño'];El Niño is the wairm phase o the El Niño Soothren Oscillation an is associatit wi a baund o wairm ocean watter that develops in the central an east-central equatorial Paceefic, includin off the Paceefic coast o Sooth Americae.
event;['amplitude'];The amplitude o a periodic variable is a measur o its chynge ower a single period.
event;['marathon'];The marathon is a lang-distance runnin event wi an offeecial distance o 42.195 kilometres, uisually run as a gate race.
event;['tsunami'];A tsunami (plural: tsunamis or tsunami. frae Japanese: 津波, lit.
event;['motion'];In pheesics, motion is a chynge in poseetion o an object wi respect tae time an its reference pynt.
event;['graduation'];Graduation is gettin a diploma or academic degree or the ceremony that is sometimes associatit, in which students acome graduates.
event;['grand naitional', 'grand national'];The Grand Naitional is a Naitional Hunt horse race held annually at Aintree Racecourse in Liverpuil, Ingland.
event;['winter olympic gemmes', 'winter olympics'];The Winter Olympic Gemmes is a major internaitional sportin event that occurs ance ivery fower year.
event;['wildfire'];A wildfire, wilderness fire or landwart fire is an uncontrolled fire in an airt o dry growthe occurin in landwart airts.
event;['coronation'];A coronation is a ceremony markin the formal investiture o a monarch an/or thair consort wi regal pouer, uisually involvin the reetual placement o a croun upon his or her heid an the presentation o ither items o regalia.
event;['noah', 'נוֹחַ'];In Abrahamic releegions, Noah, or Noé or Noach, wis the tent an last o the pre-fluid Patriarchs.
event;['action potential', 'nerve impulse'];In pheesiology, an action potential is a short-lastin event in which the electrical membrane potential o a cell rapidly rises an faws, follaein a consistent trajectory.
event;['olympic gemmes', 'olympeec games', 'olympics'];The modren Olympic Gemmes is the leadin internaitional sportin event featurin simmer an winter sports competitions in whilk thoosands o athletes participate in a variety o competitions.
event;['nurr', 'jirr', 'nirr', 'nurrin', 'nyirrin', 'nyur', 'growlin'];Nurrin is ane o the soonds makkit bi preditory ainimals, whan thay think thay are bein thraitent.
functional-matter;['hangul', 'chosongul', "chosŏn'gŭl"];The Korean alphabet, an aa kent as Hangul, or Chosongul, is the hamespun alphabet o the Korean leid.
functional-matter;['barnbrack'];Barnbrack, an aw eften shortened tae brack, is a quick breid wi addit sultanas an raisins.
functional-matter;['sushi'];Sushi is a Japanese fuid consistin o cuiked vinegared rice combined wi ither ingredients, uisually raw fish or ither seafood.
functional-matter;['sashimi'];Sashimi is a Japanese delicacy makit o verra fresh raw meat or fish sliced intae thin pieces.
functional-matter;['taco'];A taco is a tradeetional Mexican dish componed o a corn or wheat tortilla foldit or rolled aroond a fillin.
functional-matter;['pita'];Pita or pitta is a term uised tae denote several different types o bread in mony Mediterranean, Balkan an Middle Eastren cuisines.
functional-matter;['falafel', 'falafels'];Falafel is a deep-fried baw or patty made frae grund chickpeas, fava beans, or baith.
functional-matter;['haggis', 'haggis.'];Haggis is a tradeetional Scots dish.
