physical-object;['सुरक्षा जमा कक्ष'];सुरक्षा जमा कक्ष तथा लॉकर हे आपले मौल्यवान ऐवज, दस्तऐवज ठेवण्यासाठी ग्राहकाने बँकेकडून भाड्याने घेतलेली डबावजा जागा असते.
physical-object;['पेंटॅगॉन', 'pentagon'];द पेंटॅगॉन हे अमेरिकेच्या सुरक्षा संस्थेचे मुख्यालय आहे.
physical-object;['चीनची भिंत', 'ग्रेट वॉल ऑफ चायना'];चीनची भिंत चीन देशात अतिप्राचीन काळात उत्तरेकडील सीमेवरुन मंगोलिया प्रांतातून होणारी परकीय आक्रमणे थांबविण्यासाठी दगड, माती व विटा वापरुन बांधली गेली.
physical-object;['मॅजिनो लाइन', 'मॅजिनो लाईन', 'लिन मॅजिनो'];मॅजिनो लाइन तथा लिन मॅजिनो ही १९३०च्या दशकात फ्रांसने जर्मनीची आगळीक रोखण्यासाठी केलेली तटबंदी होती.
physical-object;['खिडकी'];खोली मध्ये हवा येण्यासाठी भिंतीमध्ये जी जागा ठेवण्यात येते त्याला खिडकी असे म्हणतात.
physical-object;['स्कार्फ'];स्कार्फ हा गर्भावस्था, सूर्य किरणांपासून संरक्षण, स्वच्छता, फॅशन किंवा धार्मिक कारणांमुळे गळ्याभोवती बांधलेला कापडाचा एक भाग आहे.
physical-object;['सदरा'];हा पुरुषांनी कमरेच्या वर परिधान करायचा एक वस्त्रप्रकार आहे.
physical-object;['साडी', 'şari', 'पातळ', 'लुगडे', 'सहावारी पातळ'];== निऱ्या ==
physical-object;['छिन्नी'];छिन्नी हे लाकूडकाम किंवा खडक तोडण्यासाठी वापरण्यात येणारे उपकरण आहे.
physical-object;['हातोडा', 'हातोडी'];हातोडा हे हाताने गती देऊन लक्ष्यावर ठोका मारण्यासाठी वापरले जाणारे अवजार आहे.
physical-object;['मोबाईल फोन', 'ब्र्ह्मन्ध्वनी', 'भ्रमणध्वनि', 'भ्रमणध्वनी', 'सेलफोन'];भ्रमणध्वनी हे एक इलेक्ट्रॉनिक्स उपकरण असून याचा दूरसंचारासाठी उपयोग केला जातो.
physical-object;['रंभा'];रंभा किंवा क्रोबार हातानी वापरायचे लोखंडी अवजार आहे जे कि अडकलेले किंवा वाकलेले खिळे काढण्यासाठी वापरले जाते.
physical-object;['टिकास', 'कुदळ', 'टिकाव'];कुदळ किंवा टिकाव हे हाताने वापरायचे अवजार आहे.
physical-object;['लढाऊ विमान'];एक लढाऊ हे प्रामुख्याने इतर विमानाचा विरोधात हवेतल्या हवेत लढण्यासाठी रचना केलेले लष्करी विमान आहे.
physical-object;['धुलाईयंत्र', 'धुलाई यंत्र', 'वॉशिंग मशीन'];कपडे धुण्यासाठी वापरण्यात येणारे एक यंत्र.
physical-object;['सिनेगॉग'];सिनेगॉग हे ज्यू धर्मीय लोकांचे प्रार्थनाघर आहे.
physical-object;['विजेचा दिवा', 'बल्बची शंभर वर्षे', 'विद्युत बल्ब', 'वीजेचा दिवा'];वीजेचा दिवा निर्वात किंवा ज्वलनविरोधी वायूने भरलेल्या काचेच्या फुग्यात वीजवाहक तारेतून विद्युत्प्रवाह पाठवून त्यायोगे ती तार तापवून त्यातून प्रकाश निर्माण करण्याच्या तत्त्वावर हा शोध आधारित आहे.
physical-object;['धक्का'];नाव वा जहाज यांच्या थांबण्यासाठी कृत्रिमरित्या केलेला समुद्र वा नदीतील फलाट
physical-object;['गढी', 'किल्ला', 'गड', 'दुर्ग'];आक्रमणापासुन बचाव व्हावा म्हणुन बांधलेले किल्लासदृष्य घर वा राजवाडा.या वास्तुचा वापर राजदरबारी वा तत्कालिन श्रीमंत राहण्यासाठी करीत असत.शक्यतोवर, या वास्तुचे बांधकाम उंच जागेवर किंवा टेकडीवर/पहाडावर,आक्रमणास आणि पोचण्यास त्रासदायक अश्या जागी असे.यात आक्रमणापासुन बचावाची किंवा आक्रमण झाल्यास परतविण्याची अनेक साधने आणि युक्त्या केलेल्या असत.
physical-object;['हूव्हर धरण', 'हूवर धरण', 'हूवर डॅम'];हूवर धरण हे अमेरिकेच्या नेव्हाडा व अ‍ॅरिझोना राज्यांच्या सीमेवरून वाहणार्‍या कॉलोराडो नदीवरील एक धरण आहे.
physical-object;['क्रुझर'];क्रुझर हा लढाऊ नौकांचा एक प्रकार आहे.
physical-object;['तोफ'];तोफ म्हणजे मोठी बंदूक किंवा आत स्फोटक दारू भरून बार काढण्याचे यंत्र होय.
physical-object;['स्वातंत्र्यदेवतेचा पुतळा', 'स्टॅच्यू ऑफ लिबर्टी', 'स्वतंत्रतादेवीचा पुतळा'];स्वातंत्र्यदेवतेचा पुतळा किंवा स्टॅच्यू ऑफ लिबर्टी ही अमेरिकेच्या न्यू यॉर्क शहरातील लिबर्टी आयलंड वर उभारण्यात आलेली एक वास्तू आहे.
physical-object;['स्टेडियम'];[[चित्|250 px|इवलेसे|सामन्यानुसार रंग बदलणारे म्युनिकमधील अलायंझ अरेना]] स्टेडियम ही मैदानी खेळ, सोहळे व इत्यादी घटनांसाठी वापरली जाणारी इमारत आहे.
physical-object;['विमानवाहू नौका', 'विमानवाहक युद्धनौका', 'विमानवाहू युद्धनौका', 'विवानौका'];खोल समुद्रात वावरणाऱ्या आणि आपल्यावर विमाने बाळगणाऱ्या आरमारी नौकांना विमानवाहू नौका म्हणतात.
physical-object;['कॅमेरा', 'छायाचित्रक'];कॅमेरा हे प्रकाशाच्या साहाय्याने छायाचित्रे टिपण्याचे एक यंत्र आहे.
physical-object;['छत्री'];छत्री म्हणजे प्राथमिकरित्या उन व पाऊस यापासून रक्षण करण्यासाठी बनवलेली वस्तू होय.
physical-object;['धोतर', 'dhoti'];धोतर हा भारतीय पुरुषांचा पारंपारिक वस्त्रप्रकार आहे.
physical-object;['पंप'];पंप एक असे साधन आहे जे यांत्रिक क्रियेद्वारे द्रव किंवा कधीकधी स्लरी एका ठिकाणाहून दुसऱ्या ठिकाणी पोहचवते.
physical-object;['उपग्रह'];"एखाद्या ग्रहाभोवती परिभ्रमण करणारी वस्तू किंवा ग्रह" म्हणजेचं उपग्रह.
physical-object;['स्टेथोस्कोप', 'स्टेथेस्कोप'];हे एक वैद्यकीय हत्यार आहे की ज्याच्या साहाय्याने छातीतील फुप्फुस व र्‍हदय यांचे परीक्षण करता येते.याच्या मध्ये
physical-object;['किटली'];किटली हे स्वयंपाकघरातील भांडे आहे.
physical-object;['पापणी', 'पापण्या'];प्राण्याच्या चेहऱ्यावरील डोळ्यांच्या सुरक्षेसाठी असलेल्या व डोळा झाकण्याची क्षमता असलेल्या त्वचेच्या थराला पापणी असे म्हणतात.
physical-object;['ड्रम'];ड्रम हे एक प्रकारचे नादवाद्य आहे.
physical-object;['संयुक्त गर्भनिरोधक गोळी'];या गोळ्यांमध्ये इस्ट्रोजेन आणि नवीन प्रकारच्या प्रोजेस्टेरॉनचा वापर केलेला असतो.
physical-object;['मानवरहित विमान', 'मानवरहित हवाई वाहने'];या विमानास टी-एम ए व्ही या नावानेही ओळखतात.याचे वजन सुमारे १० किलो असते.हे विमान १०००० फूट उंचीपर्यंत उंच उडु शकते.याचा वेग ७० कि.मी.
physical-object;['उद्वाहक'];The first recorded mechanism for lifting water was in the egyptain time cover 4000 years ago उद्वाहक हे ईमारतीच्या विविध मजल्यांवर सामान वा प्रवासी पोचविणारे,सरळ उभे चालणारे, एक प्रकारचे परिवहन आहे.त्यांना बल हे विद्युतचलित मोटर्स द्वारे मिळते ज्या एकतर खेच केबल व प्रती-वजनप्रणाली चालवितात किंवा दट्ट्या उचलण्यास तरल पदार्थ पंप करतात.
physical-object;['आरसा'];आरसा हि एक अशी वस्तू आहे जी प्रकाश प्रतिबिंब अशा प्रकारे प्रतिबिंबित करते की काही प्रकाश तरंगलांबीच्या घटनेच्या प्रकाशात, प्रतिबिंबित प्रकाश मूळ प्रकाशाच्या बर्‍याच किंवा बहुतेक सविस्तर भौतिक वैशिष्ट्ये जपून ठेवतो, ज्याला विशिष्ट प्रतिबिंब म्हणतात.हे इतर प्रकाश परावर्तित वस्तूंपेक्षा भिन्न आहे जे ते सपाट पांढऱ्या रंगासारख्या रंग आणि विखुरलेल्या प्रतिबिंबित प्रकाशाशिवाय इतर मूळ तरंग संकेताचे बरेचसे जतन करीत नाहीत.
physical-object;['साखर कारखाना'];ऊस, बीट इ.च्या रसापासुन ज्या ठिकाणी साखर तयार केली जाते त्याला साखर कारखाना म्हणतात.
physical-object;['कवळी'];कृत्रिम दातांना कवळी असे म्हणतात.
physical-object;['कृत्रिम अंग'];अपंगत्व आलेल्या किंवा अपघातात गमावलेल्या शरीराच्या भागाला जो नैसर्गिक नसलेला भाग बसवला जातो त्याला कृत्रिम अंग असे म्हणतात.
physical-object;['क्षेपणास्त्र', 'क्षेपणास्त्रे'];क्षेपणास्त्र म्हणजे स्वतःच चालू शकेल असे अस्त्र.
physical-object;['शयनगृह'];शयनगृह म्हणजे घरातली झोपायची खोली.
physical-object;['गुलाग', 'gulag', 'ग्लाव्हनोई उप्राव्लेनी लागेरै'];गुलाग तथा ग्लाव्हनोई उप्राव्लेनी लागेरै ही सोव्हियेत संघातील सरकारी वेठबिगारी छावण्या व तुरुंगांचे व्यवस्थापन करणारी संस्था होती.
physical-object;['ट्रांझिस्टर'];ट्रांझिस्टर हा अर्धवाहक गटातील एक इलेक्ट्रॉनिक घटक आहे.
physical-object;['डायोड'];डायोड प्रत्यावर्ति वीजधारा एकच दिशेने वाहत ठेवण्यासाठी वापरतात.डेटा डायोडसाठी, युनिडायरेक्शनल नेटवर्क पहा.
physical-object;['बळी', 'बळी, क्रिकेट'];क्रिकेटच्या खेळात गोलंदाज फलंदाजाला बाद करून त्याचा डाव संपवू शकतो.
physical-object;['जॅकेट'];जॅकेट हे कमरेपर्यंत वरचे शरीर झाकणारे वस्त्र आहे.
physical-object;['चाक'];चाक हे वर्तुळ आकाराचे असते व स्वतःभोवती फिरणारे असते.
physical-object;['भिंग'];भिंग ही बहिर्वक्र आकाराची काचेची चकती असून त्याचा उपयोग कोणत्याही वस्तूच्या प्रतिमेचे दृष्य रूप मोठे करण्यासाठी होतो.
physical-object;['क्लॅरिनेट'];क्लॅरिनेट हे फुंकून वाजवण्याच्या प्रकारातले वाद्य आहे.
physical-object;['गोट्या खेळ'];गोट्या हा फार प्राचीन खेळ आहे.
physical-object;['दप्तर'];दप्तर हे एक शालेय सहित्य ठेवण्याचे साधन आहे.याच्या साहाय्याने मूलांना शालेय साहित्य शाळेत नेहने सोपे जाते.
physical-object;['विनाशिका'];विनाशिका हा जलद, जपळ गतीच्या लढाऊ नौकांचा प्रकार आहे.
physical-object;['केसांचे टोप'];केसांचे टोप हे माणसाच्या डोक्यावर घालण्याचे केसांचे टोप होय.
physical-object;['विद्युतघट'];विद्युतघट म्हणजे रासायनिक शक्तीचे विद्युतशक्तीत रुपांतर करणारे साधन होय.
physical-object;['बाहुली'];बाहुली ही मनुष्याची छोट्या रूपातील प्रतिमा किंवा वस्तू होय.
physical-object;['वखार', 'गोदाम'];मालाचा साठा करु शकणा-या जागेस वखार असे म्हणतात.
physical-object;['सतार', 'sitar', 'सितार'];एक तंतुवाद्य
physical-object;['पियानो', 'कॅसिओ'];पियानो हा तार असणारा वाद्ययंत्र आहे.
physical-object;['गिटार'];गिटार हे तारा छेडून वाजवायचे एक तंतुवाद्य आहे.
physical-object;['कारंजे'];स्रोतापासून पाणी घेऊन ते विविध प्रकारे उडवण्याऱ्या स्थायी रचनेस कारंजे असे म्हणतात.
physical-object;['मनोरा'];मनोरा म्हणजे एक उंच संरचना, जिची उंची ही रुंदीपेक्षा बरीच जास्त असते.खांबांस तणावाचे दोर असतात तर मनोर्‍यास ते नसतात त्यामुळे खांबांपासून त्यांचे वेगळेपण जाणवते.मनोरा ही 'स्वयंआधारीत संरचना' असते.त्यांच्या उंचीचा वापर करण्यासाठी मनोरे बांधण्यात येतात.मनोर्‍याचा पाया बराच खोल असतो.मनोरा हा एखाद्या इमारतीचा किंवा बांधकामाचा एक भाग असु शकतो.
physical-object;['इमारत'];आसरा वा वावरासाठी उभारलेल्या कोणत्याही मानवनिर्मित बांधकामास इमारत म्हणतात.
physical-object;['पाणबुडी', 'पाणडुब्बी'];पाणबुडी हे पाण्याच्या खालून चालू शकणारे जहाज आहे.
physical-object;['अंतराळ पोशाख'];अवकाशात वापरल्या जाणाऱ्या विशेष प्रकारे बनवलेल्या कपड्यांना अंतराळ पोशाख असे म्हणतात.
physical-object;['गोल्डन गेट ब्रिज', 'गोल्डन गेट पूल'];गोल्डन गेट पूल हा अमेरिकेच्या सॅन फ्रान्सिस्को शहरामधील एक प्रसिद्ध पूल आहे.
physical-object;['बॉस्फोरस पूल', 'पहिला बॉस्फोरस पूल', 'बॉस्पोरस पूल'];बॉस्फोरस पूल किंवा पहिला बॉस्फोरस पूल हा तुर्कस्तानच्या इस्तंबूल शहरातील पूल आहे.
physical-object;['ब्रूकलिन ब्रिज', 'brooklyn bridge', 'ब्रुकलिन ब्रिज', 'ब्रूकलिन पूल'];ब्रूकलिन ब्रिज हा अमेरिकेच्या न्यू यॉर्क शहरामधील एक पूल आहे.
physical-object;['वीरगळ', 'menhir'];वीरगळ म्हणजे वीर पुरुषांच्या स्मरणार्थ उभारण्यात आलेला स्तंभ असतो.
physical-object;['विद्युत चुंबक'];जेंव्हा एखाद्या तारेच्या वेटोळ्यातुन विद्युत प्रवाहित केल्या जाते तेंव्हा त्या तारेसभोवताल चुंबकीय क्षेत्र निर्माण होते.विद्युत प्रवाह बंद केला असता चुंबकीय क्षेत्र नष्ट होते.
physical-object;['चित्रपटगृह'];चित्रपटगृह म्हणजेच फिल्म टॉकिझ /सिनेमाघर/सिनेमाथिएटर
physical-object;['निरोध', 'कॉन्डोम'];सर्वसामान्य भाषेत निरोध हे एक गर्भनिरोधक आहे.
physical-object;['घड्याळ'];घड्याळ हे काल मापनासाठी वापरले जाणारे उपकरण आहे.
physical-object;['फावडे'];फावडे हे मातीच्या खोदकामासाठी किंवा माती, वाळू, कचरा वगैरे पदार्थ गोळा करून घमेल्यात भरण्यासाठी वापरण्यात येणारे एक अवजार आहे.
physical-object;['ब्लाउज'];ब्लाउज किंवा झंपर हे कंबरेच्या वर घालण्याचे वस्त्र आहे.
physical-object;['कोडी'];कोडी हा एक खेळ आहे, ज्यामध्ये एखाद्या व्यक्तीची कल्पना करण्याची शक्ती तसेच त्या व्यक्तीचे ज्ञान तपासले जाऊ शकते.
physical-object;['देवक-स्तंभ', 'देवक स्तंभ', 'देवक–स्तंभ'];इश्वर नाहीत अशा पण इश्वर समकक्ष पूजनीय अथवा पवित्र परंतु प्रतीकांना देवक संबोधले जाते.
physical-object;['स्टॅनफर्ड विद्यापीठ', 'लेलँड स्टॅनफर्ड जुनियर विद्यापीठ', 'स्टॅनफर्ड युनिव्हर्सिटी', 'स्टॅनफोर्ड युनिव्हर्सिटी', 'स्टॅनफोर्ड विद्यापीठ'];स्टॅनफर्ड विद्यापीठ हे स्टॅनफर्ड, कॅलिफोर्निया ह्या शहरातस्थित असलेले अमेरिकेतील सर्वात मोठ्या विद्यापीठांपैकी एक विद्यापीठ आहे.
physical-object;['ऑक्सफर्ड विद्यापीठ', 'ऑक्\u200dसफर्ड विद्यापीठ'];ऑक्‍सफर्ड विद्यापीठ हे ब्रिटनमधील ऑक्‍सफर्ड शहरात आहे.
