geographical-object;['पँजिआ', 'pangea', 'पँजिया', 'पॅंजिआ'];पॅंजिआ हा एक प्रागैतिहासिक महाखंड होता.
geographical-object;['बोर्नियो', 'bornéo', 'बॉर्नियो', 'बोर्निओ'];बोर्नियो हे आग्नेय आशियातील ऑस्ट्रेलियाच्या उत्तरेला हिंदी महासागरात वसलेले एक बेट आहे.
geographical-object;['अझोवचा समुद्र'];अझोवचा समुद्र हा पूर्व युरोपाच्या दक्षिण भागातील एक छोटा समुद्र आहे.
geographical-object;['कांपेचेचे आखात', 'कॅम्पेकेचे आखात', 'बाहिया दि कांपेचे'];कांपेचेचे आखात हे मेक्सिकोच्या आखातामधील एक उप-आखात आहे.
geographical-object;['फंडीचे आखात'];फंडीचे आखात हे उत्तर अमेरिकेच्या अटलांटिक किनाऱ्यावरील आखात आहे.
geographical-object;['सरोवर', 'तलाव'];सरोवर म्हणजे पृथ्वीवरील गोड्या अथवा खाऱ्या पाण्याचा मोठ्या आकाराचा साठा.
geographical-object;['खारकच्छ', 'खाजण'];खारकच्छ, किंवा खाजण, म्हणजे समुद्रकिनारा व त्यापासून थोड्या अंतरावर वाळूचे संचयन होऊन निर्माण झालेले वाळूचे दांडे किंवा बांध या दोहोंमधील खाऱ्या पाण्याची पट्टी अथवा सरोवर होय.
geographical-object;['इटालियन द्वीपकल्प'];इटालियन द्वीपकल्प हा दक्षिण युरोपामधील तीन मोठ्या द्वीपकल्पांपैकी एक आहे.
geographical-object;['उपनदी'];जी नदी समुद्रास मिळत नाही परंतु जिला स्वतंत्र अस्तित्त्व असते, तिला उपनदी म्हणतात.
geographical-object;['केमन द्वीपसमूह', 'केमन बेटे', 'केमॅन द्वीप', 'केमॅन द्वीपसमुह'];केमन द्वीपसमूह हा कॅरिबियनमधील युनायटेड किंग्डमचा एक स्वायत्त प्रांत आहे.
geographical-object;['अँग्विला', 'anguilla'];ॲंग्विला हा कॅरिबियनच्या लेसर ॲंटिल्स भागामधील युनायटेड किंग्डमचा एक प्रांत आहे.
geographical-object;['दक्षिण अमेरिका'];दक्षिण अमेरिका हा पृथ्वीवरील ५ प्रमुख खंडांपैकी एक खंड आहे.
geographical-object;['समुद्र'];समुद्र हा पृथ्वीवरील खाऱ्या पाण्याचा मोठा साठा आहे.
geographical-object;['दॉन नदी', 'डॉन नदी', 'don'];दॉन ही पश्चिम रशियामधील एक प्रमुख नदी आहे.
geographical-object;['पो नदी', 'पो'];पो नदी इटलीतील एक प्रमुख नदी आहे.
geographical-object;['व्हिस्चुला नदी', 'विस्तुला नदी'];व्हिस्चुला नदी ही पोलंड देशामधील सर्वात मोठी व महत्त्वाची नदी आहे.
geographical-object;['ताहो नदी', 'एल ताहो'];एल ताहो ही स्पेनमधली आणि इबेरिया द्वीपकल्पातली सर्वांत लांब नदी आहे.
geographical-object;['सीन नदी', 'सेन'];सीन नदी ही फ्रान्समधून वाहणारी प्रमुख नदी आहे.
geographical-object;['लाऊआर नदी', 'ल्वार'];लाऊआर ही फ्रान्स देशातील सर्वात लांब नदी आहे.
geographical-object;['फेरो द्वीपसमूह', 'फरोए बेटे', 'फॅरो द्वीपसमूह', 'फेरो द्विपे', 'फेरो द्वीपसमुह', 'फेरो द्वीपे'];फेरो द्वीपसमूह हा उत्तर अटलांटिक महासागरातील डेन्मार्क देशाचा एक स्वायत्त प्रदेश आहे.
geographical-object;['ग्रेट लेक्स', 'भव्य सरोवरे'];ग्रेट लेक्स ही उत्तर अमेरिका खंडाच्या ईशान्य भागात अमेरिकेची संयुक्त संस्थाने व कॅनडा देशांच्या सीमेवरील गोड्या पाण्याची मोठी सरोवरे आहेत.
geographical-object;['मार्शल द्वीपसमूह', 'मार्शल बेटे', 'मार्शल द्वीपसमुह', 'मार्शल द्वीपे'];मार्शल द्वीपसमूह हा प्रशांत महासागरात वसलेला ओशनिया खंडाच्या मायक्रोनेशिया भागातील एक छोटा द्वीप-देश आहे.
geographical-object;['गिल्बर्ट द्वीपसमूह', 'किंग्समिल द्वीपसमूह'];गिल्बर्ट द्वीपसमूह किरिबाटीतील मुख्य द्वीपसमूह आहे.
geographical-object;['बर्म्युडा', 'बर्मुडा'];बर्म्युडा हा उत्तर अटलांटिक महासागरातील युनायटेड किंग्डमचा एक स्वायत्त प्रांत आहे.
geographical-object;['इंडिज', 'पूर्व भारत', 'ईस्ट इंडिज', 'ईस्ट इंडीझ'];पूर्व भारत हा भारत देशातील पश्चिम बंगाल, बिहार, झारखंड आणि ओडिशा राज्यांचा समावेश असलेला भाग आहे.
geographical-object;['नेदरलँड्स अँटिल्स', 'नेदरलँड्स अँटीलेस', 'नेदरलॅंड्स ॲंटिल्स'];नेदरलँड्स ॲंटिल्स हा कॅरिबियनच्या लेसर ॲंटिल्स भागामधील नेदरलँड्सच्या राजतंत्राचा एक भूतपूर्व देश आहे.
geographical-object;['गालापागोस द्वीपसमूह', 'गालापागोस', 'गॅलापागोस'];हा लेख गॅलापागोस द्वीपसमूहाबद्दल आहे.
geographical-object;['अँटिल्स', 'ग्रेटर अँटिल्स', 'लेसर अँटिल्स'];ॲंटिल्स हा कॅरिबियन समुद्रातील अनेक बेटांचा एक समूह आहे.
geographical-object;['द्वीपसमूह', 'बेट समुदाय'];द्वीपसमूह हा अनेक बेटांच्या साखळीपासून किंवा पुंजक्यापासून तयार होतो.
geographical-object;['कॅनरी द्वीपसमूह', 'कॅनरी द्वीपसमुह', 'कॅनरी बेटे', 'कॅनेरी द्वीपसमूह', 'कॅनेरी द्वीपे'];कॅनरी द्वीपसमूह हा अटलांटिक महासागरामधील एक द्वीपसमूह व स्पेन देशाचा स्वायत्त संघ आहे.
geographical-object;['फॉकलंड द्वीपसमूह', 'फॉकलंड बेटे', 'फाल्कलँड द्वीपे', 'फॉकलँड द्वीपे', 'फॉकलंड द्वीप'];फॉकलंड द्वीपसमूह दक्षिण अटलांटिक महासागरातील आर्जेन्टिनाजवळचा एक द्वीपसमूह आहे.
geographical-object;['गिनीचे आखात'];गिनीचे आखात हा आफ्रिकेच्या पश्चिमेकडील अटलांटिक महासागराचा एक भाग आहे.
geographical-object;['कॅलिफोर्नियाचे आखात', 'कॉर्तेझचा समुद्र', 'कोर्तेसचा समुद्र'];कॅलिफोर्नियाचे आखात हा प्रशांत महासागरामधील एक समुद्र आहे.
geographical-object;['श्वार्त्सवाल्ड', 'schwarzwald', 'ब्लॅक फॉरेस्ट', 'श्वार्झवाल्ड'];श्वार्त्सवाल्ड ही जर्मनी देशाच्या बाडेन-व्युर्टेंबर्ग राज्यातील एक पर्वतरांग आहे.
geographical-object;['गोंडवन', 'gondwana', 'गोंडवाना'];लाखो वर्षांपूर्वी पृथ्वीवरील भूखंड एकसंध होता.
geographical-object;['अरल समुद्र'];अरल समुद्र हे मध्य आशियातील एक खार्‍या पाण्याचे सरोवर आहे.
geographical-object;['बेट', 'द्वीप'];बेट अथवा द्वीप हा पृथ्वीवरील जमीनीचा असा भाग आहे जो चारही दिशांनी पाण्याने वेढला गेला आहे.
geographical-object;['महासागर'];महासागर हा पृथ्वीवरील अतिविशाल खाऱ्या पाण्याचा साठा आहे.
geographical-object;['ओशनिया'];ओशनिया हा पृथ्वीवरील एक खंड आहे.
geographical-object;['बाल्कन'];बाल्कन हा आग्नेय युरोपातील एक भौगोलिक प्रदेश आहे.
geographical-object;['कॅस्पियन समुद्र', 'कास्पियन समुद्र'];कॅस्पियन समुद्र हा पृथ्वीवरील जमिनीने वेढलेला सर्वात मोठा पाण्याचा साठा आहे.
geographical-object;['फ्योर्ड'];फ्योर्ड ही पृथ्वीवरील एक जलीय रचना आहे.
geographical-object;['काँगो नदी', 'कांगो नदी', 'कॉँगो नदी'];कॉंगो नदी ही आफ्रिकेतील एक प्रमुख नदी आहे.
geographical-object;['रोन नदी', 'ऱ्होन नदी', 'र्\u200dहोन नदी'];ऱ्होन ही युरोपामधील एक प्रमुख नदी आहे.
geographical-object;['मिसिसिपी नदी', 'मिसिसीपी', 'मिसिसीपी नदी'];मिसिसिपी नदी ही उत्तर अमेरिका खंडातील सर्वात मोठी नदी आहे.
geographical-object;['ह्वांग हो नदी', 'पीत नदी', 'यलो रिव्हर', 'हतान गोल', 'हुवांग हे नदी', 'ह्वांग हे', 'ह्वांग हे नदी', 'ह्वांग हो'];ह्वांग हो नदी
geographical-object;['अ\u200dॅमेझॉन नदी', 'अमेझॉन नदी', 'अॅमेझॉन', 'अॅमेझॉन नदी', 'अॅमेझोन नदी', 'ऍमेझॉन नदी', 'ॲमेझॉन नदी'];अ‍ॅमेझॉन ही जगातील सर्वांत मोठी नदी आहे.
geographical-object;['सुलावेसी', 'sulawesi'];सुलावेसी हे आग्नेय आशियामधील इंडोनेशिया देशाच्या चार प्रमुख बेटांपैकी एक आहे.
geographical-object;['सुमात्रा', 'sumatra'];सुमात्रा हे इंडोनेशिया देशातील सर्वात मोठे बेट आहे.
geographical-object;['सामुद्रधुनी'];दोन मोठ्या जलाशयांना जोडणाऱ्या नैसर्गिक कालव्यासमान असलेल्या पाण्याच्या प्रवाहाला सामुद्रधुनी म्हणतात.
geographical-object;['हडसन नदी', 'हड्सन'];हडसन नदी ही अमेरिका देशामधील एक नदी आहे.
geographical-object;['रियो ग्रांदे', 'rio grande', 'रियो ग्रांदे नदी', 'रियो ग्रान्दे', 'रियो ब्राव्हो देल नोर्ते'];रियो ग्रांदे ही उत्तर अमेरिका खंडातील एक प्रमुख नदी आहे.
geographical-object;['सेंट लॉरेन्स नदी'];सेंट लॉरेन्स नदी ही उत्तर अमेरिकेतील ऑन्टारियो ह्या भव्य सरोवराला अटलांटिक महासागरासोबत जोडणारी १,१९७ किमी लांबीची एक नदी आहे.
geographical-object;['कोलंबिया नदी'];कोलंबिया नदी ही उत्तर अमेरिका खंडाच्या पॅसिफिक वायव्य भागातील सर्वात मोठी नदी आहे.
geographical-object;['अकबाचे आखात', 'अकाबाचे आखात'];अकाबाचे आखात हे लाल समुद्राच्या उत्तरेकडील एक मोठे आखात आहे.
geographical-object;['बोथनियाचे आखात', 'बॉटेनव्हिकेन', 'बोथनियन समुद्र', 'बोथनियाचा उपसागर'];बोथनियाचे आखात हे बाल्टिक समुद्राचे सर्वात उत्तरेकडील अंग आहे.
geographical-object;['अरबी समुद्र', 'अरब सागर', 'अरबी उपसागर', 'सिंधुसागर', 'सिंधूसागर'];भारताच्या पश्चिमेला असलेल्या समुद्राला अरबी समुद्र असे म्हणतात.
geographical-object;['स्वालबार्ड', 'svalbard'];स्वालबार्ड हा आर्क्टिक महासागरातील व नॉर्वेच्या अधिपत्याखालील एक द्वीपसमूह आहे.
geographical-object;['न्यू गिनी'];न्यू गिनी हे ओशनिया खंडातील एक बेट आहे.
geographical-object;['अरबी द्वीपकल्प', 'अरेबिया'];अरबी द्वीपकल्प किंवा अरेबिया हा मध्यपूर्वेतील आशिया व आफ्रिका खंडांच्या सीमेवरील एक द्वीपकल्प आहे.
geographical-object;['युकातान द्वीपकल्प'];युकातान द्वीपकल्प हा मेक्सिको देशाच्या आग्नेय भागातील एक द्वीपकल्प आहे.
geographical-object;['कामचत्का द्वीपकल्प'];कामचत्का द्वीपकल्प हा रशिया च्या अति पूर्व भागामधील एक द्वीपकल्प आहे.
geographical-object;['सिनाई द्वीपकल्प', 'साइनाई द्वीपकल्प', 'साईनाई द्वीपकल्प'];सिनाई द्वीपकल्प हा इजिप्त देशातील एक त्रिकोणी आकाराचा द्वीपकल्प आहे.
geographical-object;['मलय द्वीपकल्प', 'मलाय द्वीपकल्प'];मलय द्वीपकल्प हा आग्नेय आशियामधीला एक द्वीपकल्प आहे.
geographical-object;['अनातोलिया', 'अनाटोलिया'];अनातोलिया ही आशियाच्या सर्वाधिक पश्चिमेकडील भूप्रदेशासाठी वापरली जाणारी भौगोलिक व ऐतिहासिक संज्ञा आहे.
geographical-object;['इबेरियन द्वीपकल्प', 'आय्बेरिया', 'आयबेरियन द्वीपकल्प', 'इबेरिया', 'इबेरिया द्वीपकल्प'];इबेरियन द्वीपकल्प, किंवा इबेरिया हा नैऋत्य युरोपातला एक द्वीपकल्प आहे ज्यावर स्पेन, पोर्तुगाल व आंदोरा हे तीन देश स्थित आहेत.
geographical-object;['केप ऑफ गुड होप'];केप ऑफ गुड होप हा दक्षिण आफ्रिकेतील अटलांटिक महासागराच्या किनाऱ्यावरील भूशिर आहे.
geographical-object;['नायगारा नदी'];नायगारा नदी ही उत्तर अमेरिकेतील ईरी व ऑन्टारियो ह्या दोन भव्य सरोवरांना जोडणारी ५८ किमी लांबीची एक नदी आहे.
geographical-object;['एल्ब नदी', 'एल्ब', 'एल्बा नदी', 'एल्बे नदी'];एल्ब नदी ही मध्य युरोपमधील मोठी नदी आहे.
geographical-object;['नेकार नदी', 'neckar'];नेकार नदी जर्मनीमधील नदी आहे.
geographical-object;['प्लॅट नदी', 'platte'];प्लॅट नदी अमेरिकेच्या कॉलोराडो आणि नेब्रास्का राज्यांतून वाहणारी नदी आहे.
geographical-object;['जॉर्डन नदी'];जॉर्डन नदी ही मध्यपूर्व आशियातील छोटी नदी आहे.
geographical-object;['कॉलोराडो नदी', 'रियो कॉलोराडो'];कॉलोराडो नदी अमेरिकेच्या कॉलोराडो राज्यात उगम पावणारी एक प्रमुख नदी आहे.
geographical-object;['पोटॉमॅक नदी', 'पोटोमॅक नदी'];पोटॉमॅक नदी अमेरिकेच्या पूर्व भागातील नदी आहे.
geographical-object;['अॅनियेन नदी', 'ऍनियेन नदी'];ॲनियेन नदी ही इटलीतील एक नदी आहे.
geographical-object;['ओहायो नदी'];ओहायो नदी ही मिसिसिपी नदीची सर्वात मोठी उपनदी व अमेरिकेची संयुक्त संस्थाने देशाच्या पूर्व भागामधील एक प्रमुख नदी आहे.
geographical-object;['नॉर्थ प्लॅट नदी', 'उत्तर प्लॅट नदी'];नॉर्थ प्लॅट नदी अमेरिकेतील मिसूरी नदीची उपनदी आहे.
geographical-object;['कंबरलँड नदी', 'कम्बरलँड नदी'];कंबरलॅंड नदी अमेरिकेच्या केंटकी आणि टेनेसी राज्यांतील मोठी नदी आहे.
geographical-object;['डेलावेर नदी'];डेलावेर नदी ही अमेरिका देशाच्या पूर्व भागातील एक महत्त्वाची नदी आहे.
geographical-object;['आर्कान्सा नदी', 'arkansas'];आर्कान्सा नदी ही अमेरिका देशामधील एक नदी व मिसिसिपी नदीची एक उपनदी आहे.
geographical-object;['गिला नदी'];गिला नदी ही अमेरिकेच्या न्यू मेक्सिको व ॲरिझोना राज्यांमधून वाहणारी एक नदी कॉलोराडो नदीची उपनदी आहे.
geographical-object;['येनिसे नदी', 'येनिसे आंगारा नदी'];येनिसे ही आशियाच्या सायबेरिया प्रदेशामधील तीन विशाल नद्यांपैकी एक नदी आहे.
geographical-object;['ओब नदी', 'ob', 'ऑब-इर्तिश नदी', 'ऑब इर्तिश नदी', 'ऑब ईर्तीश नदी'];ओब ही रशियाच्या सायबेरिया प्रदेशामधील तीन विशाल नद्यांपैकी एक नदी आहे.
geographical-object;['वोल्गा नदी', 'वोल्गा', 'व्होल्गा नदी'];व्होल्गा ही रशियामधील एक प्रमुख नदी आहे.
geographical-object;['मृत समुद्र'];मृत समुद्र हा इस्राएल व जॉर्डन यांच्या दरम्यान पसरलेला एक भूवेष्टित समुद्र आहे.
geographical-object;['काळा समुद्र'];काळा समुद्र आग्नेय दिशा युरोपातील हा भूवेष्टित समुद्र आहे.
geographical-object;['बाल्टिक समुद्र'];बाल्टिक समुद्र हा उत्तर युरोपामधील एक समुद्र आहे.
geographical-object;['इराणचे आखात', 'अरबी आखात', 'इराणचा अखात', 'इराणचा आखात', 'इराणाचे आखात', 'पर्शियन अखात', 'पर्शियन आखात', 'पर्शियन खाडी'];इराणचे आखात ऊर्फ पर्शियन आखात हा मध्यपूर्वेतील इराणला अरबी द्वीपकल्पापासून वेगळा करणारा हिंदी महासागराचा एक भाग आहे.
geographical-object;['तळे'];तळे हा नैसर्गिक किंवा मानवनिर्मित पाण्याचा साठा आहे.
geographical-object;['ओरिनोको नदी'];ओरिनोको ही दक्षिण अमेरिका खंडामधील एक प्रमुख नदी आहे.
