region;['लिबियाई दिनार', 'लिबियन दिनार'];दिनार हे लिबियाचे अधिकृत चलन आहे.
region;['मालावियन क्वाचा'];क्वाचा हे मलावीचे अधिकृत चलन आहे.
region;['मलेशियन रिंगिट', 'ringgit'];रिंगिट हे मलेशियाचे अधिकृत चलन आहे.
region;['मॉरिटानियन उगिया'];उगिया हे मॉरिटानियाचे अधिकृत चलन आहे.
region;['मॉरिशियन रुपया'];रुपया हे मॉरिशसचे अधिकृत चलन आहे.
region;['पेसो', 'मेक्सिकन पेसो'];पेसो हे मुख्यतः लॅटिन अमेरिकेतील देशांमध्ये वापरले जाणारे एक चलन आहे.
region;['मोरोक्कन दिरहाम'];मोरोक्कन दिरहाम हे मोरोक्कोचे अधिकृत चलन आहे.
region;['मोझांबिक मेटिकल'];मेटिकल हे मोझांबिकचे अधिकृत चलन आहे.
region;['नेपाळी रुपया', 'नेपाळी रूपया'];नेपाळी रुपया हे नेपाळचे अधिकृत चलन आहे.
region;['न्यू झीलँड डॉलर', 'न्यू झीलंड डॉलर'];: न्यू झीलंड डॉलर हे न्यू झीलंड देशाचे अधिकृत चलन आहे.
region;['निकाराग्वन कोर्डोबा', 'निकाराग्वन कोर्दोबा'];कोर्डोबा हे निकाराग्वाचे अधिकृत चलन आहे.
region;['नायजेरियन नाइरा'];नाइरा हे नायजेरियाचे अधिकृत चलन आहे.
region;['पापुआ न्यू गिनीयन किना', 'kina'];किना हे ओशनियामधील पापुआ न्यू गिनी देशाचे अधिकृत चलन आहे.
region;['पेराग्वे गुआरानी', 'पेराग्वे ग्वारानी'];गुआरानी हे पेराग्वेचे अधिकृत चलन आहे.
region;['पोलिश झुवॉटी', 'नवीन झ्लॉटी', 'न्यु झ्लॅाटी', 'न्यू झ्लॅाटी'];पोलिश झुवॉटी हे पोलंडचे अधिकृत चलन आहे.
region;['रोमेनियन लेउ'];लेउ हे रोमेनियाचे अधिकृत चलन आहे.
region;['सेशेल्स रुपया'];रुपया हे सेशेल्सचे अधिकृत चलन आहे.
region;['दक्षिण आफ्रिकन रँड', 'दक्षिण आफ्रिका रँड'];रॅंड हे दक्षिण आफ्रिकेचे अधिकृत चलन आहे.
region;['दक्षिण कोरियन वोन'];वोन हे दक्षिण कोरियाचे अधिकृत चलन आहे.
region;['स्पॅनिश पेसेटा', 'स्पॅनिश पेसेता'];स्पॅनिश पेसेटा हे स्पेनचे इ.स.
region;['स्वाझी लिलांगेनी', 'lilangeni'];लिलांगेनी हे स्वाझिलँडचे अधिकृत चलन आहे.
region;['स्वीडिश क्रोना', 'स्वीडिश क्रोनर', 'स्वीडीश क्रोना'];स्वीडिश क्रोना हे स्वीडनाचे इ.स.
region;['नवीन तैवानी डॉलर', 'नवा तैवान डॉलर'];नवीन तैवानी डॉलर हे चीनच्या प्रजासत्ताकाचे अधिकृत चलन आहे.
region;['टांझानियन शिलिंग'];शिलिंग हे टांझानियाचे अधिकृत चलन आहे.
region;['थाई बात'];थाई बात हे थायलंडचे अधिकृत चलन आहे.
region;['केमन द्वीपसमूह डॉलर'];केमन द्वीपसमूह डॉलर हे केमन द्वीपसमूहाचे अधिकृत चलन आहे.
region;['डॉमिनिकन पेसो'];डॉमिनिकन पेसो हे डॉमिनिकन प्रजासत्ताकाचे अधिकृत चलन आहे.
region;['फिलिपिन पेसो', 'पेसो', 'फिलिपाईन पेसो'];फिलिपाईन पेसो हे फिलिपाईन्स देशाचे राष्ट्रीय व अधिकृत चलन आहे.
region;['त्रिनिदाद व टोबॅगो डॉलर'];डॉलर हे त्रिनिदाद व टोबॅगोचे अधिकृत चलन आहे.
region;['ट्युनिसियन दिनार'];दिनार हे ट्युनिसियाचे अधिकृत चलन आहे.
region;['नवा तुर्की लिरा', 'तुर्की लिरा'];नवा तुर्की लिरा हे तुर्कस्तानचे अधिकृत चलन आहे.
region;['युगांडन शिलिंग', 'युगांडाचे शिलिंग'];शिलिंग हे युगांडाचे अधिकृत चलन आहे.
region;['व्हेनेझुएलन बोलिव्हार'];बोलिव्हार हे व्हेनेझुएलाचे अधिकृत चलन आहे.
region;['व्हियेतनामी डाँग', 'व्हियेतनामी डॉंग'];व्हियेतनामी डाँग व्हियेतनामचे अधिकृत राष्ट्रीय चलन आहे.
region;['झिंबाब्वे डॉलर'];झिंबाब्वे डॉलर हे झिंबाब्वेचे अधिकृत चलन आहे.
region;['केप व्हर्दे एस्कुदो'];एस्कुदो हे केप व्हर्देचे अधिकृत चलन आहे.
region;['केल्व्हिन'];केल्व्हिन हे तापमान मोजण्याचे एक एकक आहे.
region;['सहस्र', '१०००', '११००', '१२००', 'हजार'];१००० ही ९९९नंतरची व १००१च्या आधीची नैसर्गिक संख्या आहे.
region;['अयुत', '१००००', '10000'];भारतीय संख्यापद्धतीनुसार अयुत म्हणजे १०,०००.
region;['५', 'पाच', '5'];पाच ५ हा ४ नंतर व ६ या आकड्याच्या आधी येणारा अंक आहे.
region;['प्रकाश-वर्ष', 'प्रकाश वर्ष', 'प्रकाशवर्ष', 'प्रकाशवर्षे'];प्रकाश-वर्ष अथवा प्रकाशवर्ष हे अंतर मोजण्याचे एकक आहे.
region;['मोल'];मोल अथवा ग्रॅम-मोल हे रसायन शास्त्रा मध्ये वापरले जाणारे रेणूंची संख्या मोजण्याचे एकक आहे.
region;['नियुत', '1000000'];मराठीत ज्या संख्येला दशलक्ष किंवा दहा लाख म्हणतात त्या संख्येला भास्कराचार्य प्रयुत म्हणतात तर काही जण नियुत म्हणतात.
region;['अणुक्रमांक', 'अणु क्रमांक', 'अणू क्रमांक', 'अणूक्रमांक'];रसायनशास्त्र व भौतिकशास्त्रानुसार अणूच्या गाभ्यामधील प्रोटॉनांच्या एकूण संख्येला अणुक्रमांक म्हणतात.
region;['१', 'एक', '1'];Cambodia
region;['त्रिज्यी', 'रेडियन'];त्रिज्यी हे कंस आणि त्रिज्येतील गुणोत्तर आहे.
region;['दिवस', 'दिन'];एका दिवसात २४ तास असतात.दिवसाला दिन असेही म्हणतात.
regulation;['मानवी हक्क', 'मानवाधिकार'];मानवी हक्क किंवा मानवी अधिकार हे मानवाचे मूलभूत हक्क आहेत.
regulation;['समता', 'पॅरिटी', 'समानता'];भौतिकशास्त्रात समता म्हणजे एखाद्या function चे inversion केले तरी त्याची किंमत न बदलणे होय.
regulation;['उर्जेच्या अक्षय्यतेचा नियम', 'उर्जेच्या अक्षयतेचा नियम', 'थर्मोडायनामिक्सचा पहिला नियम'];थर्मोडायनामिक्सचा पहिला नियम तथा उर्जेच्या अक्षय्यतेचा नियम हा ऊर्जेच्या संवर्धनावर आधारित नियम आहे.
relation;['फल', 'गणिती फल', 'गणितीय फल'];गणितामध्ये फल म्हणजे दोन परिमाणांमधील परस्परसंबंध दर्शवणारे समीकरण होय.
relation;['फल', 'गणिती फल', 'गणितीय फल'];गणितामध्ये फल म्हणजे दोन परिमाणांमधील परस्परसंबंध दर्शवणारे समीकरण होय.
relation;['समुद्रसपाटी', 'आसपा', 'समुद्र सपाटी'];समुद्रसपाटी म्हणजेच समुद्राच्या पाण्याची सरासरी सपाटी.याचा वापर जमीनीची उंची ठरविण्यासाठी प्रमाण म्हणुन करतात.
relation;['धारवा', 'बेअरिंग', 'बेरिंग'];धारवा तथा बेअरिंग हा यंत्रांमधील फिरणार्‍या दोन भागांमधील घर्षण कमी करण्यासाठी वापरल्या जाणारा भाग आहे.
relation;['उत्तर दिशा'];उत्तर ही चार प्रमुख दिशांपैकी एक आहे.
relation;['दक्षिण दिशा', 'दक्षिण'];दक्षिण ही चार प्रमुख दिशांपैकी एक आहे.
relation;['पूर्व दिशा', 'पूर्व'];पूर्व ही चार प्रमुख दिशांपैकी एक आहे.
relation;['तरंगलांबी'];कोणत्याही तरंगाच्या एकमेकांशेजारील दोन समोच्च आणि समस्थानीय बिंदूंमधील अंतरास तरंगलांबी म्हणतात.
relation;['परजीवीपणा', 'परजीवी'];परजीवीपणा हा जीवशास्त्राच्या अंतर्गत असणाऱ्या जैवसंपदेतील त्या प्राण्यांचा गुणधर्म आहे जे इतर पेशीच्या प्राण्यांना, आपल्या उपजीविकेसाठी लक्ष्य करतात किंवा त्यांचेवर अशा परजीवींचे जीवनयापन होते.त्यांना 'परजीवी' असेही म्हणतात.यात, त्यांचे यजमान प्राण्यांशी अथवा सजीवांशी अन्योन्य व खेळीमेळीचे संबंध रहात नाहीत.
relevant-part;['चित्रपेशी', 'पिक्सेल'];संगणकीय चित्रांच्या लहानात लहान बिंदूला चित्रपेशी किंवा इंग्रजीमध्ये पिक्सेल म्हणतात.
relevant-part;['जैविक त्वचा', 'त्वचा', 'जैवीक त्वचा'];त्वचा ही सजीवप्राणी, वनस्पती व् मानवी शरीराचा एक अवयव आहे.
relevant-part;['जैविक त्वचा', 'त्वचा', 'जैवीक त्वचा'];निसंधिग्दीकरण जैवीक त्वचा सजीव/मानवी शरीराचा एक अवयव.
relevant-part;['केसांचे टोप'];केसांचे टोप हे माणसाच्या डोक्यावर घालण्याचे केसांचे टोप होय.
relevant-part;['चामडे', 'कातडे'];प्राण्यांची वाळवलेली त्वचा म्हणजे चामडे.
relevant-part;['मिश्या', 'मिशी', 'मिसरूड'];मिश्या म्हणजे वरच्या ओठांच्या वरील बाजूस उगवणारे चेहर्‍यावरील दाट केस होत.
relevant-part;['भुवई', 'भिवई', 'भिवया', 'भुवया'];प्राण्याच्या चेहऱ्यावरील डोळ्यांच्या वर असलेल्या केसांच्या बारीक पट्टीला भुवई असे म्हणतात.
relevant-part;['केशरचना'];एक केशरचना, केशभूषा किंवा धाटणी सामान्यतः मानवी टाळूवर केसांच्या स्टाईलचा संदर्भ देते.
relevant-part;['दाढी', 'दाढ्या'];दाढी म्हणजे चेहर्‍याच्या खालच्या अर्ध्या भागात - म्हणजे हनुवटी, गाल, गळा या भागांत - उगवणारे केस होत.
simple-collection;['तारकासमूह'];आधुनिक खगोलशास्त्रामध्ये तारकासमूह हे इंटरनॅशनल अ‍ॅस्ट्रॉनॉमिकल युनियनने ठरवलेले खगोलावरील विशिष्ट क्षेत्र आहे.त्यानुसार संपूर्ण आकाश व्यापतात असे अधिकृत मान्यता असलेले एकूण ८८ तारकासमूह आहेत.
simple-collection;['नरतुरंग'];नरतुरंग दक्षिण खगोलातील सर्वात तेजस्वी तारकासमूह आहे.
simple-collection;['हंस'];हंस हा उत्तर खगोलातील आकाशगंगेवरील एक तारकासमूह आहे.
simple-collection;['अरुंधती केश'];अरुंधती केश उत्तर खगोलार्धातील एक तारकासमूह आहे.
simple-collection;['वृक'];वृक दक्षिण खगोलातील तारकासमूह आहे.
simple-collection;['बृहल्लुब्धक', 'कॅनिस मेजॉरिस', 'बृहदलुब्धक'];बृहल्लुब्धक हा एक तारकासमूह आहे.
simple-collection;['चषक'];चषक हा दक्षिण खगोलातील एक तारकासमूह आहे.
simple-collection;['मकर'];मकर हे आधुनिक ८८ तारकासमूहातील एक तारकासमूह आहे.
simple-collection;['वासुकी'];वासुकी आधुनिक ८८ तारकासमूहातील सर्वात मोठा तारकासमूह असून त्याचे खगोलावरील क्षेत्रफळ १३०३ वर्ग अंश आहे.
simple-collection;['सिंह', '♌'];सिंह हा एक तारकासमूह आहे.
simple-collection;['कुंभ'];कुंभ हा एक तारकासमूह आणि राशीचक्रातील एक रास आहे.
simple-collection;['शब्दसंग्रह सय', 'शब्दसाठा'];भाषाशास्त्र मध्ये शब्दसाठा हा व्याकरण संबंधीच्या अर्थ पेक्षा वेगळया अर्थाने घेतला जातो.
simple-collection;['ग्रीक पुराणकथा', 'ग्रीक मिथकशास्त्र'];ग्रीक पुराणकथा ह्या प्राचीन ग्रीसमधील काल्पनिक कथा आहेत.
simple-collection;['त्रिमूर्ति', 'trimūrti', 'त्रिमूर्ती'];त्रिमूर्ति हे हिंदू धर्मामधील ब्रह्मा, विष्णु व शिव हे तीन देव आहेत.
simple-collection;['विश्व'];120.60.7.86 १२:०२, १४ मे २०१६
simple-collective;['सामंतशाही', 'सरंजामशाही'];सामंतशाही ही शासनव्यवस्था मध्ययुगीन काळात युरोप खंडात अस्तित्वात होती.
simple-collective;['रक्तगट', 'रक्त गट'];रक्तगटाचा शोध लॅंड्स्टेनर यानी लावला या शोधांबद्दल त्याना नोबेल पुरस्कार मिळाला.
simple-collective;['बाजार'];अनेक वस्तूंची दुकाने एकाच ठिकाणी मांडली जातात व वस्तुविनिमय होऊन व्यापार होतो, अशा जागेस बाजार असे म्हणतात.
simple-collective;['राष्ट्र'];राष्ट्र ह्या शब्दाचा ढोबळ अर्थ एका भूभागावर राहणाऱ्या व संयुक्त सरकार असणाऱ्या व्यक्तींचा मोठा समूह असा होतो.
simple-collective;['ब्रिटिश लोक'];ब्रिटोन्स, ब्रिट्स, युनायटेड किंग्डम, आईल ऑफ मान, चॅनल द्वीपसमूह येथील नागरिक म्हणजे ब्रिटिश लोक असे मानतात.
simple-collective;['क्षत्रिय', 'पुराण'];क्षत्रिय हा प्राचीन हिंदू समाजव्यवस्थेनुसार चातुर्वर्ण्यातील एक वर्ण आहे.
simple-planned-collective;['आंतरराष्ट्रीय न्यायालय'];आंतरराष्ट्रीय न्यायालय हे संयुक्त राष्ट्रसंघाचे एक अंग आहे.
simple-planned-collective;['गर्दी', 'जमाव', 'समुह'];एखाद्या विशिष्ट कारणासाठी किंवा कारणाविना, माणसांच्या अनियंत्रित व अशिस्तबद्ध एकत्र होण्याला गर्दी असे म्हणतात.कोणी यास 'जमाव' असेही म्हणतात.
simple-planned-collective;['विधिमंडळ', 'कायदेमंडळ', 'विधीमंडळ', 'विधीमंडळ शाखा'];विधिमंडळ अथवा कायदेमंडळ ही कायदे बनवणारी एक राज्यकारभाराची शाखा आहे.
simple-planned-collective;['क्नेसेट', 'knesset', 'नेसेट'];क्नेसेट ही पश्चिम आशियामधील इस्रायल देशाची संसद आहे.
simple-planned-collective;['अमेरिकन काँग्रेस', 'अमेरिकन कॉँग्रेस', 'अमेरिकन कॉंग्रेस', 'अमेरिकेची काँग्रेस', 'अमेरिकेन कॉँग्रेस'];अमेरिकन कॉंग्रेस हे अमेरिका या देशाचे विधिमंडळ आहे.
simple-planned-collective;['अमेरिकेची सेनेट', 'अमेरिकन सिनेट', 'अमेरिकन सेनेट', 'अमेरिका सेनेट', 'अमेरिकी सिनेट', 'अमेरिकी सेनेट', 'अमेरिकेची सिनेट'];अमेरिकन सेनेट हे अमेरिकन कॉंग्रेसच्या दोन सभागृहांपैकी एक आहे.
situation;['एकाधिकार'];अर्थशास्त्रात जेव्‍हा एका व्यक्ति अथवा संस्थेचे एखाद्या उत्पादनावर अथवा सेवेवर एवढे नियंत्रण होते कि ती व्यक्ति अथवा संस्था विक्रीसंबंधित अटी व मूल्य आपल्या इच्छेनुसार लागू करू शकते अशी स्थिति म्हणजे एकाधिकार अथवा मक्तेदारी.
situation;['ऑटिझम', 'स्वमग्नता'];स्वमग्नता हा एक प्रकारचा मनोविकार म्हणून ओळखला जातो.
situation;['उचकी'];उचकी का लागते जाणून घेऊया याचे कारणे.
situation;['सर्पदंश'];कुठल्याही सापाने चावा घेतल्यास त्याला सर्प दंश म्हणतात.
situation;['मल्टिपल स्क्लेरॉसिस', 'एम.एस.'];मेंदू व चेतासंस्थेतील होणारे मज्जारज्जुतील र्‍हासाच्या बदलांमुळे संबंधित अवयव कार्य करणे बंद करतात व त्यामुळे रूग्णात अपरिवर्तनीय बदल होतात व विकलांगता येत चालतात.
situation;['उच्च रक्तदाब'];उच्च रक्तदाब म्हणजे माणसाच्या शरीरातील साधारण रक्तदाबापेक्षा जास्त दाब होय.
situation;['सिकलसेल'];maसिकल पेशींचा आजार हा आजार सिकल पेशी रक्तक्षय किंवा ड्रेपॅनोसायटोसिस या नावाने ओळखला जातो.
situation;['कोड'];व्हिटिलिगो ही एक दीर्घकालीन त्वचेची स्थिती असून त्वचेचे ठिपके त्यांचे रंगद्रव्य गमावतात.
situation;['खरुज', 'खरूज'];खरूज ही शरीराला येणारी एक प्रकारची खाज आहेअशी खाज सरकॉप्टस स्कॅबीई या जीवाणूमुळे होते.
