abstract-region;['बहुपदी'];बहुपदी हा गणिताच्या शब्दकोशातील एक महत्त्वाचा शब्द व अतिशय महत्त्वाची संकल्पना आहे.
abstract-region;['सीमा', 'मर्यादा'];गणितानुसार, सीमा किंवा मर्यादा म्हणजे एखाद्या राशीचे मूल्य वाढवत नेले असता, त्या राशीच्या एखाद्या फलाने किंवा श्रेणीने "गाठलेले" टोकाचे मूल्य होय.
abstract-region;['फुली गुणाकार'];गणितात फुली गुणाकार, सदिश गुणाकार किंवा गिब्जचा सदिश गुणाकार ही त्रिमितीतील अवकाशातील दोन सदिशांमधील द्विक्रिया आहे.
abstract-region;['ल.सा.वि.', 'ल. सा. वि.', 'ल सा वि', 'लघुत्तम सामाईक विभाजक'];लघुत्तम सामाईक विभाज्य म्हणजे अशी लहानात लहान पूर्णांक सख्या जिला दिलेल्या संख्यांनी पुर्ण भाग जातो.
activity;['रग्बी फुटबॉल', 'रग्बी'];रग्बी फुटबॉल हा फुटबॉल खेळाचा एक प्रकार आहे.
activity;['लुडो'];लुडो हा २०२० चा अनुराग बासू दिग्दर्शित भारतीय चित्रपट आहे.
activity;['ईमेल'];ईमेल किंवा ई-मेल : हे Electronic Mail ह्या इंग्लिश संज्ञेचे लघुरूप असून इलेक्ट्रॉनिक माध्यमांच्या साहाय्याने संदेश पाठवण्याचे तंत्रज्ञान आहे.
activity;['डी.टी.पी.'];संगणकाचा वापर करून मेजावरच करण्यात येणारी छपाई वा प्रकाशन यास डेस्क टॉप पब्लिशिंग तथा डी.टी.पी.
activity;['वादळ'];वादळ ही एक नैसर्गिक आपत्ती आहे.
activity;['होम रन', 'होम धावा'];बेसबॉल खेळताना बॅटरने टोलवलेला चेंडू परत बेसवर येण्याआधी जर बॅटर तीनही बेस शिवून परत होमप्लेटवर आला तर होम रन झाला असे म्हणतात.
activity;['आयससची लढाई', 'आयसस', 'आयससची पहिली लढाई'];आयसस सध्याच्या तुर्कस्तानातील एक प्राचीन गाव होते.
activity;['आयससची लढाई', 'आयसस', 'आयससची पहिली लढाई'];आयससची लढाई अलेक्झांडर द ग्रेट आणि पर्शियाचा सम्राट दरायस तिसरा यांच्यात झालेली प्रसिद्ध लढाई होती.
activity;['ग्वादालकॅनाल मोहीम', 'guadalcanal', 'ऑपरेशन वॉचटॉवर', 'ग्वाडालकॅनालची लढाई', 'ग्वादालकॅनालची आरमारी लढाई', 'ग्वादालकॅनालची लढाई'];ग्वादालकॅनाल मोहीम तथा ग्वादालकॅनालची लढाई किंवा ऑपरेशन वॉचटॉवर ही दुसऱ्या महायुद्धादरम्यान ऑगस्ट ७, इ.स.
activity;['लॉन बोलिंग', 'bowls'];लॉन बोलिंग किंवा बोल्स हा गवतावरुन चेंडू ढकलण्याचा खेळ आहे.
activity;['ओकिनावाची लढाई', 'आइसबर्ग मोहीम'];ओकिनावाची लढाई किंवा आइसबर्ग मोहीम ही दुसऱ्या महायुद्धादरम्यान पॅसिफिक समुद्रात लढली गेलेली मोठी लढाई होती.
activity;['अंत्येष्टी', 'अंतिम विधी', 'अंत्येष्टि'];मानवी जन्माच्या आधीपासून ते त्याच्या मृत्यूनंतरही केले जाणारे संस्कार हिंदू जीवनशैलीत प्रचलित आहेत.
activity;['कार्बन १४ किरणोत्सर्ग कालमापन पद्धती', 'कार्बन १४ किरणोत्सर्ग कालमापन पध्दत', 'कार्बन १४ किरणोत्सर्ग कालमापन पध्दती', 'रेडिओकार्बन कालमापन', 'सी १४ किरणोत्सर्ग कालमापन पद्धती'];पुरातन वस्तूंचा काळ ठरविण्यासाठी कार्बन १४ किरणोत्सर्ग कालमापन पद्धती उपयोगात आणली जाते.
activity;['मतदान', 'निवडणूक'];मतदान ही एखाद्या गटास अथवा समूहास, विशिष्ट निवडणुकीसाठी अथवा एखादा महत्त्वाचा निर्णय घेण्यासाठी लिखित अथवा ठरविलेल्या माध्यमाद्वारे मतप्रदर्शन करण्याची एक पद्धती आहे.
activity;['प्राथमिक खुला देकार', 'आय.पी.ओ.', 'प्राथमिक सार्वजनिक प्रस्ताव'];प्राथमिक खुला देकार किंवा आय.पी.ओ.
activity;['मॅमोग्राफी'];मॅमोग्राफी म्हणजे स्तनाच्या कर्करोगाचे निदान करण्यासाठी असलेली एक्स रे तपासणी होय.
activity;['इराण–इराक युद्ध', 'इराण-इराक युद्ध'];इराण–इराक युद्ध इ.स.
activity;['थर्मोपिलाईचे युद्ध'];पर्शिया व ग्रीस मध्ये इ.स.पू.
activity;['फुटबॉल', 'फुटबॉल चेंडू', 'सॉकर'];फुटबॉल हा जगातील सर्वांत लोकप्रिय खेळ आहे.
activity;['चलचित्र', 'चलचित्रपट', 'चित्रपट'];चलचित्र,चित्रपट,फिल्म्स,किंवा सिनेमा,मुव्हीज.
activity;['स्नूकर', 'snooker'];स्नूकर 1 9 व्या शतकाच्या उत्तरार्धात भारतातील तैनात ब्रिटीश आर्मी अधिकाऱ्यांच्या काळात उत्पन्न झालेल्या क्यू गेम आहे.
activity;['कॅथोलिक चर्चचे पवित्र साक्रामेंट', 'कॅथलिक चर्चचे पवित्र सैक्रमन्ट'];कॅथोलिक धर्मानुसार चर्चची सात पवित्र साक्रामेंट आहेत.
activity;['सॉफ्टबॉल', 'softball'];सॉफ्टबॉल हा चेंडूफळीने खेळला जाणारा सांघिक खेळ आहे.
activity;['बुद्धिबळ', 'किल्लेकोट', 'बुद्धीबळ', 'शतरंज', 'हत्ती+'];बुद्धिबळ हा दोन खेळाडूंनी एका तक्त्यासारख्या पटाच्या दोन्ही बाजूला बसून खेळावयाचा बैठा खेळ आहे.
activity;['लॅक्रॉस', 'lacrosse', 'लॅक्रोसे'];लॅक्रॉस हा चेंडू आणि काठीने खेळला जाणारा सांघिक खेळ आहे.
activity;['वॉटर पोलो'];वॉटर पोलो हा पाण्यात खेळला जाणारा सांघिक खेळ आहे.
activity;['बास्केटबॉल', 'बास्केट-बौळ'];बास्केटबॉल हा एक सांघिक खेळ आहे.
activity;['बॅडमिंटन', 'bádminton'];रॅकेट व फूल यांच्या साह्यायाने खेळला जाणारा खेळ.
activity;['गोल्फ'];गोल्फ हा चेंडू व काठीने खेळला जाणारा मैदानी खेळ आहे.
activity;['आइस हॉकी', 'हॉकी', 'आइसहॉकी', 'आईस हॉकी'];आइस हाॅकी हा युरोप व उत्तर अमेरिकेतील एक लोकप्रिय खेळ आहे.
activity;['क्रिकेट'];क्रिकेट हा मैदानावर प्रत्येकी ११ खेळाडूंच्या दोन संघांदरम्यान, चेंडू आणि फळी ने खेळला जाणारा मैदानी खेळ आहे.
activity;['टेनिस'];टेनिस हा दोन ते चार खेळाडूंनी खेळण्याचा मैदानी खेळ आहे.
activity;['टेबल टेनिस', 'टेबलटेनिस', 'पिंग पाँग', 'पिंगपाँग'];टेबल टेनिस अथवा पिंग पॉंग हा टेनिस खेळाचा एक प्रकार आहे.
activity;['ढगफुटी', 'ढगफूटी'];काही वेळा, पाऊस देणार्‍या ढगांतून खाली आलेला पाऊस जमिनीवर न पडता, जमिनीकडच्या उष्ण तापमानामुळे त्याची परत वाफ होऊन ती त्या ढगांतच सामावली जाते.
activity;['लढाई'];युद्धातील एका संघर्षाला लढाई असे म्हणतात.
activity;['कॉरल समुद्राची लढाई', 'ऑपरेशन मो', 'प्रवाळ समुद्राची लढाई'];कॉरल समुद्राची लढाई दुसऱ्या महायुद्धादरम्यान कॉरल समुद्रात लढली गेलेली आरमारी लढाई होती.
activity;['संभोग', 'झवणे', 'मैथुन', 'समागम'];संभोग जीवशास्त्रीयदृष्ट्या अशी क्रिया आहे की ज्यात नराचे जननेंद्रिय मादीच्या जननमार्गात प्रवेश करते..
activity;['निसर्गोपचार'];'निसर्गोपचार' चिकित्सेत नैसर्गिक साधनांचा म्हणजे सूर्यप्रकाश, उष्णता, शीतता, ध्वनी, पाणी, फळे, इत्यादींचाच उपयोग करतात.
activity;['होमिओपॅथी', 'समचिकित्सा', 'समवैद्यकशास्त्र', 'होमिओपेथी', 'होमियोपथी', 'होमियोपॅथी', 'होमोपेथी'];होमिओपॅथी ही एक अशास्त्रीय आणि अवैज्ञानिक पद्धती आहे जिला चुकीच्या पद्धतीने शास्त्रीय दाखवले जाते.
activity;['ट्रफाल्गरची लढाई', 'ट्रफालगारची लढाई'];ब्रिटन व फ्रेंच स्पानिश आरमारामध्ये झालेली १८०५ मधील नौदलीय लढाई.
activity;['फिलिपाईन समुद्राची लढाई', 'फिलिपाइन्सच्या समुद्राची लढाई', 'फिलिपाईन्सच्या समुद्राची लढाई'];फिलिपाईन समुद्राची लढाई दुसऱ्या महायुद्धांतर्गत प्रशांत महासागरात झालेली आरमारी लढाई होती.
activity;['जनगणना'];जनगणना म्हणजे एका ठरावीक कालावधीत एका ठरावीक प्रदेशातील लोकसंख्येची करण्यात येणारी मोजणी होय.
activity;['संगीत नाटक', 'संगीतनाटक'];संगीत नाटक हा नाट्यप्रकार संगीत ह्या कलाप्रकाराच्या आणि नाटक ह्या साहित्यप्रकाराच्या संकरातून निर्माण झाला आहे.
activity;['प्लाझमाफेरेसिस', 'प्लाझ्मा थेरपी'];प्लाझमाफेरेसिस किव्हा प्लाझ्मा थेरेपी हे एका व्यक्तीचे रक्तातून प्लाझ्मा काढून त्यावर अभ्यास करणे आणि परत दुसर्याच्या रक्तात टाकण्याची अशी एक वैद्यकीय प्रक्रिया आहे.
activity;['ब्लिट्झक्रीग'];ब्लिट्झक्रीग हा एक युद्धव्यूह आहे.
activity;['मोसमी पाऊस', 'मान्सून', 'मॉन्सून', 'मौसमी पाऊस'];वर्षाच्या विशिष्ट ऋतूत पडणाऱ्या पावसाला मोसमी पाऊस किंवा मॉन्सून म्हणतात.
activity;['नेपोलियोनिक युद्धे', 'नेपोलियनिक युद्धे'];नेपोलियोनिक युद्धे म्हणजे नेपोलियनच्या पहिल्या फ्रेंच साम्राज्याची युद्धे.
activity;['जिम्नॅस्टिक्स'];जिम्नॅस्टिक्स हा कसरती खेळ आहे.
activity;['स्त्री नसबंदी शस्त्रक्रिया'];स्त्री नसबंदी शस्त्रक्रिया ही कुटुंबनियोजन व कायम स्वरूपाचे संतती नियमन कार्यक्रमातील एक शस्त्रक्रिया आहे.
activity;['लोकनृत्य'];जनसामान्यांमध्ये प्रचलित असलेले परंपरागत अलिखित नृत्यप्रकार म्हणजे लोकनृत्ये असे म्हणता येते.
activity;['नेत्रदान'];नेत्र दान म्हणजे दात्याच्या मृत्यूनंतर त्याचे/ तीचे डोळे दुसऱ्या कोणाला तरी दान करणे.
activity;['हर्लिंग', 'hurling'];हर्लिंग हॉकीसारखा मैदानी खेळ आहे.
activity;['रॉक संगीत'];रॉक संगीत हा इ.स.
activity;['निवडणूक', 'निवडणुक'];निवडणूक लोकसंख्या सार्वजनिक पद धारण करण्यासाठी एक स्वतंत्र निवडतो ज्या द्वारे औपचारिक निर्णय प्रक्रिया आहे.
activity;['फ्रान्स-प्रशिया युद्ध'];फ्रान्स-प्रशिया युद्ध हे इ.स.च्या १९व्या शतकाच्या उत्तरार्धात घडलेले युरोपामधील एक प्रमुख युद्ध होते.
activity;['कोरियन युद्ध'];कोरियन युद्ध हे कोरियाचे प्रजासत्ताक व कोरियाचे जनतेचे लोकशाही प्रजासत्ताक या दोन देशात झालेले युद्ध होते.
activity;['दुसरे महायुद्ध', 'दुसरे विश्व युद्ध', 'दुसरे जागतिक महायुद्ध', 'दुसरे जागतिक युद्ध', 'दुसरे महायुध्द', 'दुसरे महायु्द्ध', 'द्वितिय विश्वयुद्ध'];दुसरे महायुद्ध हे १९३९ ते १९४५ दरम्यान झालेले जागतिक युद्ध होते.
activity;['पहिले महायुद्ध', 'पहिले जागतिक महायुद्ध', 'पहिले महायुध्द', 'प्रथम विश्वयुद्ध'];पहिले महायुद्ध हे इ.स.
activity;['क्राइमियन युद्ध', 'क्रिमियन युद्ध', 'क्रिमीअन युद्ध', 'क्रिमीयन युद्ध'];क्राइमियन युद्ध हे फ्रेंच साम्राज्य, ब्रिटिश साम्राज्य, ओस्मानी साम्राज्य व सार्दिनियाचे राजतंत्र ह्यांच्या युतीने रशियन साम्राज्याविरुद्ध लढलेले १९व्या शतकामधील एक युद्ध होते.
activity;['पहिले आखाती युद्ध', 'अखाती युद्ध', 'आखाती युद्ध', 'ऑपरेशन डेझर्ट स्टॉर्म', 'खाडी युध्द', 'पहिले अखाती युद्ध'];पहिले आखाती युद्ध हे इराणच्या आखातामध्ये अमेरिकेची संयुक्त संस्थाने, व तिच्या ३४ मित्र राष्ट्रांची आघाडी विरुद्ध इराक यांच्यात घडलेले युद्ध होते.
activity;['मर्यादित युद्ध'];मर्यादित भागातच लढले जाणाऱ्या युद्धाला मर्यादित युद्ध असे म्हणतात.
activity;['उपवास', 'उपास'];== प्रस्तावना == धार्मिक आशय- उपवास या शब्दाची फोड उप+वास अशी आहे.उप म्हणजे जवळ आणि वास म्हणजे राहणे.
activity;['शिक्षण', 'पदव्युत्तर अभ्यासक्रम'];साचा:Pp-move-indef साचा:EngvarC शिक्षण ही अध्ययन सुकर करणे, किंवा ज्ञान, कौशल्य, मुल्ये, विश्वास व सवयींच्या प्राप्तीची प्रक्रिया आहे.
activity;['आंतरराष्ट्रीय संबंध'];आंतरराष्ट्रीय संबंध किंवा ज्यास कधी कधी 'आंतरराष्ट्रीय अभ्यास' असेही संबोधीले जाते, हा विविध देशांदरम्यान असलेल्या व्यापारी, मैत्रीपूर्ण वा कटू संबंधांचा एक परिपूर्ण अभ्यास आहे.
activity;['हिंसा', 'voilence'];हिंसे ची व्याख्या, जागतिक आरोग्य संघटनेच्या मते, शारिरीक शक्ती किंवा शक्तीचा हेतुपुरस्सर वापर करून धमकी किंवा वास्तवात, स्वतःच्या, दुसर्या व्यक्तीच्या, किंवा समूह किंवा समुदायाच्या विरूद्ध, परिभाषित केलेली क्रिया, ज्यामुळे परिणामी किंवा परिणामी त्याची जास्त शक्यता आहे, मृत्यू, मनोवैज्ञानिक हानी, विकृती होण्याची.
activity;['मनोरंजन'];जी कंटाळविणाऱ्या जीवनशैलीतून मन वळविते किंवा फावल्या वेळात मनाचे रंजन करते अशी कोणतीही कृती मनोरंजन समजली जाते.
activity;['राउंडर्स'];राउंडर्स हा क्रिकेट तसेच बेसबॉलसदृश चेंडू-फळीने खेळायचा मैदानी खेळ आहे.
activity;['जुटलँडची लढाई'];जुटलॅंडची लढाई ही पहिल्या महायुद्धातील आरमारी लढाई होती.
activity;['फ्रेंच चुंबन', 'फ्रेंच चुम्बन'];फ्रेंच किस तथा फ्रेंच चुंबन यात हळुवारपणे एकमेकांच्या ओठांना स्पर्श करत आनंद घेत जाणे ।।यामद्ये जीभ आणि ओठ यांचं मिलन होत असत ।। हा एक हळुवारपणे केलेला स्पर्श आणि त्यातून निर्माण झालेला हा एक आनंददायी क्षणच असतो
activity;['अँजिओप्लास्टी', 'अँजियोप्लास्टी'];हृदयाकडे रक्त वाहून नेणाऱ्या रक्तवाहिनीमध्ये जर कोणत्याही प्रकारचे अडथळे निर्माण झाले, तर हृदयविकाराचा झटका येतो.
activity;['उत्सव', 'festival'];एका विशिष्ट समाजाद्वारे साजरी केली जाणारी घटना म्हणजे सण होय.
activity;['बिलियर्ड्स', 'बिलियर्डस्'];बिलियर्डस हा एक खेळ आहे.
activity;['क्रुसेड', 'क्रुसेडी'];क्रुसेड ही मध्य पूर्वेतील Holy Land व जेरुसलेम च्या ताब्या साठी लादलेली धार्मिक युद्धे होती.
activity;['बॅटल ऑफ द बल्ज'];बॅटल ऑफ द बल्ज ही दुसऱ्या महायुद्धाच्या शेवटी जर्मनी व दोस्त राष्ट्रांतील लढाई होती.
