language;['манкс', 'манкс језик', 'manks', 'manski', 'mansko-gelski', 'manški', 'мански', 'манско-гелски', 'маншки', 'маншки језик'];Изумрли језик који се говорио на острву Ман. Тренутно је у процесу оживљавања.
language;['манкс', 'манкс језик', 'manks', 'manski', 'mansko-gelski', 'manški', 'мански', 'манско-гелски', 'маншки', 'маншки језик'];Izumrli jezik koji se govorio na ostrvu Man. Trenutno je u procesu oživljavanja.
language;['шкотски гелски језик', 'škotski gelski', 'škotsko-gelski', 'шкотски гелски', 'шкотско-гелски', 'сцоттисх гаелиц', 'сцоттисх гаелиц језика', 'шкоти галски'];Jezik gojdelske grane kelskih jezika kojim se govori u Škotskoj.
language;['шкотски гелски језик', 'škotski gelski', 'škotsko-gelski', 'шкотски гелски', 'шкотско-гелски', 'сцоттисх гаелиц', 'сцоттисх гаелиц језика', 'шкоти галски'];Језик гојделске гране келтских језика којим се говори у Шкотској.
language;['старогрчки', 'старогрчки језик', 'antički grčki', 'klasični grčki', 'starogrčki', 'антички грчки', 'класични грчки', 'антички грчки језик', 'ancient greek', 'ancient greek language', 'старог грчког језика'];Историјски језик којим се говорило на Медитерану с Грчком као центром.
language;['старогрчки', 'старогрчки језик', 'antički grčki', 'klasični grčki', 'starogrčki', 'антички грчки', 'класични грчки', 'антички грчки језик', 'ancient greek', 'ancient greek language', 'старог грчког језика'];Istorijski jezik kojim se govorilo na Mediteranu s Grčkom kao centrom.
language;['грчки језик', 'грчки', 'grčki', 'хеленски', 'хеленски језик'];Индоевропски језик који се већином говори у Грчкој и на Кипару.
language;['грчки језик', 'грчки', 'grčki', 'хеленски', 'хеленски језик'];Indoevropski jezik koji se većinom govori u Grčkoj i na Kiparu.
language;['панџаби', 'пенџаби', 'пенџапски', 'панџаби језик', 'панџабски језик', 'пунџаби', 'пунџаби језик', 'памџаби језик', 'панџапски језик', 'панџаби језику', 'панџабски'];Индо-аријски језик којим се говори у Пенџабу (делом у Индији, делом у Пакистану).
language;['синхала', 'синхалски језик', 'sinhala', 'sinhaleski', 'sinhaleški', 'синхалески', 'синхалешки', 'sinhalski jezik', 'синхала језику'];Indoarijski jezik indoevropske porodice, maternji jezik naroda Sinhalezi, najveće grupe Šri Lanek zajedno s Tamilima.
language;['синхала', 'синхалски језик', 'sinhala', 'sinhaleski', 'sinhaleški', 'синхалески', 'синхалешки', 'sinhalski jezik', 'синхала језику'];Индоаријски језик индоевропске породице, матерњи језик народа Синхалези, највеће етничке групе Шри Ланке заједно с Тамилима.
language;['албански језик', 'albanski', 'албански', 'gjuha shqipe'];Indoevropski jezik, koji se većinom govori u Albaniji, na Kosovu, u Grčkoj, Srbiji, Crnoj Gori i Republici Makedonija.
language;['албански језик', 'albanski', 'албански', 'gjuha shqipe'];Индоевропски језик, који се већином говори у Албанији, на Косову, у Грчкој, Србији, Црној Гори и Републици Македонија.
language;['sudaneski', 'сунданески', 'судански', 'судански народ'];Аустронезијски језик којим се углавном говори у западним деловима индонезијског острва Јава.
language;['sudaneski', 'сунданески', 'судански', 'судански народ'];Austronezijski jezik kojim se uglavnom govori u zapadnim delovima indonezijskog ostrva Java.
language;['јавански језик', 'javanski', 'јавански'];Аустронезијски језик којим се говори углавном у централним и источним деловима острва Јава у Индонезији.
language;['јавански језик', 'javanski', 'јавански'];Austronezijski jezik kojim se govori uglavnom u centralnim i istočnim delovima ostrva Java i Indoneziji.
language;['фарси', 'персијски језик', 'farsi', 'persijski', 'персијски', 'дари', 'перзијски језик', 'фарси језик', 'فارسی'];Индоевропски језик који се углавном говори у Ирану.
language;['асамски језик', 'asamski', 'асамски', 'асамииа'];Indijski jezik zvaničan u državi Asam u Indiji, a koji govore male zajednice u Bangladešu i Butanu.
language;['асамски језик', 'asamski', 'асамски', 'асамииа'];Индијски језик званичан у држави Асам у Индији, а који говоре мале заједнице у Бангладешу и Бутану.
language;['кмерски језик', 'кмерски'];Један од језика Камбоџе и Вијетнама.
language;['маорски језик', 'maori', 'maorski', 'маори', 'маорски', 'маори језика', 'маори језику', 'те рео маори'];Језик Маора, домородаца Новог Зеланда.
language;['маорски језик', 'maori', 'maorski', 'маори', 'маорски', 'маори језика', 'маори језику', 'те рео маори'];Jezik Maora, domorodaca Novog Zelanda.
language;['fidžijski', 'фиџијски'];Jedan od jezika Fidžija.
language;['fidžijski', 'фиџијски'];Један од језика Фиџија.
language;['бурмански језик', 'birmanski', 'burmanski', 'mjanmarski', 'бирмански', 'бурмански', 'мјанмарски', 'burmanski jezik'];Sino-tibetanski jezik kojim se govori uglavnom na Mjanmaru.
language;['бурмански језик', 'birmanski', 'burmanski', 'mjanmarski', 'бирмански', 'бурмански', 'мјанмарски', 'burmanski jezik'];Сино-тибетански језик којим се говори углавном на Мјанмару.
language;['естонски језик', 'естонски', 'estonski', 'естонском језику', 'естхониан'];Угро-фински језик којим говоре претежно Естонци.
language;['естонски језик', 'естонски', 'estonski', 'естонском језику', 'естхониан'];Ugro-finski jezik kojim govore pretežno Estonci.
language;['урду', 'urdu', 'urdu language', 'урдски језик', 'урду језик', 'урду језику'];Индијски језик којим се говори углавном у Индији и Пакистану.
language;['kašmiri', 'kašmirski', 'кашмири', 'кашмирски'];Дардички језик индоаријске гране индоевропских језика који се говори углавном у долини Кашмира.
language;['kašmiri', 'kašmirski', 'кашмири', 'кашмирски'];Dardički jezik indoarijske grane indoevropskih jezika koji se govori uglavnom u dolini Kašmira.
language;['непалски језик', 'непалски', 'nepali', 'nepalski', 'непали'];INdijski jezik kojim se govori u Nepalu, Butanu i nekim delovima Indije i Mjanmara.
language;['непалски језик', 'непалски', 'nepali', 'nepalski', 'непали'];Индијски језик којим се говори у Непалу, Бутану и неким деловима Индије и Мјанмара.
language;['арапски језик', 'арапски', 'arapski', 'arabic language', 'ar', 'арап.', 'арабски језик', 'утицај других језика на арапски језик', 'арапском језику'];Semitski jezik, koji se većinom govori u arapskim zemljama - Severna Afrika i Bliski Istok - i koji je liturgični jezik islama.
language;['арапски језик', 'арапски', 'arapski', 'arabic language', 'ar', 'арап.', 'арабски језик', 'утицај других језика на арапски језик', 'арапском језику'];Семитски језик, који се већином говори у арапским земљама - Северна Африка и Блиски Исток - и који је литургични језик ислама.
language;['амерички знаковни језик', 'асл'];Најраспрострањенији знаковни језик заједнице глувих и слабослухих људи у Сједињеним Америчким Државама, деловима Канаде где се говори енглески језик, као и у деловима Мексика.
language;['старословенски', 'старословенски језик', 'црквенословенски језик', 'црквенословенски', 'crkvenoslovenski', 'staroslovenski', 'староцрквенословенски језик', 'црквено-словенски језик', 'староцрквенословенски', 'стари бугарски', 'старословенског', 'црквенословенског језика', 'цхурцх славиц'];Први језик словенске писмености, који су на основу словенског дијалекта око Солуна развили браћа Ћирило и Методије.
language;['старословенски', 'старословенски језик', 'црквенословенски језик', 'црквенословенски', 'crkvenoslovenski', 'staroslovenski', 'староцрквенословенски језик', 'црквено-словенски језик', 'староцрквенословенски', 'стари бугарски', 'старословенског', 'црквенословенског језика', 'цхурцх славиц'];Prvi jezik slovenske pismenosti, koji su na osnovu slovenskog dijalekta oko Soluna razbili branća Ćirilo i Metodije.
language;['баи', 'баијски', 'бај', 'бајански', 'баи језик', 'баић'];Један од језика Судана.
language;['холандски језик', 'холандски', 'holandski', 'nl', 'nld', 'дуч', 'недерландс', 'холандском језику'];Zapadnonemački jezik u upotrebi u Holandiji, Flandriji i Surinamu.
language;['холандски језик', 'холандски', 'holandski', 'nl', 'nld', 'дуч', 'недерландс', 'холандском језику'];Западнонемачки језик у употреби у Холандији, Фландрији и Суринаму.
mental-object;['знање', 'спознаја', 'znanje', 'знања', 'когниција', 'ноесис', 'когнитивне', 'когнитивне обраде', 'когнитивне способности', 'когнитивне функције', 'когнитивних процеса', 'когнитивних способности', 'сазнање'];Psihološki rezultat percepcije, učenja i zaključivanja.
mental-object;['знање', 'спознаја', 'znanje', 'знања', 'когниција', 'ноесис', 'когнитивне', 'когнитивне обраде', 'когнитивне способности', 'когнитивне функције', 'когнитивних процеса', 'когнитивних способности', 'сазнање'];Психолошки резултат перцепције, учења и закључивања.
phenomenon;['киша', 'kiša', 'пљусак', 'дажд', 'кише', 'падавина', 'падавине'];Падавине у облику течних водених капљица промера већег од 0,5 милиметара.
phenomenon;['киша', 'kiša', 'пљусак', 'дажд', 'кише', 'падавина', 'падавине'];Padavine u obliku tečnih vodenih kapljica promera većeg od 0,5 milimetara.
physical-object;['фагот', 'fagot', 'bassoons', 'бассоонс', 'фаготто'];Duvački instrument sa nežnim dubokim tonom.
physical-object;['фагот', 'fagot', 'bassoons', 'бассоонс', 'фаготто'];Дувачки инструмент са нежним дубоким тоном.
physical-object;['ксилофон', 'маримба', 'ksilofon', 'гиил', 'маримбе'];Muzički instrument napravljen od drvenih pločica, koje su oblikovane tako da svaka daje ton različite visine kada se udari.
physical-object;['ксилофон', 'маримба', 'ksilofon', 'гиил', 'маримбе'];Музички инструмент направљен од дрвених плочица, које су обликоване тако да свака даје тон различите висине када се удари.
physical-object;['мост', 'most', 'мостови', 'ћуприја', 'железнички мост'];Конструкција која прелази преко препреке и тиме омогућава прелаз са једне на другу страну пута, реке, долине или неке друге препреке.
physical-object;['мост', 'most', 'мостови', 'ћуприја', 'железнички мост'];Konstrukcija koja prelazi preko prepreke i time omogućava prelaz sa jedne na drugu stranu puta, rek, doline ili neke druge prepreke.
physical-object;['телефон', 'telefon', 'телефона', 'телефонски апарат', 'фиксне телефоније'];Електронички апарат који се користи за позивање људију.
physical-object;['телефон', 'telefon', 'телефона', 'телефонски апарат', 'фиксне телефоније'];Elektronički aparat koji se koristi za pozivanje ljudiju.
political-geographic-object;['белорусија', 'belorusija', 'република белорусија', 'belarus', 'бјелорусија', 'вајсрусланд', 'република бјелорусија', 'бела русија', 'биеларус'];Источноевропска држава.
political-geographic-object;['белорусија', 'belorusija', 'република белорусија', 'belarus', 'бјелорусија', 'вајсрусланд', 'република бјелорусија', 'бела русија', 'биеларус'];Istočnoevropska država.
political-geographic-object;['киргистан', 'киргизија', 'kirgiski', 'kirgizija', 'kirgiški', 'киргиски', 'киргишки', 'киргизстан', 'kyrgyzstan', 'кирги́зия', 'киргизистан', 'кыргызста́н', 'киргхизстан'];Северозападни турски језик и уз руски званични језик Киргистана.
political-geographic-object;['киргистан', 'киргизија', 'kirgiski', 'kirgizija', 'kirgiški', 'киргиски', 'киргишки', 'киргизстан', 'kyrgyzstan', 'кирги́зия', 'киргизистан', 'кыргызста́н', 'киргхизстан'];Severozapadnim turski jezik i uz ruski zvanični jezik Kirgistana.
political-geographic-object;['авганистан', 'avganistan', 'afghanistan', 'афганистан', 'исламска република авганистан', 'исламска држава авганистан'];Држава у Централној Азији са главном граду у Кабулу.
political-geographic-object;['авганистан', 'avganistan', 'afghanistan', 'афганистан', 'исламска република авганистан', 'исламска држава авганистан'];Država u Centralnoj Aziji sa glavnom gradu u Kabulu.
political-geographic-object;['туркменистан', 'turkmenistan', 'türkmenistan', 'туркменија', 'түркменистан', 'туркомен', 'туркмен људи', 'туркмени', 'туркмениа', 'туркменс'];Država je u centralnoj Aziji.
political-geographic-object;['туркменистан', 'turkmenistan', 'türkmenistan', 'туркменија', 'түркменистан', 'туркомен', 'туркмен људи', 'туркмени', 'туркмениа', 'туркменс'];Држава је у централној Азији.
political-geographic-object;['немачка', 'њемачка', 'nemačka', 'deutschland', 'савезна република њемачка', 'срн', 'brd', 'de', 'frg', 'германија', 'дојчланд', '🇩🇪', 'bundesrepublik deutschland', 'germany', 'савезна република немачка', 'ср немачка', 'ср њемачка', 'деутсцхланд', 'немачкој'];Država u Zapadnoj Evropi.
political-geographic-object;['немачка', 'њемачка', 'nemačka', 'deutschland', 'савезна република њемачка', 'срн', 'brd', 'de', 'frg', 'германија', 'дојчланд', '🇩🇪', 'bundesrepublik deutschland', 'germany', 'савезна република немачка', 'ср немачка', 'ср њемачка', 'деутсцхланд', 'немачкој'];Држава у Западној Европи.
political-geographic-object;['италија', 'italija', 'italy', 'repubblica italiana', 'италијанска република', 'република италија', 'италиа', 'италијански република'];Држава у Јужној Европи са главним градом Рим.
political-geographic-object;['италија', 'italija', 'italy', 'repubblica italiana', 'италијанска република', 'република италија', 'италиа', 'италијански република'];Država u Južnoj Evropi sa glavnim gradom Rim.
political-geographic-object;['дамаск', 'damask', 'damascus', 'димасх', 'капитал сирије'];Главни град Сирије.
political-geographic-object;['дамаск', 'damask', 'damascus', 'димасх', 'капитал сирије'];Glavni grad Sirije.
political-geographic-object;['алжир', 'alžir', 'algier', 'algiers', 'مدينة الجزائر', 'алгерине', 'алжирски капитал', 'лука и главни град алжира'];Главни и највећи град Алжира.
political-geographic-object;['алжир', 'alžir', 'algier', 'algiers', 'مدينة الجزائر', 'алгерине', 'алжирски капитал', 'лука и главни град алжира'];Glavni i najveći grad Alžira.
political-geographic-object;['рим', 'rim', 'вечни град', 'вечити град', 'roma', 'rome', 'град рим', 'римска област', 'италијански капитал', 'престоница италије'];Glavni grad Italije.
political-geographic-object;['рим', 'rim', 'вечни град', 'вечити град', 'roma', 'rome', 'град рим', 'римска област', 'италијански капитал', 'престоница италије'];Главни град Италије.
political-geographic-object;['београд', 'beograd', 'главни град србије', 'град београд', 'belgrade', 'главни град србије и црне горе'];Највећи и главни град Србије.
political-geographic-object;['београд', 'beograd', 'главни град србије', 'град београд', 'belgrade', 'главни град србије и црне горе'];Najveći i glavni grad Srbije.
political-geographic-object;['кабул', 'kabul', 'капитал у авганистану'];Главни град Авганистана.
political-geographic-object;['кабул', 'kabul', 'капитал у авганистану'];Glavni grad Avganistana.
political-geographic-object;['тирана', 'tirana', 'tiranë', 'албански капитал'];Главни и највећи град Албаније.
political-geographic-object;['тирана', 'tirana', 'tiranë', 'албански капитал'];Glavni i najveći grad Albanije.
political-geographic-object;['луанда', 'luanda', 'анголе капитал'];Главни и највећи град Анголе.
political-geographic-object;['луанда', 'luanda', 'анголе капитал'];Glavni i najveći grad Angole.
political-geographic-object;['луксембург', 'luksemburg', 'град луксембург', 'луксембург сити', 'капитал луксембурга', 'луксембург-вилле'];Prectonica Luksemburga.
political-geographic-object;['луксембург', 'luksemburg', 'град луксембург', 'луксембург сити', 'капитал луксембурга', 'луксембург-вилле'];Престоница Луксембурга.
political-geographic-object;['улан батор', 'ulan bator', 'улан-батор', 'капитал монголије', 'кулун', 'урга'];Главни град Монголије.
political-geographic-object;['улан батор', 'ulan bator', 'улан-батор', 'капитал монголије', 'кулун', 'урга'];Glavni grad Mongolije.
quality;['сумњичавост'];Сумњичавост око истинитости или тачности неког питања.
relation;['ali', 'али'];Veznik koji označava suprotnost.
relation;['ali', 'али'];Везник који означава супротност.
relation;['širi pojmovi', 'шири појмови', 'надређен', 'хиперним', 'хиперними'];Појмови у тесаурусу који имају ширу семантичну област значења него други.
relation;['širi pojmovi', 'шири појмови', 'надређен', 'хиперним', 'хиперними'];Pojmovi u tesaurusu koji imaju širu semantičnu oblast značenja nego drugi.
situation;['руковање', 'rukovanje', 'хандцласп'];Хватање и трешење шаке неке особе, на пример приликом упознавања или сачињавања договора.
situation;['руковање', 'rukovanje', 'хандцласп'];Hvatanje i trešenje šake neke osobe, na primer prilikom upoznavanja ili sačinjavanja dogovora.
socially-constructed-person;['gikuju', 'гикују'];Један од језика Кеније.
socially-constructed-person;['gikuju', 'гикују'];Jedan od jezika Kenije.
socially-constructed-person;['родитељ', 'roditelj', 'биолошки родитељ', 'родитељи', 'улога и значај родитеља', 'родитеља'];Особа која има најмање једно дете.
socially-constructed-person;['родитељ', 'roditelj', 'биолошки родитељ', 'родитељи', 'улога и значај родитеља', 'родитеља'];Osoba koja ima najmanje jedno dete.
socially-constructed-person;['sestra', 'сестра', 'секо'];Ženska osoba koja ima iste roditelje kao i neka druga osoba.
socially-constructed-person;['sestra', 'сестра', 'секо'];Женска особа која има исте родитеље као и нека друга особа.
socially-constructed-person;['отац', 'тата', 'otac', 'tata', 'татко', 'биолошки отац', 'зачетник', 'мушко родитељ'];Muški roditelj.
socially-constructed-person;['отац', 'тата', 'otac', 'tata', 'татко', 'биолошки отац', 'зачетник', 'мушко родитељ'];Мушки родитељ.
socially-constructed-person;['супруга', 'supruga', 'žena', 'жена', 'удата жена'];Удата жена.
socially-constructed-person;['супруга', 'supruga', 'žena', 'жена', 'удата жена'];Udata žena.
socially-constructed-person;['тагалог', 'tagalog', 'tagaloški', 'tagalski', 'tagalški', 'тагалошки', 'тагалски', 'тагалшки', 'тагалог језику'];Austronezijski jezik kojim se uglavnom govori na Filipinima.
socially-constructed-person;['тагалог', 'tagalog', 'tagaloški', 'tagalski', 'tagalški', 'тагалошки', 'тагалски', 'тагалшки', 'тагалог језику'];Аустронезијски језик којим се углавном говори на Филипинима.
