activity;['geizdiuq'];Geizdiuq lij heuh geizhamj, dwg cungj geiz ndeu.
activity;['dwkhaij'];Dwkhaij lij heuh saetgvaengz, dwg cungj guh'angq ndeu.
activity;['cukgiuz'];Cukgiuz dwg cungj cizdij yindung, youz doiq soeng ndeu doxdax, doiq ndeu miz 11 boux, sawjyungh aen giuz.
activity;['lanzgiuz'];Lanzgiuz dwg cungj cizdij yindung.
activity;['cibcihginh doengcwngh'];1096 nienz - 1291 nienz, youq laj lozmaj dencujgyau gyauvuengz baecinj, Saeyouh funghgen lingjcuj caeuq bouxgwih daj gij guekgya gyau'wnq.
activity;['bej', 'póker'];Bej dwg cungj baiz ndeu.
activity;['mazcoz'];Mazcoz dwg cungj guh'angq ndeu.
activity;['rongh x'];Rongh X dwg cungj naqsiq denciz, bociengz 0.01 daengj 10 nabmeix.
activity;['nae'];Nae, lij heuh siet, dwg cungj yienhsiengq youq mbwnnamh.
activity;['fwn'];Fwn dwg cungj yienhsiengq youq mbwnnamh.
agent-driven-role;['bouxhaici'];Bouxhaici, lij heuh swhgih, dwg cungj ciznieb hai ci.
agentive-figure;['yinghlenzbangh'];Yinghlenzbangh（Vah Yinghgoz: Commonwealth of Nations）dwg aen guekgya lenzhozdij, youz Yinghgoz cujdauj, youz 54 aen guekgya cauxbaenz.
agentive-figure;['yizswhlanzgyau'];Yizswhlanzgyau, lij heuh Veizgyau, dwg aen coenggyauq ndeu.
agentive-figure;['suhlienz'];Suhlienz, gaenq dwg guekgya ceig hung gwnbiengz.
agentive-physical-object;['namzgva'];Namzgva dwg cungj byaek ndeu.
agentive-physical-object;['moengj'];Moengj dwg cungj swnghvuz ndeu.
agentive-physical-object;['noucoengz'];Noucoengz dwg cungj doenghduz ndeu.
agentive-physical-object;['doenghduz'];Doenghduz dwg cungj swnghvuz ndeu.
agentive-physical-object;['doenghgo', 'go'];Go
agentive-physical-object;['dennauj', 'gisongih', 'loeggeq'];Dennauj, lij heuh gisongih, dwg gisuz sang gyahden.
agentive-physical-object;['ma', 'canis lupus familiaris'];Ma dwg cungj doenghduz nyamhcij.
agentive-physical-object;["caen'gin", 'fungi'];Caen'gin dwg cungj swnghvuz ndeu.
agentive-physical-object;['va'];Va dwg cungj giguen doenghgo.
agentive-physical-object;['makningzmungx'];Makningzmungx dwg cungj mak ndeu.
agentive-physical-object;['maklaeq', 'castanea mollissima'];Maklaeq dwg cungj mak ndeu.
agentive-physical-object;['duhhenj', 'glycine max'];Duh lij heuh duhhenj, dwg cungj byaek ndeu.
agentive-physical-object;['faex'];Faex, dwg cungj doenghgo maj ndaej hungsang.
agentive-physical-object;['faexhoengz henzhaij'];Faexhoengz henzhaij dwg cungj ndoengfaex.
agentive-physical-object;['vagimngaenz'];Vagimngaenz dwg cungj va ndeu.
agentive-physical-object;['doenghduz ndoencag', 'chordata', 'monz doenghduz ndoencag'];Monz Doenghduz Ndoencag dwg aen monz, youq Gaiq doenghduz ceiq gauhgiz.
agentive-physical-object;['vunz', 'homo sapiens'];Gyoeb cwng bouxsai, mehmbwk, bouxgeq, lwgnyez.
agentive-physical-object;['hoengjlungz'];Hoengjlungz dwg cungj doenghduz gizlungz cunghsengdaih, caep youq gwn mboek, dungjci digiuz laigvaq 1 ik 6 cien fanh nienz.
agentive-physical-object;['vagut', "va'gyuk"];Vagut, lij heuh va'gyuk、myokgoek, dwg cungj va ndeu.
agentive-physical-object;['roegvenz'];Roegvenz, lij heuh roegcehvenz, dwg cungj duzroeg ndeu.
agentive-physical-object;['faexraeu', 'acer'];Faexraeu dwg cungj faex ndeu.
agentive-physical-object;['daesuj'];Daesuj dwg cungj doenghduz nyamhcij.
agentive-physical-object;['moegsawz', 'manihot esculenta'];Moegsawz, lij heuh maenzfaex, dwg cungj doenghgo caeuq haeuxgwn ndeu.
agentive-physical-object;['swhgvah'];Swhgvah dwg cungj byaek ndeu.
agentive-physical-object;['gvehom', 'cucumis melo'];Gvehom dwg cungj mak ndeu.
agentive-physical-object;['douq', 'doq', 'duzdoq'];Douq dwg cungj doenghduz.
agentive-physical-object;['ahlahbozsugyauh'];Ahlahbozsugyauh.
agentive-physical-object;['goep'];Goep dwg cungj doenghduz.
agentive-physical-object;['doenghduz nyamhcij', 'mammalia'];Doenghduz nyamhcij dwg cungj doenghduz nyamh cij hawj lwg.
agentive-physical-object;['maet'];Maet dwg cungj non ndeu.
agentive-physical-object;["go'ien", 'nicotiana'];Go'ien dwg cungj doenghgo ndeu.
agentive-physical-object;['gyoij', 'musa basjoo'];Gyoij dwg cungj mak ndeu.
agentive-physical-object;['vaiz', 'bubalus bubalis'];Vaiz dwg cungj doenghduz youdaez, youq Yacouh.
agentive-physical-object;['byaekgat'];Byaekgat dwg cungj byaek ndeu.
agentive-physical-object;['coeng'];Coeng dwg cungj byaek ndeu.
agentive-physical-object;['roegdingfaex', 'picidae'];Roegdingfaex, lij heuh roegdotfaex, dwg cungj duzroeg ndeu.
agentive-physical-object;['suenq', 'allium sativum'];Suenq dwg cungj byaek ndeu.
agentive-physical-object;['lwglimz'];Lwglimz, lij heuh maklimz、cehvenz, dwg cungj byaek ndeu.
agentive-physical-object;['bing', 'hirudinea'];Bing dwg cungj non ndeu.
agentive-physical-object;['sipndangj'];Sipndangj, lij heuh duzsip、siphawz、sipvaiz、duzgip、sitnamj, dwg cungj non, faenbouh youq saenamz Cunghgoz, youq seizcin okdoengh, youq seizdoeng yietbaeg.
agentive-physical-object;['haeuxfiengj'];Haeuxfiengj dwg cungj doenghgo caeuq haeuxgwn ndeu.
agentive-physical-object;['roeggacak'];Roeggacak dwg cungj duzroeg ndeu.
agentive-physical-object;['cehyiengzmbeq'];Cehyiengzmbeq dwg cungj ywdoj ndeu.
agentive-physical-object;['makdauz', 'prunus persica'];Makdauz dwg cungj mak ndeu.
agentive-physical-object;['mienhhaeux'];Mienhhaeux dwg cungj doenghgo caeuq haeuxgwn ndeu.
agentive-physical-object;['mou', 'sus scrofa domestica'];Mou dwg cungj doenghduz.
agentive-physical-object;['cwz', 'bos primigenius taurus'];Cwz dwg cungj doenghduz youdaez.
agentive-physical-object;['lwgraz'];Lwgraz dwg cungj doenghgo caeuq haeuxgwn ndeu.
agentive-physical-object;['gomoegmienz'];Gomoegmienz, lij heuh gominz、goleux, dwg cungj faex ndeu.
agentive-physical-object;['byaekgep', 'byaekgap'];Byaekgep dwg cungj byaek ndeu.
agentive-physical-object;['binghaij'];Binghaij dwg cungj doenghduz.
agentive-physical-object;['raetnae', 'lentinula edodes'];Raet, lij heuh raetnae、yiengsaenq, dwg cungj caen'gin ndeu.
agentive-physical-object;['duhheu'];Duhheu, lij heuh duhyez, dwg cungj doenghgo caeuq haeuxgwn ndeu.
agentive-physical-object;['duhhenj', 'glycine max'];Duh lij heuh duhhenj, dwg cungj byaek ndeu.
agentive-physical-object;['lauxbaeg'];Lauxbaeg dwg cungj byaek ndeu.
agentive-physical-object;['roeglaej'];Roeglaej, lij heuh roegbeih、roegcok、roegbiq, dwg cungj duzroeg ndeu.
agentive-physical-object;['makmbi', 'olea europaea'];Makmbi, lij heuh makgyamjyouz, dwg cungj faex ndeu.
agentive-physical-object;['makbizbaz'];Makbizbaz dwg cungj mak ndeu.
agentive-physical-object;['meuz', 'felis silvestris catus'];Meuz dwg cungj doenghduz nyamhcij.
agentive-physical-object;['cwz', 'bos primigenius taurus'];Cwz dwg cungj doenghduz youdaez.
agentive-physical-object;['duzciengh'];Duzciengh, dwg cungj doenghduz nyamhcij ndeu.
agentive-physical-object;['saehaexma'];Saehaexma, lij heuh hoingwh, dwg cungj doenghduz ndeu.
agentive-physical-object;['nonsei'];Nonsei, lij heuh nonmuenx, dwg cungj non ndeu.
agentive-physical-object;['lwggwz', 'solanum melongena'];Lwggwz dwg cungj byaek ndeu.
agentive-physical-object;['biek'];Biek dwg cungj byaek ndeu.
agentive-physical-object;['megmax'];Megmax, lij heuh meggo、meg'oij、megsang、haeuxbuengz、gaeuliengz, dwg cungj doenghgo caeuq haeuxgwn ndeu.
agentive-physical-object;['vamoiz', 'prunus mume'];Vamoiz dwg cungj va ndeu.
agentive-physical-object;['yungzmauh', 'ailuropoda melanoleuca'];Yungzmauh lij heuh yungzmeuz, dwg cungj doenghduz nyamhcij ndeu.
agentive-physical-object;['duzbeuq', 'panthera pardus'];Duzbeuq, lij heuh gukbeuq、swbeuq, dwg cungj doenghduz nyamhcij ndeu.
agentive-physical-object;['guk', 'panthera tigris'];Guk, lij heuh sw, dwg cungj doenghduz nyamhcij.
agentive-physical-object;['saeceij', 'panthera leo'];Saeceij, lij heuh caceij、caiceij、canghceij, dwg cungj doenghduz nyamhcij.
agentive-physical-object;['vaizcwx meijcouh', 'bison bison'];Vaizcwx meijcouh dwg cungj doenghduz youdaez, beij doenghduz baekmeijcouh gaeqlw cungj hung.
agentive-physical-object;['roeglaxceiz', 'phalacrocorax carbo'];Roeglaxceiz dwg cungj duzroeg ndeu.
agentive-physical-object;['roegmauh'];Roegmauh, lij heuh roeggvaetliuq、roegdungjdingqmauh, dwg cungj duzroeg ndeu.
agentive-physical-object;['ngwz'];Ngwz dwg cungj doenghduz.
agentive-physical-object;['mui'];Mui dwg cungj doenghduz nyamhcij ndeu.
agentive-physical-object;["va'ngaeux", 'nelumbo nucifera'];Va'ngaeux, lij heuh va'mbu、myokngaeu、valienz, dwg cungj va ndeu.
agentive-physical-object;['ronghrib'];Ronghrib, lij heuh yingjhoij、yaepcuij, dwg cungj non ndeu.
agentive-physical-object;['roeggyaeujmeuz'];Roeggyaeujmeuz, lij heuh roegbakmaeuz、roegboemhbouz、roeggoepmbon, dwg cungj duzroeg ndeu.
agentive-physical-object;['vumzvauz', 'chiroptera'];Vumzvauz dwg cungj doenghduz nyamhcij.
agentive-physical-object;['lwggyoh'];Lwggyoh dwg cungj byaek ndeu.
agentive-physical-object;['makleiz'];Makleiz dwg cungj mak ndeu.
agentive-physical-object;['hing', 'zingiber officinale'];Hing dwg cungj byaek ndeu.
agentive-physical-object;['youdaezmoeg', 'doenghduz youdaez', 'artiodactyla'];Youdaezmoeg(Artiodactyla) gvei doenghduz nyamhcij, iekliengh miz 200 cungj.
agentive-physical-object;['raetngaenz'];Raetngaenz, lij heuh raetyinzwj, dwg cungj caen'gin ndeu.
agentive-physical-object;['daekmax', 'mantodea'];Daekmax, lij heuh daekanmax、daekyangj、duzmehgangzfouj、duznganxcaengh、duzyaeklwz、gangzmax、gangxmax、gyanghmax、maxlangzgangz、maxmiq, dwg cungj non ndeu.
agentive-physical-object;['duzgyau'];Duzgyau, lij heuh gungqgyau、duzrongzgyau, dwg cungj non ndeu.
agentive-physical-object;['gijngoz'];Gijngoz dwg cungj roeg‎ ndeu.
agentive-physical-object;['maksigloux'];Maksigloux, lij heuh makleizsan、lwgloux, dwg cungj mak ndeu.
agentive-physical-object;['byaekdoengzhau'];Byaekdoengzhau dwg cungj byaek ndeu.
agentive-physical-object;['sigin', 'bacteria'];Sigin dwg cungj swnghvuz ndeu.
agentive-physical-object;['biengzbeih', 'anisoptera'];Biengzbeih, lij heuh duzfix, dwg cungj non ndeu.
agentive-physical-object;['non', 'insecta'];Non, hoh heuhguh nengz, dwg cungj doenghduz, soqcungj ceiq lai, fatyen 80 fanh lai cungj lo.
agentive-physical-object;['gungq'];Gungq dwg cungj doenghduz.
agentive-physical-object;['bit'];Bit dwg cungj doenghduz.
agentive-physical-object;['moed', 'formicidae'];Moed, dwg cungj non ndeu.
agentive-physical-object;['doq'];Doq dwg cungj non ndeu.
agentive-physical-object;['max', 'equus caballus'];Max dwg yiengh doenghduz nyamhcij.
agentive-physical-object;['maklangz'];Maklangz dwg cungj mak ndeu.
agentive-physical-object;['byaekbohcaiq'];Byaekbohcaiq dwg cungj byaek ndeu.
agentive-physical-object;['makcaujcij', 'ziziphus jujuba', 'ziziphus zizyphus'];Gocaujcij（yozmingz：Ziziphus zizyphus ） seng youq gij diegraeuj, dwg cungj faex iq.
agentive-physical-object;['nonsei'];Nonsei, lij heuh nonmuenx, dwg cungj non ndeu.
agentive-physical-object;['goyouzcoeng', 'aloè'];Goyouzcoeng dwg cungj doenghgo ndeu.
agentive-physical-object;['haeuxyangz', 'zea mays'];Haeuxyangz, lij heuh haeuxdaeq、megsuek、haeuxmaex、yiengzmaex、haeuxyawh, dwg cungj doenghgo caeuq haeuxgwn ndeu.
agentive-physical-object;['oij'];Oij dwg cungj doenghgo ndeu.
agentive-physical-object;['maknganx', 'faexnganx'];Maknganx dwg cungj mak ndeu.
agentive-physical-object;['lwghaemz'];Lwghaemz dwg cungj byaek ndeu.
agentive-physical-object;['nyungz'];Nyungz dwg cungj non ndeu.
agentive-physical-object;['mbajdaeng'];Mbajdaeng, lij heuh mengznongx, dwg cungj non ndeu.
agentive-physical-object;['roegyengj', 'psittaciformes'];Roegyengj dwg cungj duzroeg ndeu.
agentive-physical-object;['gungjcoz'];Gungjcoz, lij heuh roeggungjcoz、coz roeggungjcoz, dwg cungj duzroeg ndeu.
agentive-physical-object;['roegnyanh', 'anser cygnoides'];Roegnyanh dwg cungj duzroeg ndeu.
agentive-physical-object;['duzroeg', 'nduk roeg', 'aves'];Duzroeg, gvihaeuj Monznga Doenghduz Ndoenndok duh Monz Doenghduz Ndoencag, miz song aen ga, miz bwn caueq fwed.
agentive-physical-object;['ginzcaiq', 'apium graveolens'];Ginzcaiq dwg cungj byaek ndeu.
agentive-physical-object;['naenz'];Naenz dwg cungj non ndeu.
amount-of-matter;['raemx', 'h₂o'];Reamx dwg doengh gij doxgaiq saw lae ndaej haenx, mbouj miz saek mbouj miz heiq, mbouj miz feihdauh.
amount-of-matter;['doengz', 'cu'];Doengz, hix heuhguh luengz, dwg cungj gimsug, vayoz fuzhauh dwg Cu (Saw Latin:Cuprum), yiencij haehsoq dwg 29.
amount-of-matter;['ngeihyangjvaqdanq', 'co2'];Ngeihyangjvaqdanq dwg cungj danq yangj vaqhozvuz.
amount-of-matter;['gimhau', 'pt'];Gimhau dwg cungj gimsug ndeu.
amount-of-matter;['raemxngaenz'];Raemxngaenz, lij heuh naemxngaenz、sijngaenz, dwg cungj gimsug ndeu.
amount-of-matter;['gyaz', 'k'];Gyaz dwg cungj gimsug, vayoz fuzhauh dwg K, yiencij haehsoq dwg 19, yienzcijliengh dwg 39.0983.
amount-of-matter;['raemxmaeg'];Raemxmaeg dwg cungj raemx, hamzmiz saeksoq hoh yw'nyumx.
amount-of-matter;['linz', 'p'];Linz dwg aen vaqyoz yienzsoq, yienzswj siqsoq dwg 15, fouzhauh “P”.
amount-of-matter;['yangj', 'o'];Yangj（Oxygen，氧） dwg aen vaqyoz yienzsoq, yienzswj siqsoq dwg 8, yienghdoih yienzswjliengq dwg 16.00.
amount-of-matter;['lij', 'al'];Lij dwg cungj vayoz yienzsoq, gvi yienzsoq bengzcuz.
amount-of-matter;['sik', 'sn'];Sik, lij heuh rik、riek、sig、yiek, dwg cungj gimsug ndeu.
amount-of-matter;['yienz', 'pb'];Yienz, lij heuh yenz, dwg cungj gimsug ndeu.
amount-of-matter;['ngaenz', 'ag'];Ngaenz dwg cungj gimsug ndeu.
amount-of-matter;['gim'];Gim dwg cungj gimsug ndeu.
amount-of-matter;['danq'];Danq dwg aen vaqyoz yienzsoq, yienzswj siqsoq dwg 6, fouzhauh “C”.
amount-of-matter;['vuengzcungq', 's'];Vuengzcungq, lij heuh vuengzhenj、vuengz, dwg aen vaqyoz yienzsoq, yienzswj siqsoq dwg 16, fouzhauh “S”.
amount-of-matter;["ndaengq'ien"];Ndaengq'ien lij heuh Nizgujdingh, dwg cungj ndaeng duz.
amount-of-matter;['danqsuijvaqhozvuz'];Danqsuijvaqhozvuz,hix heuh dangzloih,itbuen youz danq,cing,yangz sam cungj yienzsoq gyoepguh baen,faencijsik gojyij sij cingz Cn(H2O)m.Hoeng miz mbangj dangzloih mbouj dwg hingzsik,beijbaenz Sujlijdangz(C6H12O5).Dangzloih dwg ndang vunz yaekaeu.
amount-of-matter;['ndaengq'];Ndaengq, caemh heuh Hamz, dwg cungj vaqyoz vuzciz, caeuq Soemj doxdoiq.
amount-of-matter;['soemj'];Soemj dwg cungj vaqyoz vuzciz, caeuq Ndaengq doxdoiq.
biological-object;['linx'];Linx dwg aen gi'gvanh (器官) doenghduz.
biological-object;['mbei'];Mbei, lij heuh damj, dwg aen gi'gvanh (器官) doenghduz.
biological-object;['naeng'];Naeng dwg cungj cujciz youq ndang doenghduz.
biological-object;['dungx'];Dungx dwg aen gi'gvanh (器官) doenghduz.
biological-object;['gasawh'];Gasawh dwg cungj gi'gvanh swnghvuz.
biological-object;['saejlaux'];Saejlaux, lij heuh saejgeq, dwg aen gi'gvanh (器官) doenghduz.
biological-object;['sainyouh'];beijnyouh haehdoengj giguen.
biological-object;['laehcei'];Laehcei dwg cungj mak ndeu.
biological-object;['bwt'];Bwt dwg aen dungxsaej, youq ndaw bakaek.
biological-object;['cij'];Cij, caemh heuh nauq, youq gwn doenghduz nyamhcij meh gij aek hoh dungx.
biological-object;['ced'];Ced, gasawh mehmbwk, lij heuh maih、 hi、 cued.
biological-object;['makbinzgoj'];Makbinzgoj, lij heuh binz, dwg cungj mak ndeu.
biological-object;['heuj'];Heuj dwg cungj gi'gvanh (器官) doenghduz.
biological-object;['gencueg', 'doegsok', 'genfwngz'];Gencueg dwg aen bouhvih doenghduz, doxdam gennou caeuq genbongz.
biological-object;['daep'];Daep dwg aen giguen, gij doenghduz gizlungz cungj miz daep.
biological-object;['hozgyongx'];Hozgyongx dwg aen gi'gvanh (器官) doenghduz.
biological-object;['rongzva'];Rongzva, lij heuh longzva、saigyaeq、vaciengz、diuzgyoek, dwg cunj gasawh mehmbwk ndeu.
biological-object;['lwgndae'];Lwgndae dwg cungj mak ndeu.
biological-object;['va'];Va dwg cungj giguen doenghgo.
biological-object;['ndok'];Ndok dwg cungj cujciz youq ndang doenghduz.
biological-object;['iucij', 'mak', 'samndaen'];Mak, lij heuh iucij、samndaen, dwg aen gi'gvanh (器官) doenghduz.
biological-object;['fwngz'];Fwngz dwg aen bouhvih doenghduz.
biological-object;['sibau'];Sibau dwg aen gihbwnj danvih lai cungj swnghvuz gietgou caiqlij goengnwngz.
biological-object;['ream'];Bouxsai roxnaeuz doenghduzboux, youq goek henz diuzviz, miz gaeq doxgaiq diuqvenj roengzdaeuj lumj aen daehnengq, ndaw de miz song aenluenxlulu haenx, heuhguh raem.
biological-object;['caekhaex'];Caekhaex dwg aen bouhvih doenghduz.
biological-object;['din'];Din dwg aen bouhvih doenghduz.
biological-object;['naj'];Naj dwg aen bouhvih ndang vunz, miz lai cungj gi'gvanh: najbyak, bwnda, da, bwndaraemx, ndaeng, bak, naengbak, rwz, naeng, gemj, rizndaeng, heuj caeuq hangz daengj.
biological-object;['simdaeuz'];Simdaeuz (心脏) dwg aen gi'gvanh (器官) doenghduz.
biological-object;['saejlwg'];Saejlwg, lij heuh saejleg、saejonq、saejsaeq、saejnengh、saejhaemz、saejiq、saejngeiq, dwg aen gi'gvanh (器官) doenghduz.
biological-object;['viz'];Viz, lij heuh ceiq、nouq、ceuq, dwg gasawh bouxsai.
biological-object;['da'];Da dwg aen gi'gvanh (器官) doenghduz.
biological-object;['ndaeng'];Ndaeng dwg aen gi'gvanh (器官) doenghduz.
biological-object;['hoz'];Hoz dwg aen bouhvih doenghduz.
biological-object;['saej'];Saej dwg aen gi'gvanh (器官) doenghduz, miz saejlaux caeuq saejlwg.
biological-object;['aek', 'najaek'];Aek, lij heuh najaek、bakaek, dwg aen bouhvih doenghduz.
biological-object;['conghhoz', 'lajhoz'];Conghhoz dwg aen gi'gvanh (器官) doenghduz.
biological-object;['laeng'];Laeng dwg aen bouhvih doenghduz.
biological-object;['dungx'];Dungx dwg aen bouhvih doenghduz.
biological-object;['rwz'];Rwz dwg aen gi'gvanh (器官) doenghduz.
biological-object;['gyaeuj', 'gyəuз'];Gyaeuj dwg aen gi'gvanh (器官) doenghduz.
cognitive-event;['gamjcingz'];Gamjcingz, rox heuhguh cingz, dwg aen coenghoz sengleix caeuq simleix cuenghdaih, youq seiz hwn vaiqgaiq gig.
cognitive-event;['swhsiengj'];Swhsiengj, nauj doiq seiqhenz gij fanjyin.
course;['mauhfung'];Mauhfung dwg cungj bingh ndeu.
course;['binghraq'];Binghraq dwg cungj bingh ndeu.
dependent-place;['caenhoengq'];Caenhoengq : mbouj hoengheiq.
dependent-place;['bakbya'];Song aen bya doenggvaq aen Bakbya dox ciep.
ecological-collective;['doenghgo', 'go'];Go
event;['haij rongx', 'haijsiu', '海\U000f664b'];Haijlangh laux lai, buqvaih lai, heuhguh haij rongx.
functional-matter;['gangsengsoq'];Gangsengsoq dwg cungj yw, youz aen nengz canjseng hoh youz vunzlai habbaenz.
functional-matter;['ywgajnon'];Ywgajnon dwg cungj ywnungz, goengqvunz yungh de gaj nonhaih.
functional-matter;['doengz', 'cu'];Doengz, hix heuhguh luengz, dwg cungj gimsug, vayoz fuzhauh dwg Cu (Saw Latin:Cuprum), yiencij haehsoq dwg 29.
functional-matter;['ngaenz', 'ag'];Ngaenz dwg cungj gimsug ndeu.
functional-matter;["ndaengq'ien"];Ndaengq'ien lij heuh Nizgujdingh, dwg cungj ndaeng duz.
functional-matter;['majlingzsuz', 'solanum tuberosum'];Majlingzsuz, lij heuh maenzdoengzlingz, dwg cungj doenghgo caeuq haeuxgwn ndeu.
functional-matter;['singgizsoq'];Singgizsoq dwg cungj gizsoq, caueq yungzgizsoq hoh cizgizsoq dox cozyungh.
functional-matter;['cinghmoizsoq'];Cinghmoizsoq dwg cungj Gangsengsoq.
functional-matter;['henjnding'];Henjnding dwg cungj saek ndeu.
functional-matter;['laehcei'];Laehcei dwg cungj mak ndeu.
functional-matter;['byaek'];Byaek dwg cungj doenghgo, miz byaekbieg, byaekgat, byaekroem, byaekmbungj, byaekyouzcaiq, byaekbohcaiq, byaekmiek, byaekgaiqlanz, byaekdoengzhau, byaekdaeuzcaiq, byaekaengjgwx, byaekguet, ginzcaiq, byaekmaenz, lauxbaeg, lauxbaeghoengz, duhseiq, duhnoh, lwgfaeg, namzgva, gve'ndiq, lwggwz, makyungz, swhgvah, lwggyoh, cietgva, lwgbieng, gveraemx, coenggep, coeng, suenq, hing, lwgmanh daengj.
functional-matter;['makbinzgoj'];Makbinzgoj, lij heuh binz, dwg cungj mak ndeu.
functional-matter;['rin'];Rin youz gvangvuz guhbaenz.
functional-matter;['lwgndae'];Lwgndae dwg cungj mak ndeu.
functional-matter;['faiq'];Faiq dwg cungj doenghgo caeuq haeuxgwn ndeu.
functional-matter;['gvangvuz'];Gvangvuz dwg cungj gietginh caenhcinghvuz.
functional-matter;['ciengqyouz'];Ciengqyouz dwg cungj diuzliuh, yungh daeuj cawj haeux.
geographical-object;['nanzmeijcouh', 'namzmeijcouh'];Nanzmeijcouh, lij heuh Namzmeijcouh, dwg aen couh, youq Meijcouh Daihluz.
geographical-object;['cunghvaz minzgoz', 'cuŋƅvaƨ minƨgoƨ'];Cunghvaz Minzgoz, ngoenzneix doengcwng Daizvanh, dwg aen gunghozgoz Yacouh, youq 1911 nienz youz Sunhvuenz laebbaenz.
geographical-object;['dayangzcouh', 'daihyangzcouh'];Dayangzcouh dwg aen couh caiqlij daihluz.
geographical-object;['bahwjgan buendauj'];Bahwjgan buendauj（Balkan） dwg benq dieg youh baihdoengnamz ouhcouh, youq laj Yadwzlijyahaij caueq Hwzhaij.
geographical-object;['dah ganghgoj'];Dah Ganghgoj dwn diuz dah, youq baihcunghsae Feihcouh dwg ceiq raez.
geographical-object;['dahvangzhoz'];汏黃河廸汏中國。
geographical-object;['dah yamajsenhoz'];Dah Yamajsenhoz（Vah Buzdauzyaz：Rio Amazonas；Vah Sihbanhyaz：Río Amazonas, youq Nanzmeijcouh, youq sojmiz dah cungqgyang liuzlieng liuzyiz ceiq hung, dahnga ceiq lai, raezdinj deih ngeih.
geographical-object;['haijdai', 'sijhaij'];Haijdai youq gizdieg Isire(Israel) caeuq Jodan(Jordan) doxgyau，dwg aenhuz ceiq daemq gwnzbiengz.Sang daemq Haijdai dwg -422m,dohraez 67km,dohgvangq 18km,vangqraez miz 810km2.Gij dohgyu raemx de miz 300g/L, lai gvaq raemxhaij bingzciengz 7.6 boix.
geographical-object;['haijhaek'];Haijhaek (Black sea) dwg aen haijndaw Daihloeg Eu-Ya, miz iek 42.4 fanh bingzfueng goengleix gvangq.
geographical-object;['nanz cunghgozhaij'];Nanz Cunghgozhaij, lij heuh Nanzhaij, dwg aen haij youq doengnamz Yacouh.
geographical-object;['dahhwzlungzgyangh', 'amur'];Dahhwzlungzgyangh (Sawmanj:ᠰᠠᡥᠠᠯᡳᠶᠠᠨ ᡠᠯᠠ,Saw'wz:река Аму́р) dwg dah Hwzlungzgyangh Sengj.
geographical-object;['dahmeizgunghhoz', 'mékong'];Dahmeizgunghhoz dwg diuz dah, youq doengnamz Yacouh.
geographical-object;['namzgigcouh'];Namzgigcouh youq digiuz baihnamz,youq henz Nanzcizgig.De youq digiuz Namzbuenqgiuz nanzgiggih baihndaw,ceng mbouj geij lai youq Namgiggien ceiq namz,deng Namzgigyangz homh.
geographical-object;['baekbinghyangz'];Baekbinghyangz, lij heuh Baekbingyangz、Bwzbinghyangz, dwg aen daihyangz.
geographical-object;['meijcouh'];Meijcouh dwg aen couh caiqlij daihluz, youq baihsae Dasihyangz caeuq baihdoeng Daihbingzyangz.
geographical-object;['dasihyangz', 'daihsaeyangz'];Dasihyangz, lij heuh Daihsaeyangz, dwg aen daihyangz.
geographical-object;['daibingzyangz', 'daihbingzyangz'];Daibingzyangz, lij heuh Daihbingzyangz, dwg aen daihyangz.
geographical-object;['dahcangzgyangh'];汏長江扽汏中國。
information-encoding-system;['sei'];Sei dwg cungj vwnzyoz yienghsik,miz cizlieng gyaeundei caeuq miz cingzeiq，caiqlij miz banj.Sei gojyij dandog sij,hix gojyij caeuq gizyawz yisuz doxgap,beijbaenz heiqsei,suhcingzsei caeuq canmeijsei.Sei miz gaenj raez lizsij.
information-realization;['fwen lajbiengz'];Geu go neix dwg boux vunz Fazgoz ndeu 1871 nienz guh baenz, doeklaeng cienz doh lajbiengz, deng hoiz baenz haujlai cungj vah.
information-realization;['yinhyoz'];Yinhyoz dwg cunj yisuz, yij sing vih moiz, yungq baenzyauq daeuj gyoepguh.
information-realization;['vwnzyoz'];Vwnzyoz dwg cungj yisuz,biujyienh mboujdoengz vwnzva.Miz sawcuenh,heiq,seiq.
language;['vahmaxgai', 'vah maxgai'];Vahmaxgai dwg vahcoj Bouxmaxgai, vanz Vahgun Yijcuz, Gun-cangq Yijheah.
language;['vahmanggyalah'];Vahmanggyalah（bāṅlā / বাংলা roxnaeuz bāṅālī / বাঙালী） gvi Yindu-yajlizan yijcih duh Yindi - Yilangj yijcuz.
language;['vahfan'];Vahfan（संस्कृता वाक् saṃskṛtā vāk, संस्कृतम् saṃskṛtam） gvi Yindu-yajlizan yijcih duh Yindi - Yilangj yijcuz.
language;['esperanto'];Esperanto- lingvo internacia -
language;['vah yinghgoz', 'sawyingh', 'vahyingh', 'yinghvah', 'yinghyij'];Yinghyij(Yinghvwnz:English) dwg aen sae Germanic vah，gvi Inq-ouh yijhaeh.Youq 18 caeuq 19 seiqgeiq,Daihyingh daeqgoz youq biengz baenzmaz miz yingjyangj,nyinxcix seizneix yung yinghyij baenzmaz guengj.Seizneix yinghyij dwg guenfueng yijyanz youq Yinghlienzbangh gozgya,caemhcaiq dwg vah daih ngeih youq baenzbyoz gozgya.
language;['vahgun', 'guenvah'];Vahgun (Sawndip: 吪倱. Sawgun:汉语) dwg vah Bouxgun,vanz Gun-cangq yijheah,miz swnghdiu.Sawgun dwg cungj saw biuj-eiq.Vahgun miz vahsaw gyamx vahgangj.Vahsaw ciuhlaux heuh sawciuhgonq.Yendai-vahgun miz haujlai fuengyanz.
language;['vahgvangjdungh'];Vahgvangjdungh dwg vahcoj Boux Gvangjdungh, vanz Vahgun Yijcuz, Gun-cangq Yijheah.
language;['vah yindunizsihya'];Vah Yindunizsihya dwg vah guenfuengh Yindunizsihya, gvihaeuq Majlaiz-Bohlinizsihya Yijcuz.
language;['vah yiednamz', 'vah yeznanz', 'saw yiednamz'];Vah Yiednamz (Tiếng Việt) dwg vahguek Yiednamz, vanz Namzya Yijheah.
language;['vah swahili'];Vah Swahili dwg cungj Vah Bantu, hix dwg vah guenfueng Danjsanghnizya.
language;['vahyindi', 'vah yindi'];Vah Yindi (हिन्दी), lij heuh Vah Baekyindu, vanz Yindu-yajlizanh Yijcih, Yindu-yihlangj Yijcuz, Yin-ouh Yijheah.
language;['vah vuhwjduh', 'urdû'];Vah Vuhwjduh（اردو）vanz Yindu-yajlizanh Yijcih, Yindu-yihlangj Yijcuz, Yin-ouh Yijheah.
language;['vahnizbozwj'];Vahnizbozwj (नेपाली) gvi Yindu-yajlizan yijcih, youq doengh dieg Nizbozwj、Buzdanh、Yindu caeuq Mienjdienh sawjyungh.
language;['vah dwzgoz'];Vah Dwzgoz dwg cungj vah Yin-ouh Yijhaeh Rwwjman Yijcuz.
locative-role;['nanzging', 'namzging', 'nanzgingh'];Nanzging Si (Sawgun: 南京市) dwg aen hawsingz youq baihdoeng henzhaij Cunghvaz Yinzminz Gunghozgoz, de dwg soujfuj Swngj Gyanghsuh.
locative-role;['swnjyangh', 'sinjyangz'];Swnjyangh Si (Sawgun: 沈阳市) dwg aen hawsingz youq baih doengbaek Cunghvaz Yinzminz Gunghozgoz, de dwg soujfuj Swngj Laeuzningz.
locative-role;['edirne'];Edirne, dwg si Dujwjgiz.
locative-role;['punta arenas'];Punta Arenas dwg si Chile.
locative-role;['ho chi minh si', 'huz cimingz si'];Ho Chi Minh Si dwg sohguenjsi Yiednamz Seveicujyi Gunghozgoz.
