political-geographic-object;['minnesota'];Minnesota is n Buundesstoat in do Fereende Stoaten fon Amerikoa.
political-geographic-object;['missouri'];Missouri is n Buundesstoat fon do Fereende Stoaten.
political-geographic-object;['michigan'];Michigan is n Buundesstoat in do Fereende Stoaten fon Amerikoa.
political-geographic-object;['nebraska'];Nebraska is n Buundesstoat in do Fereende Stoaten fon Amerikoa.
political-geographic-object;['belgien'];Belgien is n Lound in Wääst-Europa.
political-geographic-object;['swasilound', 'swaziland', 'swazilound'];Swasilound is n Lound in Afrikoa.
political-geographic-object;['pakistan'];Pakistan is n Lound in Suudasien.
political-geographic-object;['bangladesch'];Bangladesch is n Lound in Asien.
political-geographic-object;['afghanistan'];Afghanistan is n Lound in Asien.
political-geographic-object;['aastriek'];Aastriek (de.
political-geographic-object;['australien'];Australien is die grootste Deel fon dän Waarelddeel Australien un dät säkstgrootste Lound ap ju Waareld.
political-geographic-object;['connecticut'];Connecticut is n Buundesstoat in do Fereende Stoaten fon Amerikoa.
political-geographic-object;['hannover', 'region hannover'];Hannover is een Stääd in dät Noude fon Düütsklound.
political-geographic-object;['bordèu', 'bordeaux'];Bordèu is een Stääd in dät Suudwääste fon Frankriek.
political-geographic-object;['bhutan'];Bhutan is n Lound in Asien, twiske China un Indien.
political-geographic-object;['katalonien'];Katalonien is een fon do 17 autonome Gemeenskuppe fon Spanien, et lait in dät Aaste fon Spanien.
political-geographic-object;['georgien'];Georgien is n eurasisk Lound in Asien, oaber al tichte bie n Uurgong tou Europa.
political-geographic-object;['ruanda'];Ruanda is n Lound in Afrikoa.
political-geographic-object;['sambia'];Sambia is n Lound in Afrikoa == Geographie == Dät wäd begränsed fon...
political-geographic-object;['demokratiske republik kongo'];Ju Demokratiske Republik Kongo is n Lound in Afrikoa.
political-geographic-object;['guatemala'];Guatemala is die befoulkengsriekste Stoat fon Middel-Amerikoa.
political-geographic-object;['costa rica', 'crc'];Costa Rica is een Lound in Middel-Amerikoa.
political-geographic-object;['ungarn'];Ungarn is n Lound in Europa.
political-geographic-object;['polen'];Polen is n Lound in Europa.
political-geographic-object;['burundi'];Burundi is n Lound in Afrikoa.
political-geographic-object;['tansania'];Tansania is n Lound in Afrikoa.
political-geographic-object;['guinea'];Guinea is n Lound in Afrikoa.
political-geographic-object;['somalia'];Somalia is n Lound in Afrikoa.
political-geographic-object;['vietnam'];Vietnam is n Lound in Asien.
political-geographic-object;['libyen', 'lybien'];Düssen Stoat häd hoast een Revolutsjoon bääte sik.
political-geographic-object;['aast-düütsklound', 'ddr', 'düütsk demokratiske republik'];Ju Düütske Demokratiske Republik of Aast-Düütsklound waas n Lound dät äntsteen is in 1949 as Satellitstoat fon de Sowjetunion.
political-geographic-object;['düütsklound', 'buundesrepublik düütsklound'];Düütsklound is n Lound in Middel-Europa.
political-geographic-object;['sudan'];Die Sudan is n Lound in Afrikoa.
political-geographic-object;['ägypten'];Ägypten is n Lound in Noudaast-Afrikoa.
political-geographic-object;['algerien'];Algerien is n Lound in Noudafrikoa.
political-geographic-object;['indien', 'india'];Indien is n groot Lound in Suud-Asien an dän Indiske Ozeoan.
political-geographic-object;['italien'];Italien is n Lound in Middel-Europa.
political-geographic-object;['chile'];Chile is een Lound in dät suud-wäästelke Suud-Amerikoa, dät sik ap n smälle, loange Striepe twiske do Anden un ju Pazifik-Kuste loangs lukt.
political-geographic-object;['botsuana', 'botswana'];Botsuana is n Lound in Afrikoa.
political-geographic-object;['mosambik', 'mozambique'];Mosambik af Mozambique is n Lound in Afrikoa.
political-geographic-object;['indonesien'];Indonesien is n Ailoundstoat in Suudaast-Asien.
political-geographic-object;['griechenlound'];Griechenlound (de.
political-geographic-object;['ukraine'];Ukraine is n Lound in Aast-Europa.
political-geographic-object;['mexiko'];Mexiko is n Lound in Midden-Amerikoa.
political-geographic-object;['armenien'];Armenien is n Lound in n Kaukasus in Faanderasien.
political-geographic-object;['irak'];Die Irak is n Lound in Asien.
political-geographic-object;['gambia'];Gambia is n Lound in Afrikoa.
political-geographic-object;['ghana'];Ghana is n Lound an ju Wäästkuste fon Afrikoa.
political-geographic-object;['nigeria'];Nigeria is n Lound in Afrikoa.
political-geographic-object;['älfenbeenkuste', 'älpenbeenkuste'];Juu Älfenbeenkuste is n Lound in Wäästafrikoa.
political-geographic-object;['niger'];Niger is n Lound in Afrikoa.
political-geographic-object;['gabun', 'gabon', 'gabuun'];Gabun is n Lound in Afrikoa.
political-geographic-object;['republik kongo'];Juu Republik Kongo is n Lound in Afrikoa.
political-geographic-object;['kamerun'];Kamerun is n Lound in Afrikoa.
political-geographic-object;['guinea-bissau'];Guinea-Bissau is n Lound in Afrikoa.
political-geographic-object;['senegal'];Senegal is n Lound in Afrikoa.
political-geographic-object;['frankriek'];Frankriek is n Lound in Wääst-Europa.
political-geographic-object;['irlound', 'irland', 'republik irlound'];Irlound is n Lound in Wääst-Europa un ju Haudstääd is Dublin.
political-geographic-object;['madagaskar'];Dät Lound Madagaskar is n Ailound-Stoat un heert tou Afrikoa.
political-geographic-object;['panama-stääd', 'ciudad de panamá', 'panama-stadt', 'panama city', 'panamastääd'];Panama-Stääd is ju Haudstääd un die Regierengssit fon dän middel-amerikoansken Stoat Panama.
political-geographic-object;['seychelle'];Doo Seychelle sunt n Ailoundstoat noudelk fon Madagaskar in dän Indiske Ozean.
political-geographic-object;['sweeden', 'sweden'];Sweeden is n skandinavisk Lound in Noud-Europa.
political-geographic-object;['haudstääd'];Ne Haudstääd is maastens dät politiske Säntrum fon n Stoat, Provinz, Meente, Departement of Buundeslound.
political-geographic-object;['liechtenstein', 'liechtensteen'];Liechtenstein is n Lound in Wääst-Europa.
political-geographic-object;['andorra'];Andorra is n litje Lound in Wääst-Europa.
political-geographic-object;['western australia'];Western Australia is n Buundesstoat fon Australien mäd ne Flakte fon 2.529.880 km² un 2.565.600 Ienwoonere.
political-geographic-object;['tennessee'];Tennessee is n Buundesstoat in do Fereende Stoaten fon Amerikoa.
political-geographic-object;['kentucky'];Kentucky is n Buundesstoat in do Fereende Stoaten fon Amerikoa.
political-geographic-object;['kansas'];Kansas is n Buundesstoat in do Fereende Stoaten fon Amerikoa.
political-geographic-object;['vermont'];Vermont is n Buundesstoat in do Fereende Stoaten fon Amerikoa.
political-geographic-object;['massachusetts'];Massachusetts is n Buundesstoat in do Fereende Stoaten fon Amerikoa.
political-geographic-object;['rhode island'];Rhode Island is n Buundesstoat in do Fereende Stoaten fon Amerikoa.
political-geographic-object;['south dakota'];South Dakota is n Buundesstoat in do Fereende Stoaten fon Amerikoa.
political-geographic-object;['läichsaksen', 'lound läichsaksen'];Läichsaksen is een fon do säkstien Buundeslounde fon Düütsklound, wier uk dät Seelterlound tou heert.
political-geographic-object;['alaska'];Alaska is n Buundesstoat fon do Fereende Stoaten.
political-geographic-object;['montana'];Montana is n Buundesstoat in do Fereende Stoaten fon Amerikoa.
political-geographic-object;['oregon'];Oregon is n Buundesstoat in do Fereende Stoaten fon Amerikoa.
political-geographic-object;['louisiana'];Louisiana is n Buundesstoat fon do Fereende Stoaten.
political-geographic-object;['south australia'];South Australia is n australisken Buundesstoat mäd ne Flakte fon 983.480 km² un 1.698.600 Ienwoonere.
political-geographic-object;['oklahoma'];Oklahoma is n Buundesstoat in do Fereende Stoaten fon Amerikoa.
political-geographic-object;['arkansas', 'arkansas\u200e'];Arkansas is n Buundesstoat in do Fereende Stoaten fon Amerikoa.
political-geographic-object;['victoria'];Victoria is n australisken Buundesstoat.
political-geographic-object;['florida'];Florida is n Buundesstoat in do Fereende Stoaten fon Amerikoa.
political-geographic-object;['georgia'];Georgia is n Buundesstoat in do Fereende Stoaten fon Amerikoa.
political-geographic-object;['north carolina'];North Carolina is n Buundesstoat in do Fereende Stoaten fon Amerikoa.
political-geographic-object;['new mexico'];New Mexico is n Buundesstoat in do Fereende Stoaten fon Amerikoa.
political-geographic-object;['arizona'];Arizona is n Buundesstoat fon do Fereende Stoaten.
political-geographic-object;['mississippi'];Mississippi is n Buundesstoat in do Fereende Stoaten fon Amerikoa.
political-geographic-object;['south carolina'];South Carolina is n Buundesstoat in do Fereende Stoaten fon Amerikoa.
political-geographic-object;['virginia'];Virginia is n Buundesstoat in do Fereende Stoaten fon Amerikoa.
political-geographic-object;['idaho'];Idaho is n Buundesstoat in do Fereende Stoaten fon Amerikoa.
political-geographic-object;['alabama'];Alabama is n Buundesstoat in do Fereende Stoaten fon Amerikoa.
political-geographic-object;['hawaii'];Hawaii is n Buundesstoat in do Fereende Stoaten fon Amerikoa.
political-geographic-object;['nevada'];Nevada is n Buundesstoat in do Fereende Stoaten fon Amerikoa.
political-geographic-object;['kalifornien'];Kalifornien is n Buundesstoat in do Fereende Stoaten fon Amerikoa.
political-geographic-object;['wyoming'];Wyoming is n Buundesstoat in do Fereende Stoaten fon Amerikoa.
political-geographic-object;['utah', 'uta'];Utah is n Buundesstoat fon doo Fereende Stoaten.
political-geographic-object;['colorado'];Colorado is n Buundesstoat in do Fereende Stoaten fon Amerikoa.
political-geographic-object;['north dakota'];North Dakota is n Buundesstoat in do Fereende Stoaten fon Amerikoa.
political-geographic-object;['northern territory'];Dät Northern Territory is n Buundesterritorium fon Australien.
political-geographic-object;['jordanien'];Jordanien is n Lound in Faander-Asien.
political-geographic-object;['libanon'];Libanon is n Lound in dät Naie Aaste.
political-geographic-object;['new south wales'];New South Wales is aan australisken Buundesstoat, wier mäd sowät soogen Millionen Ljuude moor as n Träädel fon juu heele australiske Befoulkenge lieuwet.
political-geographic-object;['vatikanstääd', 'vatikoanstääd', 'vatikoan'];Vatikanstääd (dt.
political-geographic-object;['amsterdam'];Amsterdam is ju Haudstääd fon do Niederlounde.
political-geographic-object;['nijmegen'];Nijmegen is ne Meente in ju Provinz Gelderland, in do Niederlounde.
political-geographic-object;['düsseldorf', 'duesseldorf'];Düsseldorf is ju Haudstääd fon dät düütske Buundeslound Noudrhien-Wäästfoalen.
political-geographic-object;['kap verde', 'koap verde'];Kap Verde of do Kapverdiske Ailounde is n Lound foar ju Wäästkuste fon Afrikoa.
political-geographic-object;['bahrain'];Bahrain is n Ailoundstoat in n Persisken Gulf, Asien.
political-geographic-object;['ieslound', 'island', 'ísland'];Ieslound (is.
political-geographic-object;['são paulo'];São Paulo is mäd 12.038.175 Ienwoonere ju grootste Stääd fon do Brasilien un fon heel Suudamerikoa.
political-geographic-object;['meente'];Ne Meente
political-geographic-object;['lissabon'];Lissabon is ju grootste Stääd un ju Haudstääd fon Portugal.
political-geographic-object;['lima'];Lima is ju Haudstääd un uk ju grootste Stääd fon Peru mäd sowät 8,89 Millionen Ienwoonere.
political-geographic-object;['dublin'];Dublin is ju Haudstääd un grootste Stääd fon Irlound.
political-geographic-object;['sofia'];Sofia is ju Haudstääd fon Bulgarien.
political-geographic-object;['bogotá', 'bogotá, d.c.', 'bogotá, distrito capital'];Bogotá [bo̞ɰo̞ˈta̠] is ju Haudstääd fon Kolumbien un dät Ferwaltengs-Säntrum fon dät Departamento Cundinamarca.
political-geographic-object;['havanna'];Havana is ju Haudstääd fon Kuba.
political-geographic-object;['praag', 'prag', 'praha'];Prag is ju Haudstääd un grootste Stääd fon Tschechien.
political-geographic-object;['budapest'];Budapest is ju Haudstääd fon Ungarn.
political-geographic-object;['bagdad'];Bagdad is ju Haudstääd fon Irak.
political-geographic-object;['room', 'rom'];Room is ju grootste Stääd in Italien mäd sowät 2,7 Millionen Ienwoonere.
political-geographic-object;['beirut'];Beirut is ju Haudstääd fon Libanon.
political-geographic-object;['brisbane'];Brisbane is ju Haudstääd fon dän australisken Deelstoat Queensland.
political-geographic-object;['bukarest'];Bukarest is ju Haudstääd fon Rumänien.
political-geographic-object;['jerusalem'];Jerusalem is ju Haudstääd fon Israel un wäd uk as Haudstääd fon do Palästinensiske Autonomielounde in Ansproak nuumen, uumdät in dät Aaste ful Arabere lieuwje un foarallen uumdät Jerusalem uk foar do Muslime een Betjuudenge as hillige Stääd häd.
political-geographic-object;['lomé'];Lomé is ju Haudstääd fon Togo.
political-geographic-object;['berlin'];Berlin is ju Haudstääd fon Düütsklound.
political-geographic-object;['peking'];Peking of Beijing is ne Stääd in dät Noudaaste fon dän Foulksrepublik China.
political-geographic-object;['thailound'];Dät Köönichriek Thailound is n Lound in dät Suudaaste fon Asien.
political-geographic-object;['äthiopien', 'abessinien'];Äthiopien af Abessinien is n Lound in Afrikoa.
political-geographic-object;['moskau'];Moskau is ju Haudstääd fon Ruslound.
political-geographic-object;['benin'];Benin is n Lound in Afrikoa, an dän Golf fon Guinea.
political-geographic-object;['burkina faso'];Burkina Faso is n Lound in Wääst-Afrikoa.
political-geographic-object;['bahamas'];Do Bahamas sunt n Ailoundkoppel in dät Karibiske Gebiet.
political-geographic-object;['sao tome un principe', 'são tomé un príncipe'];Sao Tome un Principe sunt touhoope n Ailoundstoat in dän Golf fon Guinea, n Deel fon dän Atlantik foar de Kuste fon Wääst-Afrikoa.
political-geographic-object;['israel'];Israel is n Lound in dät Midde-Aaste.
political-geographic-object;['chicago'];Chicago is ne Stääd in dän amerikoanisken Buundesstoat Illinois.
political-geographic-object;['manhattan'];Manhattan is n Ailound an ju Mundenge fon dän Hudson River un n Stääddeel fon New York.
political-geographic-object;['skotlound'];Skotlound is ne Nation in Noudwääst- Europa un Paat fon dät Fereenigde Köönichriek.
political-geographic-object;['finlound'];Finlound is n Lound in Wääst-Europa.
political-geographic-object;['rotterdam'];Rotterdam is ätter Amsterdam ju twäidgrootste Stääd in do Niederlounden.
political-geographic-object;['tórshavn'];Tórshavn is ju Haudstääd fon do Färöer.
political-geographic-object;['wien'];Wien is ju Haudstääd fon Aastriek un fon dät Buundeslound Wien.
political-geographic-object;['münchen'];München is ne Stääd in Düütsklound un Haudstääd fon Buundeslound Beieren.
political-geographic-object;['brussel'];Brussel is ju Haudstääd fon Belgien.
political-geographic-object;['nikosia', 'nicosia', 'lefkosa', 'lefkosia', 'lefkosía', 'lefkoşa', 'λευκωσία'];Nikosia is ju Haudstääd fon Zypern.
political-geographic-object;['kopenhagen'];Kopenhagen is ju Hööftstääd fon Dänemark.
political-geographic-object;['london'];London is ju Haudstääd fon Änglound un Groot-Britannien.
political-geographic-object;['tallinn'];Tallinn (aller dt.
political-geographic-object;['helsinki'];Helsinki is ju Haudstääd un grootste Stääd fon Finlound.
political-geographic-object;['paris'];Paris is ju Haudstääd fon Frankriek un ju Region Île-de-France.
political-geographic-object;['athene'];Athene is ju Haudstääd fon Griechenlound un ju grootste Stääd in Griechenlound.
political-geographic-object;['reykjavík', 'reykjavik'];Reykjavík is ju Haudstääd fon Ieslound.
political-geographic-object;['indianapolis'];Indianapolis is ne Stääd in dän amerikoanisken Buundesstoat Indiana.
political-geographic-object;['tokio'];Tokio, ätter dät Hepburn-systeem gjuchtschrieuwen as Tokyo, is ju Haudstääd fon Japan.
political-geographic-object;['riga'];Riga is ju Haudstääd fon Letlound un is ju grootste Stääd fon do Baltiske Stoate.
political-geographic-object;['vilnius'];Vilnius is ju Haudstääd un grootste Stääd fon Litauen.
political-geographic-object;['luxembuurich', 'luxembuurich stääd'];Luxembuurich Stääd is ju Haudstääd fon Luxembuurich.
political-geographic-object;['mexiko-stääd', 'altepetl mexihco', 'ciudad de mexiko', 'ciudad de méxico', 'mexico city', 'mexiko-stadt'];Mexiko-Stääd is ju Haudstääd fon Mexiko.
political-geographic-object;['panama-stääd', 'ciudad de panamá', 'panama-stadt', 'panama city', 'panamastääd'];Panama-Stääd is ju Haudstääd un die Regierengssit fon dän middel-amerikoansken Stoat Panama.
political-geographic-object;['warschau'];Warschau is ju Haudstääd fon Polen.
political-geographic-object;['dakar'];Dakar is ju Haudstääd fon Senegal.
political-geographic-object;['madrid'];Madrid is ju Haudstääd fon Spanien.
political-geographic-object;['stockholm'];Stockholm is ju Haudstääd fon Sweeden.
political-geographic-object;['bangkok', 'krung thep', 'krung thep mahanakhon amon rattanakosin mahinthara ayuthaya mahadilok phop noppharat ratchathani burirom udomratchaniwet mahasathan amon piman awatan sathit sakkathattiya witsanukam prasit'];Bangkok, Thaisk: Krung Thep Mahanakhon, is ju Haudstääd fon Thailound.
political-geographic-object;['caracas', 'santiago de léon de caracas'];Caracas is ju Haudstääd un grootste Stääd fon Venezuela.
political-geographic-object;['hanoi'];Hanoi is ju Haudstääd fon Vietnam.
political-geographic-object;['canberra'];Canberra is ju Haudstääd fon Australien.
political-geographic-object;['brasília', 'brasilia'];Brasilia is ju Haudstääd fon Brasilien.
political-geographic-object;['ottawa'];Ottawa is ju Buundeshaudstääd fon Kanada.
political-geographic-object;['zagreb'];Zagreb is ju Haudstääd un grootste Stääd fon Kroatien.
political-geographic-object;['valletta'];Valletta is ju Haudstääd un grootste Stääd fon Malta, man ju litste EU-Haudstääd.
political-geographic-object;['ljubljana'];Ljubljana
political-geographic-object;['melbourne'];Melbourne is ju Haudstääd un grootste Stääd fon dät australiske Buundeslound Victoria.
political-geographic-object;['rio de janeiro'];Rio de Janeiro is een Stääd in't Suudaaste fon Brasilien in dän Buundesstoat Rio de Janeiro.
political-geographic-object;['sydney'];Sydney is ju Haudstääd fon dän australisken Deelstoat New South Wales.
political-geographic-object;['tel aviv'];Tel Aviv is ju twäidgrootste Stääd in Israel an dät Middelmeer.
political-geographic-object;['detroit'];Detroit is ne Stääd in dän amerikoanisken Buundesstoat Michigan.
political-geographic-object;['new york city', 'new york'];New York is ju grootste Stääd fon do Fereende Stoaten in dän Stoat New York.
political-geographic-object;['philadelphia'];Philadelphia is ne Stääd in dän amerikoanisken Buundesstoat Pennsylvania.
political-geographic-object;['brasilien'];Brasilien is n Lound in Suud-Amerikoa.
political-geographic-object;['texas'];Texas is n Buundesstoat in do Fereende Stoaten fon Amerikoa.
political-geographic-object;['den haag'];Den Haag is ne Meente in ju Provints Suudhollound in do Niederlounde.
political-geographic-object;['phoenix'];Phoenix is ne Stääd in dän amerikoanisken Buundesstoat Arizona.
political-geographic-object;['adelaide'];Adelaide is ju Haudstääd fon dän australisken Deelstoat South Australia.
political-geographic-object;['perth'];Perth is ju Haudstääd fon dän australisken Deelstoat Western Australia.
quality;['atommasse'];Ju Atommasse, fröier Atomgewicht, is ju Masse fon n Atom.
quality;['atommasse'];Ju Atommasse, fröier Atomgewicht, is ju Masse fon n Atom.
quality;['religion'];Religion af Gloowe is dät Ferhoolden fon Moanskene, so as dät bestimd wäd fon dät Bewustweesen, dät me fon ne uurmoanskelke Macht ouhängich is.
quality;['faawe', 'farbe'];Faawen af Klöäre sunt optiske Oainskuppe, wier dät Ooge fon n Moanske neen Struktuur ärkanne kon, heel niep nuumen sunner deerap tou kiekjen, wo ljoacht af junkelch dät is.
quality;['heedendum', 'heidendum'];Dät Heedendum is n Begriep in do Religionswietenskuppe, die bruukt wäd foar religiöse Traditione, weerbie ferskeedene Godhäide fereerd wäide.
quality;['bruttoinloundsprodukt', 'brutobinnenloundskprodukt'];Mäd dät Bruttoinloundsprodukt of Bruttobinnenloundskprodukt kon me ju Wirtskaft fon n Lound bereekenje.
quality;['blau'];Blau is ne Faawe, ju in dät Spektrum lait twiske zyan un saang.
quality;['phänotyp'];Dät Froamdwoud Phänotyp stoant in ju Biologie foar dät bloote Uutsjoon fon n Lieuweweesen.
quality;['juudendum'];Dät Juudendum is die Gloowe fon do Juuden, man uk Seeken as juudske Kultuur un Geskichte heere tou dät Juudendum.
quality;['genotyp'];Die Genotyp is in ju Biologie die Begriep fon dän genetisken Typ, also foar aal do Genetiske Määrkmoale touhoope.
quality;['masse'];Masse is ne physikaliske Gruundgrööte, ju der n Oainskup fon Materie beteekent.
quality;['rood'];Rood is ne primäre Faawe bie ju additive Faawenmiskenge.
quality;['jeel'];Jeel is ne primäre Faawe bie ju subtraktive Faawenmiskenge.
quality;['kristendum'];Dät Kristendum is een Religion ätter dät Lieuwend fon Jesus Kristus, dät beschrieuwen is in dät Näie Testament.
quality;['gewicht'];Gewicht is ju Oainskup fon n Körper, ju der ounrakt, wo stäärk hie fon de Äide anleeken wäd.
region;['munte'];Ju Munte is dät stoatelke Jäildweesen fon n Lound.
region;['miele'];As Miele beteekent me ferscheedene oolde Mäiten.
region;['astronomiske eenhaid'];Ju astronomiske Eenhaid is ne Oustandsmäite, ju der bolde gliek dän Truchsleek-Oustand is twiske ju Äide un ju Sunne, soowät 149,6 Millionen km.
region;['ailound fon ju stabilität'];N Ailound fon ju Stabilität wäd in ju Käädenphysik fon Isotope bilded, wierfon do Neutrone- un Protonetaale bestimde magiske Taale äntspreeke un do der deeruum stabiler as in dät Periodensystem deerieuwenske lääsende Elemente sunt.
region;['luchtjier'];N Luchtjier, Symbol lj, is n Laangtemäite ju der bruukt wäd in ju Astronomie.
region;['atomtaal', 'atomnummer'];Ju Atomtaal beteekent, wofuul Protone dät rakt in dän Kääden fon n Atom.
regulation;['historiske luudleere'];Ju historiske Luudleere befoatet sik deermäd, wo do Luude sik in ju Geschichte fon ju Sproake äntwikkeld hääbe un wo do in früünde Sproaken touhoopehongje.
relation;['beegenge', 'flexion'];Ju Beegenge (uk: Flexion, fon lat.
simple-collection;['mythologie'];Ju Mythologie is een Sammelenge fon Mythen.
simple-collection;['al', 'all'];Dät Al af Universum is aal wat bestoant, ju Ruumte mäd aal wät deer oun tou fienden is.
situation;['ökologiske niske'];Die Begriep "Ökologiske Niske" (de.
situation;['wierwenge'];Wierwenge mai wäkke Seelter froamd läite, man wie mouten uus litje Sproake uutbaue, dät wie ju uk in ju moderne Tied anweende konnen.
situation;['chemiske formel'];Ju chemiske Formel fon n Stof beskrift kuut, uut wäkke Elemente un in wäkke Taale Atome een Molekül fon dän Stof apbaud is.
situation;['ruumtefoart', 'ruumfoart'];Ruumtefoart (dt.
situation;['konkordanz'];N Konkordanz is ne alpahabetiske Lieste fon do Woude in n Bouk of n uur Stuk skriftelke Oarbaid, touhoope mäd ju deertou heerende Uumtext.
situation;['doatenboank'];N Doatenboank of Doatenboanksystem is n digitoal spiekerd Archiv, iengjucht foar flexibele Beräidenge un Gebruuk.
situation;['ääntjen'];Dät Ääntjen is ne Technik, juu foarallen benutsed wäd, uum Fruchtboome vegetativ tou fermoorjen.
situation;['weeder'];As Weeder beteekent me n kuuten Toustand fon juu Atmosphäre an ne Steede ap juu Äidbupperkaante.
situation;['synapse'];Een Synapse is een Kontaktsteede twiske two Näärwensällen.
situation;['klima'];Mäd dän Begriep "Klima" beteekend me dän Middelsleek fon aal Weeder-Toustande een Steedegnau so, juu jierelke Foulge fon ferscheedene Weeder-Toustande an disse Steede apnunner.
social-relationship;['politik'];Mäd Politik ferträt man Gruppen fon Ljuude mäd bestimde Interessen, man tougliek politiske Ideen do dät algemeene Wäilweesen bestrieuwje.
social-role;['munte'];Ju Munte is dät stoatelke Jäildweesen fon n Lound.
socially-constructed-person;['geoffrey chaucer'];Geoffrey Chaucer (bädden uum 1343, weerskienelk in London. stuurwen weerskienelk ap dän 25.
socially-constructed-person;['tiziano vecellio', 'da cadore', 'titian', 'tizian', 'tiziano vecelli'];Tiziano Vecellio (oafter kuut Tizian naamd, in sien Lieuwend ätter sien Heematstääd uk Da Cadore. *uunbekoand Doatum in Pieve di Cadore tichte bie Belluno, †27.
socially-constructed-person;['johann sebastian bach'];Johann Sebastian Bach (21.
socially-constructed-person;['georg friedrich händel', 'georg friederich händel', 'george frederic handel', 'george frideric handel'];Georg Friedrich Händel (in't Deepregister iendrain as Georg Friederich Händel, In Änglound naamd: George Frideric Handel. bädden ap dän 23.
socially-constructed-person;['freerk ii.', 'friedrich ii.', 'alter fritz', 'friedrich der große', 'friedrich die groote', 'oolde frits', 'oolden frits'];Freerk II., uk Freerk die Groote of die Oolde Frits naamd (düütsk: Friedrich II.* 24.
socially-constructed-person;['johann wolfgang von goethe'];Johann Wolfgang von Goethe (* 28.
socially-constructed-person;['ludwig van beethoven', 'ludwig van bethoven'];Ludwig van Beethoven (deept ap dän 17.
