physical-object;['korapy'];Korapy yvu pehẽngue óga jeréregua.
physical-object;['mboka'];Mboka niko ojeipuruha oporoñongatu téra oporojuka hag̃ua.
physical-object;['internet'];Internet ha'e umi ñandutikuéra momaranduha kombutadórapegua joaju.
physical-object;['káma jokoha'];Káma jokoha aoguy, kuña oipurúva ojaho’i ha ojoko hag̃ua ikáma.
physical-region;["kuarahy'ã"];Kuarahy'ã Kuarahyrope ohupyty’ỹhápe.
political-geographic-object;['rrumáña', 'rrumaña', 'rrumania'];Rrumáña ha'e peteĩ tetã hekosãsóva ojejuhu Európa ipehẽngue mbytegua ha ipehẽngue ñemby kuarahyresẽygua imbytépe, upe para Hũ rembe'ýre.
political-geographic-object;['alepo', 'aleppo'];Alepo ha'e peteĩ táva guasu ha tenondegua Siria retã pegua, Tetãvore Alepo itavusu.
political-geographic-object;['punta arenas'];Punta Arenas táva Chilepe.
political-geographic-object;['táva ho chi minh', 'ho chi minh city'];Táva Ho Chi Minh hasy pete kapilla ve tekotevẽ gui Vietnam.
political-geographic-object;['los ángeles', 'los angeles'];Los Ángeles ha'e peteĩ táva Tetãvore Joapykuéra retãme.
political-geographic-object;['ginebra'];Ginebra . ha'ehína peteĩ táva Suisa.
political-geographic-object;['san petersburgo'];San Petersburgo ha'e táva mokõiha orekovéva tapicha kuéra ipype Rrusia retãme, oguereko 5 026 000 tapicha ha ijerére oikove 5,85 sua.
political-geographic-object;['méka', 'la meca'];Méka ha´eva táva tetã Aráviape.
political-geographic-object;['recife'];Recife táva Vrasilpe, ha'eva tavusu ha tava tenondegua tetãvore Pernambuco.
political-geographic-object;['oaxaca de juárez', 'oaxaca'];Oaxaca de Juárez, ha'e peteĩ táva guasu Méhiko pegua, tetãvore Oaxaca itavusu.
political-geographic-object;['yvatekorea', 'yvate koréa', 'korea tekoha tetã jekopytyjojáva', 'korea yvategua'];Koréa Tetarã Retã Jekopytyjojáva ―ojeikuaavéva Yvate Koréa oñemoingoe hag̃ua Ñemby Koréagui, ha'e peteĩ tetã Asia pegua.
political-geographic-object;['noruega', 'noruéga', 'norge'];Oĩ ko Noruega Europape tetã.
political-geographic-object;['tetãnguéra yvýi', 'holanda', 'tetã guýpe'];Tetãnguéra Yvýi ha'e peteĩ tetã hekosãsóva Európa pegua oĩva Tavetã umi Tetãnguéra Yvýi pegua.
political-geographic-object;['hapõ', 'japón'];Hapõ, héra tee hína Hapõ Retã, ha'e niko peteĩ tetã hekosãsóva ojejuhúva ypa'ũnguérape Ásia pehẽngue kuarahyresẽyguápe.
political-geographic-object;['samóa'];Samóa, héra tee hína Tetã Hekosãsóva Samóa, ha'e peteĩ tetã hekosãsóva ijyvy apekue oĩva heta ypa'ũme, tetã peteĩ umi irundýgui oĩva Mikyonésia-pe, ha tetã peteĩ umi 14-gui oĩva Oseanía-pe.
political-geographic-object;['jimbúti'];Jimbúti, héra tee hína Tavakuairetã Jimbúti, ha'e tetã hekosãsóva michĩ Áfrika Ratĩme.
political-geographic-object;['malásia'];Malásia térã Joaty Malásia pegua, ha'e peteĩ umi 49 tetã hekosãsógui ojejuhúva Ásia yvyrusúpe.
political-geographic-object;['antigua ha barbuda'];Antigua ha Barbuda ha'e peteĩ ypa'űaty tetã oĩ Paraguasu Atlántikope, Para Karive.
political-geographic-object;['mauritáña'];Mauritáña, héra tee hína Tavakuairetã Islã rapépe Mauritáña, ha'e hína peteĩ tetã hekosãsóva ojejuhu Áfrika ipehẽngue yvate kuarahyreikeguápe.
political-geographic-object;['mbelise', 'velíse', 'belize'];Mbelise ha'e peteĩ tetã oĩ Mbyteamérika, ijerére ojejuhu yvate gotyo Méjiko. kuarahyreike ha ñemby gotyo Guatemala. kuarahysẽ gotyo Paraguasu Atlántiko.
political-geographic-object;['san cristóbal ha nieves'];San Cristóbal ha Nieves ha'e hína mokõi ypa'ũ Karívepe ojejuhúva, Amérikape, oiko joaju Tetã Ñembyatypyre San Cristóbal ha Nieves rupive ha upéicha ha'e peteĩ tetã hekosasóva ypa'ũnguéra Karíve pegua yvate gotyo.
political-geographic-object;['komóra', 'comoras', 'komora'];Komóra Joaty, térã Komóra ha'e peteĩ tetã hekosãsóva mbohapy ypa'ũ ijyvy apekuéicha ojejuhúva kuarahyresẽ Áfrika-pe, tetã Mosambíke rembe'ýre paraguasu Índiko-pe, yvate ypa'ũ Mandagaka ha kuarahyresẽ Mosambíke.
political-geographic-object;['ndominíka'];Ndominíka, héra tee hína Ñembojoaju Ndominíka, ha'e peteĩ ypa'ũ ha tetã hekosãsóva ojejuhúva Amérikape, ypa'ũnguéra Karíve pegua atýpe, para Karíve-pe.
political-geographic-object;['santa lucía'];Santa Lucía ha'e peteĩ tetã michĩ hekosãsóva ijyvy apekue oĩ ypa'ũme Karíve yguasúpe, ojejuhúva Amérikape, ijerére ojejuhu, yguasu rupi, ñemby gotyo San Vicente ha Granadinas ha yvate gotyo ojejuhu upe ypa'ũ Martinica.
political-geographic-object;['ingyaterra', 'ingyatérra', 'inglaterra'];Ingyatérra ha'e peteĩ tetã oĩva Tavetã Joajúpe.
political-geographic-object;['yvate irilánda'];Yvate Irilánda ha'e peteĩ tetã oĩva Tavetã Joajúpe.
political-geographic-object;['suísa', 'suisa', 'ch', 'suiza'];Tetã Suisa térã Joaty Suisa ha'e peteĩ tetã oĩ Europape, itavusu ha'e Veyna ha itava kuéra tenondegua ha'e Súrichi, Mbasilea, Hinebyra ha Lugano.
political-geographic-object;['aravia emiryvy joaju', 'arávia emiráto joapykuéra', 'aravia emiryvy juaju', 'emiryvy araviagua joapykuéra'];Aravia Emiryvy Joaju ha'e peteĩ tetã joaty oĩ kuarahysẽ Yvyapy Arávia, Yvyrusu Asiape.
political-geographic-object;['tetã peteĩ reko soviétiko', 'urss'];Tetã peteĩ reko Soviétiko hína 15 teta socialista oñembyatyva´ekue Ary 1917-pe partido comunista soviétiko-guype ary 1991 peve.
political-geographic-object;['luxemburgo'];Oĩ ko Luxemburgo Europape tetã.
political-geographic-object;['marruéko'];Marruéko —héra tee hína Mburuvi Marruéko ha'e peteĩ tetã hekosãsóva ojejuhúva Mageréve-pe, Áfrika ipehẽngue yvatépe, oñehembe'ýva paraguasu Atlántiko rehe ha para Yvy mbytépe rehe.
political-geographic-object;['tetã joaju', 'tavetã joaju', 'reino unido'];Tavetã Joaju, héra tee niko Tavetã Joaju Vyretáña Guasu ha Yvate Irilánda pegua ha'e peteĩ tetã hekosãsóva ojejuhúva ypa'ũnguérape yvyrusu Európa pehẽngue yvate kuarahyreikeguápe.
political-geographic-object;['españa', 'epáña', 'epaña', 'vikipetã:españa'];Epáña ha'e peteĩ tetã hekosãsóva, oikóva Európa Joatýpe, oporombojára Porokuái peteĩme amandajére rupive.
political-geographic-object;['aravia saudíta', 'arávia saudíta'];Aravia Saudita ha'éva peteĩ tetã Aráviape, Asia.
political-geographic-object;['tajikitã'];Tajikitã —héra tee niko Tavakuairetã Tajikitã — ha'e peteĩ tetã hekosãsóva yguasu rembe'y'ỹva ojejuhúva Mbyte Ásiape.
political-geographic-object;['vielorrúsia', 'vielorrusia'];Vielorrusia, Tavakuairetã Vielorrusia, ha'e peteĩ tetã hekosãsóva Kuarahyresẽ Európa pegua, ary 1991 peve oĩva Tetã peteĩ reko Soviétiko ipype.
political-geographic-object;['maláui', 'malaui'];Maláui ha'e peteĩ tetã hekosãsóva yguasu rembe'y'ỹva ojejuhúva Áfrika ipehẽngue ñemby kuarahyresẽme, hérava ymaguare Nyasalándia.
political-geographic-object;['simbávue', 'zimbabue', 'zimbabwe'];Simbávue, héra tee hína Tavakuairetã Simbávue, ha'e niko peteĩ tetã hekosãsóva ojejuhúva Áfrika pehẽngue ñemby kuarahyresẽyguápe, ysyry Sambése, chororo Victoria ha ysyry Limpópo mbytépe.
political-geographic-object;['aservaijã'];Tetã Aservaijã ha'e peteĩ tetã oĩ Europa ha Asiape.
political-geographic-object;['kirigitã', 'kirguistán', 'kirigísa'];Kirigitã, hérava avei Kirigísa, ha héra tee Tavakuairetã Kirigitã, ha'e peteĩ tetã hekosãsóva oguereko'ỹva parápe osẽ hag̃ua ha ijyvy apekue yvyty ha yvytyrysýi memete, ojejuhúva Mbyte Ásia-pe, ijerére ojejuhu Chína, Kasahitã, Tajikitã ha Uvekitã.
political-geographic-object;['mali'];Mali térã Máli, héra teéva hína Tavakuairetã Mali, ha'e peteĩ tetã hekosãsóva ha yguasu rembe'y'ỹva Áfrika ipehẽngue kuarahyreiképe.
political-geographic-object;['kazajistán', 'kasahitã'];Oĩ ko Kazajistán Europape ha Asiape tetã.
political-geographic-object;['mongolia', 'mongólia'];Mongólia ha'e niko peteĩ tetã hekosãsóva ha yguasu rembe'y'ỹva, tetã Kuarahyresẽ Asiape ojejuhúva.
political-geographic-object;['pyahu jersey', 'new jersey', 'jersey pyahu', 'nueva jersey'];New Jersey ha'e niko peteĩva Tetãvore Joapykuéra apytépe.
political-geographic-object;['illinois'];Illinois ha'e niko peteĩva Tetãvore Joapykuéra apytépe.
political-geographic-object;['minnesota', 'minesóta'];Minesóta ha'e niko peteĩva Tetãvore Joapykuéra apytépe.
political-geographic-object;['misuri', 'misúri', 'missouri'];Misúri ha'e niko peteĩva Tetãvore Joapykuéra apytépe.
political-geographic-object;['michigan'];Michigan ha'e niko peteĩva Tetãvore Joapykuéra apytépe.
political-geographic-object;['nebraska'];Nebraska ha'e niko peteĩva Tetãvore Joapykuéra apytépe.
political-geographic-object;['véyhika', 'bélgica', 'mbélgyka', 'mbéyhika'];Tetã Véyhika ha'e peteĩ tetã oĩ Europape.
political-geographic-object;['eswatini', 'esuatíni', 'suasilándia', 'suasilandia'];Esuatíni, héra teéva ha'e hína Tavetã Esuatíni, ha'e peteĩ tavetã hekosãsóva michĩ ha y rembe'y'ỹva opytáva yvyrusu Áfrika iñemby gotyo, kuarahyresẽ gotyo umi Yvytyrysýi Drakensberg, Yvyáfrika ha Mosambíke imbytépe, ko tetã rekuái reko niko oporokuáiva peteĩme pavẽ.
political-geographic-object;['tónga'];Tónga, héra tee hína Tónga Mburuvi, ha'e hína peteĩ tetã hekosãsóva Oseaníape, ojejuhúva ypa'ũ aty Polinésiape ha heko rekuái oporokuái peteĩme amandajére.
political-geographic-object;['pakistán', 'pakitã'];Oĩ ko Pakistán Asiape tetã.
political-geographic-object;['vangyladẽ', 'vangalande'];Vangalande Tekoha Tetã térã Vangalande ha'e peteĩ tetã oĩ Yvy Asia.
political-geographic-object;['ahyganitã', 'afganistán'];Ahyganitã, Tetã Islãrehegua Ahyganitã ha'e peteĩ tetã Asiape.
political-geographic-object;['áuteria', 'auteria', 'austria'];Tetã Áuteria ha'e peteĩ tetã oĩ Europape, itavusu ha'e Viéna.
political-geographic-object;['láo', 'laos'];Láo, héra tee hína Láo Tekoha Tavakuairetã Jekopytyjojápe, ha'e peteĩ tetã hekosãsóva Ásia pegua.
political-geographic-object;['miama', 'miamar'];Miamar hérava ONU-pe ha teehápe UE Joaty Myanmar,Tavakuairetã Joaty Miamar térã avei Virmaña, ha'e tetã ñemby kuarahyresẽ Asiape.
political-geographic-object;['kamboja', 'kambója'];Kambója, hératee hína Tavetã Kambója, ha'e peteĩ tetã hekosãsóva ojejuhúva Indochína yvyapy ipehẽngue ñembyguiguápe, Ñemby Kuarahyresẽ Ásiape.
political-geographic-object;['autarália', 'autaralia', 'australia', 'auteralia'];Tetã Autarália, hérava avei avañe'ẽme Autarália térã Auterália, ha'e peteĩ tetã hekosãsóva opytáva yvyrusu Oseania-pe, tetãkua oñesãmbyhýva tavetãporokuái tekorãháme ñembyatypyre.
political-geographic-object;['connecticut'];Connecticut ha'e niko peteĩ Tetãvore Joapykuéra apytépe.
political-geographic-object;['konakri', 'conakry'];Konakri ha'e hína Gynéa retã itavusu, ha itáva orekovéva tapichakuéra ipype.
political-geographic-object;['antofagasta'];Antofagasta táva Chilepe.
political-geographic-object;['mombása'];Mombasa ha'e hína Kéña retã itáva orekovéva tapichakuéra ipype mokõiha, itavusu Nairóvi rire.
political-geographic-object;['vutã', 'bután'];Vutã ha'e peteĩ tetã michĩ hekosãsóva Ñemby Asia pegua, Yvytyrusu Himalaia-pe.
political-geographic-object;['kolumbia vyretañagua'];Kolumbia Vyretañagua, ha'e tetãvore opytáva kuarahyreike gotyo Kanatã retãme, paraguasu Py'aguapy yhembe'ýpe.
political-geographic-object;['katalúña', 'cataluña'];Katalúña ha'e peteĩ tetãvore hekosãsóva España retã pegua, ojekuaáva katuetehápe tetã hembiasa guasu, oĩva yvate kuarahyresẽ España retãme.
political-geographic-object;['tuykomenitã'];Tuykomenitã ha'e peteĩ tetã hekosãsóva ojejuhúva Mbyte Ásiape ha omohembe'y Kasahitã rehe yvate kuarahyreikévo, Uvekitã retãre yvate ha yvate kuarahyresẽ ngotyo, ñemby kuarahyreikévo omohembe'y Irãre, ñemby kuarahyresẽ ngotyi Ahyganitã rehe ha kuarahyreikévo para Káspio rehe, ojehechakuaa ramo jepe ko tetã yguasu rembe'y'ỹvaha.
political-geographic-object;['georgia'];Geórgia ha'e peteĩ tetã hekosãsóva oĩva para Hũ rembe'ýre,upe tenda Európa ha Ásia ojojuhuhápe, upévare ko tetã oĩ Kuarahyresẽ Európape.
political-geographic-object;['sámbia'];Sámbia, héra tee Tavakuairetã Sámbia ha'e peteĩ tetã hekosãsóva yguasu rembe'y'ỹva ojejuhúva Áfrika ipehẽngue ñemby mbytépe.
political-geographic-object;['tetã jekopytyjoja kongo', 'kóngo jekopytyjoja retã'];Kóngo Jekopytyjoja Retã
political-geographic-object;['honduras', 'ondúra', 'hondura'];Tetã Honduras ha'e peteĩ tetã Ñembyamérikapegua.
political-geographic-object;['guatemala', 'guatemála'];Tetã Guatemala ha'e peteĩ tetã Ñembyamérikapegua.
political-geographic-object;['kosta rrika', 'crc', 'costa rica'];Kosta Rrika ha'e peteĩ tetã oĩ Mbyteamérika, ijerére ojejuhu yvate gotyo Nikaragua. ha ñemby gotyo Panama.
political-geographic-object;['hungyria'];Oĩ ko Hungyria Europape tetã.
political-geographic-object;['polóña', 'poloña', 'polonia', 'tavakuairetã polóña'];Polóña —ha'etehápe, Tavakuairetã Polóña — ha'e peteĩ tetã hekosãsóva oĩ kuarahyresẽ gotyo Mbyte Európa-pe, oikóva Európa Joaju.
political-geographic-object;['vurundi', 'burundí'];Vurundi, héra tee ha'éva Tetã Vurundi ha'e peteĩ tetã hekosãsóva michĩ opytáva umi ypa guasu Áfrika pegua kuarahyresẽ Afrikape ha ndorekói yguasu rembe'y.
political-geographic-object;['tãsaña', 'tãsáña'];Tãsaña, héra tee Tavakuairetã Tãsaña Joaju, ha'e tetã oĩva kuarahyresẽ mbyte Afrikape.
political-geographic-object;['somália'];Somália térã Somalía, héra tee niko Tavakuairetã Ñembyatypyre Somália, ha'e peteĩ tetã hekosãsóva ojejuhúva Áfrika Ratĩme, Áfrika ijyvy pehẽngue kuarahyresẽyguáme.
political-geographic-object;['vietnam', 'vienã', 'vietynã'];Vietnam ha'e peteĩ tetã hekosãsóva Ñemby Asia pegua.
political-geographic-object;['livia', 'lívia'];Tetã Livia ha'e peteĩ tetã oĩ Yvate Afrikape.
political-geographic-object;['alemaña', 'alemania'];Tetã Joaty Alemaña ha'e peteĩ tetã joaty oĩ Európape.
political-geographic-object;['sudano', 'sundã', 'sudan'];Tetã Sundã, ha'e peteĩ joaty hekosãsóva oĩ Áfrika pehẽngue yvate kuarahysẽygua.
political-geographic-object;['ehipto', 'ehíto', "e'ypto", 'egipto'];Ehíto, héra tee hína Ehíto Tavakuairetã Árave, ha'e hína peteĩ tetã hekosãsóva ojejuhu Áfrika ipehẽngue yvate kuarahyresẽme.
political-geographic-object;['gujána', 'guyana'];Gujána tetã oĩ yvate gotyo Yvyamérikape.
political-geographic-object;['surinam', 'surinẽ', 'suriname'];Surinam tetã oĩ yvate gotyo Yvyamérikape.
political-geographic-object;['venesuéla', 'venesuela', 'venezuela'];Venesuéla ha'e peteĩ Tetã Ñembyatypyre oĩ Yvyamérikape.
political-geographic-object;['ayhelia', 'arhélia', 'ahélia', 'arhelia'];Tetã Ahélia héra teéva ha'ehína Tavakuairetã Ahélia Tekoha ha Jekopytyjojáva ha'e peteĩ tetã oĩ Yvate Afrikape.
political-geographic-object;['india', 'índia'];Índia ―héra tee hína Tavakuairetã Índia ― ha'e peteĩ tetã hekosãsóva ojejuhúva Ásia ipehẽngue ñembyguápe.
political-geographic-object;['itália', 'italia'];Itália, héra tee hína Tavakuairetã Itália, ha'e peteĩ tetã hekosãsóva oĩva hína Európa Joajúpe.
political-geographic-object;['chile', 'chíle'];Chile tetã oĩ Yvyamérika ñembykuarahyreikete gotyo.
political-geographic-object;['paraguái', 'tetã paraguái', 'paraguay retã', 'paraguai', 'paraguaigua', 'paraguaya', 'paraguayo', 'paraguáipe', 'paraguáy'];Paraguái, herateéva Tetã Paraguái, niko peteĩ tetã opytáva Ñembyamérikape oguereko’ỹva parápe osẽ hag̃ua, oñemongoráva Arhentínare, ñemby rupi, Pindorámare, kuarahyresẽ rupi ha Voríviare, yvate rupi.
political-geographic-object;['votusuana', 'botsuana', 'botswana'];Votusuana, héra tee ha'éva Tetã Votusuana, ha'e peteĩ tetã hekosãsóva ndorekói yguasu rembe'y ñemby Afrika pegua, itekuái reko hína tavakuairetã amandajerapépe.
political-geographic-object;['mosambike', 'mosambíke'];Tetã Mosambike tetã hekosãsova oĩva ñembykuarahysẽ gotyo Afrikape, Paraguasu Índiko yrembe'ype.
political-geographic-object;['indonésia', 'indonesia'];Tavakuairetã Indonésia ha'e peteĩ tetã hekosãsóva ijyvy apekue ojejuhúva hetaite ypa'ũre Ásia ipehẽngue ñemby kuarahyresẽme ha Oseanía ipehẽngue yvatépe.
political-geographic-object;['gyresia', 'gyrésia', 'grecia', 'gresia'];Gyrésia ha'e niko peteĩ umi 27 tetã hekosãsóvagui upe Európa Joatýpe oĩva.
political-geographic-object;['ukyaña', 'ukyáña', 'ucrania'];Oĩ ko Ukyaña Europape tetã.
political-geographic-object;['méhiko', 'méjiko', 'méxico'];Méhiko, hérava avei Tetã peteĩ reko Méhikogua ha'e peteĩ tetã ñemby Yvateamérika pegua.
political-geographic-object;['ayméña', 'armenia', 'aymeña'];Tetã Armenia, ha'e peteĩ tetã oĩ Europa ha Asia, itavusu ha'e Erevã ha oguereko 3.215.800 tavayguakuéra.
political-geographic-object;['irake', 'irak'];Irake, hérava ymaguare Mesopotamia, héra ete Tetã Irake, ha'e peteĩ tetã ñemby kuarahyreike Asia pegua oĩva yvytyrysýi Zagros-pe, kuarahyresẽ yvyku'iparusu Siria-pegua ha yvate yvyku'irusu Aravia-pegua.
political-geographic-object;['ñemby koréa', 'yvykorea', 'corea del sur', 'koréa retã', 'tavakuairetã korea', 'ñembykorea'];Tetã Yvykorea ha'e peteĩ tetã kuarahysẽ Asia pegua, oĩ ñemby gotyo Korea yvyapýpe.
political-geographic-object;['tavakuairetã ndominikagua', 'dominicana', 'república dominicana', 'tetã ndominikagua'];Tavakuairetã Ndominikagua térã Tetã Ndominikagua ha'e peteĩ tetã hekosãsóva oĩva Karíve-pe, ypa'ũnguéra Karíve pegua atýpe, ha peteĩ umi 35 tetã hekosãsóvagui Amérika pegua, ijyvy apekue niko upe ypa'ũ La Española ipehẽngue kuarahyresẽ.
political-geographic-object;['gána'];Gána, héra tee hína Tavakuairetã Gána, ha'e peteĩ tetã hekosãsóva oĩva Áfrika kuarahyreiképe, itekuái oikóva tavakuairetã ramo mburuvichavy rapépe.
political-geographic-object;['niheria', 'nihéria', 'nigeria'];Nihéria, héra tee hína Tavakuairetã Joaty Nihéria ha'e niko peteĩ tetã hekosãsóva ojejuhúva Áfrika ipehẽngue kuarahyreikeguápe, upe parapyte Gynéa rembe'ýpe, ko tetã oñesãmbyhy tavakuairetã ñembyaty rekóre ha mburuvicharapére.
political-geographic-object;["marfil rembe'y", 'côte d’ivoire'];Marfil Rembe'y, héra tee hína Tavakuairetã Marfil Rembe'y, ojeikuaavéva ko tetã héra Hyãsiañe'ẽme, ha'éva Côte d’Ivoire, ha'e peteĩ tetã hekosãsóva ojejuhúva Áfrika ipehẽngue kuarahyreiképe.
political-geographic-object;['níher', 'níger'];Níher, héra tee hína Tavakuairetã Níger, ha'e hína peteĩ tetã hekosãsóva ha yguasu rembe'y'ỹva Áfrika ipehẽngue kuarahyreikeguápe.
political-geographic-object;['gavõ', 'gabón'];Gavõ, héra tee hína Tavakuairetã Gavõ, ha'e peteĩ tetã hekosãsóva oĩva Áfrika rembe'y kuarahyreiképe, upe paraguasu Atlántiko rembe'ýre.
political-geographic-object;['tavakuairetã kóngo', 'tetã kóngo'];Tavakuairetã Kóngo térã Tetã Kóngo, ojeikuaa avei Congo-Brazzaville ha Kóngo réraicha, ha'e peteĩ tetã hekosãsóva Mbyte Áfrika-pe.
political-geographic-object;['kamerũ', 'camerún'];Kamerũ, héra tee ha'éva Tetã Kamerũ, ha'e peteĩ tavakuairetã Mbyte Afrika-pe.
political-geographic-object;['gynéa mbisáu', 'guinea-bisáu'];Gynéa Mbisáu ha'e peteĩ tetã hekosãsóva kurahyreike Áfrika pegua.
political-geographic-object;['hyãsia', 'francia', 'fránsia'];Hyrãsia terã Hyãsia, héra tee Tavakuairetã Hyrãsia, ha'e niko peteĩ tetã hekosãsóva, oĩva Európa Joatýpe, oporombojára itapichakuéra upe tavakuairetã mburuvichavy rapépe.
political-geographic-object;['ekuator', 'ec', 'ecu', 'república del ecuador', 'ecuador', 'ekuador'];Ekuator tetã opyta yvatekuarahyreike gotyo Yvyamérikape.
political-geographic-object;['irilánda', 'ilandia', 'ilánda'];Irilánda héra tee niko Tavakuairetã Irilánda oñembojuavy hag̃ua Yvate Irilánda retãgui, ha'e peteĩ tetã hekosãsóva, oĩva Európa Joajúpe ha ojejuhúva upe ypa'ũ héra jojáva ipehẽngue tuichavépe.
political-geographic-object;['mandagaka', 'madagaka'];Mandagaka hérava avei Madagakar ha'e peteĩ tetã Afrikape.
political-geographic-object;['mayndíva', 'maldivas'];Mayndíva —héra tee hína Tavakuairetã Mayndíva — ha'e peteĩ ypa'ũ aty ha tetã hekosãsóva ojejuhúva paraguasu Índiko-pe, itekuái reko ha'éva tavakuairetã mburuvicharapépe.
political-geographic-object;['salvador', 'el salvador'];Tetã Guatemala térã El Salvador ha'e peteĩ tetã Ñembyamérikapegua.
political-geographic-object;['filipina', 'filipína', 'hilipina'];Tetã Filipina térã Hilipina ha'e peteĩ ypa'ũ tetã oĩ Yvykuarahysẽ Asia, Paraguasu Py'aguapy.
political-geographic-object;['viña del mar'];Viña del Mar táva Chilepe oimeha Paraguasu Py'aguapyrembe´ýpe.
political-geographic-object;['suésia', 'suesia'];Suésia, héra tee niko Mburuvi Suésia, ha'e peteĩ tetã hekosãsóva Ekandinávia pegua ojejuhúva Yvate Európape ha oĩva Európa Joajúpe.
political-geographic-object;['táva kuáite'];Táva Kuáite ha'e hína tetã Kuáite itavusu ha itáva orekovéva tapichakuéra ipype.
political-geographic-object;['puerto rico', 'puerto rríko'];Puerto Rríko, héra tee niko Estado Libre Asociado de Puerto Rico karaiñe'ẽme, ha'e hína peteĩ yvy pehẽngue noĩri Tetãvore Joapykuéra ipype, hákatu oĩ ipoguýpe, hekosãsóva iñesãmbyhýme.
political-geographic-object;['andorra'];thumb|Tuja Andorra ha'e tavaguasu Andorragua.
political-geographic-object;['tenesi', 'tennessee'];Tenesi ha'e niko peteĩva Tetãvore Joapykuéra apytépe.
political-geographic-object;['kentucky'];Kentucky ha'e niko peteĩva Tetãvore Joapykuéra apytépe.
political-geographic-object;['kansas'];Kansas ha'e niko peteĩva Tetãvore Joapykuéra apytépe.
political-geographic-object;['vermont'];Vermont ha'e niko peteĩva Tetãvore Joapykuéra apytépe.
political-geographic-object;['massachusetts'];Massachusetts ha'e niko peteĩva Tetãvore Joapykuéra apytépe.
political-geographic-object;['rhode island'];Rhode Island ha'e niko peteĩva Tetãvore Joapykuéra apytépe.
political-geographic-object;['ñemby dakota', 'dakota del sur'];Dakota del Sur ha'e niko peteĩva Tetãvore Joapykuéra apytépe.
political-geographic-object;['guy sahoña', 'niedersachsen'];Guy Sahoña ha'e peteĩ tetãvore Alemañagua, yvate gotyo.
political-geographic-object;['alaska', 'aláska'];Aláska niko peteĩva Tetãvore Joapykuéra apytépe.
political-geographic-object;['montana', 'montána'];Montána ha'e niko peteĩva Tetãvore Joapykuéra apytépe.
political-geographic-object;['oregon', 'oregón'];Oregon ha'e niko peteĩva Tetãvore Joapykuéra apytépe.
political-geographic-object;['luisiana', 'louisiana'];Luisiana ha'e niko peteĩva Tetãvore Joapykuéra apytépe.
political-geographic-object;['oklahoma'];Oklahoma ha'e niko peteĩva Tetãvore Joapykuéra apytépe.
political-geographic-object;['arkansas'];Arkansas ha'e niko peteĩ Tetãvore Joapykuéra apytépe.
political-geographic-object;['florida'];Florida ha'e niko peteĩva Tetãvore Joapykuéra apytépe.
political-geographic-object;['georgia'];Georgia ha'e niko peteĩva Tetãvore Joapykuéra apytépe.
political-geographic-object;['yvate karolina'];Yvate Karolina ha'e niko peteĩva Tetãvore Joapykuéra apytépe.
political-geographic-object;['pyahu méjiko', 'méhiko pyahu', 'nuevo méxico'];Méhiko Pyahu ha'e niko peteĩva Tetãvore Joapykuéra apytépe.
political-geographic-object;['arizona', 'arisóna'];Arisóna niko peteĩva Tetãvore Joapykuéra apytépe.
political-geographic-object;['misisipi', 'misisípi', 'mississíppi'];Misisípi ha'e niko peteĩva Tetãvore Joapykuéra apytépe.
political-geographic-object;['yvy karolina'];Yvy Karolina ha'e niko peteĩva Tetãvore Joapykuéra apytépe.
political-geographic-object;['virginia'];Virginia ha'e niko peteĩva Tetãvore Joapykuéra apytépe.
political-geographic-object;['idaho'];Idaho ha'e niko peteĩva Tetãvore Joapykuéra apytépe.
political-geographic-object;['alavama', 'alaváma', 'alabama'];Alaváma niko peteĩva Tetãvore Joapykuéra apytépe.
political-geographic-object;['havái', "havái'i", 'hawaii', 'hawái'];Hawaii ha'e niko peteĩva Tetãvore Joapykuéra apytépe.
political-geographic-object;['nevada', 'neváda'];Neváda ha'e niko peteĩva Tetãvore Joapykuéra apytépe.
political-geographic-object;['california'];California ha'e niko peteĩ Tetãvore Joapykuéra apytépe.
political-geographic-object;['wyoming'];Wyoming ha'e niko peteĩva Tetãvore Joapykuéra apytépe.
political-geographic-object;['utah'];Utah ha'e niko peteĩva Tetãvore Joapykuéra apytépe.
political-geographic-object;['colorado', 'kolorádo'];Kolorádo ha'e niko peteĩ Tetãvore Joapykuéra apytépe.
political-geographic-object;['yvate dakota', 'dakota del norte'];Dakota del Norte ha'e niko peteĩva Tetãvore Joapykuéra apytépe.
political-geographic-object;['omã'];Suytãretã Omã ha'e peteĩ tetã oĩ Asiape, ijykére oĩ yvatekuarahyresẽ gotyo Aravia Emiryvy Joaju, kuarahyreike gotyo Aravia Saudíta ha ñembykuarahyreike gotyo Jemẽ.
political-geographic-object;['ndamáko', 'damasco'];Táva Ndamáko, herava sapy'apy'a Siria-pe ash-Sham, ha'e tetã Siria itavusu ha itáva tenondegua mokõiha, táva guasu Aleppo rire.
