political-geographic-object;['kuáite'];Kuáite, ha'e peteĩ tetã hekosãsóva árave ojejuhúva Kuarahyreike Ásia-pe, Arávia Yvyapy ijapy yvate kuarahyresẽme ha parapyte Péysia pegua ijapy yvatépe, ijerére ojejuhu yvate gotyo tetã Iráke ha ñemby gotyo ojejuhu tetã Arávia Saudíta.
political-geographic-object;['horytáña', 'horytaña'];Horytáña, héra ete Tavetã Hachemita Horytáña, omboherava akue Horytãmboypýri ary 1950 peve, ha'e peteĩ tetã Asia-pe oĩva Mbyte Kuarahyresẽ.
political-geographic-object;['lívano'];Lívano ha'ehina tetã Asiaygua.
political-geographic-object;['táva vatikáno', 'táva vatikano', 'ciudad del vaticano', 'táva vaticano'];Oĩ ko Táva Vatikano Europape tetã.
political-geographic-object;['fíji'];Fíji, héra tee hína Tavakuairetã Fíji, ha'e peteĩ tetã hekosãsóva oiko ypa'ũnguéra Oseaníape upe paraguasu Py'aguapýpe ha oporokuái tavakuairetãicha amandajerapépe.
political-geographic-object;['amterdam', 'amsterdam'];Amterdam táva ha'e Holanda tava guasú.
political-geographic-object;['kávo véyde'];Kávo Véyde, héra tee hína Tavakuairetã Kávo Véyde, ha'e peteĩ tetã hekosãsóva ypa'ũ atýpe oĩva Áfrika yvyrusúpe, upe paraguasu Atlántiko-pe, upe tetã Senegal yrembe'y renondépe.
political-geographic-object;['san vicente ha granadinas'];San Vicente ha Granadinas ha'e peteĩ tetã hekosãsóva ijyvy apekue oĩ heta ypa'ũme Karívepe ojejuhúva, Amérikape, tetã Venesuéla yvate gotyo ha tetã ypa'ũ ambuéva Gyranáta yvtae gotyo avei, upe ypa'ũnguéra Karíve pegua atýpe.
political-geographic-object;['varéĩ'];Tetã Varéĩ térã Tetã Varáĩ ha'e tetã michĩve ha peteĩ ypa'ũ oĩ Arávia, Asia.
political-geographic-object;['kiriváti', 'kiribati'];Kiriváti, héra tee hína Tavakuairetã Kiribati, ha'e peteĩ ypa'ũ aty ha tetã hekosãsóva ojejuhúva paraguasu Py'aguapy ipehẽngue mbyte kuarahyreiképe, y rupive ko ypa'ũ aty oĩ yvate kuarahyresẽ Autarália pegua.
political-geographic-object;['trinidad ha továgo', 'trinidad ha tobago', 'trinidad y tobago'];Trinidad ha Továgo, héra avei Trinidad ha Tavágo, héra tee niko Tavakuairetã Trinidad ha Továgo, ha'e tetã hekosãsóva ypa'ũme ojejuhúva, upe Antillas ypa'ũ atýpe para Karívepe, peteĩ umi 13 tetã hekosãsóvagui para Karíve ypa'ũnguérape oĩva ha peteĩ umi 35 tetã hekosãsóvagui Amérikape oĩva.
political-geographic-object;['iylanda', 'ilándia'];Oĩ ko Ilándia Europape tetã.
political-geographic-object;['gyranáta', 'grenada'];Gyranáta ha'e peteĩ tetã hekosãsóva oĩva ypa'ũme ha opyta Amérika-pe, upe para Karíve-pe.
political-geographic-object;['são paulo', 'sao paulo'];São Paulo ha'ehína peteĩ táva Pindorama pegua, tetãvore São Paulo itávarusu, oĩ kurahyresẽ tetã retãme.
political-geographic-object;['port louis'];Port Louis ha'e voi Maurísio retã itavusu ha itáva orekovéva tavayguakuéra ipype.
political-geographic-object;['lisimbã', 'lisboa'];Lisimbã ha`ehína táva guasu Poytuga gui.
political-geographic-object;['lima'];Lima ha'ehína táva guasu Perũngua, oĩ kuarahy resẽ ko tetame.
political-geographic-object;['bogotá'];Bogotá ha'ehína táva guasu Kolómbia, oĩ kuarahy resẽ tetã retãme.
political-geographic-object;['la habana'];La Habana ha'e voi Kúva retã itavusu ha upe tetã táva hetave tapichakuéra ipype orekóva, yga rupa tuichavéva ha oñeñemuvehápe.
political-geographic-object;['praga'];Praga ha'e Chekia retã tavusu, ku tetã léiguasu rupive.
political-geographic-object;['budapest'];Budapest téra Vudapé ha´eva hína távaguasu tetã Europapegua Hungyria.
political-geographic-object;['rróma', 'róma', 'roma'];Róma ha'ehína táva guasu Itália, oĩ kuarahy resẽ tetã retãme.
political-geographic-object;['beirut'];Beirut térã Veiru ha´eva hína tavusu tetã Lívano.
political-geographic-object;['herusalẽ', 'jerusalén'];Herusalẽ hína tavusu tetã Israelpegua.
political-geographic-object;['belyrat'];Belyrat ha'ehína táva guasu Sevia, oĩ kuarahy resẽ tetã retãme.
political-geographic-object;['berlin', 'berlín'];Berlin ha'ehína táva guasu Alemaña.
political-geographic-object;['pekĩ', 'mbejingo', 'pekín'];Pekĩ hérava avei Mbejingo ha'e China Tekoha Tetã tavusu ha oguereko amove 17.000.000 tavayguakuéra.
political-geographic-object;['tailandia', 'tailándia'];Tetã Tailandia ha'e peteĩ tetã oĩ Yvy Asia, Indochinape.
political-geographic-object;['etiopia', 'etiopía'];Tetã Etiopia ha'e niko peteĩ tetã oĩ Afrika Hatĩme, ha'e hína tetã orekovéva tetãyguakuéra mbohapyha opa umi tetã Áfrikape apytépe, ha tetã orekovéva tetãyguakuéra 13ha.
political-geographic-object;['mosku', 'moscú'];Mosku ha´eva tavusu teta Rrúsia retã pegua.
political-geographic-object;['mbenĩ'];Mbenĩ, héra tee Tavakuairetã Mbenĩ, ha'e niko peteĩ tetã opytáva Áfrika kuarahyreike gotyo.
political-geographic-object;['vukína fáso', 'burkina faso', 'vurukina faso'];Vukína Fáso ha'e peteĩ tetã hekosãsóva ha yguasu rembe'y'ỹva Áfrika ipehẽngue kuarahyreiképe.
political-geographic-object;["va'ama", 'vaamakuéra'];Tetã Va'ama ha'e peteĩ tetã ypa'ũ aty oĩ Paraguasu Atlántiko, ñemby gotyo Tetã peteĩ reko Amérikaguape.
political-geographic-object;['santo tome ha príncipe'];Tavakuairetã Jekopytyjojáva Santo Tome ha Príncipe, ha'e peteĩ tetã hekosãsóva Áfrika pegua ijyvy apekue hína heta ypa'ũ ojejuhúva parapyte Gynéape, tetã Gavõ y rembe'y yvate kuarahyreike gotyo, Ekuato ohasahápe hi'aguĩ.
political-geographic-object;['chikago', 'chicago'];Chikago ha'e peteĩ táva oĩ Tetã peteĩ reko Amérikagua.
political-geographic-object;['memphis'];Memphis ha'e peteĩ táva tetãvore Tenesi-pe, Tetãvore Joapykuéra.
political-geographic-object;['ekosia', 'ekósia', 'escocia'];Ekósia ha'e peteĩ tetã oĩva Tavetã Joajúpe, upe ojejuhúva yvatevépe.
political-geographic-object;['hĩlandia', 'hĩlándia', 'finlandia'];Oĩ ko Hĩlandia Europape tetã.
political-geographic-object;['monrovia'];Monrovia ha'e hína peteĩ táva paraguasu Atlántiko rembe'ýpe, Áfrika ipehẽngue kuarahyreiképe, Livéria retã itavusu, ha itáva orekovéva tapichakuéra ipype.
political-geographic-object;['paraguay', 'asunción', 'paraguaype', 'paraguaý', 'paraguaýgui', 'paraguaýpe', 'táva paraguay', 'táva paraguaýpe'];Paraguay térã Asunción ha'ehína peteĩ táva oĩva Paraguái retãme, ysyry Paraguái ha Araguay oñug̃uaitĩhápete.
political-geographic-object;['viéna'];Viéna ha'e hína peteĩ táva guasu Áuteria itavusu oĩva Mbyte Európa-pe ha ysyry Danúvio rembe'ýre, upe yvyty pa'ũ Viéna Ka'aguasúpe, upe yvytyrysýi Áype iñepyrũme.
political-geographic-object;['múnich'];Múnich ha'e peteĩ táva oĩ Alemañape.
political-geographic-object;['jaména', 'yamena'];Jaména ha'e hína Cháde retã itavusu, ha itáva orekovéva tapichakuéra ipype.
political-geographic-object;['santiago de chile'];Santiago de Chile ha'ehína peteĩ táva Chile, oĩ mbytépe tetã retãme.
political-geographic-object;['kopenihage', 'copenhague'];Kopenihage ha'e Ndinamayka itavusu, oguereko 1.167.569 tavayguakuéra, ha ha'e avei Ndinamayka retã itáva tuichaveva.
political-geographic-object;['jimbúti'];Jimbúti ha'e hína Jimbúti retã itavusu, ha itáva orekovéva tapichakuéra ipype.
political-geographic-object;['londye', 'lóndyre', 'londres'];Londyre ha'e tavaguasu ha tuichave táva Ingyaterra ha Tavetã Joajugua.
political-geographic-object;['talin'];Talin táva ha'e Etoña tava guasú.
political-geographic-object;['suva'];Suva ha'e Fíji retã itavusu.
political-geographic-object;['parĩ', 'paris', 'parís'];Parĩ ha'ehína táva guasu Hyãsia, oĩ kuarahy resẽ tetã retãme.
political-geographic-object;['tivilísi'];Tivilísi térã Tblisi ha'e hína Georgia retã itavusu ha itáva tuichavéva.
political-geographic-object;['akra', 'accra'];Akra ha'e hína Gána retã itavusu ary 1877 guive ha itáva tuichavéva.
political-geographic-object;['atena', 'atenas'];Atena ha'ehína táva guasu Gyresia, oĩ kuarahy resẽ tetã retãme.
political-geographic-object;['tegucigalpa'];Tegucigalpa ha'ehína táva guasu Ondúra, oĩ kuarahy resẽ tetã retãme.
political-geographic-object;['indianápolis'];Indianápolis ha'e peteĩ táva tetãvore Indiána-pe, Tetãvore Joapykuéra.
political-geographic-object;['tokio', 'tókio'];Tókio ha'e hína Hapõ retã itavusu, ojejuhu upe tetã pehẽngue kuarahyresẽ mbyteguápe.
political-geographic-object;['amã', 'amman'];Amã ha'e tavusu Tavetã Hachemita Horytaña rehegua, ha táva orekovéva viru remono'õ, ogavoña ha táva oisãmbyhýva Horytaña retãme.
political-geographic-object;['nairóvi', 'nairobi'];Nairóvi ha'e hína Kéña retã itavusu, ha itáva orekovéva tapichakuéra ipype.
political-geographic-object;['vientiã', 'vientiane'];Vientiã ha'e hína Láo retã itavusu, ha itáva orekovéva tapichakuéra ipype.
political-geographic-object;['vilnius', 'vilñus'];Vilnius ha'ehína táva guasu Lituaña, oĩ arasẽ tetã retãme, Neris rembe'ýpe.
political-geographic-object;['kuala lumpur'];Kuala Lumpur ha'e hína Malásia Joaty itavusu, ha itáva orekovéva tapichakuéra ipype, ha'e avei Tetã Amandaje Guasu renda tee.
political-geographic-object;['méjiko táva', 'táva méhiko', 'méjikope tava', 'méxico, d. f.'];Táva Méhiko ha'e hína Méhiko retã itavusu ha itáva tuichavéva.
political-geographic-object;['katemandu', 'kātmāndū'];Katemandu ha'e tavusu ha táva tenondeguaveva Nepal retãme.
political-geographic-object;['niaméi', 'niamey'];Niaméi ha'e hína Níher retã itavusu, ha itáva orekovéva tapichakuéra ipype.
political-geographic-object;['varsóvia', 'varsovia', 'warszawa'];Varsóvia ha'e táva orekovéva tapichakuéra ipype Polóña retãme, itavusu tee ary 1596 guive, mburuvicha guasu Segismundo III Vasa oguerehávo Krakóvia guive.
political-geographic-object;['kigali'];Kigali ha'e hína Rruánda retã itavusu, ha itáva orekovéva tapichakuéra ipype, ojejuhu Rruánda ipehẽngue mbyteguápe.
political-geographic-object;['mogandísio', 'mogadiscio'];Mogandísio ha'e niko peteĩ táva tetã Somália ipehẽngue ñemby kuarahyresẽyguáme, ko tetã itavusu ha itáva orekovéva tapichakuéra, upéicha ko táva hína táva tuichavéva ha tenondeguavéva Somália retãme, ojejuhu paraguasu Índiko rembe'ýpe.
political-geographic-object;['seúl'];Táva Tenondegua Seúl hérava avei Seúl, ha'e Yvykorea itavusu, pe tavakuairetã reñói guive ary 1948-jave, Korea itavusu marandekóva hetave 600 ary guive ha táva oguerekovéva tapicha kuéra ipype Korea yvyapy pegua.
political-geographic-object;['madrid'];Madrid táva ha'e Epáña tava guasú.
political-geographic-object;['kolómbo', 'colombo'];Kolómbo, hérava avei Colombo, ha'e tetã Seilãu itáva tuichavéva ha itavusukue ary 1978 peve.
political-geographic-object;['etohom', 'estocolmo'];Estocolmo ha'ehína Suésia retã itavusu ha itáva orekovéva tavayguakuéra.
political-geographic-object;['vãkoke', 'bangkok'];Vãkoke ha'e táva guasuve ha Tailandia itavaguasu.
political-geographic-object;['ambijã', 'abidjan'];Ambijã ha'e hína Marfil Rembe'y retã itáva tuichavéva, ñemuha guasu oimehápe ha itavusu umi ary 1933 ha 1983 mbytépe.
political-geographic-object;['puerto epáña', 'port of spain'];Puerto Epáña ha'e voi Trinidad ha Továgo retã itavusu, ojejuhu pe ypa'ũ guasu Trinidad hembe'y yvate kuarahyreiképe.
political-geographic-object;['achagaváte', 'ashgabat', 'asjabad'];Achagaváte ha'e Tuykomenitã tavusu ha itáva tuichavéva, ojejuhu tave'ỹ Karakũme, oikohápe y ha yvyramáta yvyku'i tuicha pa'ũme, Tuykomenitã omohembe'yhápe Irã rehe hi'aguĩ.
political-geographic-object;['montevideo'];Montevideo ha'ehína táva guasu Uruguái, oĩ ñembýpe tetã retãme.
political-geographic-object;['salt lake city'];Salt Lake City, sapy'apy'a oñemombyky jepi pe héra Salt Lake térã SLC-pe, ha ha'e pe tavusu ha tavaguasu itavayguakúera hetavéva pe tetãvore Utah-pegúape.
political-geographic-object;['caracas'];Caracas ha'ehína táva guasu Venesuéla, oĩ kuarahy resẽ tetã retãme.
political-geographic-object;['harare'];Harare ha'e hína Simbávue retã itavusu ha itáva orekovéva tapichakuéra.
political-geographic-object;['brasilia', 'vrasília', 'brasília'];Vrasília ha'ehína táva guasu Pindorama, oĩ mbytépe tetã retãme.
political-geographic-object;['ottawa'];Ottawa térã Otáua ha'e tetã Kanatã itavusu ha táva tenondegua ha tuichavéva irundyha opaite tetãgua.
political-geographic-object;['praia'];Praia ha'e hína Kávo Véyde retã itavusu, ha itáva orekovéva tapichakuéra ipype.
political-geographic-object;['quito'];Quito ha'ehína táva guasu Ekuator, oĩ kuarahy resẽ tetã retãme.
political-geographic-object;['libreville'];Libreville ha'e hína Gavõ retã itavusu, ha itáva orekovéva tapichakuéra ipype.
political-geographic-object;['banjul'];Banjul ha'e hína Gámbia retã itavusu.
political-geographic-object;['ndéli pyahu', 'nueva delhi', 'pyahu deli'];Ndéli Pyahu ha'e tavusu upe Tetã India pegua ha pe Tetã Ruvicha, Tetã Amandaje ha Tetã Tekojoja Ruvicha róga renda.
political-geographic-object;['biskek'];Biskek ha'e hína Kirigitã retã itavusu, ha itáva orekovéva tapichakuéra ipype.
political-geographic-object;['maseru'];Maseru ha'e hína Lesóto retã itavusu ha itáva orekovéva tapichakuéra ipype.
political-geographic-object;['lilongue', 'lilongwe'];Lilongue ha'e hína Maláui retã itavusu, ha itáva orekovéva tapichakuéra ipype.
political-geographic-object;['vámako', 'bamako'];Vámako ha'e hína Mali retã itavusu, ha itáva orekovéva tapichakuéra ipype.
political-geographic-object;['dusambe'];Dusambe ha'e Tajikitã retã itavusu ha itáva orekovéva tavayguakuéra.
political-geographic-object;['valparaíso', 'valparaiso'];Valparaíso ha'e peteĩ táva Chilepe, Valparaíso provincia-pe.
political-geographic-object;['rio de janeiro', 'río de janeiro'];Rio de Janeiro ha'e peteĩ táva Vrasilpe.
political-geographic-object;['kévek táva', 'quebec'];Kévek ha'e tetãvore Québec itavusu ha itáva tenondegua ha tuichavéva, opyta kuarahyresẽ Kanatã retãme.
political-geographic-object;['tel aviv'];Tel Aviv-Yafo, herameméva Tel Aviv, ha'e peteĩ táva Israel retãme orekóva ipype amo 411.800 tapichakuéra.
political-geographic-object;['detroit'];Detroit ha'e peteĩ táva tetãvore Michigan-pe, Tetãvore Joapykuéra.
political-geographic-object;['táva nueva york', 'new york city', 'nueva york'];Táva Nueva York táva orekove tavayguakuéra Estado de Nueva York-pe, ha Tetã peteĩ reko Amérikaguape, ha mokõiha tuichave távarusu aty Amérikape.
political-geographic-object;['filadelfia'];Filadelfia ha'e peteĩ táva tetãvore Pensilvania-pe, Tetãvore Joapykuéra.
political-geographic-object;['pindoráma', 'pindorama', 'brasil', 'brazil', 'vrasil'];Pindoráma ha'e hína tetã hekosãsóva tuichavéva Ñembyamérikape ha tetã tuichavéva poha opa Yvýpe ha tetã pokõiha orekovéva tapichakuéra ipype.
political-geographic-object;['québec', 'kévek tetãvore'];Québec herava avei Kévek ha'e tuichave Kanatã tetãvore.
political-geographic-object;['toronto'];Toronto ha'e táva tetãvore Ontario itavusu ha, oguereko hína ipype 2 615 060 tavayguakuéra, ha'e hína táva tuichavéva ha tenondegua Kanatã retãme, además del centro financiero de dicho país.
political-geographic-object;['yvy akua táva', 'cape town', 'ciudad del cabo'];Yvy akua Táva - ha'e táva mokõiha orekoveva yvypóra tetã Yvyafrika, Johannesburgo rire.
political-geographic-object;['texas'];Texas ha'e niko peteĩva Tetãvore Joapykuéra apytépe.
political-geographic-object;['tetãvore'];Tetãvore, oje´e peteĩ yvy pehẽme ha oñondivepa ojapo peteĩ tetã, péicha oñembohéra província, estado federal, distrito térã departamento España ñe´ẽme.
quality;['itaju'];Sa'y itaju herava avei Itajuva ha'e peteĩ sa'y, ha'e peteĩ jehe'a sa'yju ha pytã'yju.
quality;["jejapose'ỹ"];Jejapose'ỹ ha'e peteĩ temiandu oreko mava jejapo'ỹva, mava omboaje ha oporangareko ambue tekove, ombohovái peteĩ mba'e jejeroviarei'ỹ ha jerovu'ỹ, tekove ijejapose'ỹva itĩ'atã'ỹ.
quality;['hũngy'];Hũngy oĩ ko sa'y.
quality;["py'aguasu"];Py'aguasu ha'e peteĩ temiandu mbarete ava ipu'aka orekova, ombohovái peteĩ mba'e omongyhyjeva, ipu'akava.
quality;['jerovia', 'tupãrape', 'jeroviapy', 'ajengatu', 'jeroviakatu'];Jerovia ha'e ta'arõmby orovia peteĩ tekove térã peteĩ mba'e ojehecha'ỹva.
quality;['jerovia', 'tupãrape', 'jeroviapy', 'ajengatu', 'jeroviakatu'];Jeroviapy, térã ajengatu, niko yvypóra jegueroviapy kuéra oporombojepokuaáva oporomboguata hag̃ua imbo'epýre ha upéicha ijapaite avano'õre ha arandupýre.
quality;["sa'y"];Sa'y ha'e peteĩ ñeñandu techa rehegua ojejapómava apytu'ũpe.
quality;['avapaje', 'paje'];Avapaje oĩ peteĩ yvypóra oñemomarandu jarýindive.
quality;['jain dharma', 'jainismo'];Jain Dharma ha'e niko peteĩ jeroviapy ymaguareite oñepyrũ Índia retãme.
quality;['hovy', 'chovy', 'rovy', 'tovy'];Hovy, tovy, rovy oĩ ko sa'y.
quality;["mba'epytu"];Mba'epytu ha'e peteĩ tetakue mba'erekógua taku, takuvy térã to'ysã ñeñandu rehegua, ikatu oha'ã mba'e mba'epytu ra'ãha rupive.
quality;['islã', 'musulman'];Islã hína jerovia he'íva oikónte peteĩ Tupã, heko tee ha ijeroviapy ou ku aranduka marangatu hérava Korã, ipype he'i «Ndaipóra Tupã guasuvéva Alágui ha Muhámad hína imomaranduhára paha».
quality;["mba'era'ã"];Mba'era'ã ha'e peteĩ ta'ã oha'ã pe hetakue mba'e tetepe.
quality;['hovyũ', 'rovyũ', "sa'yky", 'tovyũ'];Hovyũ, tovyũ, rovyũ, sa'yky oĩ ko sa'y.
quality;["py'aporã", 'tekoporã'];Py'aporã térã Tekoporã ha'e temiandu porã ha porohayhúva, oñangareko rei máva.
quality;['morotĩ'];Morotĩ oĩ ko sa'y.
quality;['hũ'];Hũ oĩ ko sa'y.
quality;['pytã'];Pytã oĩ ko sa'y.
quality;["sa'yju", 'sayju'];Sa'yju oĩ ko sa'y.
quality;['hesu rape', 'cristiano'];Hesu rape hérava avei Kirito rape ha'e peteĩ tupãrape ojeroviáva peteĩ Tupãme mante ombohapéva Hesu Nasaregua rekovépe, rekombo'ére ha rembiapóre.
quality;['jererovu'];Jererovu ha'e peteĩ temiandu jejapo ohachauka peteĩ ava ojejapova ha itĩ'atãva, ha'e temiandu ñembotuicha ete ha ñaña ete.
region;["aravo'ive"];Aravo'ive ha'e ára jehasa iguetevo Ta'ãhareko Hetatetãrehegua pegua, ha'e 60 vore jojáva peteĩ aravo pegua.
region;['garámo', 'g'];Garámo ha'e mba'era'ã ra'ãha tenondegua Ta'ãhareko Hetatetãrehegua, imoha'angahára ha'e tai "g".
region;["ára mboja'okáva", 'aravo'];Aravo ha'e ára jehasa iguetevo ombovo ára rembiasa 24 pehẽnguére ijojáva.
region;['unidad astronómica'];Arapy guetevo térã unidad astronómica, oje'eháicha karaiñe'ẽme, ha'e peteĩ ñeha'ã ojojáva 149.597.870.700 m rehe, kóva ha'e Kuarahy ha ñande Yvy mombyrykue.
region;["aravo'i"];Aravo'i ha'e ára jehasa iguetevo, ha'e 60 vore jojáva peteĩ aravo pegua.
region;['toneláda', 'gg', 'kt', 'mg', 't'];Toneláda ha'e peteĩ mba'era'ã ra'ãha guetevo Ta'ãhareko Hetatetãrehegua pegua, ha'e 1000 kilogarámo térã 1 000 000 garámo.
region;['kilogarámo', 'hg', 'kg', 'mg', 'tg'];Kilogarámo ha'e mba'era'ã ra'ãha año Ta'ãhareko Hetatetãrehegua, imoha'angahára ha'e "kg".
region;['sa', '100'];Sa papapy rehegua, pa jey pa.
region;["temira'ãha", 'm', 'metro'];Temira'ãha ha'e pukukue ra'ãha tenondegua Ta'ãhareko Hetatetãrehegua, imoha'angahára ha'e tai "m".
region;['guarani', 'guarani viru'];Guarani viru Paraguái retã pegua, upe ary 1944 guive.
region;['su'];Su ha'e peteĩ papapy ojojáva sa pa jeýre.
region;['irundypa', '40'];Irundypa téra oñemoĩva papapýpe.
region;['mbohapypa', '30'];Papaha 30
region;['porundy', '0', '9'];Porundy
region;['paporundy', '19'];Papaha 19
region;['papoteĩ', '16', 'papoteî'];Papaha 16
region;['poteĩ', '6'];Poteĩ
region;['po', '5'];Po
region;['papo', '15'];Papaha 15
region;['pa', '10'];Pa
region;['mbohapy', '3'];Mbohapy
region;['mokõi', '2'];Mokõi
region;['poapy', '8', 'pohapy'];Pohapy
region;['pokõi', '7'];Pokõi
region;['papokõi', '17', 'papokôi'];Papaha 17
region;['pateĩ', '11', 'pateî'];Papaha 11
region;['parundy', '14'];Papaha 14
region;['irundy', '4'];Irundy
region;['pahapy', '13'];Papaha 13
region;['sua', '1000000'];Sua ha'e peteĩ papapy ojojáva su súre.
region;['peteĩ', '1'];Peteĩ
region;['ára'];Ára ha'e Yvy isapy'a jehasa, Kuarahy oĩva yvága mbyte guive kuarahy oĩva jey peve.
relation;['kuarahyresẽ', 'kuarahy resẽ'];Kuarahyresẽ yke Yvygua.
relevant-part;['pire'];Pire ha'e yvypóra rete ha mymba rete mboapakuahára, ha'e tetepehẽngue pohýive ha oñangareko pe tete.
relevant-part;['vakapi'];Vakapi pire iñanambusúva omo’áva vaka ro’o.
relevant-part;["puru'ã"];Tyeguy ha'e peteĩ tete pere oĩ yvypóra tyeguýpe, puru'ã sã pegua, membyrã rire, pe puru'ã sã ho'a ha omoha'anga pe puru'ã, kunumime.
relevant-part;['eskína'];Eskína ojotopahápe mokõi tape térã óga pa’ũme tapia oñuguãitĩhápe.
relevant-part;["mbyjaveve ku'asã"];Tajave Ku'asã ha'e peteĩ tenda oĩva Kuarahy Ypykatúpe, Jasytata guasu ha Jarýi mbytépe, oguereko heta tajave ojeréva kuarahy ha yvorevakuéra aturi rehe avei.
simple-collection;['mbyjaty'];Mbyjaty hérava avei Mbyja'apesã'aty ha'e peteĩ mbyja aty.
simple-collection;['ñandu pysã'];Ñandu Pysã ha'e peteĩ mbyjaty oĩva yvaga ñembýpe peteĩ Mborevi Rape vorépe.
simple-collection;['arapy'];Arapy ha'e opa mba'e ha ára, ha opa teko teterehegua mba'egui ha ku'erã.
situation;['crup'];Crup ningo peteĩ mba'asy ñanemopytuhẽ asýva, oĩgui virus ombyaíva ñande pytu rape tuichavéva.
situation;['kamby ryru jere'];Kamby ryru jere ha'e mba'asy ojeíramo ojoehegui so'o mitã retere.
situation;['tesãi', 'hesãi'];Tesãi niko yvypóra ha mymba reko ha rete oiko hekópe.
situation;["mbiru'a"];Mbiru'a mba'asy ováva ha isarambíva tekove apytépe, ojehecha pire rupive.
situation;['uhéi'];Uhéi ñeikotevẽ'y je’úre.
situation;['akãguyry'];Akãguyry mba'asy oporomoñeñandu vaíva, ñamo’ávaicha ombojeréva pe máva akã ha ombopy’avaíva avei ichupe.
situation;['ruru'];Ruru ha'e mba'éicha mba'asy ikatu oñembyaíva ñande retére.
situation;['tepyno'];Tepyno hína mba´etĩmbo inéva ñanderete rehegua osẽha tevikuágui.
situation;['atĩa'];Atĩa yvytu osẽmbaretéva ñane tĩ ha ñande juru rupi ñane ã remóigui.
situation;['sarapĩu'];Sarapĩu mitã mba'asy ováva, ome´ẽ akanundu, ahy´o rasy, tesa pytã, pire pytã avevo hakuvopáva reheve.
situation;['tétano'];Tétano mba'asy oikéva máva retepýpe oñekytĩhague rupi.
situation;["mba'asypararã"];Mba'asypararã ha'e pe mba'asy omosarambi yvypóra rete, guyra ha opa mymba okambúva rete, peteĩ víru ojapo ko mba'asy.
situation;["mba'asy"];Mba'asy, ñande rete nahesãirõ.
situation;['kesasy'];Kesasy angekói ojeke jave ome’ẽva mba’asýgui térã jepy’apy raságui.
situation;['faringitis estreptocócica', "ahy'o rasy", 'amigdalitis estreptocócica'];Faringitis estreptocócica, amigdalitis estreptocócica, terã ahy’o rasy ojeheróva ningo mba'asy ojeguereko kuaáva peteĩ bacteria hérava estreptococo del grupo A rupive.
situation;['dengue', 'rompe huesos-pe'];Dengue ha'e peteĩ mba'asy víru ombohasáva ñati'ũ rupive.
situation;["akanundu ro'y"];Akanundu ro'y mba'asy oguerováva ñati'ũ Anhopheles.
situation;['kái'];Kái jehapy tatápe, kuarahype térã ytakúpe, avei oimeraẽva mba’e hakúvape.
situation;['kái'];Kái jehapy tatápe, kuarahype térã ytakúpe, avei oimeraẽva mba’e hakúvape.
situation;['kái'];Kái jehapy tatápe, kuarahype térã ytakúpe, avei oimeraẽva mba’e hakúvape.
situation;["mba'asy po'i"];Mba'asy po'i tesãi’y ñe'ãvevúi obyaíva jeikovai há jekarupora’ỹngue.
situation;["mbita'i", 'mbita´'];Mbita´i síntoma osẽva oñemopa´ãmba haguére glandula ry’airi kuéra jaguereko ñande pire rehe.
situation;["tekakapa'ã"];Tekakapa'ã jaguereko ñanderekakapa´ã jakakarõ hasýpe tepoti ikã ha hatãhaguére.
situation;["jati'i"];Jati'i kuru vai oñembojuru rire opúva okuera hag̃ua.
situation;['hepatitis a'];Hepatitis A ha'e peteĩ mba'asy py'akue oñepámo rehegua, omoñepyrũva mba'asy hepatitis A, ivíru rupive.
situation;['kái'];Kái jehapy tatápe, kuarahype térã ytakúpe, avei oimeraẽva mba’e hakúvape.
situation;['kandu'];Kandu mba’e pekõi opu’ãva yvate gotvo.
situation;['membykua', 'membykua ojejapokáva'];Membykua ningo oiko oñembopahavove tyeguasu ojeipe'ávo térã mbaretépe oñeguenohẽvo membyryrúgui upe mitãrã térã mitãñepyrũ ikatu mboyve oikove ijehegui año.
situation;['pochy'];Pochy ha'e peteĩ temiandu mbarete ñarõ ha ñeko'õi pegua, ombohovái peteĩ mba'e oiko'õ, tekove ipochyva otaky mbarete ha oja'o avei, oporoñembyasyva.
situation;["memby'ỹ", "a'ỹ", "memby'ý"];Memby'ỹ mymba térã kuña ikatu'ỹva oñemoña.
situation;['sogue', 'mboriahu'];Tekotevẽ, mboriahu térã sogue ha'e yvypóra ndaikatúi jave, ndorekóigui imba'erã, ohupyty umi mba'ekuéra oikotevẽva oiko porã hag̃ua, yvypóra mongakuaáre, hete ha iñapytu'ũ, akóinte oguereko hag̃ua hi'upyrã, hekoharã, ohupyty hag̃ua tekombo'e, y ipotĩva, ha mba'erendy hógape.
situation;["py'ajere"];Py'ajere mba'asy pu'ã ome'ẽva tembi'u ja'úva ndoguapýiramo, ojerepáramo ha ñanemogu'ẽséramo.
situation;['ararova'];Ararova ha'e hína ára reko ha jeiko ñehesa'ỹijo ha ñeha'ã peteĩ tendápe, ikatu oha'ã heta guetevo: mba'epytu, te'õ, yvytu ha ama.Mba'e kuéra tekorãndy pegua ikatu oñemoambue ararova ha'e yvy ape, yvytu ituichakue, yguasu imombyrykue ha yguasu yhape.
