activity;['باپتیست'];== سرچشمٱ ==
socially-constructed-person;['خلق قزاق', 'خلک قزاق'];قزاق‌ یا یا کازاخ‌ یا ،یاٛ گاٛل د لۉنیا تورک نجات ٱ کاٛ هان د آسیا مینجایی و د زۊن قزاقی قسٱ میکٱن و دۏ بیشترشۊ هان د کۊمرٱ ۋولات قزاقستان.
socially-constructed-person;['سیرالئون', 'sierra leone'];سیرالئون یئ گئل ڤولاتە کئ ھا د أفتونئشین ھومپئیڤأند آفریقا.
socially-constructed-person;['جید'];جیدی وه کسی موئن که وه جیدیت ائتقات داره.
socially-constructed-person;['ڤٱرگٱگرد', 'ورگه گرد'];ڤٱرگٱگرد یا ڤٱرگٱ تلکیار کسیٱ کاٛ رئته بوئه وه ورگه وه دری د چارقر گرته زمین.
socially-constructed-person;['عیسا', 'عیسی'];عیسا مٱسی یا عیسا ناسری یا عیسا کور مٱریٱم ڤ دی اومایٱ د ۲ تا ۷ سال دما زایشت ۉ د دۏنیا رٱتٱ د ۲۶ تا ۳۶ نوئا زارۊ، پاٛغٱمبٱر دین مٱسییٱت ۉ ٱندوم پاٛغٱمبٱریا خودایی د دین اْسلام ٱ.
socially-constructed-person;['لئو تولستوی'];لئو نیکولایوڤیچ تولستوی ؛، کونشتکار سؽاسی-کومولٱیٱکی ۉ نڤیسؽار رۊسی بی.
socially-constructed-person;['رۊزنومٱ نڤیس', 'روزنامه نیس'];رۊزنومٱ نڤیس هومبراوٱر ڤا Journalist رۊزنومٱ نڤیس کٱسؽٱ کاْ ڤا تکیٱ کرداْ ڤ زۉق ۉ استعداد خوش،ۉ نها د سٱر گواردن گاتؽا آمۊزشی کسمداری ۉ هٱمچنیݩ ڤا ساٛیلٛ ڤ یٱ کاْ مٱسۊلیٱت اْشتمویی کاْ اؽ کسم مؽنؽٱ ڤ گوردٱش، ڤٱزیفاٛ گرتن، آمادٱ کردن، جٱم کردن ۉ سامونکاری ٱخبار ۉ بوردنشو ڤ ڤارٱسگٱریا ڤ ملٛ دارٱ.
socially-constructed-person;['تۊماس اْدیسون', 'توماس ادیسون'];تۊماس آلڤا اْدیسون ڤ اْنڳلٛیسی ːThomas Edison نھاساز اْمریکایی بی.
socially-constructed-person;['اْرنست ھمینگڤاٛی', 'ارنست همینگوی', 'ernest hemingway'];اْرنست میلر ھمینگڤاٛی د نڤیسؽارؽا گٱپ اْمریکا ۉ جاؽزٱ گیر نوبل نیسموݩ ئٱ.
socially-constructed-person;['مائوتساٛ تونگ', 'مائوتسئ تونگ'];مائوتساٛ تونگ ڤیر ۉ باڤٱر دؽارکوݩ مارکسیسم لنینیسم ۉ سؽاسٱتکار ڤٱزآلشتکار کومونیست بی.
socially-constructed-person;['فردیناند ماجلان'];فردیناند ماجلان (وه دی اومائه د ۱۴۸۰ –د دنیا رئته د ۲۷ آوریل ۱۵۲۱ زایشتی پی حور و دریاگرد پرتغالی بی که خذمتکار دولت ئسپانیا بی.
socially-constructed-person;['جوٙلیوٙس سئزار'];گائوس جۊلٛیۊس سزار چوٙأ:ڤ لاتین یا جۊل سزار یا قاٛسٱر «دیکتاتور» ۉ رٱدیارکون سٱردیار کۊمٱرٱ ڤلٛات رۊم بیٱ.
socially-constructed-person;['اْمانوئل کانت', 'امانوئل کانت'];اْمانوئل کانت شؽڤات ٱسلی د کٱلسٱفٱ نۊئٱ.
socially-constructed-person;['تاٛمۊر لٛٱنڳ', 'تئیموٙر لأنگ'];أمیر تئیموٙر گوٙرکان یا تئیموٙر لأنگ (ڤئ دی ئوٙماە د ۸۰۷-۷۷۱ مألکأنوٙن/ ۱۴۰۵-۱۳۳۶ زایئشتی.
socially-constructed-person;['آلورت انیشتین'];آلبرت ٱنشتٱین سرؽشت دونسمٱن نٱزٱری آلمانی بی.
socially-constructed-person;['دیمیتری مندٱلیوف', 'دیمیتری مندلیف'];دمیتری ایڤانویچ مندٱلیوف کیمؽا دونسمٱن نوم دیار رۊسیٱ.
socially-constructed-person;['جوزف اْستالین', 'جوزئف ئستالین'];یوسب بساریۊنیس دزاْ جۊکاشیڤیلی نوم دؽار بیٱ د جوزف اْستالین رٱدؽارکار ۉ سؽاستکار کومونیست کومرٱ ڤلاتؽیا یٱکاگرتٱ شۉرٱڤی بی کاْ د مؽنجا دٱهٱ ۲۰ زارۊیی تا گات د دۏنیا رٱتنش د سال ۱۹۵۳ رٱدؽارکار پارتی کومونیست شۉرٱڤی ۉ رٱدؽارکار دوفاکتو کول اؽ ڤلات بی.
socially-constructed-person;['نابغٱ', 'نابغه'];نابغٱ؛ کٱسونؽ چی ٱنیشتٱین کاْ مؽتونٱن چیا اْستسنایی ناْ د ڤیرکاری ، سازیاری کردنؽا نۊدؽاری کردن رٱڤٱندؽاری بٱکٱ.
subject;['زمین شناسی', 'زئمین شئناسی'];زمین شناسی یاٛ دونسمٱنیا کاْ ڤا شکل ۉ بارت زمین، چیایؽ کاْ دۏرس کردنٱ ۉ ساختموݩ زمیݩ ها د ارتبات.
subject;['هندسٱ اْقلیدسی', 'هندسه اقلیدسی'];== سرچشمٱ ==
subject;['کیمیا دونسمٱنی', 'کیمیا دونسمنی'];کیمیا یٱکؽ د تٱلٛؽا دونسمٱنی غریڤٱ ئا کاْ سی تٱبدیلٛ کانیا ۉ فلزؽا تلاش میٛکٱ.
subject;['سرؽشت دونسمٱنی', 'سریشت دونسمنی'];سرؽشت دونسمٱنی رٱفتار ڤا کارگرایی ری ڤ ری مادٱ ۉ نيرۊ ناْ ڤارٱسی مؽكٱ.
subject;['زیشت', 'زئشت'];زیشت یا زئشت شناسی یٱکؽ د دونسمٱنیا پایٱ ئا کاْ ڤا زیشت آیم ۉ هٱر چؽ کاْ زیشت دارٱ ها د اْرتبات.
temporal-region;['اٛداْ پاک', 'عئید پاک'];اٛد پاک یا اٛد قؽام یٱکؽ د رۊزؽا تٱتیلٛ د سال مٱسیی کاْ ھومبراوؤٱرٱ ڤا یٱکؽ د یاٛشٱمٱیا مونڳ مارس یا آڤریل.
