region;['ганскі сэдзі'];Ганскі сэ́дзі (па-ангельску: Ghanaian cedi, код ISO 4217 — GHS) — афіцыйная валюта Ганы.
region;['фунт стэрлінгаў', 'gbp', 'брытанскі фунт', '₤'];Фунт стэрлінгаў (£. па-ангельску: pound sterling, міжнароднае абазначэньне GBP) — афіцыйная грашовая адзінка Вялікабрытаніі.
region;['ганконскі даляр', 'ганконгскі даляр'];Ганко́нскі даля́р (ISO 4217: HKD) — афіцыйная валюта Спэцыяльнага адміністратыўнага раёну Ганконг Кітайскай Народнай Рэспублікі.
region;['ісьляндзкая крона'];Ісьля́ндзкая кро́на — грашовая адзінка Ісьляндыі.
region;['рупія', 'індыйская рупія'];Інды́йская ру́пія — грашовая адзінка Індыі.
region;['рупія', 'індыйская рупія'];Рупія — назва валюты некалькіх азіяцкіх краін і выспавых краін Індыйскага акіяна.
region;['інданэзійская рупія'];Інданэзі́йская ру́пія (па-інданэзійску rupiah) — афіцыйная грашовая адзінка Інданэзіі.
region;['іранскі рыял'];Іранскі рыял — грашовая адзінка, якая мае абарачэньне ў Іране.
region;['ірацкі дынар'];Іра́цкі дына́р (па-арабску: دينار‎, міжнародны код — IQD) — афіцыйная валюта Іраку.
region;['ена'];Ена — афіцыйная валюта Японіі і адна з сусьветных валют, ISO 4217 код — JPY. Трэція найбольш гандляваная валюта на валютным рынку пасьля даляру ЗША і эўра.
region;['ярданскі дынар'];Ярда́нскі дына́р — валюта Ярданіі.
region;['кенійскі шылінг'];Кенійскі шылінг — нацыянальная валюта Кеніі.
region;['кувэйцкі дынар'];Кувэ́йцкі дына́р (па-арабску: دينار‎, код ISO 4217: KWD) — афіцыйная валюта Кувэйту.
region;['кіп'];Кіп (ISO 4217 — LAK) — афіцыйная валюта ў Лаосе.
region;['лібанскі фунт'];Ліба́нскі фунт (па-арабску: ليرة‎, ISO 4217: LBP) — афіцыйная валюта Лібану.
region;['лібійскі дынар'];Лібі́йскі дына́р (па-арабску: دينار‎, код ISO 4217: LYD) — афіцыйная валюта Лібіі.
region;['квача'];Квача (код ISO 4217: MWK) — афіцыйная валюта Малаві з 1971 году.
region;['рынгіт', 'ringgit'];Рынгі́т (па-малазійску: зазубраны) – афіцыйная валюта Малайзіі.
region;['маўрытанская угія', 'аўгуя'];Угія (па-арабску: أوقية‎, код ISO 4217: MRO) — афіцыйная валюта Маўрытаніі з 1973 году.
region;['маўрыцыйская рупія', 'маўрыкійская рупія'];Маўрыцы́йская рупія — афіцыйная валюта Рэспублікі Маўрыцы.
region;['мараканскі дырхам'];Марака́нскі дырха́м — афіцыйная валюта Марока і Заходняй Сахары з 1960 году, замяніўшы францускі франк, але франк заставаўся ў абарачэньні да 1974 году.
region;['мэтыкал', 'мецікал'];Мэтыка́л — афіцыйная валюта Мазамбіку, уведзеная ў абарачэньне ў 1976 годзе для замены партугальскага эскуда.
region;['новазэляндзкі даляр'];Новазэляндзкі даляр (па-ангельску: New Zealand dollar, код ISO 4217 — NZD) — афіцыйная валюта Новай Зэляндыі, залежных ад яе тэрыторый: Ніуе, Такелаў і выспаў Кука, антарктычнай тэрыторыі Роса, на якую Новая Зэляндыя прэтэндуе, і брытанскай калёніі Піткейрн.
region;['нігерыйская найра'];Найра — грашовая адзінка Нігерыі, роўная 100 Коба.
region;['паўночнакарэйская вона', 'паўночна-карэйскі вон'];Паўночнакарэйская вона — грашовая адзінка Паўночнай Карэі.
region;['кіна', 'kina'];Кіна (код ISO 4217: PGK) — афіцыйная валюта Папуа-Новай Гвінэі.
region;['злоты', 'pln', 'польскі злоты'];Злоты (па-польску: Złoty, скарочана — zł, актуальны код ISO 4217: PLN) — афіцыйная грашовая адзінка Польшчы, складаецца са 100 грошаў.
region;['румынскі лей'];Румынскі лей — афіцыйная валюта Румыніі.
region;['сэйшэльская рупія'];Сэйшэ́льская рупія (код ISO 4217: SCR) — афіцыйная валюта Сэйшэлаў, дзеліцца на 100 цэнтаў.
region;['паўднёваафрыканскі ранд'];Ранд — валюта Паўднёва-Афрыканскай Рэспублікі.
region;['лілангені', 'lilangeni'];Лілангені (па-ангельску: lilangeni, код ISO 4217: SZL) — афіцыйная валюта Сўазілэнду.
region;['швэдзкая крона', 'sek'];Швэ́дзкая кро́на – афіцыйная валюта Швэцыі.
region;['танзанійскі шылінг'];Танзані́йскі шы́лінг (на суахілі: і па-ангельску: shilling код ISO 4217: TZS) — афіцыйная валюта Танзаніі з 1966 года.
region;['тайскі бат'];Бат — афіцыйная валюта Тайлянду.
region;['туніскі дынар'];Туніскі дынар — грашовая адзінка дзяржавы Туніс.
region;['угандыйскі шылінг'];Угандыйскі шылінг — грашовая адзінка дзяржавы Уганда.
region;['зымбабвійскі даляр', 'зімбабвійскі даляр'];Зымбабві́йскі даля́р (па-ангельску: Dоllar of Zimbabwe. код ISO 4217: ZWD) — афіцыйная валюта Зымбабвэ.
region;['эскуда каба-вэрдэ'];Эскуда Каба-Вэрдэ — грашовая адзінка дзяржавы Каба-Вэрдэ.
region;['кельвін', 'градус кэльвіна', 'кэльвін'];Ке́львін (пазначэньне: K) — адзінка вымярэньня тэмпэратуры ў СІ, прапанаваная ў 1848 годзе.
region;['фарад'];Фара́д (пазначэньне: Ф, F) — адзінка вымярэньня электрычнай ёмістасьці ў сыстэме СІ (раней звалася фара́да).
region;['мірыяда', '10000', "мыр'яда"];Мірыя́да, мн.л.
region;['тузін', 'дванаццаць', '12'];Тузін — мера паштучнага ліку аднародных прадметаў, раўняецца 12.
region;['тры', '3'];3 — трэці па парадку натуральны лік.
region;['7', 'сем'];7 (сем) — натуральны лік паміж 6 і 8.
region;['7', 'сем'];Новы год — сьвяткуецца амаль усімі народамі сьвету згодна з прынятымі гадавым каляндаром і сыстэмай зьлічэньня часу, азначаючы сканчэньне аднаго году і пачатак наступнага.
region;['сьветлавы год', 'сьв. г.'];Сьветлавы́ го́д — пазасыстэмная адзінка даўжыні, роўная адлегласьці, якую пераадольвае сьвятло за год.
region;['моль'];Моль — адзінка вымярэньня колькасьці рэчыва, што ўтрымлівае такую ж колькасьць структурных адзінак, што і 0,012 кг вугляроду-12.
region;['дзельнік'];Дзельнік — другі апэранд апэрацыі дзяленьня, лік, на які дзеляць.
region;['мільён', '1000000'];Мільён — лічба вартасьцю: 1 000 000 = 106 (тысяч тысячы), а таксама галоўны лічэбнік.
region;['дробы', 'дроб'];Простыя дробы — гэта рацыянальныя лікі, запісаныя ў выглядзе аднаго цэлага ліку (лічнік), падзеленага на іншы ненулявы цэлы лік (назоўнік).
region;['радыян'];Радыя́н (ад лац.
region;['стэрадыян', 'ср'];Стэрадыя́н (ср, sr) — адзінка вымярэньня цялеснага вугла.
region;['содні', 'суткі'];Со́дні ці су́ткі — адна з адзінак вымярэньня часу.
regulation;['правы чалавека'];Правы чалавека лічацца неад’емнай часткай асноўных правоў і свабодаў якімі валодае кожны чалавек.
regulation;['закон захаваньня энэргіі'];Закон захаваньня энэргіі — асноўны закон прыроды, які крыецца ў тым, што энэргія замкнёнай сыстэмы захоўваецца ў часе.
regulation;['закон захаваньня электрычнага зараду'];Зако́н захава́ньня электры́чнага зара́ду — адзін з фізычных законаў захаваньня, які сьцьвярджае немагчымасьць зьнішчэньня (бясьсьледнага зьнікненьня) або, наадварот, зьяўленьня зьніадкуль электрычнага зараду.
relation;['словазьмена', 'флексія'];Словазьмена — стварэньне словаформаў той жа лексэмы, якія маюць розныя граматычныя значэньні.
relation;['функцыя'];Фу́нкцыя — адзін з асноўных паняткаў матэматыкі.
relation;['прыдатак', 'апазыцыя'];Прыда́так — другарадная часьціна сказу, якая, даючы дадатковую назву характарызаванаму прадмету, падкрэсьлівае ягоныя характэрныя асаблівасьці.
relation;['функцыя'];Фу́нкцыя — адзін з асноўных паняткаў матэматыкі.
relation;['практычная столь'];Практычная столь лятальнага апарата — гэта найбольшая вышыня, на якой пры палёце з сталай гарызантальнай хуткасьцю яшчэ прысутнічае лішак цягі, дастатковы для выкананьня ўздыму з вызначанай вертыкальнай хуткасьцю.
relation;['поўнач'];Поўнач — адзін з чатырох асноўных бакоў сьвету, які заўсёды паказвае ў напрамку паўночнага полюса.
relation;['поўдзень'];Поўдзень — адзін з чатырох асноўных бакоў сьвету, які паказвае ў напрамку паўднёвага полюсу.
relation;['усход'];Усход — адзін з чатырох асноўных бакоў сьвету (там, дзе ўсходзіць Сонца).
relation;['даўжыня хвалі'];Даўжыня́ хва́лі — адлегласьць паміж двума найбліжэйшымі адзін да аднаго пунктамі, якія вагаюцца з аднолькавымі фазамі.
relation;['паразытызм'];Паразіты́зм
relation;['сымбіёз'];Сымбіёз — шчыльнае суіснаваньне біялягічных відаў.
relation;['камэнсалізм'];Камэнсалізм (па-лацінску: con mensa — літаральна «у стала», «за адным сталом») — узаемаадносіны паміж індывідамі ці групамі розных відаў, якія суіснуюць без канфліктаў і без узаемадапамогі (напрыклад, чашуйніца звычайная і чалавек).
relevant-part;['піксэл', 'піксэль'];Пі́ксэл
relevant-part;['скура'];Скура — анатамічны орган, вонкавае покрыва арганізму хрыбетных жывёлаў, абараняе цела ад шырокага спэктру зьнешніх узьдзеяньняў, удзельнічае ў дыханьні, тэрмарэгуляцыі, абменных і многіх іншых працэсах.
relevant-part;['харчовы дадатак', 'харчовая дабаўка', 'харчовыя дабаўкі', 'харчовыя дадаткі'];Харчовы дадатак — уведзенае падчас вытворчасьці і гандлю ў харчовы выраб рэчыва для захаваньня і наданьня водару, смаку і выгляду.
relevant-part;['флігель'];Флігель — дапаможная прыбудова да жылога або нежылога дому, а таксама асобна стаячая другарадная пабудова, якая ўваходзіць у комплекс гарадзкой ці сельскай сядзібы, функцыянальна й кампазыцыйна падпарадкаваная яе галоўнаму збудаваньню.
relevant-part;['вейкі'];Вейкі — валасы, якія аблямоўваюць зьверху і зьнізу разрэз вока ў сысуноў.
relevant-part;['брыво', 'бровы'];Брыво — дугападобнае ўзвышэньне скуры над вачніцамі, пакрытае кароткім валасамі і забясьпечанае асобнай цагліцаю corrugator supercilii, якая абараняе вочы ад моцнага сьвятла, поту і іншых вадкасьцяў.
relevant-part;['барада', 'вусы'];Барада — валасяное покрыва на ніжняй частцы твару.
relevant-part;['пяро'];Пяро́ — наскурнае рагавое ўтварэньне, уласьцівае толькі птушкам.
relevant-part;['пояс астэроідаў'];Пояс астэроідаў — навала астэроідаў, разьмешчаная паміж арбітамі Марса і Юпітэра.
relevant-part;['ракавіна'];Ра́кавіна — вонкавы абарончы шкілетны покрыў цела шматлікіх бесхрыбетных жывёлаў.
set;['адцінак', 'адрэзак'];Адцінак (адрэзак) — тэрмін, які можа ўжывацца для двух блізкіх паняцьцяў у геамэтрыі і матэматычным аналізе.
set;['падмноства'];Для кожных двух неарыентаваных мностваў
simple-collection;['сузор’е', "сузор'е", "сузор'і"];Сузор’і — участкі неба ў сучаснай астраноміі, на якія ўмоўна падзеленая нябесная сфэра для зручнасьці арыентаваньня па зорным небе.
simple-collection;['возьнік'];Возьнік (па-лацінску: Auriga, Aur) — адно з 48 сузор’яў, пералічаных у II стагодзьдзі Пталемэем і адно з 88 сучасных сузор’яў.
simple-collection;['цэнтаўр'];Цэнта́ўр (па-лацінску: Centaurus, Cen) — яскравае і буйнае сузор’е ў паўднёвай частцы зорнага неба.
simple-collection;['малы пёс'];Малы́ Пёс (па-лацінску: Canis Minor, CMi) — невялікае сузор’е ў паўночнай частцы экватарыяльнага пояса зорнага неба.
simple-collection;['лебедзь'];Ле́бедзь (па-лацінску: Cygnus, Cyg) — сузор’е ў паўночнай частцы зорнага неба.
simple-collection;['валасы бэрэнікі', 'валасы веранікі', 'воласы бэрэнікі'];Валасы Бэрэні́кі (або Валасы Верані́кі. па-лацінску: Coma Berenices, Com) — традыцыйны астэрызм, які цяпер зьяўляецца адным з 88 сучасных сузор’яў.
simple-collection;['пэгас', 'pegasus'];Пэга́с (па-лацінску: Pegasus, Peg) — сузор’е ў паўночнай частцы зорнага неба, названае ў гонар Пэгаса з старажытнагрэцкай міталёгіі.
simple-collection;['валапас'];Валапа́ (па-лацінску: Boötes, Boo) — сузор’е з паўночнай частцы зорнага неба, якое разьмясьцілася на плошчы 907 кв.
simple-collection;['воўк'];Воўк (па-лацінску: Lupus, Lup) — сузор’е ў паўднёвай частцы зорнага неба.
simple-collection;['паўднёвая гідра'];Паўднё́вая Гі́дра (па-лацінску: Hydrus, Hyi) — невялікае сузор’е ў паўднёвай частцы зорнага неба.
simple-collection;['малая мядзьведзіха', 'малая мядзьведзіца'];Малая Мядзьведзіха або Малы Воз (па-лацінску: Ursa Minor) — сузор’е ў паўночнай частцы зорнага неба, адно з 88 сузор’яў дзейнай намэнклятуры IAU (1930).
simple-collection;['вялікі пёс'];Вялі́кі Пёс (па-лацінску: Canis Major, CMa) — адно з 88 сучасных сузор’яў, якое паходзіць з Старажытнай Грэцыі і было пералічанае ў «Альмагесьце» Пталемэя, астранома II стагодзьдзя.
simple-collection;['цэфэй'];Цэфэ́й (па-лацінску: Cepheus, Cep) — каляпалярнае сузор’е ў паўночнай частцы зорнага неба, бачнае ў Беларусі ўвесь год.
simple-collection;['келіх', 'чаша'];Ке́ліх або Ча́ша (па-лацінску: Crater, Crt) — сузор’е на поўдзень ад нябеснага экватару.
simple-collection;['тукан'];Тука́н (па-лацінску: Tucana, Tuc) — сузор’е ў паўднёвай частцы зорнага неба, створанае ў канцы XVI стагодзьдзя і названае ў гонар птушкі, знойдзенай у Паўднёвай Амэрыцы.
simple-collection;['рыбы'];Гэтая назва мае некалькі сэнсаў.
simple-collection;['скарпіён', '♏'];Скарпіён (па-лацінску: Scorpius, Sco) — задыякальнае сузор’е.
simple-collection;['дзева'];Дзева (па-лацінску: Virgo) — экватарыяльнае задыякальнае сузор’е, якое ляжыць паміж Ільвом і Шалямі.
simple-collection;['гідра'];Гідра (па-лацінску: Hydra, Hya) — найбуйнейшае з 88 сузор’яў, якое распасьцертае на плошчы 1303 квадратных градусаў.
simple-collection;['трылёгія'];Трылё́гія (па-француску: trilogia) — сукупнасьць трох твораў мастацтва, аб’яднаных пераемнасьцю сюжэту або агульнай ідэяй.
simple-collection;['крыж', 'паўднёвы крыж'];Крыж (па-лацінску: Crux, Cru) — найменшае з 88 сучасных сузор’яў, але адно з самых заўважных у паўднёвым небе.
simple-collection;['паўночная карона'];Паўно́чная Каро́на (па-лацінску: Corona Borealis, CrB) — невялікае сузор’е ў паўночнай частцы зорнага неба.
simple-collection;['ліра'];Лі́ра (па-лацінску: Lyra, Lyr) — невялікае сузор’е ў паўночнай частцы зорнага неба.
simple-collection;['шалі'];Шалі або Вагі (па-лацінску: Libra, Lib) — задыякальнае сузор’е ў паўднёвай частцы нябеснай сфэры.
simple-collection;['груган'];Груган (па-лацінску: Corvus, Crv) — дробнае сузор’е ў паўднёвай частцы зорнага неба.
simple-collection;['рак'];Рак (па-лацінску: Cancer, Cnc) — адно з дванаццаці задыякальных сузор’яў, ляжыць у экватарыяльным поясе неба.
simple-collection;['баран', 'авен'];Баран (таксама Авен або Овен. па-лацінску: Aries, Ari) — задыякальнае сузор’е ў паўночным паўшар’і, мяжуе з Рыбамі на захадзе і Цяльцом на ўсходзе.
simple-collection;['касіяпэя'];Касіяпэя (па-лацінску: Cassiopeia, Cas) — сузор’е ў паўночнай частцы зорнага неба, названае паводле ганарыстай каралевы Касіяпэі, што хвалілася на сваю непераўзыходную прыгажосьць.
simple-collection;['леў', '♌'];Леў (па-лацінску: Leo) — задыякальнае сузор’е паміж Ракам і Дзевай.
simple-collection;['блізьняты'];Блізьняты (па-лацінску: Gemini, Gem) — задыякальнае сузор’е ў паўночным паўшар’і.
simple-collection;['вадаліў'];Вадаліў (па-лацінску: Aquarius, Aqr) — задыякальнае сузор’е, разьмешчанае крыху паўднёвей за нябесны экватар паміж Казярогам і Рыбамі.
simple-collection;['міталёгія'];Міталё́гія (па-грэцку: Μυθολογία ад грэцкага міт — казка) — сукупнасьць пераказаў, апавяданьняў, дзе ў наіўна пэрсаніфікаванай, навочна-вобразнай, несьвядома мастацкай форме падаваліся зьявы прыроды і грамадзкага жыцьця.
simple-collection;['мэдычнае абсталяваньне'];Мэдычнае абсталяваньне — шырокі спэктар вырабаў мэдычнае тэхнікі, прызначаных для забесьпячэньня аптымальных умоваў хворым і мэдычнаму пэрсаналу пры правядзеньні лячэбна-дыягнастычных мерапрыемстваў, а таксама догляду за хворымі.
simple-collection;['скандынаўская міталёгія', 'германа-скандынаўская міталёгія'];Скандынаўская міталёгія (старажытнагерманская міталёгія) — міталёгія германскіх плямёнаў (англаў, саксаў, нарманаў, данаў і інш.), якая фармавалася з V в.
simple-collection;['старажытнагрэцкая міталёгія'];Старажытнагрэцкая міталёгія была асноваю адной з найдаўнейшых цывілізацыяў сьвету — Старажытнай Грэцыі, калыскі сучаснай цывілізацыі.
