functional-matter;['фаліянт'];Фаліянт уяўляе сабой кнігу фарматам у палову папяровага ліста.
functional-matter;['галяктоза'];Галяктоза — адзін з простых цукраў.
functional-matter;['аблата'];Абла́та — салодкая кулінарная страва, якая ўяўляе сабой круглыя выпечаныя з прэснага цеста вахлі дыямэтрам 10—20 см і таўшчынёй 1—3 мм.
functional-matter;['раўхтапаз'];Раўхтапаз
functional-matter;['антыманіт'];Антымані́т
functional-matter;['флюарыт'];Флюары́т (ад лац.
functional-matter;['цэз', 'цэзій', 'cs'];Цэз (па-лацінску: Caesium) Cs — хімічны элемэнт I групы пэрыядычнай сыстэмы. атамны нумар 55.
functional-matter;['срэбра', 'серабро'];Срэ́бра Ag — хімічны элемэнт 11 групы пэрыядычнай сыстэмы . атамны нумар 47.
functional-matter;['падзолістыя глебы'];Падзолістыя глебы разьвіваюцца пад іглічнымі лясамі і мховай расьліннасьцю.
functional-matter;['сыр'];Сыр — малочны прадукт, які гатуецца з кіслага малака кароваў, коз альбо авечак.
functional-matter;['маргарын'];Маргарын — эмульсія рапсавага, сланечнікавага і соевага алеяў з уводам вады, жывёльных тлушчаў, тлушчаў рыбы і марскіх сысуноў, як і даданьнем малака і вітамінаў.
functional-matter;['плеяды', 'm45', "аб'ект мэсье m45", 'мэсье 45'];Плея́ды — расьсеянае скопішча у сузор’і Цяльца.
functional-matter;['бэтон'];Бэто́н
functional-matter;['паўправаднік'];Паўправаднік — цьвёрды матэрыял, які валодае адначасова двума тыпамі праводнасьці — электроннай і гэтак званай дзіркавай.
functional-matter;['выбуховае рэчыва'];Выбуховае рэчыва — хімічнае злучэньне ці іхная сумесь, здольная ў выніку пэўных зьнешніх узьдзеяньняў ці нутраных працэсаў разрывацца з выбухам, выдзяляючы цеплыню і ўтвараючы моцна нацепленыя газы.
functional-matter;['клей'];Клей — рэчыва або сумесь, а таксама шматкампанэнтныя кампазыцыі на аснове арганічных або нэарганічных рэчываў, здольныя злучаць (склейваць) розныя матэрыялы — у прыватнасьці, драўніну, скуру, паперу, тканіну, шкло, кераміку, мэталы, плястмасы, гуму.
functional-matter;['вакцына'];Вакцы́на — мэдычны біялягічны прэпарат для стварэньня імунітэту да інфэкцыйных хваробаў.
functional-matter;['дэсэрт'];Дэсэрт — страва, якая падаецца пасьля асноўнай і сама не зьяўляецца асноўнай, на заканчэньне ежы.
functional-matter;['мёд'];Мёд — салодкае й вязкае рэчыва, прыгатаваная пчоламі з выкарыстаньнем нэктару кветак, а таксама іншых салодкіх сокаў расьліннага і жывёльнага паходжаньня, як то падзевы мёд.
functional-matter;['мэтадон'];Мэтадо́н (6-(дыметыляміна)-4,4-дыфэніл-3-гептанон) — сынтэтычны лекавы прэпарат з групы апіёідаў, выкарыстоўваецца як анальгетык, а таксама пры лячэньні наркатычнай залежнасьці.
functional-matter;['сыроп'];Сыроп — канцэнтраваная цукровая рашчына або сумесь асобных цукраў у вадзе або ў натуральным садавінавым соку.
functional-matter;['чыпсы'];Чыпсы (анг.
functional-matter;['дахоўка', 'чарапіца'];Дахо́ўка — керамічны выраб для пакрыцьця даху.
functional-matter;['батыст'];Баты́ст (па-француску: batiste. ад імя францускага ткача 13 стагодзьдзя Батыста Шамбрэ) — высакаякасная тонкая паўпразрыстая льняная або баваўняная тканіна. вырабляецца з тонкай кручанай пражы, якая звычайна падвяргаецца апрацоўцы канцэнтраваным растворам шчолачы для наданьня шаўкавістага бляску і мяккасьці. выкарыстоўваецца для пашыву бялізны, сукенак, блюзак.
functional-matter;['амэтыст'];Амэты́ст — сіняя, сінявата-ружовая ці чырвона-фіялетавая разнавіднасьць кварцу.
functional-matter;['вітамін c', 'аскарбінавая кісьля'];Аскарбі́навая кі́сьля, вытворнае L-гулёнавай кісьлі, водарастваральны вітамін.
functional-matter;['бэнзін', 'бензін'];Бэнзі́н — сумесь лёгкіх вуглевадародаў з тэмпэратурай кіпеньня ад 30 да 200 °C. Шчыльнасьць каля 0,75 г/см².
functional-matter;['хляраформ'];Хляраформ — арганічнае хімічнае злучэньне з формулай CHCl3.
functional-matter;['бістр'];Бістр (па-француску: bistre) — фарба з драўнянай сажы, адценьне чорнага колеру, змяшанай з растваральным у вадзе раслінным клеем. выкарыстоўвалася эўрапейскімі мастакамі XV—XVIII стагоддзяў пры маляваньні пяром і пэндзьлем.
functional-matter;['цукар'];Цу́кар — крышталічны харчовы прадукт салодкага смаку.
functional-matter;['малако'];Малако́ — сакраторная вадкасьць малочных залозаў сысуноў і чалавека, фізыялягічна прызначаная для выкормліваньня дзіцянятаў.
functional-matter;['трынітраталуол'];Трынітраталуол (тратыл, тол, TNT) — адно з найбольш распаўсюджаных брызантных выбуховых рэчываў.
functional-matter;['марэна'];Марэна — адклады, назапашаныя непасрэдна ледавікамі пры іх руху і ўтварэньні ложы.
functional-matter;['абсыдыян'];Абсыдыян — аднастайнае вульканічнае шкло, якое прайшло праз хуткае астуджэньне расплаўленых горных парод.
functional-matter;['опіюм', 'опій'];Опій
functional-matter;['кумыс'];Кумы́с — кісламалочны напой з кабылінага малака, атрыманы ў выніку малочнакіслага і сьпіртавога закісаньня пры дапамозе баўгарскай і ацыдафільнай малочнакіслых палачак і дрожджаў.
functional-matter;['марфін'];Марфін (па-лацінску: Morphinum. састарэлы варыянт назвы — морфій) — адзін з галоўных алкалёідаў опія, утрымліваецца ў маку снатворным (па-лацінску: Papaver somniferum).
functional-matter;['нікатын'];Нікаты́н — алкалёід, наркотык, які ўтрымоўваецца ў расьлінах сямейства пасьлёнавых, пераважна ў тытуне, складаючы пры гэтым 0,6-3,0% ад сухой вагі.
functional-matter;['нэфрыт'];Нэфрыт — мінэрал, разнавіднасьць актыналіта, якая складаецца ў асноўным са зблытаных валокнаў амфіболаў.
functional-matter;['ладан'];Ладан — у перакладзе з грэцкай мовы азначае араматычную смалу, якую атрымліваюць пры падсечцы кары дрэва баскевіля, што расьце на тэрыторыі ўсходняй Афрыкі, Азіі і ў паўднёва-заходняй частцы Арабійскай паўвыспы.
functional-matter;['аспартам', 'e951'];Аспартам, E951 — сынтэтычны замяняльнік цукру, невугляводнай прыроды (мэтылавы этэр амінакіслот: аспартавай і фэнілаланіну).
functional-matter;['масла', 'сьметанковае масла'];Ма́сла — харчовы канцэнтрат малочнага тлушчу.
functional-matter;['бульба', 'solanum tuberosum'];Бу́льба (па-лацінску: Solanum tuberosum) — шматгадовыя клубняносныя расьліны роду пасьлён сямейства пасьлёнавых.
functional-matter;['гармоны', 'гармон'];Гармоны — сыгнальныя рэчывы, якія выпрацоўваюцца эндакрыннымі залозамі непасрэдна ў кроў і аказваюць складанае і шматбаковае ўзьдзеяньне на арганізм цалкам альбо на вызначаныя органы і тканкі-мішэні.
functional-matter;['лёд'];Лёд — вада ў цьвёрдым агрэгатным стане, мінэрал.
functional-matter;['агат'];Агат — мінэрал, схаванакрышталічная разнавіднасьць кварцу, уяўляе сабой тонкавалакністы агрэгат халцэдона са слаістай тэкстурай і стужкавым разьмеркаваньнем афарбоўкі.
functional-matter;['яшма'];Я́шма, Ясьпіс — асадкава-мэтамарфаґенная тонка- або скрытакрышталічная шчыльная горная парода.
functional-matter;['жалезная руда'];Жалезныя руды — прыродныя мінэральныя агрэгаты, у якіх ёсьць жалеза ў колькасьцях і формах, што адпавядаюць умовам прамысловай здабычы.
functional-matter;['магнэтыт'];Магнэтыт (састарэлы сынонім — магнітны жалязьняк) FeO·Fe2O3 — мінэрал чорнага колеру, валодае моцнымі магнітнымі ўласьцівасьцямі.
functional-matter;['процівірусныя прэпараты', 'антывірусныя прэпараты'];Проціві́русныя прэпара́ты — кляс лекавых сродкаў, якія выкарыстоўваюцца для лячэньня вірусных інфэкцыяў.
functional-matter;['стэроіды'];Стэроіды — рэчывы жывёльнага ці радзей расьліннага паходжаньня, якія валодаюць высокай біялягічнай актыўнасьцю.
functional-matter;['парфір'];Парфір — палеатыпныя эфузіўныя кіслыя горныя пароды, якія маюць парфіравую структуру.
functional-matter;['напой', 'напоі'];Напо́й — вадкасьць, прызначаная для піцьця.
functional-matter;['лупняк', 'сланец'];Лупня́к — горныя пароды з паралельным разьмяшчэньнем мінэралаў, якія ўваходзяць у іх склад.
functional-matter;['хлярафіл'];Хлярафіл (ад грэц.
functional-matter;['гранат'];Гранаты
functional-matter;['вітаміны', 'вітамін'];Вітамі́ны — група нізкамалекулярных арганічных злучэньняў адносна простай будовы і разнастайнай хімічнай прыроды.
functional-matter;['вэрмут'];Вэрмут
functional-matter;['гіфа'];Гі́фа — ніткападобны, разгалінаваны элемэнт, што, пераплятаючыся зь іншымі гіфамі, складае міцэлій або цела грыба.
functional-matter;['пэніцылін'];Бэнзыльпэніцылін (пэніцылін G (PCN G) або проста пэніцылін (PCN)) — бэнзылевы этэр 6-амінапэніцылянавай кісьлі.
functional-matter;['бацьвіньне'];Бацьві́ньне: надземная расьлінная маса агароднінных, кармавых і тэхнічных коранеклубняплодаў асабліва буракоў, націна.
functional-matter;['лушчак', 'сьлюда', 'сьлюды'];Лушчак, сьлюды — група мінэралаў-алюмасылікатаў, якія валодаюць слаістай структурай і якія маюць агульную формулу R13 [AlSi3O10]2, дзе R1 = К, Na. R2 = Al, Mg, Fe, Li.
functional-matter;['бульбяная салата', 'бульбяны салат'];Бульбяны́ сала́т — папулярная страва эўрапейскай кухні, пераважна чэскай, нямецкай і аўстрыйскай.
functional-matter;['печыва'];Печыва — невялічкі ласунак зь цеста, звычайна круглы, квадратовы, прастакутны або ў выглядзе зоркі, руркі і інш., бывае з надзеньнямі: крэмам, сочывам, шакалядам.
functional-matter;['пудынг'];Пудынг (па-ангельску: Pudding) — дэсэртная ці закусачная страва, традыцыйная й найболей распаўсюджаная ў Вялікабрытаніі, часьцей за ўсё ўяўляе сабой аднастайную масу на аснове малочных прадуктаў з даданьнем крухмалу ці патакі.
functional-matter;['арак', 'arak'];Арак (арабскае) — моцны (60 % аб.) алькагольны напой.
functional-matter;['шнапс'];Шнапс (па-нямецку: Schnaps) — абагульняючая назва дужых алькагольных напояў.
functional-matter;['стаксэль', 'стаксель'];Стаксэль (па-нямецку: stagsegel) — асноўны зь пярэдніх косых парусоў.
functional-matter;['вітаміны', 'вітамін'];Вітамі́ны — група нізкамалекулярных арганічных злучэньняў адносна простай будовы і разнастайнай хімічнай прыроды.
functional-matter;['бэкон', 'бекон'];Бэко́н (па-ангельску: bacon) — засоленая ахалоджаная палавіна сьвіной тушы, бязь ніжніх канцавінаў, пазванка, касьцей тазу, грудзіны.
functional-matter;['амлет'];Амле́т — страва францускай кухні, прыгатаваная са зьлёгку ўзьбітых яйкаў, абсмажаных на патэльні.
functional-matter;['лягер', 'lager'];Лягер (ад па-нямецку: Lagerbier, піва, дасьпяваючае пры захоўваньні) — тып піва, пры вырабе якога выкарыстоўваецца нізавое закісаньне з наступнай фэрмэнтацыяй пры нізкай тэмпэратуры.
functional-matter;['гонт', 'гонта', 'гонты'];Гонт ці гонты — драўляны матэрыял для пакрыцьця даху ў форме дошчачкі зь невялікім зубам.
functional-matter;['кола'];Кола — салодкі газаваны напой, які вытвараецца на аснове арэхаў кола (ці іншых рэчываў), звычайна разбаўлены карамельлю, утрымлівае кафэін.
functional-matter;['лічы'];Кітайскія лічы — пладовыя дрэвы сямейства сапіндавыя, вядомыя таксама як «лічы», «ліджы», «лайсі», «лісі», «кітайская сліва».
functional-matter;['сьпіннамазгавая вадкасьць'];Сьпіннамазгавая вадкасьць (цэрэбрасьпінальная вадкасьць, ліквар) — вадкасьць, якая пастаянна цыркулюе ў жалудачку галаўнога мозгу, лікваправодных шляхах, субарахнаідальнай (падпавуціннай) прасторы галаўнога мозгу і млечы.
functional-matter;['пудра'];Пудра
functional-matter;['хімічныя валокны'];Хімічныя валокны — тэкстыльныя валокны, якія атрымліваюцца з прыродных і сынтэтычных арганічных палімераў, а таксама неарганічных злучэньняў.
functional-matter;['імбірнае печыва', 'перачнае печыва', 'пранае печыва', 'пэпаркака'];Імбірнае печыва (па-ангельску: Ginger nut), або Перачнае (пранае) печыва (напр.
functional-matter;['портэр', 'porter'];По́ртэр — цёмнае ангельскае піва з характэрным вінным прысмакам і моцным водарам соладу.
functional-matter;['марсала', 'marsala'];Марсала — моцнае віно, якое мае некаторае падабенства з мадэрай, але адрозьніваецца ад яе большым утрыманьнем цукру.
functional-matter;['бурбон', 'bourbon'];Бурбон — від віскі, які вырабляюць у ЗША. зьявіўся ў канцы XVIII стагодзьдзя — пачатку XIX стагодзьдзя ў горадзе Парыс, акруга бурбон, Кентукі.
functional-matter;['мараскіна', 'maraschino'];Мараскіна па-італьянску: Maraschino, maraskino — гатунак безколернага лікёру, які спачатку вырабляўся ў Далмацыі на ўзьбярэжжу Андрыятыкі, а цяпер таксама ў Італіі.
functional-matter;['ром'];Ром (парт.
functional-matter;['брэндзі', 'brandy'];Брэндзі (нід.
functional-matter;['моцныя сьпіртныя напоі', 'моцныя алькагольныя напоі'];Моцныя сьпіртныя напоі — сьпіртныя напоі з параўнальна высокім утрыманьнем алькаголю, асновай якіх, як правіла, зьяўляецца дыстылят або бідыстылят (атрымліваецца мэтадам перагонкі) або рэктыфікат (які атрымліваецца мэтадам рэктыфікацыі) зброджанага сусла.
functional-matter;['кальвадос', 'calvados'];Кальвадо́с — яблычны брэндзі, які атрымоўваюць шляхам перагонкі сыдру, з францускага рэгіёну Ніжняя Нармандыя.
functional-matter;['гародніна', 'агародніна'];Гародніна — пэўныя ядомыя часткі расьлінаў, пераважна травяністых, якія выкарыстоўваюцца чалавекам у ежу й звычайна супрацьпастаўляюцца салодкай садавіне, ягадам і разнастайнаму зерню, спэцыям, травам або затаўкам.
functional-matter;['яечня', 'яешня'];Яечня, Яешня — страва, зробленая са смажаных яек.
functional-matter;['капучына', 'cappuccino'];Капучына — кава з дадаткам сьпененага малака, альбо зь вяршкамі й шчопаткай сыпучага шакаляду ці какава для аздобы.
functional-matter;['эль', 'піва'];Эль (па-ангельску: ale) — крэпкае горкае піва, выраблянае хуткім верхавым браджэньнем пры адносна высокай тэмпературы.
functional-matter;['віно'];Віно́ (па-лацінску: vinum) — алькагольны напой (крэпасьць 9—20 % аб.), атрыманы поўным або частковым сьпіртовым закісаньнем вінаграднага або пладова-ягаднага соку (часам з даданьнем сьпірту і іншых рэчываў).
functional-matter;['пілавіньне', 'апілкі'];Пілавіньне — дробная стружка, якая атрымліваецца пры пілаваньні драўніны.
functional-matter;['мука'];Мука́ — прадукт харчаваньня, які атрымліваецца ў выніку перамолваньня збожжа розных культураў.
functional-matter;['цыгарэта', 'цыгарэты'];Цыгарэта — гэта невялікая папяровая люлечка, часьцяком зь фільтрам, у якую забіваюць тытунь для паленьня.
functional-matter;['табака'];Таба́ка альбо ню́хальны тыту́нь (па-ангельску: snuff) — тытунь бяздымнага спосабу ўжываньня.
functional-matter;['соўс', 'падліва', 'падліўка', 'соўсы'];Со́ўс
functional-matter;['хлеб'];Хлеб — зборная назва для групы прадуктаў харчаваньня, якія рыхтуюцца шляхам выпечкі, паравой апрацоўкі альбо смажаньня цеста, што складаецца, як мінімум, з мукі і вады.
functional-matter;['ракфор', 'roquefort'];Ракфор
functional-matter;['марожанае', 'марозіва'];Маро́зіва — замарожаны дэсэрт, які атрымліваюць шляхам замарожваньня масы з малочных прадуктаў або вады, звычайныя дадаткі — садавіна ці шакаляд, таксама існуюць незвычайныя дадаткі — мяса ці гародніна.
functional-matter;['яблык', 'яблыкі'];Я́блык — садавіна, плод яблыні.
functional-matter;['выкапнёвае паліва'];Выкапнёвае паліва, гаручыя карысныя выкапні — нафта, вугаль, гаручы лупняк, прыродны газ і ягоныя гідраты, торф і іншыя гаручыя мінэралы й рэчывы, якія здабываюцца пад зямлёй ці адкрытым мэтадам.
functional-matter;['ківі'];Ківі — агульнаўжывальная назва пладоў культурных сартоў расьлінаў, якія належаць да роду актынідыя, больш дакладна актынідыі кітайскай (Actinidia chinensis) або актынідыі дэлікатэснай (Actinidia deliciosa).
functional-matter;['напалм', 'napalm'];Напа́лм (па-ангельску: napalm — скарачэньне ад анг.
functional-matter;['плястмаса', 'плястык'];Плястма́са — штучныя арганічныя матэрыялы, асновай якіх зьяўляюцца сынтэтычныя або прыродныя высокамалекулярныя злучэньні.
