language;['मराठी'];मराठी ही इंडो-युरोपियनच्या भारतीय आर्य शाखेंतली एक दक्षिणेकडची भास.
language;['inglez'];Inglez zaun asa ek West Germanic bhas ji Englandan suru zali ani atam akhea sounsarak uloitat.
language;['इंडो-युरोपियन भाशा पंगड'];संवसारांत सुमार 1-4 हजार भासो उलयतात.
language;['हिन्दी', 'हिंदी'];बुखार हिन्दी ही भरतन्ची एक मुख्य भाषा.
language;['उर्दू भाशा', 'urdu'];उर्दू भास चड करून पाकिस्तान आनी भारत देशांत उलयतात.
language;['उर्दू भाशा', 'urdu'];Urdu bhas chodd korun pakistan ani bharot dexant uloitat.
locative-role;["dil'li", 'délhi'];Dil'li zaun asa Bharotache ek kendraxasit pradex.
locative-role;['tamillnaddu', 'tamil nadu'];Tamillnaddu zaun asa Bharotache ek rajya.
locative-role;['मोनॅको', 'मोनाको'];मोनॅको, एरोपांतलो देस आसा। ताची राजधानी मॉन्टे कार्लो नगर आसा।
locative-role;['महाराष्ट्र', 'maharashtra'];महाराष्ट भारतीय संघ राज्यांतलें एक घट राज्य.
locative-role;['सर्बिया'];सर्बिया, एरोपांतलो देस आसा। ताची राजधानी बेलग्रेड नगर आसा।
locative-role;['लिथुआनिया'];लिथुआनिया, एरोपांतलो देस आसा। ताची राजधानी विल्नीयस नगर आसा।
locative-role;['jammu ani kashmir'];Jammu ani Kashmir zaun asa Bharotache ek rajya.
locative-role;['वेल्स', 'wales'];वेल्स, एरोपांतलो देस आसा। ताची राजधानी कार्डिफ नगर आसा। ते युनायटेड किंगडम भाग आहे।
locative-role;['वेल्स', 'wales'];Wales, एरोपांतलो देस आसा। ताची राजधानी कार्डिफ नगर आसा। ते युनायटेड किंगडम भाग आहे। == Wales == ….
locative-role;['karachi'];…..
non-physical-collection;['हिंदू धर्म'];हिंदु धर्म जगालॆं सकड धर्मांपशिनॆं पॊरनॆं धर्म आस्स। हॆं द्क्षिण आशियालॆं निज धर्म आनि बहुसंख्येलॆं धर्म। हॆं वेद आधारित धर्म, विंगड-विंगड अनुष्ठान, मत, पद्धतियॊ, संप्रदाय आनि दर्शन ओट्टु करुनु आस्स। विश्वासकांगॆलॆं संख्यॆरि हॆं जगांतुलॆं तिसरॆं व्हॊड धर्म आस्स। यद्यपि हांतुं मस्त देवि-देवतांगॆलि पूजा ज़ात्ता, बद्द म्हणलॆरि हॆं एकीश्वरवादि धर्म आस्स। अनुयायि अनुसार हॆं जगांतुलॆं तिसरॆं व्हॊड धर्म आस्स। हाज्जीं ८२८ अरब अनुयायि भारतांतुं, २३ अरब नॆपाळांतुं, १४ अरब बांग्लादेशांतुं आनि ३.३ अरब बालि, इंडोनेशियांतुं आस्सति। हिंदु शास्त्रालॆं मस्त वाङ्मय श्रुति अथवा स्मृतिंतुं विंगड कॆल्ललॆं आस्स। हीं वाङ्मय अनुष्ठान, तत्त्ववाद आनि पुराणाविषयारि आस्सति आनि धर्म अनुसार कश्शि जीयचॆं हॆं सांगताति। हांतुं प्राय, महत्त्व आनि अधिकाराविषयारि वेद सकदांतुं व्हॊड आस्सति। उपनिषद्, महाकाव्य रामायण आनि महाभारत अन्य व्हॊड वाङ्मय। महाभारतारि आधारित शास्त्र भागवद् गीता हाका च़ड महत्त्व आसता। == उगम == हिंदु हॆं ऊत्र,भारतीय उपमहाद्वीपालॆं वायव्य बदिक व्हांवतलॆं सिंधु न्हयिंथांवुनु आयलां। हिंदु हॆं नांव, मुखारि, अरबि ऊत्र अल्-हिंद, अर्थात् सिंधु न्हयिलॆं पॆलतडियॆरि राबतलीं जन, म्हुणु प्रसिद्ध ज़ाल्लॆं। १३शतक इ.
non-physical-collection;['योग', 'yóga'];योग दर्शनालीं जनक पतांजलि हांका आप्पयताति। तांनि बरंयलीं योग सूत्र हीं हॆ दर्शनांगॆलीं पाळ । योग, सांख्य दर्शनालॆं समानचि आस्स. ज़ाल्लॆरि योग फुडलॆथांवुनु ईश्वरवादि दर्शन आस्स।
non-physical-collection;['मानवतावाद'];मानवतावादाची एक विचारप्रणाली.
non-physical-collection;['islam'];Muhm'mod poigombor hanne sthapil'loya dhormak ' islam' dhorm' ' oxem namv asa.
non-physical-collection;['kristanvponn'];Kristanvponn zaun asa ek monotheistic dhorm, mhonnge ekuch devan visvas thevpi, ani ho dhorm Jezu Kristache jivitacher adarlelem asa.
non-physical-place;['कन्या'];.
parametrized-collection;['रूजाय सायबिणिचो तेर्स'];== तेर्स म्हणची रीत - हो तो प्राय थे रसार्य == १.
phenomenon;['वीज'];एक तरेची ऊर्जा.अचेतन वस्तूंकप्रवाहीत करून तांकां चलत करपाक चालना दिवपी एक शक्त.हे शक्तीवरवीं मुखेलपणान तीन तरेचीम कामां करप जातात.उपकरणां क्रियाशील करून तांचेवरवीं अपार कामां,तापमानांत जाय तसो बदल घडोवन हाडप आनी उजवाड निर्माण करप.ह्या तीन मुखेल कामांभायर रसायनीक विश्लेशण करपाखातीरय विजेचो वापर करप जाता.
phenomenon;['हवामान'];हवामान
physical-body;['धर्तरी'];धर्तरी जीवसृश्ट आशिल्लो सूर्यकुलांतलो एक ज्ञात गिरो.
physical-object;['इगर्ज', 'इगर्जे'];किरिस्तांव धर्मीयांचें प्रार्थनाथळ.
physical-object;['adolli'];== Adolli ==
political-geographic-object;['रोमेनिया', 'romania', 'रोमानिया'];रोमेनिया, एरोपांतलो देस आसा। ताची राजधानी ब्यूकरेस्ट नगर आसा।
political-geographic-object;['युगोस्लाविया'];युगोस्लाविया.
political-geographic-object;["dil'li", 'délhi'];Dil'li zaun asa Bharotache ek kendraxasit pradex.
political-geographic-object;['tamillnaddu', 'tamil nadu'];Tamillnaddu zaun asa Bharotache ek rajya.
political-geographic-object;['उत्तर कोरिया'];उत्तर कोरिया, आशीयांतलो देस आसा। ताची राजधानी प्योंगयांग नगर आसा।
political-geographic-object;['नॉर्वे', 'norway'];नॉर्वे, एरोपांतलो देस आसा। ताची राजधानी ओस्लो नगर आसा।
political-geographic-object;['नॉर्वे', 'norway'];Norway, एरोपांतलो देस आसा। ताची राजधानी ओस्लो नगर आसा। == Norway == ….
political-geographic-object;['नेदरलँड्स'];नेदरलँड्स, एरोपांतलो देस आसा। ताची राजधानी आम्सटरडॅम नगर आसा।
political-geographic-object;['जपान', 'japan', 'ಜಪಾನ್'];जपान, आशीयांतलो देस आसा। ताची राजधानी टोकियो नगर आसा।
political-geographic-object;['मोनॅको', 'मोनाको'];मोनॅको, एरोपांतलो देस आसा। ताची राजधानी मॉन्टे कार्लो नगर आसा।
political-geographic-object;['सामोआ'];सामोआ, ओशनिया च्या बेट देश आसा। ताची राजधानी अपिया नगर आसा।
political-geographic-object;['जिबूती'];जिबूती, अफ्रीकांतलो देस आसा। ताची राजधानी जिबूती नगर आसा।
political-geographic-object;['मलेशिया'];मलेशिया, आशीयांतलो देस आसा। ताची राजधानी क्वाला लंपुर नगर आसा।
political-geographic-object;['अँटिगा आणि बार्बुडा'];अँटिगा आणि बार्बुडा, उत्तर अमेरिकेंतलो देस आसा। ताची राजधानी सेंट जॉन नगर आसा।
political-geographic-object;['बेलिझ', 'belize'];बेलिझ, उत्तर अमेरिकेंतलो देस आसा। ताची राजधानी बेलमोपन नगर आसा।
political-geographic-object;['सेंट किट्स आणि नेव्हिस', 'सेंट किट्स आनी नेव्हिस'];सेंट किट्स आनी नेव्हिस, उत्तर अमेरिकेंतलो देस आसा। ताची राजधानी बस्सेटर नगर आसा।
political-geographic-object;['कोमोरोस'];कोमोरोस, अफ्रीकांतलो देस आसा। ताची राजधानी मॉरोनी नगर आसा।
political-geographic-object;['डॉमिनिका'];डॉमिनिका, उत्तर अमेरिकेंतलो देस आसा। ताची राजधानी रोसेऔ नगर आसा।
political-geographic-object;['सेंट लुसिया'];सेंट लुसिया, उत्तर अमेरिकेंतलो देस आसा। ताची राजधानी कॅस्ट्रिएस नगर आसा।
political-geographic-object;['इंग्लंड', 'ಇಂಗ್ಲೆಂಡ್', 'इंग्लैंड', 'इंग्लैण्ड'];== इंग्लीश भास == इंग्लीश भास.
political-geographic-object;['उत्तर आयर्लंड'];उत्तर आयर्लंड, एरोपांतलो देस आसा। ताची राजधानी बेलफास्ट नगर आसा। ते युनायटेड किंगडम भाग आहे।
political-geographic-object;['स्वित्झर्लंड', 'ch', 'स्विट्ज़रलैण्ड'];स्वित्झर्लंड, एरोपांतलो देस आसा। ताची राजधानी बर्न नगर आसा।
political-geographic-object;['संयुक्त अरब अमीरात'];संयुक्त अरब अमीरात, आशीयांतलो देस आसा। ताची राजधानी अबु धाबी नगर आसा।
political-geographic-object;['लक्संबॉर्ग', 'luxembourg', 'लक्\u200dझेंम्बर्ग'];लक्संबॉर्ग, एरोपांतलो देस आसा। ताची राजधानी लक्संबॉर्ग नगर आसा।
political-geographic-object;['लक्संबॉर्ग', 'luxembourg', 'लक्\u200dझेंम्बर्ग'];Luxembourg, एरोपांतलो देस आसा। ताची राजधानी लक्संबॉर्ग नगर आसा। == Luxembourg == ….
political-geographic-object;['मोरोक्को'];मोरोक्को, अफ्रीकांतलो देस आसा। ताची राजधानी राबत नगर आसा।
political-geographic-object;['युनायटेड किंगडम', 'यूनाइटेड किंगडम', 'संयुक्त राजशाही'];युनायटेड किंगडम, एरोपांतलो देस आसा। ताची राजधानी लंडन नगर आसा।
political-geographic-object;['स्पेन'];स्पेन, एरोपांतलो देस आसा। ताची राजधानी माद्रिद नगर आसा।
political-geographic-object;['सौदी अरेबिया'];सौदी अरेबिया, आशीयांतलो देस आसा। ताची राजधानी रियाद नगर आसा।
political-geographic-object;['ताजिकिस्तान'];ताजिकिस्तान, आशीयांतलो देस आसा। ताची राजधानी दुशान्बे नगर आसा।
political-geographic-object;['युगांडा', 'uganda'];युगांडा आफ्रिका खंडांतलो एक आदलो ब्रिटीश रक्षीत देश.
political-geographic-object;['बेलारूस'];बेलारूस, एरोपांतलो देस आसा। ताची राजधानी मिन्स्क नगर आसा।
political-geographic-object;['अझरबैजान'];अझरबैजान, आशीयांतलो देस आसा। ताची राजधानी बाकु नगर आसा।
political-geographic-object;['किरगिझस्तान'];किरगिझस्तान, आशीयांतलो देस आसा। ताची राजधानी बिश्केक नगर आसा।
political-geographic-object;['उझबेकिस्तान'];उझबेकिस्तान, आशीयांतलो देस आसा। ताची राजधानी ताश्केंत नगर आसा।
political-geographic-object;['कझाकस्तान'];कझाकस्तान, आशीयांतलो देस आसा। ताची राजधानी असताना नगर आसा।
political-geographic-object;['मंगोलिया'];मंगोलिया, आशीयांतलो देस आसा। ताची राजधानी उलानबातर नगर आसा।
political-geographic-object;['belgium', 'बेल्जियम'];बेल्जियम, एरोपांतलो देस आसा। ताची राजधानी ब्रुसेल्स नगर आसा।
political-geographic-object;['belgium', 'बेल्जियम'];….
political-geographic-object;['टोंगा'];टोंगा, ओशनिया च्या बेट देश आसा। ताची राजधानी नुकू'आलोफ़ा नगर आसा।
political-geographic-object;['पाकिस्तान'];पाकिस्तान, अॅशियांतलो देश आसा। ताची राजधानी इस्लामाबाद नगर जावन आसा।
political-geographic-object;['बांगलादेश', 'bangladesh'];बांगलादेश, आशीयांतलो देस आसा। ताची राजधानी ढाका नगर आसा।
political-geographic-object;['बांगलादेश', 'bangladesh'];….
political-geographic-object;['अफगाणिस्तान'];== भूंयवर्णन == नैर्ऋत्य आशियेंतलो, चोंयवशीन भुंयेन रेंवडायल्लो देश.अक्षवृत्तीय विस्तार 29° ते 38° 35 ‘ उत्तर आनी रेखावृत्तीय 60°, 50 ‘ ते 71°, 50’ उदेंत.
political-geographic-object;['ऑस्ट्रिया'];मध्य युरोपांतलें प्रजासत्ताक राश्ट्र.
political-geographic-object;['लाओस', 'laos'];लाओस आग्नेय आशियेंतलो इंडोचायना व्दिपकल्पांतलो एक देश क्षेत्रफळ 2,36,800 चौ किमी.
political-geographic-object;['लाओस', 'laos'];Laos agney axientolo inddochaina vdipoklpantolo ek dex kxetrofoll 2,36,800 chovo kimi.
political-geographic-object;['म्यानमार', 'बर्मा'];म्यानमार, आशीयांतलो देस आसा। ताची राजधानी नय्पयिदव नगर आसा।
political-geographic-object;['कंबोडिया'];कंबोडिया, आशीयांतलो देस आसा। ताची राजधानी फ्नॉम पेन्ह नगर आसा।
political-geographic-object;['ऑस्ट्रेलिया', 'ಆಸ್ಟ್ರೇಲಿಯ'];जगांतलो सगळ्यांत ल्हान आनी लोकसंख्येची दाटी सगळ्यां परस उणी आशिल्लो खंड.
political-geographic-object;['भूतान'];भूतान, आशीयांतलो देस आसा। ताची राजधानी थिम्पू नगर आसा।
political-geographic-object;['तुर्कमेनिस्तान'];तुर्कमेनिस्तान, आशीयांतलो देस आसा। ताची राजधानी अश्गाबात नगर आसा।
political-geographic-object;['जॉर्जिया'];जॉर्जिया, आशीयांतलो देस आसा। ताची राजधानी टबाइलीसी नगर आसा।
political-geographic-object;['होंडुरास', 'होन्डूरस', 'honduras'];होन्डूरस, उत्तर अमेरिकेंतलो देस आसा। ताची राजधानी टेग्यूसिगॅल्पा नगर आसा। मध्य अमेरीकेंतलो एक ल्हान देश.
political-geographic-object;['ग्वाटेमाला', 'guatémala'];ग्वाटेमाला, उत्तर अमेरिकेंतलो देस आसा। ताची राजधानी ग्वाटेमाला सिटी नगर आसा।
political-geographic-object;['कोस्टा रिका'];कोस्टा रिका, उत्तर अमेरिकेंतलो देस आसा। ताची राजधानी सण जोसे नगर आसा।
political-geographic-object;['हंगेरी'];हंगेरी, एरोपांतलो देस आसा। ताची राजधानी बुडापेस्ट नगर आसा।मध्य युरोपांतलो चारयवाटांनी जमनीन एक ल्हान देश.क्षेत्रफळ 93,032 चौ.
political-geographic-object;['पोलंड'];पोलंड, एरोपांतलो देस आसा। ताची राजधानी वॉर्सा नगर आसा।
political-geographic-object;['बुरुंडी', 'burundí'];बुरुंडी, अफ्रीकांतलो देस आसा। ताची राजधानी बुजंबुरा नगर आसा।
political-geographic-object;['सोमालिया'];सोमालिया, अफ्रीकांतलो देस आसा। ताची राजधानी मोगादिशू नगर आसा।
political-geographic-object;['व्हिएतनाम', 'vietnam'];व्हिएतनाम, आशीयांतलो देस आसा। ताची राजधानी हॅनोइ नगर आसा।
political-geographic-object;['व्हिएतनाम', 'vietnam'];….
political-geographic-object;['लिबिया'];लिबिया, अफ्रीकांतलो देस आसा। ताची राजधानी ट्रिपोली नगर आसा।
political-geographic-object;['जर्मनी'];जर्मनी, एरोपांतलो देस आसा। ताची राजधानी बर्लिन नगर आसा।
political-geographic-object;['सुदान', 'सुडान', 'sudan'];सुडान, अफ्रीकांतलो देस आसा। ताची राजधानी खारटॉम नगर आसा।
political-geographic-object;['मिस्र', 'ईजिप्त', 'इजिप्त'];.
political-geographic-object;['गयाना'];गयाना, दक्षिण अमेरिकेंतलो देस आसा। ताची राजधानी जॉर्जटाउन नगर आसा।
political-geographic-object;['सूरीनाम'];सूरीनाम, दक्षिण अमेरिकेंतलो देस आसा। ताची राजधानी पारामारिबो नगर आसा।
political-geographic-object;['व्हेनेझुएला', 'व्हॅनेझुएला'];व्हेनेझुएला, दक्षिण अमेरिकतलो देश आसा.
political-geographic-object;['algeria', 'आल्जेरिया'];आकाराचे नदरेन आफ्रिका खंडांतलें दुसरें व्हडलें राश्ट्र.
political-geographic-object;['algeria', 'आल्जेरिया'];Akarache nodren afrika khonddantolem dusrem vhoddlem raxttr.
political-geographic-object;['भारत', 'dn/भारत'];भारत हो जगांतलो सगळ्यांत व्हड लोकशाय-प्रधान देश.
political-geographic-object;['इटली'];इटली, एरोपांतलो देस आसा। ताची राजधानी रोम नगर आसा।
political-geographic-object;['चिली'];चिली, दक्षिण अमेरिकेंतलो देस आसा। ताची राजधानी सॅंटियागो नगर आसा।चिलीः रिपब्लिका दे चिली.
political-geographic-object;['पराग्वे'];पराग्वे, दक्षिण अमेरिकेंतलो देस आसा। ताची राजधानी आसुन्सियोन नगर आसा।
political-geographic-object;['इंडोनेशिया'];आगनेय आशियांतलें कितल्याशाच जुंव्यांचें एक प्रजासत्ताक राश्ट्र.
political-geographic-object;['ग्रीस', 'यूनान'];ग्रीस, एरोपांतलो देस आसा। ताची राजधानी अथेन्स नगर आसा।
political-geographic-object;['युक्रेन'];रशियेचे आग्नेयेक आशिल्लो एक देश.
political-geographic-object;['मेक्सिको'];मेक्सिको, उत्तर अमेरिकेंतलो देस आसा। ताची राजधानी मेक्सिको सिटी नगर आसा।
