agentive-physical-object;['mank impalaerel', 'aptenodytes forsteri'];Ar mank impalaerel (Aptenodytes forsteri) a zo un evn dic'houest da nijal, brosezat en Antarktika.
agentive-physical-object;["delfin c'hwezher", 'tursiops truncatus'];An delfin c'hwezher (Tursiops truncatus) a zo ur morvil dantek.
agentive-physical-object;['geotyar vras', 'tympanuchus cupido', 'tympanuchus cupido pinnatus'];Ar c'heotyar vras (liester: geotyer bras) a zo un evn eus kerentiad ar Phasianidae, Tympanuchus cupido pinnatus eo e anv skiantel.
agentive-physical-object;['monotremata', 'monotrem'];Monotremata zo un urzhiad e rummatadur ar bronneged.
agentive-physical-object;['minnie mouse', 'minnie'];Minerva "Minnie" Mouse zo un dudenn tresadennoù-bev ha bannoù-treset ijinet gant Walt Disney.
agentive-physical-object;['louarn arktik', 'alopex', 'alopex lagopus', 'vulpes lagopus', 'vulpex lagopus'];Al Louarn Arktik (Vulpes lagopus pe Alopex lagopus) a zo ul louarn hag a vev e rannvedoù yen an hantervoul norzh.
agentive-physical-object;['trochilidae', 'evned-kelien', 'evnedigoù-lufr', 'evn-kelien', 'trochiliformes'];Kerentiad an Trochilidae zo ennañ 328 spesad evnedigoù-lufr, evned-kelien, pe kolibried.
agentive-physical-object;['krank-meskl', 'pinnotheres pisum'];Ar c'hrank-meskl (Pinnotheres pisum) a zo ur c'hresteneg bihan hag a vev er meskl, en istr pe e daougleureged all.
agentive-physical-object;['bombina'];Bombina zo ur genad e rummatadur an divelfenneged, ennañ tousegi eus Eurazia.
agentive-physical-object;['pangolin', 'pangolined', 'manidae', 'manis', 'pholidota'];Ar pangolined zo bronneged dizant eus Afrika hag Azia.
agentive-physical-object;['bezv-melen', 'betula alleghaniensis'];Bezv-melen (Betula alleghaniensis) a zo gwez eus reter Norzhamerika e-touez kerentiad ar Betulaceae.
agentive-physical-object;['phoeniculidae'];Phoeniculidae a zo ur c'herentiad e rummatadur an evned, termenet e 1831 gant an evnoniour gall Charles Lucien Bonaparte.
agentive-physical-object;['motmot', 'momotidae'];Ar motmoted(Daveoù a vank) eo an evned a ya d'ober ar c'herentiad Momotidae, termenet e 1840 gant al loenoniour saoz George Robert Gray (1808-1872).
agentive-physical-object;['jakamar', 'galbulidae'];Ar jakamared(Daveoù a vank) eo an evned a ya d'ober ar c'herentiad Galbulidae, termenet e 1825 gant al loenoniour iwerzhonat Nicholas Aylward Vigors (1785-1840).
agentive-physical-object;['agave'];Marteze emoc'h o klask Agaue.
agentive-physical-object;['orthotomus'];Orthotomus a zo ur genad e rummatadur an evned, krouet e 1821 gant an naturour stadunanat Thomas Horsfield.
agentive-physical-object;['psophia crepitans'];Psophia crepitans a zo ur spesad e-touz ar c'hwec'h a ya d'ober kerentiad ar Psophiidae.
agentive-physical-object;['kañval baktria', 'camelus bactrianus', 'kañval'];Kañval Baktria (Camelus bactrianus diouzh e anv skiantel), pe kañval alies hepmuiken, a vez graet eus spesad kañvaled Kreizazia, eus ar genad Camelus.
agentive-physical-object;['moustik', 'culicidae'];Ar moustiked zo amprevaned eus kerentiad ar Culicidae.
agentive-physical-object;['psittaciformes'];Psittaciformes a zo un urzhiad e rummatadur an evned, ennañ ar perokidi, ar c'hrakperokidi hag ar c'haketoued.
agentive-physical-object;['testudinidae'];Testudinidae zo ur c'herentiad e rummatadur ar stlejviled, ennañ baoted.
agentive-physical-object;['koadyar frezennek', 'bonasa umbellus', 'tetrastes umbellus'];Ar goadyar frezennek (liester: koadyer frezennek) a zo un evn hag a vev er c'hoadoù.
agentive-physical-object;['boa'];Ur boa , pe boa mouger (boa constrictor e latin hag e meur a yezh), zo un naer vras, divinim, debrerez-kig, eus Amerika.
agentive-physical-object;['kangourou gris ar reter', 'macropus giganteus'];Kangourou gris ar reter (Macropus giganteus) a zo ur bronneg geotdebrer godellek hag a vev e su ha reter Aostralia.
agentive-physical-object;['deutsche dogge'];Deutsche Dogge zo anv ur ouenn chas alaman eus ar re vrasañ.
agentive-physical-object;["platan-ar-c'hornôg"];Platan-ar-C'hornôg (Platanus occidentalis) a zo gwez a-orin eus Norzhamerika.
agentive-physical-object;['paun', 'paün'];Ar paun zo un evn eus ar c'herentiad Phasianidae.
agentive-physical-object;["gwaz-alarc'h", 'anser cygnoides'];Ar waz alarc'h (Anser cygnoides) a zo un evn palvezek.
agentive-physical-object;["c'hwezher bitous", 'kogia simus'];Ar c'hwezher bitous (Kogia simus pe Kogia sima) a zo ur morvil dantek.
agentive-physical-object;['compsognatus', 'compsognathus', 'kompsognatus'];Campsognathus (anv hag a dalvez karvan fin) a oa un dinosaor bihan.
agentive-physical-object;['tragulidae'];Tragulidae a zo ur c'herentiad e rummatadur ar bronneged.
agentive-physical-object;['polioptilidae'];Polioptilidae a zo ur c'herentiad e rummatadur an evned, ennañ spesadoù hag a vev en Amerika.
agentive-physical-object;['kaplañsenn', 'kaplañs', 'mallotus villosus'];Ar gaplañsenn (Mallotus villosus) a zo ur pesk mor hag a vev e hanternoz meurvor Atlantel ha meurvor Arktek.
agentive-physical-object;['lann-gallek'];Lann-gallek (Ulex europaeus) a zo plant e-touez kerentiad ar Fabaceae.
agentive-physical-object;['beked', 'esox lucius'];Ar beked (Esox lucius), liester: bekeded, a zo ur pesk dour dous kigdebrer hag a vev en Eurazia hag en Amerika an norzh, en takadoù kerreizh.
agentive-physical-object;['soner', 'lamna nasus'];Ar soner (Lamna nasus) zo ur pesk migornek kar d'ar rinkin.
agentive-physical-object;['klujar-spagn', 'klujar-spagn voutin', 'numida meleagris', 'numididae', 'numida'];Ar c'hlujiri-Spagn eo an evned a ya d'ober ar c'herentiad Numididae, termenet e 1842 gant ar politikour ha skiantour belgiat Edmond de Sélys Longchamps (1813-1900).
agentive-physical-object;['klujar-spagn', 'klujar-spagn voutin', 'numida meleagris', 'numididae', 'numida'];Ar glujar-Spagn voutin a zo un evn, Numida meleagris an anv skiantel anezhañ.
agentive-physical-object;['kourlan', 'aramidae', 'aramus guarauna', 'aramus'];Ar c'hourlan (Aramus guarauna) a zo un evn hirc'harek eus Amerika.
agentive-physical-object;['spanell', 'platalea', 'plataleinae'];Ar spanelled eo evned ar genad Platalea, krouet e 1758 gant an naturour svedat Carl von Linné.
agentive-physical-object;['ibiz', 'threskionithinae'];An ibized zo evned hirc'harek, kromm o figos, hag a ya d'ober an darn vrasañ eus ar c'herentiad Threskiornithidae.
agentive-physical-object;['evn', 'labous', 'aves', 'evned', 'evnez', 'loen-nij'];An evned (pe laboused) zo loened mellkeinek pluek hag askellek.
agentive-physical-object;['skaseg roudennek', 'skaseg gouriz du', 'cladorhynchus', 'cladorhynchus leucocephalus'];Ar Skaseg gouriz du (liester: Skaseged gouriz du), pe Skaseg roudennek(Daveoù a vank), a zo un evn hirc'harek, Cladorhynchus leucocephalus an anv skiantel anezhañ.
agentive-physical-object;['gwaz', 'gway'];Ar gwazi, pe gwazied (distaget "gwayed" ha skrivet «gwaied» a-wechoù) a zo evned bras, hag a vez savet spesadoù 'zo evit o debriñ.
agentive-physical-object;['speg jave ruz', 'sphyrapicus ruber'];Ar speg jave ruz(Daveoù a vank) a zo ur spesad evned, Sphyrapicus ruber an anv skiantel anezhañ.
agentive-physical-object;['morvil fanoliek', 'mysticeti'];Ar morviled fanoliek eo ar bronneged a ya d'ober an isurzhiad Mysticeti.
agentive-physical-object;['grived', 'chlorocebus aethiops'];Ar grived (Chlorocebus aethiops) a zo ur marmouz hag a vev e reter Afrika (Soudan, Etiopia, Eritrea ha Djibouti).
agentive-physical-object;["brean-erc'h", 'plectrophenax nivalis'];Ar brean-erc'h (liester : breaned-erc'h) a zo ur spesad golvaneged amprevanetaer ha greundebrer, Plectrophenax nivalis an anv skiantel anezhañ.
agentive-physical-object;['gouelan gwenn', 'pagophila eburnea', 'pagophila'];Ar Gouelan gwenn a zo un evn mor.
agentive-physical-object;['kaketou roz', 'cacatua leadbeateri', 'lophochroa', 'lophochroa leadbeateri'];Ar c'haketou roz (liester : kaketoued roz) a zo ur spesad evned, Lophochroa leadbeateri (Cacatua leadbeateri kent) an anv skiantel anezhañ.
agentive-physical-object;['arzh gwenn', 'ursus maritimus'];An arzh gwenn (Ursus maritimus) a zo un arzh arktikel.
agentive-physical-object;['kaketou kupenn aour', 'cacatua galerita'];Ar c'haketou kupenn aour (liester : kaketoued kupenn aour) a zo ur spesad evned, Cacatua galerita an anv skiantel anezhañ.
agentive-physical-object;['gouelan bras', 'larus marinus'];Ar Gouelan bras (liester: Gouelini bras) a zo un evn-mor, Larus marinus an anv skiantel anezhañ.
agentive-physical-object;['kaketou', 'cacatuidae'];Ar c'haketoued eo an evned a ya d'ober ar c'herentiad Cacatuidae hag a voe termenet e 1840 gant al loenoniour saoz George Robert Gray (1808-1872).
agentive-physical-object;['merien-gwenn', 'termitenn'];Amprevaned debrer-koad eo ar merien-gwenn a vez anvet termit ivez.
agentive-physical-object;['baot lêrek', 'dermochelys coriacea'];Ar vaot lêrek (Dermochelys coriacea) eo ar vaot vor vrasañ er bed.
agentive-physical-object;['roumarin', 'rosmarinus officinalis', 'rosmari'];Ar roumarin, pe rosmari, pe rosmair, Rosmarinus officinalis o anv skiantel, a zo gwezigoù frondus, dezho delioù padus ha bleunioù glas melus.
agentive-physical-object;['ach', 'apium graveolens'];An ach (Apium graveolens anv skiantel ar spesad) a zo plant geotennek daouvloaziek eus ar c'herentiad Apiaceae.
agentive-physical-object;['narcissus jonquilla', 'boked-laezh-ribod'];Arabat droukveskañ gant ar boked-laezh.
agentive-physical-object;['sourd-tigr', 'ambystoma tigrinum'];Ar sourd-tigr (Ambystoma tigrinum) a zo un divelfenneg lostek hag a vev e Stadoù-Unanet Amerika, Kanada ha Mec'hiko.
agentive-physical-object;['oroñjez', 'oroñj'];An oroñjez zo ur spesad Fungi mat da zebriñ, Amanita caesarea an anv skiantel anezhañ.
agentive-physical-object;['heskenneg kuch', 'mergus serrator'];An heskenneg kuch a zo un evn palvezek, Mergus serrator an anv skiantel anezhañ.
agentive-physical-object;["minoc'h-dour", 'neomys fodiens'];Ar minoc'h-dour (Neomys fodiens) a zo ur bronneg bihan eus Eurazia.
agentive-physical-object;['geot gallek'];Ar geot gallek (Dactylis glomerata L.), a zo geot hir, eus kerentiad ar poaceae, boutin tre e pradennoù Europa ha Afrika an Norzh met ivez Amerika an Norzh, Aostralia ha Zeland Nevez ma oa bet emporzhiet.
agentive-physical-object;['kiang', 'equus kiang'];Ar c'hiang (Equus kiang) a zo ur bronneg karnek hag a vev en India, Sina, Tibet, Pakistan ha Nepal.
agentive-physical-object;['houad-korz', 'anas platyrhynchos'];An houad-korz (liester : houidi-korz) a zo ur spesad evned palvezek, Anas platyrhynchos an anv skiantel anezhañ.
agentive-physical-object;['louarn debrer-kranked', 'cerdocyon thous', 'louarn debrer a granked'];Al louarn debrer-kranked (Cerdocyon thous) a zo ur bronneg eus kerentiad ar c'hieged krenn e vent hag a vev e kreiz Suamerika.
agentive-physical-object;['turzhunell drist', 'zenaida macroura'];An durzhunell drist a zo ur spesad evned, Zenaida macroura an anv skiantel anezhañ.
agentive-physical-object;["kragvouc'h an alpoù", 'kragvouc’h an alpoù', 'capra ibex'];Kragvouc'h an Alpoù (Capra ibex) a zo ur bronneg daskirier hag a vev en Europa.
agentive-physical-object;["marc'h przewalski", 'equus przewalskii'];Marc'h Przewalski, marc'h Prjevalski, zo ur spesad pe un isspesad kezeg gouez tost-kenañ d'ar spesad Equus caballus.
agentive-physical-object;['gwanako', 'lama guanicoe'];Ar gwanako (Lama guanicoe) a zo ur bronneg gouez hag a vev e Suamerika (Chile, Arc'hantina, Paraguay, Bolivia ha Perou).
agentive-physical-object;['lama', 'lama glama'];Al lamaed a zo ur spesad bronneged doñv eus Suamerika, Lama glama an anv skiantel anezhañ.
agentive-physical-object;['gaur', 'bos gaurus'];Ar gaur (Bos gaurus) a zo ur bronneg daskirier hag a vev e su ha gevred Azia.
agentive-physical-object;['banteng', 'bos javanicus'];Ar banteng (Bos javanicus) a zo ur bronneg daskirier hag a vev e gevred Azia.
agentive-physical-object;['aoudad', 'ammotragus lervia', "bouc'h barbaria", 'ammotragus'];An aoudad pe bouc'h Barbaria (Ammotragus lervia) a zo ur bronneg daskirier hag a vev e Norzhafrika.
agentive-physical-object;['argali', 'ovis ammon'];An argali (Ovis ammon) a zo ur bronneg daskirier kar d'an dañvad hag a vev e kreiz Azia.
agentive-physical-object;['debrer-merien'];An debrer-merien zo un amprevan a denn d'an nadoz-aer.
agentive-physical-object;['laou'];Laou zo amprevaned munut ha diaskell a vev e blev al loened hag an dud.
agentive-physical-object;['dingo', 'canis lupus dingo'];An dingo (Canis lupus dingo) a zo ur c'hi doñv distroet d'ar stad gouez kantvedoù ’zo.
agentive-physical-object;['karkajou', 'kargloud', 'gulo', 'gulo gulo'];Ar c'hargloud (Gulo gulo) zo ur bronneg bras eus kerentiad ar Mustelidae.
agentive-physical-object;['kazeg-koad', 'ebeul-koad', 'picus viridis', 'speg gwer'];Ar gazeg-koad, pe ebeul-koad, pe speg gwer, a zo un evn eus kerentiad ar speged.
agentive-physical-object;['dañvad', 'deñved', 'dañvadez', 'ovis aries'];Ur bronneg daskirier doñv eus ar c'herentiad Bovidae, anv spesad Ovis aries eo an dañvad (liester : deñved).
agentive-physical-object;['leue'];Hini bihan ar vuoc'h hag an tarv eo al leue (liester : leueoù).
agentive-physical-object;['oan'];Un oan eo an anv a vez graet eus un dañvad bihan, ganet eus un dañvadez hag ur maout.
agentive-physical-object;['roudenneg grévy', 'equus grevyi'];Roudenneg Grévy (Equus grevyi) a zo ur bronneg karnek hag a vev en Afrika (Kenya hag Ethiopia).
amount-of-matter;['trenkenn sulfurek'];An drenkenn sulfurek zo ul lieselfenn gimiek pistrius.
amount-of-matter;['timin', 'thymine'];An timin zo un nukleobazenn implijet e sintezenn ar proteinoù p'eo un elfenn eus an TDN.
amount-of-matter;['sitozin', 'cytosine'];Ar sitozin zo un nukleobazenn implijet e sintezenn ar proteinoù p'eo un elfenn eus an TDN.
amount-of-matter;['kafe', 'dourgafe'];Ar c'hafe zo ur blantenn, ur vrousgwezenn eus ar genad Coffea hag a ro greun, ha gant ar greun-se e vez graet un evaj hag a zo dezhañ efedoù bredoberiant.
amount-of-matter;['sistr', 'chistr', 'dourchistr'];Ar sistr (pe chistr) a zo un died alkoolek fardet gant chug avaloù goet.
amount-of-matter;['europiom', 'eu'];Un elfenn gimiek eo an europiom . Eu eo e arouez kimiek, 63 e niver atomek ha 151,964 e dolz atomek.
amount-of-matter;['zink', 'zn'];Ar zink a zo un elfenn gimiek hag ur metal trañzitadur.
amount-of-matter;['germaniom', 'г', 'ge'];Un elfenn gimiek eo ar germaniom . Ge eo e arouez kimiek, 32 e niver atomek ha 72,64 e dolz atomek.
amount-of-matter;['telluriom', 'te'];An telluriom a zo un elfenn gimiek.
amount-of-matter;['dour', 'h₂o'];Ul liñvenn dreuzwelus, diliv, dic'hwezh ha divlaz eo an dour (liester : dourioù, doureier).
amount-of-matter;['argon', 'ar'];An argon a zo un elfenn gimiek, Ar eo e arouez kimiek ha 18 e niver atomek.
amount-of-matter;['kripton', 'kr'];Ar c'hripton a zo un elfenn gimiek, Kr eo e arouez kimiek ha 36 e niver atomek.
amount-of-matter;['ozon'];An ozon a zo stumm triatomek an oksigen, dezhañ O2 e formulenn gimiek.
amount-of-matter;['mezcal'];Ar mezcal zo anv nahouatlek plant eus dezerzhioù hanternoz Mec'hiko, ur seurt agavez, hag un evaj a vez graet diwar lambigañ chug ar frouezh, e stadoù Oaxaca, Tamaulipas, Durango ha Guerrero.
amount-of-matter;['metan'];Ar metan zCH4
amount-of-matter;['neon', 'ne'];An neon a zo un elfenn gimiek hag ur gaz rouez.
amount-of-matter;['klor', 'cl'];Ar c'hlor a zo un elfenn gimiek.
amount-of-matter;['nitrogen', 'azot', 'n'];An nitrogen, pe azot, a zo un elfenn gimiek, N eo e arouez, 7 eo e niver atomek ha 14,00674 u e vas atomek.
amount-of-matter;['hal'];E kimiezh e vez lavaret eo un hal (liester halioù) un danvez neptu hag hep karg kimiek ebet, stummet gant anionoù ha kasionoù.
amount-of-matter;['teknetiom', 'tc'];Un elfenn gimiek eo an teknetiom . Tc eo e arouez kimiek, 43 e niver atomek ha 98 e dolz atomek.
amount-of-matter;['eoul-maen', 'petrol', 'tireoul'];An eoul-maen, pe tireoul pe petrol, a zo ul liñvenn zu pe c'hell-du kavet e reier splu.
amount-of-matter;['keriom', 'seriom', 'ce'];Arabat eo droukveskañ gant Keziom 55Cs !
amount-of-matter;['kouevr', 'cu'];Ar c'houevr a zo ur metal, hag un elfenn gimiek.
amount-of-matter;['gadoliniom', 'gd'];Un elfenn gimiek eo ar gadoliniom . Gd eo e arouez kimiek, 64 e niver atomek ha 157,250 e dolz atomek.
amount-of-matter;['sistr per'];Ar sistr per a zo un died alkoolek fardet gant chug per.
amount-of-matter;['samariom', 'sm'];Un elfenn gimiek eo ar samariom . Sm eo e arouez kimiek, 62 e niver atomek ha 150,36 e dolz atomek.
amount-of-matter;['hafniom', 'hf'];Un elfenn gimiek eo an hafniom . Hf eo e arouez kimiek, 72 e niver atomek ha 178,49 e dolz atomek.
amount-of-matter;['osmiom', 'osmium'];Un elfenn gimiek eo an osmiom . Os eo e arouez kimiek, 76 e niver atomek ha 190,23 e dolz atomek.Ur metal ardreuzat eo.
amount-of-matter;['krom', 'cr'];Ar c'hrom a zo un elfenn gimiek.
amount-of-matter;['manganez', 'mn'];Ar manganez a zo un elfenn gimiek.
amount-of-matter;['kobalt', 'co'];Ar c'hobalt a zo un elfenn gimiek.
amount-of-matter;['tantalom', 'tantal', 'ta'];Un elfenn gimiek eo an tantalom . Ta eo e arouez kimiek, 73 e niver atomek ha 180,948 e dolz atomek.
amount-of-matter;['nikel', 'ni'];An nikel a zo un elfenn gimiek.
amount-of-matter;['bismut'];Un elfenn gimiek eo ar bismut . Bi eo e arouez kimiek, 83 e niver atomek ha 208,98 e dolz atomek.
amount-of-matter;['iridiom'];Un elfenn gimiek eo an iridiom . Ir eo e arouez kimiek, 77 e niver atomek ha 192,217 e dolz atomek.
amount-of-matter;['wolfram', 'tungsten'];Un elfenn gimiek eo ar wolfram . W eo e arouez kimiek, 74 e niver atomek ha 183,84 e dolz atomek.
amount-of-matter;['platin', 'pt'];Un elfenn gimiek eo ar platin . Pt eo e arouez kimiek, 78 e niver atomek ha 195,084 e dolz atomek.
amount-of-matter;['merkur', 'bevargant', "arc'hant-bev"];Ar bevargant , anvet merkur ivez, a zo un elfenn gimiek.
amount-of-matter;['uraniom', 'u'];An uraniom a zo un elfenn gimiek.
amount-of-matter;['guinness'];Guinness (distaget [ɡɪnɨs] e saozneg) a zo ur bier brudet eus Iwerzhon ijinet e 1759 gant Arthur Guinness (1725-1803) en e vreserezh eus Geata San Séamais e Dulenn.
amount-of-matter;['everglades'];An Everglades zo un tolead naturel hag ur c'heun drovanel e kreisteiz Florida e SUA. Pa-hay-okee a lavare an indianed Calusa, kentañ broiz an ardremez, eus o bro, ma vevjont e-pad ouzhpenn 2 000 bloaz a-raok donedigezh ar Spagnoled er XVIvet kantved.
amount-of-matter;['magneziom', 'magnesiom', 'mg'];Ar magneziom a zo un elfenn gimiek.
amount-of-matter;['potasiom', 'k', 'kaliom'];Ar potasiom pe kaliom a zo un elfenn gimiek, K eo e arouez kimiek (diwar an anv nevezlatin Kalium) ha 19 e niver atomek.
amount-of-matter;['beriliom', 'be'];Ar beriliom a zo un elfenn gimiek.
amount-of-matter;['titaniom', 'titan', 'ti'];Un elfenn gimiek eo an titaniom . Ti eo e arouez kimiek, 22 e niver atomek ha 47,867 e dolz atomek.
amount-of-matter;['zirkoniom', 'zr'];Un elfenn gimiek eo ar zirkoniom . Zr eo e arouez kimiek, 40 e niver atomek ha 91,224 e dolz atomek.
amount-of-matter;['antimon', 'sb', 'stibiom'];An antimon, pe stibiom, a zo un elfenn gimiek.
amount-of-matter;['terbiom', 'tb'];Un elfenn gimiek eo an terbiom . Tb eo e arouez kimiek, 65 e niver atomek ha 158,925 e dolz atomek.
amount-of-matter;['fosfor', 'p'];Ar fosfor a zo un elfenn gimiek.
amount-of-matter;['oksigen', 'o', 'oksijen'];An oksigen zo un elfenn gimiek hag a aparchant da skourr ar c'halkogenoù, 8 eo he niver atomek hag O hec'h arouez.
amount-of-matter;['iod', 'i'];An iod a zo un elfenn gimiek.
amount-of-matter;['brom', 'br'];Un elfenn gimiek eo ar brom . Br eo e arouez kimiek, 35 e niver atomek ha 79,904 e dolz atomek.
amount-of-matter;['hidrogen', 'h'];An hidrogen a zo un elfenn gimiek, H eo e arouez kimiek hag 1 e niver atomek.
amount-of-matter;['fluor', 'f'];Ar fluor a zo un elfenn gimiek.
amount-of-matter;['trenkenn dezoksiribonukleek', 'adn', 'dna', 'tdn', 'trenkenn dizoksiribonukleek'];An drenkenn dezoksiribonukleek (berraet e TDN) zo ur volekulenn a gaver en holl vevien.
amount-of-matter;['trenkenn ribonukleek', 'trn'];An drenkenn ribonukleek (TRN) zo ur polimer damheñvel ouzh an drenkenn dizoksiribonukleek (TDN) ken evit a sell he framm, ken evit a sell he c'hefridi (Ober war-dro an titouroù genetek ha reiñ korf dezhe).
amount-of-matter;['molibden', 'mo'];Un elfenn gimiek eo ar molibden . Mo eo e arouez kimiek, 42 e niver atomek ha 95,96 e dolz atomek.
amount-of-matter;['gluten'];Ar gluten zo un hollad proteinoù a vez adkavet e kalz greun ed.
amount-of-matter;['guanin', 'guanine'];Ar guanin zo un nukleobazenn implijet e sintezenn ar proteinoù p'eo un elfenn eus an TDN.
amount-of-matter;['aktiniom', 'ac'];Un elfenn gimiek eo an aktiniom . Ac eo e arouez kimiek, 89 e niver atomek ha 227,028 e dolz atomek.
amount-of-matter;['frankiom', 'frañsiom'];Un elfenn gimiek eo ar frankiom . Fr eo e arouez kimiek, 87 e niver atomek ha 223 e mas atomek.
amount-of-matter;['radon'];Un elfenn gimiekeo ar radon, 86 eo e niver atomek hag Rn e arouez.
amount-of-matter;['keziom', 'seziom', 'cs'];Un elfenn gimiek eo ar c'heziom . Cs eo e arouez kimiek, 55 e niver atomek ha 132,905 e dolz atomek.
amount-of-matter;['strontiom', 'sr'];Un elfenn gimiek eo ar strontiom . Sr eo e arouez kimiek, 38 e niver atomek ha 87,62 e dolz atomek.
amount-of-matter;['poloniom'];Un elfenn gimiek eo ar poloniom . Po eo e arouez kimiek, 84 e niver atomek ha 208,982 e dolz atomek.
amount-of-matter;['einsteiniom'];Un elfenn gimiek treuzuraniat skinoberiek eo an einsteiniom . Es eo e arouez kimiek, 99 e niver atomek ha 252,083 e dolz atomek.
amount-of-matter;['nobeliom'];Un elfenn gimiek treuzuraniat skinoberiek eo an nobeliom . No eo e arouez kimiek, 102 e niver atomek ha 259,101 e dolz atomek.
amount-of-matter;['mendeleviom'];Un elfenn gimiek treuzuraniat skinoberiek eo ar mendeleviom . Md eo e arouez kimiek, 101 e niver atomek ha 258,098 e dolz atomek.
amount-of-matter;['lawrensiom', 'laorenciom'];Un elfenn gimiek treuzuraniat skinoberiek eo al lawrensiom . Lr eo e arouez kimiek, 103 e niver atomek ha 262,110 e dolz atomek.
amount-of-matter;['plutoniom', 'pu'];Ar plutoniom a zo un elfenn gimiek.
amount-of-matter;['rutherfordiom'];Un elfenn gimiek eo ar rutherfordiom . Rf eo e arouez kimiek, 104 e niver atomek ha 265,12 e dolz atomek.
amount-of-matter;['berkeliom', 'bk'];Un elfenn gimiek treuzuraniat skinoberiek eo ar berkeliom . Bk eo e arouez kimiek, 97 e niver atomek ha 247,070 e dolz atomek.
amount-of-matter;['kaliforniom'];Un elfenn gimiek treuzuraniat skinoberiek eo ar c'haliforniom . Cf eo e arouez kimiek, 98 e niver atomek ha 251,080 e dolz atomek.
amount-of-matter;['fermiom'];Un elfenn gimiek treuzuraniat skinoberiek eo ar fermiom . Fm eo e arouez kimiek, 100 e niver atomek ha 257,095 e dolz atomek.
amount-of-matter;['amerikiom', 'am'];Un elfenn gimiek treuzuraniat skinoberiek eo an amerikiom . Am eo e arouez kimiek, 95 e niver atomek ha 243,061 e dolz atomek.
amount-of-matter;['neptuniom'];Un elfenn gimiek treuzuraniat skinoberiek eo an neptuniom . Np eo e arouez kimiek, 93 e niver atomek ha 237,048 e dolz atomek.
amount-of-matter;['kuriom', 'cm'];Arabat eo droukveskañ gant' Keriom 58Ce !
amount-of-matter;['reniom', 're'];Un elfenn gimiek eo ar reniom . Re eo e arouez kimiek, 75 e niver atomek ha 186,207 e dolz atomek.
amount-of-matter;['ruteniom', 'ru'];Un elfenn gimiek eo ar ruteniom . Ru eo e arouez kimiek, 44 e niver atomek ha 101,7 e dolz atomek.
amount-of-matter;['galliom', 'galioa', 'ga'];Ar galliom a zo un elfenn gimiek.
amount-of-matter;['indiom', 'in'];An indiom a zo un elfenn gimiek hag ur metal.
amount-of-matter;['nitrat', 'ion nitrat'];An nitrat, hag a oa anvet gwechall-gozh an nitr, hag a oa alies heñvelster da "holen-moger" a zo holenoù an drenkenn nitrek.
amount-of-matter;['protaktiniom'];Un elfenn gimiek skinoberiek eo ar protaktiniom . Pa eo e arouez kimiek, 91 e niver atomek ha 231,036 e dolz atomek.
amount-of-matter;['aluminiom', 'al'];An aluminiom zo un elfenn gimiek, Al eo e arouez kimiek ha 13 e niver atomek.
amount-of-matter;['staen', 'sn'];Ar staen a zo un elfenn gimiek hag ur metal.
amount-of-matter;['itriom', 'y'];Un elfenn gimiek eo an itriom . Y eo e arouez kimiek, 39 e niver atomek ha 88,906 e dolz atomek.
amount-of-matter;['sodiom', 'natriom', 'na'];Ar sodiom pe natriom a zo un elfenn gimiek hag ur metal alkalin.
amount-of-matter;['histon'];An histon eo ar protein pennañ er c'hromatin.
amount-of-matter;['eoul'];An eoul zo un dourenn druz ha helosk, ha na c'hall ket dileizhañ en dour.
amount-of-matter;['palladiom', 'pd'];Un elfenn gimiek eo ar palladiom . Pd eo e arouez kimiek, 46 e niver atomek ha 106,42 e dolz atomek.
amount-of-matter;['kadmiom', 'cd'];Ar c'hadmiom a zo un elfenn gimiek.
amount-of-matter;['niobiom', 'cb', 'nb'];Un elfenn gimiek eo an niobiom, a zo bet anvet kolombiom ivez . Nb eo e arouez kimiek, 41 e niver atomek ha 92,906 e dolz atomek.
amount-of-matter;['taliom', 'talliom'];An talliom ), a zo un elfenn gimiek.
amount-of-matter;['plom', 'pb'];Ar plom a zo un elfenn gimiek, Pb eo e arouez kimiek ha 82 e niver atomek.
amount-of-matter;['keziom', 'seziom', 'cs'];Un elfenn gimiek eo ar c'heziom . Cs eo e arouez kimiek, 55 e niver atomek ha 132,905 e dolz atomek.
amount-of-matter;['strontiom', 'sr'];Un elfenn gimiek eo ar strontiom . Sr eo e arouez kimiek, 38 e niver atomek ha 87,62 e dolz atomek.
amount-of-matter;['litiom', 'li'];Al litiom a zo un elfenn gimiek.
amount-of-matter;['bariom', 'ba'];Un elfenn gimiek eo ar bariom . Ba eo e arouez kimiek, 56 e niver atomek ha 137,327 e dolz atomek.
amount-of-matter;['rubidiom', 'rb', 'rubiom'];Un elfenn gimiek eo ar rubidiom . Rb eo e arouez kimiek, 37 e niver atomek ha 85,468 e dolz atomek.
amount-of-matter;['prometiom', 'pm'];Un elfenn gimiek eo ar prometiom . Pm eo e arouez kimiek, 61 e niver atomek ha 144,913 e dolz atomek.
amount-of-matter;['tuliom', 'tm'];Arabat eo droukveskañ Tuliom 69Tm gant Talliom 81Tl pe gant Toriom 90Th !
