region;['tonenn', 'gg', 'kt', 'mg', 't'];An donenn (simbol: t) a zo un unanenn vas kevatal gant 1 000 kilogram.
region;['poezell', 'bushel'];Ur boezell zo un endalc'her kranennek graet evit muzuliañ greun pe vleud.
region;['niver feurek'];Un niver feurek zo, e jedoniezh, un niver hag a c'hell en em ezgeriañ evel rannad daou kevan daveel.
region;['niver kentael', 'niveroù kentael'];Niver kentael a reer e matematikoù eus un niver anterin muiel en deus rik daou ranner diforc'h, anterin ha muiel – a zo neuze 1 hag eñ e-unan.
region;['lev', 'kardlev'];Un unanenn hed kozh eo al lev (reizh benel, liester levioù, eus al latin leuca deuet eus ar galianeg).
region;['kevan daveel'];Ur c'hevan daveel zo un niver kevan (eleze hep parzh rannel) ha muiel (
region;['dilestradeg normandi', '6 a viz even 1944', 'devezh d', 'dilestradeg ar 6 a viz mezheven 1944', 'oberiadenn neptune'];An Oberiadenn Neptune eo an anv-kod roet d’an dilestradeg en Normandi gant armeoù ar Re Unanet e-kerzh an Eil Brezel-bed e-pad Oberiadur brezel Overlord.
region;['pengő'];Ur moneiz hungarat kozh eo ar pengő.
region;['kilogramm', 'hg', 'kg', 'mg', 'tg', 'kilogram'];Ar c'hilogramm (simbol: kg) eo an unanenn SI diazez evit ar mas.
region;['amper'];An amper (simbol A) eo an unanenn SI evit fonnder an tredan.
region;['metr', 'm', 'kilometr', 'kilometrad', 'metrad'];Ar metr (simbol : m) eo unanenn diazez hirder ar sistem etrebroadel.
region;['candela', "c'handela"];Ar c'handela (simbol: cd) eo unanenn SI ar c'hreñvder gouloù (galloudezh merzhet embannet gant un andon gouloù en un durc'hadur bennak).
region;['lek'];Al lek eo unanenn voneiz Albania, krouet e 1926.
region;['kwanza'];Ar c'hwanza eo unanenn voneiz Angola, kognet goude dizalc'hiezh ar vro e plas an escudo.
region;['pula'];Ar pula (kod bank : BWP) eo unanenn voneiz Botswana abaoe 1976.
region;['lur kiprenez'];Lur Kiprenez, anvet ivez en un doare nann-ofisiel Lira Kiprenez (eus a latin lira, gresianeg λίρα / lies.
region;['lur djibouti'];Lur Djibouti eo unanenn voneiz ofisiel Djibouti.
region;['birr'];Ar birr eo unanenn voneiz Etiopia, implijet abaoe 1945.
region;['cedi'];Ar cedi eo unanenn voneiz Ghana abaoe 1965.
region;['lur sterling', 'lur saoz'];Al lur sterling (saozneg: pound sterling), (arouez: £. kod ISO: GBP), anvet alies lur saoz e brezhoneg (dre fazi, pa n'eo nemet unan anezho), eo unanenn voneiz ar Rouantelezh-Unanet, dalc'hidigezhioù ar gurunenn, evel Enez-Vanav ha Jerzenez, hag un nebeud tiriegezhioù tramor.
region;['yen', 'yen japanat'];Ar moneiz japanat ofisiel eo ar yen.
region;['kwacha malawi'];Ar c'hwacha (kod bank : MWK) eo unanenn voneiz Malawi.
region;['peso'];Ar peso a zo anv unanenn voneiz meur a vro eus ar bed spagnolek, bet trevadennoù gwechall eus Bro-Spagn.
region;['kelvin'];Ar c'helvin (simbol K, diwar anv Lord Kelvin) eo unanenn SI an temperadur termodinamikel.
region;['10000', 'dek mil'];10 000 zo un niver, etre an niver 9 999 hag 10 001.
region;['tregont', '30'];30 (tregont) zo
region;['daouzek', 'dousenn', '12', 'dousen'];Daouzek eo an niver etre unnek ha trizek.
region;['daouzek', 'dousenn', '12', 'dousen'];Un dousenn zo un unanenn-vuzuliañ, enni daouzek unanenn.
region;['tri', '3', 'teir'];Tri eo anv brezhonek an niver etre daou ha pevar, a zo skrivet 3, ha teir eo furm wregel (pe benel) ar ger.
region;['daou', '2', 'div'];Daou eo anv brezhonek an niver etre unan ha tri, a zo skrivet 2, ha div eo furm wregel (pe benel) ar ger.
region;['seizh', '7'];Gant ar ger seizh (niver) e tegouezher amañ, evit ar sterioù all, gwelit ar pennad Seizh (disheñvelout).
region;['4', 'pevar', 'pewar'];Pevar eo anv brezhonek an niver etre tri ha pemp, ha peder eo furm wregel (pe benel) ar ger.
region;['bloavezh-gouloù', 'ar bloavezh goulou', 'bloavezh goulou'];== Termenadur ==
region;['mol'];Ar mol (simbol : mol) a zo un unanenn ziazez eus ar sistem etrebroadel a vez graet ganti war dachennoù ar fizik hag ar gimiezh dreist-holl.
region;['milion', '1000000'];Ur milion [miˈliːõn] (1 000 000) eo an niver a deu war-lerc'h nav c'hant naontek mil ha pevar-ugent nav c'hant naontek ha pevar-ugent hag a-raok unan hag ur milion .
region;['niver atomek'];Graet e vez niver atomek (Z) e kimiezh hag e fizik eus an niver a brotonoù a zo e-barzh nukleüs an atomoù.
region;['rann'];Ur rann, pe kevrenn zo ul lodenn pe un toullad lodennoù eus un niver anterin rannet e lodennoù kevatal.
region;['unan', '1'];Unan zo
region;['niver mas', 'niver tolz'];An niver mas, anvet ivez niver mas atomek, eo an niver a brotonoù hag a neutronoù zo e nukleüs an atomoù.
region;['bragoù kapri'];Ar bragoù kapri zo ur bragoù kof-gar, brudet dre ma veze implijet en enez Capri en Italia er bloavezhioù 1950.
region;['deiz', 'deizioù ar sizhun'];An deiz eo ar c'houlzad etre ar sav-heol hag ar c'huzh-heol, etre div noz, da lavaret eo prantadoù teñvalijenn.
region;['gros', '144'];Ur gros zo un unanenn vuzuliañ hag a zo kement ha 12 dousenn.
regulation;['gwirioù mab-den'];Gwirioù Mab-Den zo ur meizad a embanner drezañ ez eus un toullad gwirioù diazez, ha heñvel evit pep den war an douar.
relation;['tu', 'tu yezhadurel'];Er yezhoniezh e vez implijet an termen tu (yezhadurel) pe diatezenn (diwar ar stumm latinekaet diathesis, diwar an henc'hresianeg: diatithenai, "urzhiañ") evit komz eus ur verb en ur frazenn resis hag an doare m'emañ liammet ar stad pe an ober displeget gantañ ouzh arguzennoù ar verb-se, da lâret eo rener yezhadurel ar frazenn, renadenn(où) ar frazenn, hag all.
relation;["argemmvac'henn"];Ar c'hevreizhennoù argemmvac'hel zo ul lodenn a 'n arloadurioù pouezusañ e dezrann, pe en un doare hollekoc'h e jedoniezh pe en domanioù arloadur anezhañ.
relation;['doare-disklêriañ'];Patrom:Doareoù yezhadurel
relation;['doare-sujañ'];Er yezhadur, hag er yezhoniezh, e vez implijet an termen doare-sujañ evit komz eus an doareoù-verb pennañ a dalvez, en un islavarenn, da zeskrivañ un ober pe un darvoud nann-gwirvoudel hervez an hini a zo o komz : het, fromad, gallusted, barnadenn, redienn, pe un ober n'eo ket c'hoarvezet c'hoazh.
relation;['norzh'];Ma klaskit an departamant gall, kit da welout Norzh (departamant).
relation;['su', 'kreistez'];Ar Su a zo unan eus ar pevar avel ha merket eo war an nadoz-vor.
relation;['reter'];Unan eus ar pevar avel eo ar reter pe sav-heol.
relation;['gevred'];Ar Gevred a zo unan eus an eizh avel, rag-enep d'ar Gwalarn emañ hag a-skouer d'ar Mervent en un tu, ha d'ar Biz en un tu all.
relation;['hirder gwagenn'];Hirder gwagenn ur wagenn dredanwarellek prantadek zo an hed ma ya ar gouloù er goullo e-pad an amzer zo etre div gribenn lerc'h-ouzh-lerc'h eus ar wagenn dredanwarellek-se.
relation;['tranzitivelezh'];Er yezhoniezh e vez implijet an termen kevreadurezhel tranzitivelezh
relation;['kenurzhierezh', 'kenlavarenn'];War dachenn ar yezhoniezh hag ar yezhadur dreist-holl e implijer an termen kenurzhierezh pe kenlavarenniñ evit komz eus savadennoù kevrennek ma vez liammet daou gedrann pe muioc'h an eil re ouzh ar re all.
relation;['tu-gra'];Er yezhoniezh e vez implijet an termen tu-gra evit komz eus an tu yezhadurel diazez p'emañ rener yezhadurel ar frazenn graer yezhadurel an ober pe ar stad displeget gant ar verb.
relation;['tu-gouzañv'];Er yezhoniezh e vez implijet an termen tu-gouzañv evit komz eus un tu yezhadurel enebet ouzh an tu-gra.
relevant-part;['regez'];Regez zo glaou ruz, pe glaou-bev, a chom goude un tantad.
relevant-part;["kroc'hen"];Ar c'hroc'hen zo ur gwiskad a c'holo korf an darn vrasañ eus ar mellkeineged, an den en o zouez, koulz ha hini loened all.
relevant-part;['kazel'];Kazel a reeer, er savouriezh, eus lodenn gostez ur savadur bras, rannet un tammig diouzh al lodenn greiz.
relevant-part;['lêr', 'ler'];Lêr (ler ivez alies) a vez graet eus kroc'hen al loened a vez implijet, goude kivijañ, da ober botoù, seier, ha dilhadoù zo.
relevant-part;['mourroù'];Ar mourroù eo ar blev a gresk war ar vuzell uhelañ, dindan fri un den, hag a c'hall diskenn a bep tu d'ar genoù.
relevant-part;['kivij'];Kivij zo poultr aozet diwar rusk ar gwez-derv hag a dalvez d'ar givijerien da ober lêr gant ar c'hrec'hin loened.
relevant-part;['leuegen'];Al leuegen a vez graet eus kroc'hen ul leue.
relevant-part;['blev-gaol'];Ar blev-gaol eo ar blev a zo e gaol an dud, a-wechoù e krec'h o garbedenn.
relevant-part;['maoutken aour', 'krisomallos', 'krisomalos', 'maoutgen aour', "c'hrysomallos"];Ar maoutken aour, e mojennoù Hellaz kozh, eo kroc'hen ha kreoñ ar maout askellek C'hrysomallos.
relevant-part;['begel'];Ar begel, anvet ivez bouton-kof (pe umbilicus hervez al latin) zo ur gleizenn graet e kof ar vugale nevez-c'hanet pa vez troc'het kordenn ar begel.
relevant-part;['abrant'];An abrantoù (pe ambrantoù), pe daouabrant, pe divabrant, eo ar blev a zo e traoñ tal un den, a-us d'an daoulagad, hag a dalv da ziwall anezho diouzh an dour-c'hwez, an heol pe ar glav .
relevant-part;['feur', 'blev'];Ar blev zo ur seurt feur, pe foulinenn, a c'holo korf an dud, pe lodennoù anezhañ, ha hini loened zo.
relevant-part;['ezrelegenn'];Emañ an ezrelegennoù da vezañ enebet ouzh ar relegennoù diabarzh.
relevant-part;['barv', 'baro', 'barveg', 'barvek', "blouc'h"];Ar barv a vez graet eus ar blev ouzh dremmoù an dud, ouzh an divjod, hag ouzh an elgezh (pe ar groñj).
relevant-part;['plu', 'pluñv', 'pluenn', 'pluek'];Plu, pe pluñv, eo ar pezh a c'holo korf an evned.
relevant-part;['periant'];Ar periant (eus ar c'hembraeg periant, a dalv kement ha “mekanik”) eo hollad an elfennoù kalvezel a dalvez da geweriañ ar stlennoù e mod pe vod.
relevant-part;['gourizad asteroidennoù'];Ar Gourizad asteroidennoù a zo un dachenn e Koskoriad an Heol etre kelc'htro Meurzh ha hini Yaou.
relevant-part;['talar-tro'];Un talar-tro zo ur benveg implijet gant kilvizien d'ober toulloù er c'hoad.
simple-collection;['steredeg'];Ur steredeg zo ur strollad stered hag a weler tost a-walc'h an eil re d'ar re all e bolz an oabl.
simple-collection;['toucher'];An Toucher zo ur steredeg eus an hantervoul norzh.
simple-collection;["den-marc'h"];An Den-Marc'h (Centaurus, berraet e Cen) zo ur steredeg eus an hantervoul su.
simple-collection;['ki bihan'];Ar C'hi Bihan (Canis Minor, berraet e CMi) zo ur steredeg eus an hantervoul norzh.
simple-collection;["alarc'h"];An Alarc'h zo ur steredeg eus an hantervoul norzh.
simple-collection;['blev berenis'];Blev Berenis (Coma Berenices, berraet e Com) zo ur steredeg eus an hantervoul norzh.
simple-collection;['pegasos', "marc'h askellek", 'pegasus'];Ar Marc'h Askellek (Pegasus, berraet e Peg) zo ur steredeg e norzh an oabl, anvet diwar ar marc'h askellek Pegasos e mitologiezh Henc'hres.
simple-collection;['bugul'];Ar Bugul (Boötes, berraet e Boo) zo ur steredeg eus an hantervoul norzh.
simple-collection;['bleiz'];Ar Bleiz zo ur steredeg eus an hantervoul su.
simple-collection;['par aerouant', 'aerouant'];An Aerouant zo ur steredeg eus an hantervoul su.
simple-collection;['karr-kamm bihan'];Ar C'harr-kamm Bihan (Ursa Minor, berraet en UMi) zo ur steredeg eus an hantervoul norzh.
simple-collection;['ki bras'];Ar C'hi Bras (Canis Major berraet e CMa) zo ur steredeg eus an hantervoul su.
simple-collection;['cepheus'];Cepheus (Cepheus, berraet e Cep) zo ur steredeg eus an hantervoul norzh.
simple-collection;['kib'];Ar Gib zo ur steredeg eus an hantervoul su.
simple-collection;['gavr', 'gavr-mor'];Ar C'havr (Capricornus, berraet e Cap) zo ur steredeg eus ar zodiak.
simple-collection;['toukan'];An Toukan zo ur steredeg eus an hantervoul su.
simple-collection;['pesked'];Ar Pesked (Pisces, berraet e Psc) zo ur steredeg eus ar zodiak.
simple-collection;['krug', 'skorpion', '♏'];Ar Grug (Scorpius, berraet e Sco) zo ur steredeg eus ar zodiak.
simple-collection;["gwerc'hez"];Ar Werc'hez (Virgo, berraet e Vir) zo ur steredeg eus ar zodiak.
simple-collection;['parez aerouant', 'aerouantez'];An Aerouantez zo ur steredeg eus an hantervoul su.
simple-collection;['kroaz ar su'];Kroaz ar Su (Crux, berraet e Cru) zo ur steredeg eus an hanterzouar su.
simple-collection;['kurunenn an norzh'];Kurunenn an Norzh zo ur steredeg eus an hantervoul norzh.
simple-collection;['lourenn'];Al Lourenn zo ur steredeg eus an hantervoul norzh.
simple-collection;['balañsoù'];Ar Balañsoù (Libra, berraet e Lib) zo ur steredeg eus ar zodiak.
simple-collection;['bran'];Ar Vran (Corvus, berraet e Crv) zo ur steredeg eus an hantervoul su.
simple-collection;['krank'];Ar C'hrank (Cancer, berraet e Cnc) zo ur steredeg eus ar zodiak.
simple-collection;['tourz'];An Tourz zo ur steredeg eus an hantervoul norzh.
simple-collection;['cassiopeia'];Cassiopeia (Cassiopeia, berraet e Cas) zo ur steredeg eus an hantervoul norzh.
simple-collection;['leon', 'leo', '♌', 'steredeg al leon'];Al Leon zo ur steredeg eus ar zodiak.
simple-collection;['gevelled'];Ar C'hevelled (Gemini, berraet e Gem) zo ur steredeg eus ar zodiak.
simple-collection;['skuilher-dour', 'skuilh-dour'];Ar Skuilher-dour zo ur steredeg eus ar Zodiak.
simple-collection;['mitologiezh', 'gwengelouriezh', 'mitologiezh roman', 'mojennerezh', 'mojennouriezh'];Ar vitologiezh pe gwengelouriezh (diwar gwenn ha kel/où) eo studi an holl danevelloù (pe istorioù) a zo bet savet e-barzh pep sevenadur lakaet da wir ha liammet gant ur sistem relijiel pe kredennoù.
simple-collection;['trimurti', 'trimourti', 'trimūrti'];Trimurti zo ur ger a ra dave d’an tri doue pennañ en hindouegezh : Brahma, Vichnou ha Chiva.
simple-collection;['hollved'];Graet e vez gant hollved evit ober anv eus kement tra a zo.
simple-collective;['hebraed', 'daouzek meuriad israel', 'hebreed', 'hebre'];An Hebreed zo ur bobl semitek eus ar Reter Nesañ.
simple-collective;['hebraed', 'daouzek meuriad israel', 'hebreed', 'hebre'];Hervez an hengoun e voe diazezet framm Israel war zaouzek meuriad, o tiskenn eus daouzek mab Yaakov anvet ivez Israel : Reouven, Shimeon, Levi, Yehouda, Isac'har, Zevouloun, Gad, Asher, Yosef, Binyamin, Dan ha Naftali.
simple-collective;['gwerin'];Ar werin eo yoc'h an dud izelañ o statud er gevredigezh.
simple-collective;['saozon'];Ar Saozon zo ur bobl eus Bro-Saoz da gentañ penn, daoust ma’z eus aet lod anezho da vroioù all dre ar bed.
simple-collective;['bourc’hizelezh', "bourc'hizelezh"];Ar vourc'hizelezh zo ur rummad sokial stag en deroù ouzh ar c'hêrioù ha da c'houde d'ar goñversanted ha d'an artizaned.
simple-planned-collective;['burgh'];Ur burgh, e Bro-Skos, a oa ur gêr emren, adal an XIIvet kantved, dindan ar roue David Iañ, evel ar borough saoz.
simple-planned-collective;['lez-varn etrebroadel'];Al Lez-varn Etrebroadel a zo ul lez-varn bet krouet e mennad 92 karta ar Broadoù Unanet.
simple-planned-collective;['triumvirelezh'];« Triumvirelezh » (Troika e ruseg) a vez graet eus un emglev politikel pe soudardel etre tri den hag en em unan evit ren.
simple-planned-collective;['sabad'];Ar sabad eo bodadeg ar sorserien da noz.
simple-planned-collective;['sened'];Ar Sened zo un aozadur politikel en ur renad politikel gant div gambr.
simple-planned-collective;['dael'];Un dael a zo ur vodadeg kevareizhañ dezhi an aotrouniezh evit sevel lezennoù ma vo implijet gant ur c'horf politikel, evel ur Stad, ur rannvro pe ur gêr vras.
simple-planned-collective;['skolaj'];Ur skolaj a zo un ensavadur deskadurezh a zo bet peurvuiañ al live deskadurezh etre ar skol hag ar skol-veur abaoe ar Grennamzer.
simple-planned-collective;['knesset', 'kneset'];Kneset (כנסת, e hebraeg, hag a dalvez bodadeg) eo anv parlamant Israel, ur gambr enni hepken.
simple-planned-collective;['kongres ar stadoù-unanet', "kendalc'h ar stadoù-unanet"];Kongres ar Stadoù-Unanet pe, aliesoc'h, Kendalc'h ar Stadoù-Unanet (saozneg: United States Congress) eo parlamant divgambrek Stadoù-Unanet Amerika, gantañ ar galloud lezenniñ.
simple-planned-collective;["ti ar c'humunioù"];Kambr izel ar Rouantelezh-Unanet ez eo Ti ar C'humunioù, e saozneg House of Commons.
simple-planned-collective;['dáil éireann'];Dáil Éireann (distaget : [d̪ˠaːlʲ ˈeːrʲən̪ˠ] en iwerzhoneg, [dɔɪl ˈɛərən] e saozneg), Dael Iwerzhon, eo kambr izel Parlamant Republik Iwerzhon.
simple-planned-collective;['ti al lorded', 'ti an arlozed'];Kambr Uhel Parlamant ar Rouantelezh-Unanet eo Ti al Lorded, House of Lords e saozneg.
simple-planned-collective;['sened ar stadoù-unanet', 'sened', 'sened sua'];Sened ar Stadoù-Unanet (United States Senate) eo kambr uhel Kongres ar Stadoù-Unanet, Parlamant Stadoù-Unanet Amerika, gantañ ar galloud lezenniñ ha gwirioù all, kreñvoc'h eget re ar gambr izel, Ti Dileuridi ar Stadoù-Unanet.
situation;['klemm'];Klemm eo ar pezh a ra an den pa lavar en devez poan, pe ez eus bet graet droug dezhañ, pe gaou outañ.
situation;['komenad kehentiñ'];An dafar diazez implijet evit ar c'hehentiñ a zo frammet tro-dro da drevnadoù a ro al lank da dreuzkas elfennoù daouredel eus ur poent d'un all.
situation;['gwenaenn'];Ur wenaenn zo un tamm koeñv eus ar c'hroc'hen a deu war an daouarn pe an treid, war an daouilin, an dremm.
situation;['aotism'];An aotism zo ur c'hleñved eus diorroadur an neuronoù.
situation;['emgann little bighorn'];Emgann Little Bighorn pe Custer's Last Stand pe c'hoazh Battle of the Greasy Grass e-kostez an indianed Lakota hag indianed ar plaenennoù a voe un emgann a c'hoarvezas etre Indianed Amerika hag arme ar Stadoù-Unanet d'ar 25 ha d'ar 26 a viz Even 1876, e-kichen ar stêr Little Bighorn e reter Montana e-pad ar Great Sioux War of 1876
situation;['formulenn diaoz'];E kimiezh ez eo ar formulenn diaoz ar skrivad kompaktañ a daolenn ur c'hompozad kimiek pe ur c'horf simpl.
situation;['lupus'];Lupus eo anv latin ar bleiz, deuet da vezañ un anv-badez latin.
situation;['kleñved naplez'];Kleñved Naplez, pe naplez, a reer eus ur c'hleñved dre ma kreder e vije deuet eus Naplez, pe Napoli, degaset gant ar C'hallaoued pa oant bet oc'h ober brezel en Italia er XVvet ha XVIvet kantved, hag a deu eus an Treponema pallidum, pe treponem disliv, ur vakterienn.
situation;['termenadur'];An termenadur eo an displegadur a roer d'ur ger, pe termen (yezhoniezh).
situation;['sabotaj', 'tarverezh'];Ar sabotaj pe tarverezh a zo un ober graet a-fetepañs-kaer evit distruj, gwanaat pe disteraat ur benveg evit ma chomfe sac'het pe na vefe ket ken efedus ken.
situation;['drev'];An drev, anvet ivez pertussis, a zo ur c'hleñved poreüs.
situation;['drougsant'];Dindan e furm ez eo an drougsant ur c'hleñved-spered hêrezel unan dleet da labeziou en empenn.
situation;['freuz-dimeziñ'];Gant embann ur freuz-dimeziñ e kemenner eo bet nullet an dimeziñ, ha kildalvoudus eo, da lavaret eo e vez graet evel pa ne vije ket bet eus an dimeziñ.
situation;['lagad-yar'];Ul lagad-yar, pe lagadenn-yar, pe lagad-bran, zo ur seurt kaledenn ouzh ur biz-troad.
situation;["yec'hed"];Evit reiñ da intent petra eo ar yec'hed e c'heller lavaret en un doare negativel eo an nann-kleñved, da lavaret eo kaout ar varregezh evit ober traoù ar pemdez, hag en un doare pozitivel eo stad kompez ar c'horf pe mont en-dro mat ar c'horf.
situation;["brec'h"];Ar verol vras eo an naplez, ur c'hleñved disheñvel-mik.Ar vrec'h, anvet ivez verol vihan, a oa ur c'hleñved degaset gant ur viruz, pe poksviruz, eus ar re begusañ.
situation;['serk'];Ar serk zo ur c'hleñved grevus degaset gant ar spesad bakteri Bacillus anthracis.
situation;['falstamall'];Ur falstamall zo un tamall direizh, graet e gaou, a ra droug da enor un den, hag a zegas droukvrud (pe fallvrud, pe brud fall) warnañ.
situation;['sifern'];Sifern pe Friad a vez graet eus ur c'hleñved stank, dre-vras izel, hag a dap korzennoù analiñ uhel Mab-den gant ur viruz.
situation;['ailurofobiezh'];An ailurofobiezh, pe kazhkasaouriezh, zo ur gasaouriezh difer, hini an aon dreistvuzul hag anpoellet rak ar c'hizhier.
situation;['danvez-pried'];An danvez-pried a larer eus paotr pe plac'h a zo da zimeziñ, hag a vo priedoù.
situation;['kolladenn', 'golladenn'];Ur c'holl, pe ur golladenn, a vez graet gant ur vaouez dougerez pa goll ar bugel en he c'hof dre ma ne ya ket an engehentiñ da benn-vat, pe dre wallzarvoud, pe dre zarvoud naturel.
situation;['pons asinorum'];Pons asinorum zo un droienn latin implijet er ventoniezh hag a vez meneget evel ur c'hrennlavar.
situation;['bruderezh'];Ar bruderezh eo an hollad teknikoù ha doareoù-ober implijet gant un den pe un embregerezh, evit reiñ da anavezout e anv, ar c'henderc'hoù aozet gantañ, pe gwerzhet gantañ.
situation;['gerioù-kroaz'];Ur c'hoari eo ar gerioù-kroaz ma klasker leuniañ ur gael gant gerioù a-blom pe a-serzh gant sikour divinadelloù.
situation;['formulenn gimiek'];Ur formulenn gimiek a zo un doare berr da skrivañ petra eo an elfennoù en ur volekulenn.
situation;['droug an divskouarn'];Droug an divskouarn zo un anv hollek evit meur a zroug deuet diwar re a drouz en-dro dimp.
situation;['kaerskriverezh', 'kaligrafiezh'];Kaerskriverezh, pe kaligrafiezh, a reer eus arz ar stummañ lizherennoù brav.
situation;['anevrism'];Un anevrism (eus an henc'hresianeg ἀνεὐρυσμα, « frankadur») zo ur frankadur lec'hel eus speurenn un dalmerenn a stumm ur c'hodell bras pe brasoc'h hag a sko en dalmerenn war-bouez un takad strizh anvet ar c'houzougenn.
situation;['lizherenneg hebraek'];Div lizherenn warn-ugent zo el lizherenneg hebraek.
situation;['bosenn', 'bosenn werblus'];Ar vosenn (diwar al latin pestis atra, ar marv spontus) zo ur c'hleñved degaset gant ar bakteri Yersinia pestis hag a sko ken loened ken tud.
situation;['bramm'];Ar bramm a zo anezhañ skarzh trouzus ur gaz dre ar fraezh.
situation;['gaou'];Kontañ gaou, livañ gevier, zo kontañ traoù dre gomz pe dre skrid evit touellañ an dud peurvuiañ, pa ouzer n'eo ket ar wirionez.
situation;['den piltdown'];Den Piltdown zo un taol-bourd skiantel a lakaas da grediñ e oa bet dizoloet karrekaennoù ur rakden e Piltdown Common.
situation;['mezventi', 'mezv'];Ar vezventi eo stad an dud a zo mezv goude evañ boeson pe diedoù alkoolek, an dud zo ur c'hementad bras a alkool en o gwad.
situation;['promesa'];Ur bromesa zo un dra a zo bet prometet, dre gomz pe dre skrid.
situation;['korventenn'];Pa vez direizhet an aergelc'h lec'hel gant ur barrad-amzer fall-tre e vez kaoz eus ur gorventenn.
situation;['feur-emglev etrebroadel', 'feur-emglev', 'pacte', 'feur-skrid'];Ur feur-emglev a zo ur skrid savet evit bezañ test d'un emglev etre div gostezenn, stadoù riek anezho peurvuiañ pe aozadurioù etrebroadel.
situation;['fazi'];Ur fazi zo un ober ha ne glot ket gant ar wirionez, hag a zo graet diwar ur soñj kamm.
situation;['luch'];Luch eo an den na sell ket eeun ouzh an traoù.
situation;['tort'];Un tort zo un distummadur eus al livenn-gein deuet alies eus ur c'hleñved, evel kleñved Scheuermann.
situation;['bachelouriezh'];Ar vachelouriezh a zo un diplom a vez roet d'ar skolidi o deus graet berzh en arnodennoù aozet e dibenn ar studioù er skolioù eil derez (skolaj ha lise).
situation;['ciao', 'aloha'];== Pennad kar ==
situation;['ruzell'];Ar ruzell zo ur c'hleñved a daper aes-tre diwar viruz ar ruzell.
situation;['terzhienn-ruz'];An derzhienn-ruz zo ur c'hleñved a gouezh war ar vugale dreist-holl, etre 5 ha 10 vloaz, degaset gant ur vakterienn, streptokok ar strollad A, a ro pikoù ruz dezho, hag o laosk dinerzh.
situation;['grip'];Ar grip a zo ur c'hleñved poreüs degaset gant pevar seurt viruz eus kerentiad an Orthomyxoviridae.
situation;['kolera'];Ar c'holera zo ur c'hleñved-red degaset gant bazhelloù ar Vibrio cholerae, dizoloet gant Pacini e 1854 hag addizoloet gant Koch e 1883.
situation;['droug-sant-anton'];Droug-Sant-Anton zo ur c'hleñved eus ar c'hroc'hen a deu da vout ruz.
situation;['tañvadenn'];Ur c'hlip evit diskouez tennadoù eus ur film hag a zo en e goulzad brudañ eo an dañvadenn.
situation;['lizherenneg kirillek', 'alfabet kirillek', 'lizherenneg girillek'];Al lizherenneg kirillek (e rusianeg кириллица pe кирилиця e ukraineg pe Кірыліца e bieloruseg, Ћирилица e serbeg pe Кирилица e bulgareg) a zo anezhi ul lizherenneg implijet evit skrivañ ar c'hwec'h yezh slavek a-is ouzhpenn meur a yezh all a familhoù-yezh liesseurt komzet en ez-Unaniezh Soviedel, Azia hag Reter Europa.
situation;['formulenn diorroet plaen'];== Termenadur == Er gimiezh volekulel ez eo ar formulennoù diorroet plaen formulennoù hag a ro titouroù diwar-benn aozadur an atomennoù a ya da sevel ar molekulennoù.
situation;["spisc'her"];Ur spisc'her a zo ur ger skrivet ouzhpenn war ur skrid evit sklaeraat ster ur ger dianav pe nebeut anavezet gant ar braz eus al lennerien.
situation;['kleñved'];Ar c'hleñved (liester : kleñvedoù pe kleñvejoù) a c'hoarvez pa vez gwelet pe santet un dra bennak direizh e mont-endro ar c'horf pe e hini ar spered a ya da grouiñ diaesterioù evit un den pe evit ar re zo en endro an den-se.
situation;['tostadur'];Un tostadur, pe un aproksimaçïon, so ur represantaçïon anrik (faos un tammig) deus un dra, hag a so tost a-walc'h memes-tra ewid boud implijabl.
situation;['herpes'];An herpes, pe herpes simplex, zo ur c'hleñved hag a laka tanijenn er c'hroc'hen deuet diwar ar viruz Herpes simplex.
situation;['malaria', 'kleñved ar paludoù'];Kleñved ar paludoù pe Malaria (diwar an italianeg : mal'aria, « aer fall ») a zo ur pore hag ur c'hleñved-red drastus abalamour da arvevaded.
situation;['stlennvon', 'diaz roadennoù'];Un hollad roadennoù eo ur stlennvon, pe bon roadennoù ("Database" e saozneg), o telvanañ ergorennoù eus ar bed gwerc'hel hag o vezañ ur skor evit un arload stlennegel.
situation;['litotenn', 'litotezenn'];Litotenn, pe "mouskomz" a reer eus un droienn stil a implijer pa lavarer pe skriver nebeutoc'h evit reiñ da gompren muioc'h.
situation;['saotradur dre drouz'];Ar saotradur dre drouz eo an holl drouzioù a vez gouzañvet hag a falla yec'hed an den.
