locative-role;['tchornobyl', 'tchernobyl', "černobyl'"];Tchornobyl (ukrainaneg: Чорнобиль, distaget [tʃɔrˈnɔbɪlʲ]). belaruseg: Чарнобыль, Tcharnobil’. rusianeg: Чернобыль, distaget [tɕɪrˈnobɨlʲ]) a zo ur gêr dilezet e norzh Ukraina, en oblask Kyiv, nepell diouzh harzoù Belarus.
locative-role;['delhi'];Delhi a zo unan eus seizh tiriad India hag ur veurgêr, tremen a 22,4 milion a dud o vevañ enni.
locative-role;['shenyang'];Shenyang a zo ur gêr vras e Republik Pobl Sina e proviñs Liaoning.
locative-role;['thessaloniki', 'salonik'];Thessaloniki (gresianeg: Θεσσαλονίκη, Thessaloníki, distaget: [θɛsalɔˈnikʲi) eo eil kêr vrasañ Gres, e Makedonia, e biz ar vro.
locative-role;['sioux city'];Sioux City zo ur gêr lec'hiet e kornôg Iowa er Stadoù-Unanet.
locative-role;["c'harkiv", 'kharkiv'];C'harkiv, kêr eus reter Ukraina.
locative-role;['ciudad juárez', 'el paso del norte'];Ciudad Juárez eo kêr vrasañ stad Chihuahua e Mec'hiko, war lez dehou ar stêr Río Bravo, a-dal da gêr El Paso war al lez kleiz, er Stadoù-Unanet.
locative-role;['brugge', 'bruges'];Brugge (Bruges e galleg) a zo ur gêr hag ur gumun eus Flandrez Belgia.
locative-role;['hargeysa', 'hargeisa'];Hargeysa zo ur gêr e Somalia.
locative-role;['basel'];Basel (Basel en alamaneg, Bâle e galleg, Basilea e spagnoleg/italianeg/romañcheg) zo ur gêr eus Suis, an trede kêr vrasañ goude Zürich ha Geneva.
locative-role;['aleppo'];Aleppo zo ur gêr e Siria, penn ur muhafazah.
locative-role;['edirne'];Edirne (gresianeg : Ἁδριανούπολις Hadrianopolis pe Αδριανούπολη Adrianopoli, bulgareg : Одрин Odrin) zo ur gêr e Trakia (Turkia) ha kêrbenn proviñs Edirne.
locative-role;['cincinnati'];Patrom:Infobox Settlement Cincinnati zo ur gêr lec'hiet e mervent stad Ohio, e SUA. War lez ar stêr Ohio emañ.
locative-role;['sevastopol', 'aqyar', 'sebastopol'];Sevastopol (Севасто́поль, Sevastopol’, en ukraineg ha rusianeg, Aqyar e tatareg Krimea) a zo ur gêr gant ur statud ispisial e Krimea, ur republik emren eus Ukraina, hag ur porzh war ar Mor Du.
locative-role;['kêr ho-chi-minh', 'saigon', 'sài gòn', 'thành phố hồ chí minh'];Kêr Hồ-Chí-Minh (Thành phố Hồ Chí Minh ent-ofisiel e vietnameg. Saigon, Sài Gòn e vietnameg, betek 1975, hag en implij c'hoazh gant an dud) zo ur gumun eus Viêt Nam, e kumuniezh emren Đông Nam Bộ.
locative-role;['marselha', 'marsilha', 'marseille'];Marsilha e brezhoneg, Marselha en okitaneg (distaget [maʀˈsejɔ] pe [maʀˈsijɔ]), Marseille e galleg hag ez-ofisiel, zo ur gêr eus Okitania er Stad C'hall hag ur porzh ag ar Mor Kreizdouar.
locative-role;['nisa', 'nice', 'niça'];Nisa, un anv all roet d'ar rouanez Pylia, e mojennoù Hellaz kozh.Nisa a zo hiriv penn-kêr departamant Alpoù-an-Arvor, er Frañs.
locative-role;['leipzig'];Hed ha treuz: 51°′N 12°′ Leipzig en alamaneg, Lipsk e sorabeg, a zo ur gêr ag Alamagn lec'hiet er Bundesland Saks.
locative-role;['nürnberg'];Nürnberg a zo ur gêr e Bro-Alamagn, e Bavaria.
locative-role;['busan', 'pusan'];Busan (부산} er skritur hangeul, 釜山 er skritur hanja) zo ur gêr vras hag ur porzh eus Korea ar Su, e gevred ar vro.
locative-role;['lund'];Lund zo unan eus kêrioù koshañ Sveden.
locative-role;['los angeles'];Ur bajenn disheñvelout Los Ángeles zo ivez.
locative-role;['nagasaki'];Nagasaki (長崎市 Nagasaki-shi e japaneg) a zo ur gêr ha sez ur prefeti eus Japan, war aod mervent Kyūshū emañ.
locative-role;['stuttgart'];Stuttgart (distaget [ˈʃtutgart] en alamaneg) eo kêr-benn Baden-Württemberg, hag unan eus kêrioù bras Alamagn.
locative-role;['pittsburgh'];Pittsburgh zo ur gêr lec'hiet e kreiz Pennsylvania er Stadoù-Unanet, e kember ar stêrioù Allegheny ha Monongahela, a ya d'ober ar stêr Ohio.
locative-role;['wrocław', 'breslau', 'wroclaw'];Wrocław (distaget [ˈvrɔtswaf], alamaneg: Breslau), kêr-benn rannvro istorel Silezia, Polonia.
locative-role;['jerez de la frontera'];Jerez de la Frontera pe Jerez zo ur gêr eus Spagn, ha brasañ kêr proviñs Cádiz en Andalouzia.
locative-role;['geneva', 'genève', 'jeneva'];Geneva zo ur gêr eus Suis (Kanton Geneva), war glannoù ar stêr Ron el lec'h ma kuita lenn Geneva (e galleg lac Leman, e frankoprovañseg. Lèman).
locative-role;['brighton'];Brighton zo ur gêr eus kontelezh East Sussex, e Bro-Saoz.
locative-role;['omsk'];Omsk (Омск e rusianeg) zo ur gêr vras eus Rusia, e mervent Siberia.
locative-role;['utrecht'];Utrecht (distagadur nederlandek /ˈytrɛxt/) zo ur gêr e-kreiz an Izelvroioù, kêr-benn proviñs Utrecht.
locative-role;['perm'];Perm, Пермь, Perm’, a zo ur gêr a Rusia, e-harz kornaoueg Menez-Oural.
locative-role;['volgograd', 'stalingrad'];Volgograd (Волгоград e rusianeg) a zo ur gêr eus Rusia ha kêr-benn velestradurel Oblast Volgograd.
locative-role;['sant-petersbourg', 'sankt peterbourg', 'leningrad', 'petrograd', 'sankt-peterbourg', 'sant petersbourg', 'sant petersburg'];Sant-Petersbourg pe Sankt-Peterbourg (Санкт-Петербу́рг, Sankt-Peterbourg e rusianeg, stumm berr ha pobl : Пи́тер, Piter), a zo ur gêr vras eus gwalarn Rusia.
locative-role;['leiden'];Leiden (distaget ['lɛidən] pe ['lɛidə] e nederlandeg) zo ur gêr gozh eus an Izelvroioù, 15 km en norzh da Den Haag ha 40 km er mervent da Amsterdam.
locative-role;['pisa'];Ur pennad Pisa zo ivez.
locative-role;['padova'];Padova a zo ur gêr ag Italia, kêr-benn proviñs Padova, e rannvro Veneto.
locative-role;['verona'];Verona zo ur gêr en Italia an hanternoz.
locative-role;['essen'];Essen (distaget /ˈɛsən/ en alamaneg) zo ur gêr eus Alamagn, e stad Nordrhein-Westfalen.
locative-role;['mekka'];Mekka (مكة المكرمة en arabeg, Makkah al-Mukarramah) zo ur gêr e kornôg Arabia Saoudat.
locative-role;["xi'an"];Xi'an (西安) zo unan eus kêrioù-penn kozh Sina, e rannvro Shaanxi, e-kreiz Republik Pobl Sina hiziv.
locative-role;['hangzhou'];Hangzhou zo ur gêr vras e proviñs Zhejiang e Republik Pobl Sina.
locative-role;['recife'];Recife eo kêr-benn stad Pernambuco, war aod ar Meurvor Atlantel, e biz Brazil.
locative-role;['gdańsk', 'dantzig', 'danzig', 'gdansk'];Gdańsk (distaget ['ɡdaɲsk], e poloneg. Gduńsk e kachoubeg. Danzig en alamaneg) zo ur gêr war ribl ar Mor Baltel ha kêr-benn rannvro (województwo) Pomerania e Polonia.
locative-role;['würzburg'];Würzburg (distaget [ˈvʏʁtsbʊʁk], [ˈvʏɐ̯tsbʊɐ̯k] en alamaneg) zo ur gêr eus hanternoz Bavaria, en Alamagn.
locative-role;['tamil nadu'];Tamil Nadu (tamil: தமிழ் நாடு - tamiḻ nāṭu - [ˈtʌmiʐˌnaːɖɯ], „Bro Damil“) zo ur stad eus su India, dezhi 130 266 km² a c’horread ha 64 445 183 a annezidi (d’ar 1añ a viz Genver 2006).
locative-role;['oaxaca de juárez', 'oaxaca'];Oaxaca de Juárez eo kêr-benn stad Oaxaca, e kreisteiz Bro-Vec'hiko.
locative-role;['orleañs', 'orléans'];Orleañs zo ur gêr eus kreiz Bro-C'hall, war lez ar stêr Liger.
locative-role;['leeds'];Ur gêr eus Bro-Saoz eo Leeds.
locative-role;['reading'];Reading a zo ur gêr eus Bro-Saoz, kêr-benn kontelezh Berkshire, e traoñienn an Tavoez, e kember an Tavoez hag ar stêr Kennet.
locative-role;['hiroshima'];Hiroshima (広島市 Hiroshima-shi, da lâret eo "Enezennn ledan" e japaneg) a zo ur gêr hag ur porzh eus Japan.
locative-role;['bandenn gaza', 'strizhenn gaza'];Bandenn Gaza, pe Strizhenn Gaza (قطاع غزة, Qita' Ghazzah, en arabeg, רצועת עזה, Retzuat 'Azza, en hebraeg) zo un dachenn douar lec'hiet e mervent Israel.
locative-role;['köln', 'kolun'];Köln (distaget [ˈkœln]), e rannyezh Köln: Kölle ([ˈkœɫə]) a zo ur gêr eus kornaoueg Alamagn, war ribl ar Roen.
locative-role;['monaco', 'monako'];Priñselezh Monako (galleg: Principauté de Monaco. monegaskeg: Principatu de Múnegu. okitaneg: Principat de Mónegue), ent-berr Monako pe Monaco a zo ur vonarkiezh vonreizhel hag ur geoded-riez lec'hiet etre ar mor Kreizdouar ha Frañs (departamant an Alpes-Maritimes).
locative-role;['impalaeriezh roman ar reter', 'impalaeriezh vizantat', 'bizantion', 'roma ar reter', 'impalaeriezh bizantion'];Impalaeriezh roman ar Reter zo un anv istoriografek roet da lodenn reter an Impalaeriezh roman en Henamzer diwezhañ hag er Grennamzer, al lodenn nemeti chomet en he sav adalek 476.
locative-role;['kloastr'];Ar c'hloastr (liester : kloastroù) eo al lodenn eus un iliz-veur, un iliz-chabistr, ur abati, ur gouent pe ur manati hag a vez berzet da dud an diavaez, da lavaret eo ar c'hlozadur bevennet gant ur voger m'emañ al leaned o vevañ.
locative-role;['arkadia'];Arkadia zo ur vro eus Henc'hres, e menezioù kreiz ar Peloponnesos, mor Egea er reter dezhi.
locative-role;['mayenne', 'mezven', 'mezvenn'];Ar Mayenne (Mezven a-wechoù e brezhoneg) zo un departamant gall abaoe 1790, e kornog Bro-C'hall.
locative-role;['dezerzh mojave'];Dezerzh Mojave, Hayikwiir Mat'aar e mohaveg, a zo un dezerzh tomm e tu gevred Kalifornia er Stadoù-Unanet, gant darnoù e su Nevada, mervent Utah ha gwalarn Arizona.
locative-role;['gobi'];Ar Gobi a zo ur gouelec'h bras eus Azia ar Reter.
locative-role;['namib'];An Namib zo un dezerzh en em astenn en arvor Namibia, a-hed war-dro 1 600 km, ha war ur gorread 80 000 km².
locative-role;['dezerzh atacama', "gouelec'h atacama"];Dezerzh Atacama, pe Gouelec'h Atacama, a zo un dezerzh e norzh Chile, en Amerika ar Su, etre ar Meurvor Habask hag an Andoù, war-hed ur 1 000 km bennak, e rannvro Antofagasta hag e norzh rannvro Atacama.
locative-role;['negev'];An Negev a zo un dezerzh e kreisteiz Israel.
locative-role;['kalahari'];Ar C'halahari zo un dezerzh traezhek krin ha damgrin en em led war 900 000 km² en Afrika ar Su.
locative-role;['normandi-uhel', 'haute-normandie'];Ur Rannvro c'hall e oa Normandi-Uhel (e galleg Haute-Normandie).
locative-role;['acapulco', 'acapulco de juárez'];Acapulco pe Acapulco de Juárez eo kêr vrasañ stad Guerrero e kreisteiz Mec'hiko, lec'hiet war ribl ar Meurvor Habask, 304 km eus Kêr Vec'hiko.
locative-role;['thessalia', 'tessalia'];Thessalia, Θεσσαλία, Thessalía hag e rannyezh Thessalia : Πετθαλία, Petthalia, zo anv un unvez velestradurel eus Bro-Hellaz hag ur vro hengounel zo anezhi abaoe an Henamzer.
locative-role;['oaziz'];Oaziz a reer en douaroniezh eus un dachenn strujus en dezerzh, stummet diwar douar gleb pe diwar ur boullennad dour tost a walc'h dindan an douar, pe a wechoù e-kichen un oued.
locative-role;['peurvan'];Ur peurvan, pe ur prad, zo un dachenn ma lakaer ar chatal da beuriñ.
locative-role;['savanenn'];Ar savanenn a zo un ekosistem eus an takadoù damgrin a gaver war an Douar.
locative-role;['prusia', 'prus', 'prusian'];Prusia, pe Prus,, zo ur vro e reter Europa hag voe kalon ur rouantelezh pouezus en istor ar c'hevandir etre 1701 ha 1918.
locative-role;['yorkshire', 'swydd efrog'];Yorkshire zo ur gontelezh istorel eus Bro-Saoz e Breizh-Veur, e biz ar vro, ha hini vrasañ ar Rouantelezh-Unanet.
locative-role;['frank-kontelezh', 'franche-comté', 'kontelezh-frank'];Franche-Comté a oa ur rannvro c'hall, savet diwar ar pevar departamant gall-mañ : Doubs, Jura, Saona-Uhel, Territoire de Belfort.
locative-role;['bourgogn'];Gwelet ivez ar pennad Bourgogn.
locative-role;['orléanais'];An Orléanais (distaget: [ɔʁleanɛ]) a zo ur proviñs eus kreiz Bro-C'hall en-dro da gêrioù Orleañs, Chartrez ha Bleaz.
locative-role;['artez', 'artois', 'kontelezh artez'];Artez (Artois e galleg) a oa ur broviñs istorel eus Bro-C'hall, etre Pikardi ha kontelezh Flandrez.
locative-role;['breizh', 'rannvro breizh', 'istor breizh', 'breizh-vihan', 'breizhad', 'breizhadez', 'breizhat', 'breizhek', 'breizhiz', 'vreizh'];Breizh zo ur vro geltiek e kornôg Europa.
locative-role;['breizh', 'rannvro breizh', 'istor breizh', 'breizh-vihan', 'breizhad', 'breizhadez', 'breizhat', 'breizhek', 'breizhiz', 'vreizh'];Rannvro Breizh zo ur rannvro eus ar Republik c'hall, ha n'eus ken nemet pevar departamant enni: Aodoù-an-Arvor, Penn-ar-Bed, Mor-Bihan hag Il-ha-Gwilen.
locative-role;['normandi', 'norman'];Normandi pe Normandia (Nouormandie e normaneg, Normandie e galleg ha Normandy e saozneg) zo unan eus ar broioù kozh a zo aet da ober Bro-C'hall, war-bouez an inizi Aldernez, Gwernenez, Jerzenez, Sark hag a zo perc’hennet gant kurunenn Breizh-Veur, hep bezañ un darn eus ar Rouantelezh-Unanet, dre ma'z eo rouaned Breizh-Veur ha Norzhiwerzhon duged Normandi ivez.
locative-role;['normandi', 'norman'];Normandi zo unan eus rannvroioù melestradurel Bro-C'hall, e hanternoz ar vro.
locative-role;['anjev', 'anjou', 'anjevat', 'anjeviz', 'kontelezh anjev'];Anjev a zo unan eus ar broioù kozh a eas d'ober Bro-C'hall.
locative-role;['tanganyika'];Tanganyika (1961-1962), war-lerc'h Republik Tanganyika (1962-1964), a zo bet ur stad verrbad aet d'ober al lodenn vrasañ eus Tanzania.
locative-role;['azia ar gevred', 'gevred azia', 'gevredazia'];Azia ar Gevred, Gevredazia, eo ar rannved a zo e gevred Azia, da lavarout eo e reter an Indez hag e su Sina.
locative-role;['weimar'];Weimar zo ur gêr e land Thüringen, en Alamagn.
locative-role;['frankfurt am main', 'frankfurt'];Frankfurt am Main a zo ur gêr eus Hessen, e kornôg-kreiz Alamagn, war lez ar stêr Main.
locative-role;['skandinavia', 'skandinavien'];Ur rann eus Europa eo Skandinavia (pe Lec'hlenn), en hanternoz d’ar c’hevandir.
locative-role;['pearl harbor'];Pearl Harbor a zo ur porzh-brezel stadunanat en Enez Oahu, en Inizi Hawaii, er Meurvor Habask.
locative-role;['cúige uladh', 'bro-ulad', 'ulad', 'ulaidh', 'ulster'];Cúige Uladh, pe Ulaidh, en iwerzhoneg, hag Ulad pe Bro-Ulad e brezhoneg, zo unan eus peder froviñs Iwerzhon, hag un darn anezhi dindan ar Rouantelezh-Unanet.
locative-role;['maharashtra'];Maharashtra (Marathi: महाराष्ट्र distaget [mahārāṣṭra]), zo unan eus stadoù India, an eil vrasañ e-keñver poblañs (96,7 milion a annezidi e 2001), goude Uttar Pradesh.
locative-role;['serbia', 'serb', 'србија'];Republik Serbia pe, ent-berr Serbia (serbeg kirillek: Србија, serbeg latin: Srbija), a zo ur Stad eus Europa, er Balkanoù, ha Beograd eo he c'hêr-benn.
locative-role;['dalmatia'];Dalmatia (Dalmacija e kroateg) zo ur vro istorel a-hed aod reter Mor Adria.
locative-role;['thüringen', 'turingia'];Stad dieub Thüringen (alamaneg : Freistaat Thüringen) a zo unan eus ar 16 Land a ya d'ober Alamagn.
locative-role;['panjab', 'pundjab'];Panjab (ar stummoù Punjab ha Penjab a gaver ivez) zo ur vro istorel eus kreiz Azia, rannet bremañ etre meur a stad : stadoù Panjab ha Haryana en India ha proviñs Panjab e Pakistan.
locative-role;['sapporo'];Sapporo (札幌市. Sapporo-shi e japaneg) zo unan eus kêrioù bras Japan.
locative-role;['metropolenn', 'kêr', 'keoded', 'keodedoù', 'kêrioù'];Ur vetropolenn pe meurgêr pe mammgêr a vez graet eus ur gêr vras, an hini pouezusañ eus ur rann-vro pe eus ur vro.
locative-role;['liverpool'];Ur gêr ha distrig deuet da vezañ er pleustr un gonetezh abaoe freuz Kuzul-Kontelezh Merseyside e 1986, eo Liverpool, e gwalarn Bro-Saoz.
locative-role;['łódź', 'lodz'];Łódź (distaget [wudʑ] e poloneg, Lodz en alamaneg) eo an trede kêr vrasañ e Polonia, e-kreiz ar vro.
locative-role;['kingston upon hull'];Kingston upon Hull, berraet e Hull alies, zo ur gêr hag ur velestradurezh unvan eus kontelezh lidel Riding Reter Yorkshire e Bro-Saoz.
locative-role;['kaokaz'];Evit an aradennad venezioù, gwelet Menezioù Kaokaz.
locative-role;['centre-val de loire', 'centre'];Centre-Val de Loire a zo unan eus rannvroioù Bro-C'hall, krouet gant ar gouarnamant gall e 1955.
locative-role;['poatev', 'poitou-charentes', 'poatevat'];Poitou-Charentes a oa unan eus an 22 rannvro a oa e Bro-C'hall betek 2015.
locative-role;['poatev', 'poitou-charentes', 'poatevat'];Poatev (Poitou e galleg, ha Poetou e poateveg) a zo unan eus ar broioù kozh a yeas d'ober Bro-C'hall, e kornaoueg ar vro, hag er gevred da Vreizh.
locative-role;['ruhr', 'rannvro ar ruhr', 'ruhrgebiet'];Ar Ruhr, pe resisoc'h takad ar Ruhr, pe c'hoazh rannvro ar Ruhr a zo un takad poblet stank e Nordrhein-Westfalen e kornaoueg Alamagn.
locative-role;['tianjin'];Ur gêr e Sina an hanternoz eo Tianjin hag unan eus ar peder c'heoded e RPS a zo par d'ur rannvro er frammadur melestradurel sinat.
locative-role;['veracruz de ignacio de la llave', 'veracruz', 'stad veracruz'];Stad Veracruz pe Veracruz de Ignacio de la Llave, zo unan eus an 31 stad kevredet a ya d'ober Stadoù-Unanet Mec'hiko, e reter ar vro, a-hed Pleg-mor Mec'hiko.
locative-role;['rhône-alpes'];Rhône-Alpes, pe Ron-Alpoù e brezhoneg, a oa unan eus rannvroioù Bro-C'hall, krouet e 1955.
locative-role;['gorread'];Ar gorread a zo muzul ur c'horreenn bennak.
locative-role;['rheinland'];Rheinland a zo ur rannvro dispis a-walc'h eus Alamagn hag a denn hec'h anv eus ar stêr Roen (Rhein en alamaneg. land = bro).
locative-role;['porzh', 'porzh-mor'];Ur porzh zo ul lec'h ma c'hall bigi pe listri kaeañ.
locative-role;['gwinieg'];Ur winieg zo ur park dindan gwini, gwez bihan hag a ro rezin, da zebriñ pe d'ober chug ha dreist-holl gwin.
locative-role;['jardin', 'liorzh'];Ur jardin pe liorzh zo ul lec'h, er-maez peurliesañ, ma planter gwez, plant ha bleunioù evit an dudi pe evit gounit frouezh ha legumaj.
locative-role;['cancún'];Cancún a zo kêr gouronkañ e biz ledenez Yucatán, war ribl Mor Karib.
locative-role;['canas', 'cannes'];Canas (en okitaneg. Cannes e galleg) a zo ur gêr douristel vras war aod ar Mor Kreizdouar e Provañs en Okitania.
locative-role;['proviñs messina'];Proviñs Messina (Provincia di Messina en italianeg. Pruvincia di Missina e sikilianeg) zo unan eus nav froviñs Sikilia ha Messina eo he c'hêr-benn.
locative-role;['hannover'];Hannover zo unan eus kêrioù brasañ Alamagn ha kêr-benn land Niedersachsen (Saks-Izel) eo ivez.
locative-role;['dubrovnik'];Dubrovnik (distaget [ˈdǔbroːʋniːk] e kroateg . Ragusa en italianeg) zo ur gêr eus arvor Kroatia, e kreisteiz Dalmatia.
locative-role;['bourdel', 'bordeaux'];Unan eus kêrioù bras Mervent Frañs eo Bourdel.
locative-role;['antofagasta'];Antofagasta zo ur gêr eus Chile, en hanternoz ar vro, 700 km diouzh ar gêr-benn Santiago de Chile.
locative-role;['pago pago'];Pago Pago eo kêr-benn de facto Samoa Amerikan, un tiriad e dalc'h ar Stadoù-Unanet er Meurvor Habask.
locative-role;['trondheim'];Trondheim (distaget [ˈtrɔnhɛjm] pe [ˈtrɔnjæm] e norvegeg) zo ur gêr vras eus Norvegia, an trede kêr vrasañ eus ar vro, e kontelezh Sør-Trøndelag.
locative-role;['newcastle upon tyne'];Un distrig deuet da vezañ er pleustr un Amaezerezh unvan abaoe freuz Kuzul-Kontelezh Tyne ha Wear e 1986, eo Newcastle upon Tyne.
locative-role;['antwerpen', 'anvers'];Antwerpen a zo ur gêr, ur gumun hag ur porzh eus Flandrez Belgia.
locative-role;['oran'];Oran eo eil brasañ kêr Aljeria, hag unan eus ar re bouezusañ eus ar Maghreb.
locative-role;['mombasa'];Mombasa eo an eil kêr vrasañ e Kenya.
locative-role;['bergen'];Bergen a zo ur gêr eus arvor Norvegia, an eil kêr vrasañ er vro goude Oslo, e-keñver an niver a annezidi (242 000 anezho e Genver 2006).
locative-role;['inbhir àir', 'ayr'];Inbhir Àir eo pennlec'h takad-kuzul Siorrachd Àir a Deas e Bro-Skos.
locative-role;['cádiz'];Cádiz zo ur gêr hag ur porzh war aod ar Meurvor Atlantel, ha kêr-benn proviñs Cádiz en Andalouzia, e Spagn.
locative-role;['göteborg'];Göteborg (distaget /ˌjœtəˈbɔrj/ e svedeg) eo an eil kêr vrasañ e Sveden, gant 484 106 a annezidi (e 2006).
locative-role;['silicon valley'];Silicon Valley (« Traoñienn ar silisiom ») a zo un takad e-tro bae San Francisco, e Kalifornia) (Stadoù-Unanet) kreñv-bras ha niverus an embregerezhioù teknologiezh uhel ha blein ennañ.
locative-role;['auvergne', 'arvern', 'aovergn'];Auvergne, pe Aovergn alies e brezhoneg, a oa unan eus rannvroioù Bro-C'hall, krouet gant ar gouarnamant gall e 1955.
locative-role;['auvergne', 'arvern', 'aovergn'];Arvern, Alvern, pe Aovergn zo ur vro istorel eus Okitania hag evit un darn vat ur broviñs kozh eus Bro-C’hall abaoe dibenn an XIIvet kantved.
locative-role;['manchouria', 'mandchouria'];Manchouria zo ur vro vras ec'hon e biz Azia, rannet etre meur a Stad : war-dro 1 550 000 km² e biz Sina ha war-dro 1 000 000 km² e reter Rusia, en arvor ar Meurvor Habask.
locative-role;['nord-pas-de-calais'];Nord-Pas-de-Calais a oa unan eus rannvroioù Bro-C'hall, krouet gant ar gouarnamant gall e 1955.
locative-role;['languedoc-roussillon'];Languedoc-Roussillon (Lengadòc-Rosselhon en okitaneg, Llenguadoc-Rosselló e katalaneg) a oa unan eus rannvroioù Bro-C'hall, krouet gant ar gouarnamant gall e 1955, diwar proviñsoù kozh Lengadok ha Rousilhon.
locative-role;['andalouzia', 'andalucía'];Andalouzia (Andalucía e spagnoleg, diwar an arabeg الأندلس Al-Andalus, "bro ar Vandaled") zo unan eus ar 17 kumuniezh emren bet krouet e Spagn e 1981, adwelet he Statud Emrenerezh e 2002 hag adarre e 2007.
locative-role;['midi-pyrénées'];Midi-Pyrénées, a oa unan eus rannvroioù Bro-C'hall, krouet e 1955.
locative-role;['silezia', 'silezia uhel'];Silezia a zo ur vro istorel e Kreiz Europa, rannet etre ar Republik Tchek, Polonia hag Alamagn.
locative-role;['limousin'];Evit sterioù all an anv Lemojez, gwelit ar pennad Lemojez (disheñvelout).
locative-role;['enez-frañs', 'rannvro pariz'];Evit sterioù all an anv, gwelet Enez-Frañs.Enez-Frañs a zo unan eus rannvroioù Bro-C'hall, krouet e 1955.
locative-role;['champagne-ardenne'];Champagne-Ardenne a oa unan eus rannvroioù Bro-C'hall, krouet gant ar gouarnamant gall e 1955.
locative-role;['elzas', 'bro-elzas', 'elzasad', 'elzasat'];Elsass en elzaseg, Elzas e brezhoneg, Alsace e galleg, zo ur rannvro istorel ha sevenadurel e Bro-C'hall.
locative-role;['bro-saoz nevez', 'new england'];Bro-Saoz Nevez a zo ur rannvro istorel ha sevenadurel eus tu biz ar Stadoù-Unanet.
locative-role;['pikardi', 'picardië'];Ur rannvro en hanternoz Bro-C'hall e oa Pikardi, anezhi tri departamant: Aisne, Oise, Somme.
locative-role;['indez-sina'];Indez-Sina pe Ledenez Indez-Sina zo ul ledenez eus Azia e su Sina hag e reter India.
locative-role;['gwaskogn'];Gwaskogn (ne vez ket degemeret ar stumm Gaskogn peurvuiañ), Gasconha ([gasˈkuɲɔ / gasˈkuɲə]) en okitaneg (gwaskoneg), zo ur broviñs kozh, rannet bremañ etre Bro-C'hall, evit an darn vrasañ, ha Bro-Spagn, gant Traoñienn Aran a zo e Generalitat Katalonia.
locative-role;['akitania', 'aquitaine'];Ur pennad Akitania zo ivez.Akitania a oa unan eus ar rannvroioù krouet gant ar gouarnamant gall e 1955 gant departamantoù an Dordogne, ar Gironde, al Landes, al Lot-et-Garonne hag ar Pireneoù-Atlantel.
locative-role;['kolkida', "kolc'his", 'kolchida'];Kolkida, pe Kolc'his (Jorjieg ha lazeg: კოლხეთი, ḳolc'hethi pe "ḳolc'ha". henc'hresianeg: Κολχίς, Kolkhís) a oa ur Stad, ur rouantelezh hag ur vro, war aod ar Mor Du, e kornôg Jorjia, he deus bet ur roll pouezus e savidigezh broad Jorjia.
locative-role;['bengal'];Bengal (বঙ্গ Bôngo, বাংলা Bangla, বঙ্গদেশ Bôngodesh pe বাংলাদেশ Bangladesh e banglaeg) zo ur vro istorel eus kreisteiz Azia, rannet bremañ etre Bangladesh er reter ha stad Kornôg Bengal er c’hornôg, en India.
locative-role;['lituania', 'lituanat'];Lituania (Lietuva e lituaneg) a zo ur vro eus biz Europa.
locative-role;['yalta', 'jalta'];Yalta a zo ur gêr hag ur c'houronklec'h war aod ar Mor Du e Krimea, ur republik emren en Ukraina.
locative-role;['viña del mar'];Viña del Mar a zo ur gêr eus Chile.
locative-role;['genova', 'genoa', 'jena'];Genova (e ligureg: Zena) a zo ur gumun, ur gêr, hag ur porzh bras eus hanternoz Italia, en arvor Liguria, war aod ar Mor Kreizdouarel.
locative-role;['vladivostok'];Vladivostok a zo ur gêr eus Reter-Pellañ Rusia, lec'hiet war an aod, nepell diouzh an harzoù gant Sina ha Norzhkorea.
locative-role;['rostov-an-don', 'rostov-war-don'];Rostov-an-Don, kêr ha porzh a Rusia, war ribl ar stêr Don, 46 km eus Mor Azov.
locative-role;['sheffield'];Un distrig deuet da vezañ er pleustr un Amaezerezh unvan abaoe freuz Kuzul-Kontelezh Su Yorkshire e 1986, eo Sheffield.
locative-role;['stratford-upon-avon'];Stratford-upon-Avon a zo ur gêr e Warwickshire, e Bro-Saoz, war lez ar stêr Avon, nepell diouzh Birmingham.
locative-role;['digoadenn', 'frankizenn'];Un digoadenn, pe frankizenn zo ur lec'h zo bet digoadet, ha dre-se hep gwez, e-kreiz ur c'hoad.
locative-role;['siberia', 'sibiria'];Ur rannvro ledan ken-ha-ken eo Siberia pe Sibiria (ruseg : Сиби́рь, Sibir’ . tatareg : Себер "Seber"), e Kevread Rusia, eus an Oural betek ar Meurvor Habask.
locative-role;['jeriko'];Jeriko (en arabeg أريحا Rīḥa ou Arīḥā, en hebraeg יריחו, Yerīḥo, e gresianeg Iεριχώ) a zo ur gêr e Sisjordania, unan eus ar re goshañ er bed, war ribl kôrnog ar Jordan.
locative-role;['broioù al liger', 'broioù-al-liger', 'pays de la loire', 'pays de loire', 'rannvro broioù-al-liger'];Broioù al Liger pe Pays de la Loire zo unan eus rannvroioù Bro-C'hall, krouet gant ar gouarnamant gall e 1955, war-lerc'h ur rannvro velestradurel krouet e 1941.
locative-role;['zaragoza'];Zaragoza zo ur gêr vras eus Spagn.
locative-role;['tabriz'];Tabriz (تبريز Tabrīz e perseg . تبريز Təbriz en azereg) zo ur gêr vras e gwalarn Iran.
locative-role;['mykenai', 'mikenai', 'mikene', 'mikenea'];Mykenai (Μυκῆναι Mykễnai e henc'hresianeg) a oa un hen geoded rakhellenek war un dorgenn er biz da blaenenn Argos, er Peloponnesos ha mogerioù bras en dro dezhi, mogerioù a lavarer anezho int kiklopean peneogwir ez eus anezho pezhiadoù mein bras ponner.
locative-role;['gizah', 'gizeh', 'giza'];Evit lec'hienn ar piramidennoù, gwelet amañ
