agentive-physical-object;['gewöönelk siagäärs', 'zostera marina'];At gewöönelk siagäärs as en plaantenslach an hiart tu a siagäärsplaanten.
agentive-physical-object;['aloen', 'aloe'];Aloen san en plaantenskööl uun det famile faan a Gäärsbuumplaanten.
agentive-physical-object;['sunswaalk', 'riparia riparia'];At sunswaalk hiart tu at fögelfamile faan a swaalken.
agentive-physical-object;['letj swaan', 'cygnus columbianus', 'cygnus bewickii'];At letj swaan as en fögel an hiart tu at onerfamile ges an swaanen.
agentive-physical-object;['poden', 'bufonidae', 'trüse'];A poden (Bufonidae) san en famile faan amfiibien uun det kategorii faan a hobelfasker an poden (Anura).
agentive-physical-object;['meis', 'mais', 'zea mays'];Meis (Zea mays) as en plaantenslach uun det famile swetgäärs (Poaceae), an kaam tuiarst uun Meksiko föör.
agentive-physical-object;['eskebuum', 'fraxinus excelsior'];Di Eskebuum as en bloosenbuum uun det skööl Eskebuumer uun det famile faan a Öölebuumplaanten.
agentive-physical-object;['virginia-tabak', 'nicotiana tabacum'];Virginia-tabak as en plaantenslach an hiart tu det famile faan a naachtskaadplaanten.
agentive-physical-object;['ruad toost', 'holcus lanatus'];Ruad toost as en plaantenslach uun det famile swetgäärs.
agentive-physical-object;['ruad fangerhud', 'digitalis purpurea'];Di Ruad Fangerhud as en plaantenslach uun det skööl faan a Fangerhuder uun det famile Waibleedplaanten.
agentive-physical-object;['margerit', 'gewöönelk margerit', 'leucanthemum vulgare'];At (gewöönelk) margerit (Leucanthemum vulgare) as en plaant uun det famile faan a kurewbloosen (Asteraceae).
agentive-physical-object;['lonten', 'typha', 'typha latifolia'];Lont san plaanten uun det famile faan a boberrosken.
agentive-physical-object;['wilagruusje', 'epilobium angustifolium', 'chamerion angustifolium'];At Wilagruusje as en plaantenslach uun det skööl Epilobium an uun det famile Onagraceae.
agentive-physical-object;['papyrusraid', 'papyrus'];Papyrusraid as en plaantenslach uun det skööl zypergäärs uun't famile raidgäärs.
agentive-physical-object;['kanaarisk draagbuum', 'draagbuum', 'draagbuumer'];Di kanaarisk draagbuum as wel di bekäändst slach faan a draagbuumer.
agentive-physical-object;['echt datelpualem', 'phoenix dactylifera'];At echt datelpualem as en pualem faan det famile Arecaceae.
agentive-physical-object;['sokerröör', 'saccharum officinarum', 'sokerraid'];Sokerröör of uk sokerraid as en plaant uun det famile swetgäärs.
agentive-physical-object;['aprikoos', 'aprikoosenbuum', 'aprikose', 'prunus armeniaca'];At aprikoos as en frücht an en buum uun det skööl Prunus an hiart tu a ruusenplaanten.
agentive-physical-object;['plankton', 'nekton'];Plankton as nian kategorii uun a süstemaatik faan a biologii.
agentive-physical-object;['buan', 'buanen', 'phaseolus vulgaris'];At guardbuan (Phaseolus vulgaris), green buan of uk man ianfach buan as en plaant uun det famile Fabaceae.
agentive-physical-object;['himbei', 'rubus idaeus'];At himbei as en frücht an en plaant uun det famile faan a ruusenplaanten.
agentive-physical-object;['müsensiif', 'buteo buteo'];A müsensiif as en fögel ütj at famile faan a hanjügern.
agentive-physical-object;['meew', 'kaukmö', 'larus canus', 'letj buur'];At meew hiart tu at fögelfamile faan a kuben an as 43 cm grat.
agentive-physical-object;['ruad foos', 'vulpes vulpes'];A ruad foos hiart tu at kategorii faan a hünjer an as en tetjdiart.
agentive-physical-object;['maarswin', 'phocoena phocoena'];At maarswin (Phocoena phocoena) as en letjen waal (Cetacea) ütj det famile faan a Swinswaalen an woort 1,85 m lung.
agentive-physical-object;['aarebaare', 'ciconia ciconia', 'storch'];At aarebaare
agentive-physical-object;['hermeliin', 'mustela erminea'];At hermeliin as en ruuwdiart uun det famile faan a huarmer an elken.
agentive-physical-object;['goobeldiarten', 'monotremata'];Goobeldiarten (Monotremata) san man en letj kategorii faan tetjdiarten uun det onerklas faan a Protheria.
agentive-physical-object;['polaarfoos', 'vulpes lagopus'];A Polaarfoos of uk Isfoos as en foos faan det skööl Vulpes an lewet trinjam a nuurdpuul.
agentive-physical-object;['bleedenmöösk', 'bryophyta'];Bleedenmöösk (Bryophyta) as ian faan trii ufdialangen möösk.
agentive-physical-object;['hingstkastanje', 'aesculus hippocastanum', 'hingstkastanjin'];At hingstkastanje as en buum uun det famile faan a echt siapenbuumer.
agentive-physical-object;['papaya', 'carica', 'carica papaya'];At Papaya het uk "meloonenbuum" an as di iansagst plaantenslach uun det skööl Carica uun det famile faan a Papayaplaanten.
agentive-physical-object;['kakaobuum', 'theobroma cacao', 'kakao', 'kakaobuumer'];Di Kakaobuum as en plaant uun det famile faan a Malwenplaanten.
agentive-physical-object;['ceylon-kaneel', 'cinnamomum verum', 'echt kaneel'];Ceylon-kaneel as en buum uun det famile faan a loorbeiplaanten.
agentive-physical-object;['hongerkral', 'armeria maritima'];At hongerkral (Armeria maritima) hiart tu at plaantenkategorii Caryophyllales.
agentive-physical-object;['steegmagen', 'culicidae', 'moskiiten', 'steegmag'];Steegmagen of moskiiten (Culicidae) san en famile faan insekten uun det kategorii faan a twiijügeten.
agentive-physical-object;['twiijügeten', 'diptera'];Twiijügeten (Diptera) san en kategorii faan insekten.
agentive-physical-object;['fladermüsen', 'microchiroptera'];A fladermüsen san en onerkategorii faan tetjdiarten mä 17 familin an 900 slacher.
agentive-physical-object;['fialkamel', 'matricaria inodora', 'tripleurospermum inodorum', 'tripleurospermum maritimum inodorum', 'tripleurospermum perforatum'];Det fialkamel (Tripleurospermum maritimum inodorum, Tripleurospermum perforatum of uk Matricaria inodora) as en onerslach faan Tripleurospermum maritimum uun det plaantenfamile faan a kurewbloosen (Asteraceae).
agentive-physical-object;['letj bor'];Det letj bor as en plaant uun det famile faan a kurewbloosen.
agentive-physical-object;['teeruus', 'achillea millefolium', 'marin-wolmerstee'];At teeruus of uk Marin-Wolmerstee as en plaant faan det famile Asteraceae.
agentive-physical-object;['wil hingst', 'equus ferus'];A wil hingst (Equus ferus) as en slach faan a hingster (Equidae).
agentive-physical-object;['triadwirmer', 'nematoda', 'triadwirem'];Triadwirmer of Nematoden (Nematoda, faan griichisk νημα ‚triad‘) san en stam faan diarten mä amanbi 20.000 slacher.
agentive-physical-object;['kwegels', 'saccharomyces cerevisiae'];Kwegels (Saccharomyces cerevisiae) as en swaamp an sodenang nai mä a hünjmotsen.
agentive-physical-object;['papagein', 'popegein', 'psittaciformes'];Popegein san en order faan fögler.
agentive-physical-object;['echt aloe', 'aloe vera'];Echt Aloe as en plaantenslach uun det skööl faan a Aloen.
agentive-physical-object;['parlhanen', 'numididae'];Parlhanen san en famile faan hanenfögler mä schauer sköölen an sääks slacher.
agentive-physical-object;['fögler', 'aves', 'fögel', 'fügler', 'vögel'];Fögler san en klas faan diarten mä jügen an en nääb.
agentive-physical-object;['ääker-senep', 'sinapis arvensis'];Ääker-Senep as en senep-plaant an woort miast üs ünkrüüs uunsen.
agentive-physical-object;['snäsparag', 'plectrophenax nivalis', 'snefügel', 'snekok', 'sniiling', 'sniispåri'];A snäsparag liket en sparag, hiart oober tu det fögelfamile faan a Calcariidae.
agentive-physical-object;['hääfkub', 'heefkub', 'hålifoomen', 'larus marinus'];At hääfkub
agentive-physical-object;['kakaduun', 'cacatuidae', 'kakaduus'];Kakaduun san en fögelfamile an hiar tu a popegein.
agentive-physical-object;['sauvignon blanc'];Sauvignon Blanc as en slach faan green windrüüw, wat ütj det Bordeaux regiuun faan Frankrik komt.
agentive-physical-object;['eerdnöd', 'arachis hypogaea', 'eerdnöden'];At eerdnöd as en plaantenslach uun det onerfamile faan a flenerkbloosen.
agentive-physical-object;['solbei', 'ribes nigrum'];Solbei (Ribes nigrum) het en plaant an uk sin früchten uun det famile Grossulariaceae.
agentive-physical-object;['ruusmariin', 'rosmarinus officinalis'];Ruusmariin as en plaantenslach uun det skööl Rosmarinus uun det famile faan a Lapbloosplaanten.
agentive-physical-object;['echt silere', 'apium graveolens'];Echt silere as en plaant faan det famile Apiaceae.
agentive-physical-object;['rööwsiad', 'brassica rapa'];Rööwsiad, uk: Kualrööwen as en plaantenslach uun det famile faan a Krüsbloosen.
agentive-physical-object;['suart senep', 'brassica nigra'];Suart senep, uk "mosterkual" as en plaantenslach uun det skööl faan a Kualplaanten.
agentive-physical-object;['jakobskrüskrüüs', 'senecio jacobaea'];At Jakobskrüskrüüs as en plaantenslach uun det famile faan a kurewbloosen.
agentive-physical-object;['kiang'];A Kiang as en tetjdiart uun det famile faan a Hingster.
agentive-physical-object;['wil an', 'anas platyrhynchos', 'wilan'];At wil an
agentive-physical-object;['dünemeert', 'lathyrus japonicus'];At Dünemeert (Lathyrus japonicus) as en plaant ütj det famile flenerkbloosen (Faboidae).
agentive-physical-object;['stianhopern', 'archaeognatha'];Stianhopern san en order faan insekten mä 450 bekäänd slacher.
agentive-physical-object;['lüs', 'phthiraptera'];A lüs san en kategorii faan insekten.
agentive-physical-object;['dingo'];Di Dingo as en hüshünj, di al för juardüüsenen ferwilagt as an daalang üs wil diart täält.
agentive-physical-object;['sjip', 'ovis aries', 'ovis orientalis aries', 'schaf'];Dat Uurt Sjip uur fuar dat Hüssjip (Ovis orientalis aries) brükt.
agentive-physical-object;['wirmer', 'annelida', 'wirem', 'platwirmer', 'baswirmer', 'clitellata'];A wirmer (fe.
agentive-physical-object;['güül klapruus', 'glaucium flavum'];At güül klapruus as en plaant uun det famile Papaveraceae.
agentive-physical-object;['sassafras'];Sassafras as en plaantenskööl uun det famile faan a Loorbeiplaanten.
amount-of-matter;['swaawelsüren', 'dihydrogensulfat', 'swieuwelsuure'];Vorlage:Infobox Chemikalie/Summenformelsuche nicht möglich Swaawelsüren as en cheemisk ferbinjang faan swaawel mä det cheemisk formel H2SO4.
amount-of-matter;['adenosintriphosphat'];Vorlage:Infobox Chemikalie/Summenformelsuche vorhanden Adenosintriphosphat, kurt ATP, as en nukleotid.
amount-of-matter;['kofe', 'koafje', 'kaffee'];Kofe woort faan kofesiad maaget, det woort röst an grünjen an do mä hiat weeder apkööget.
amount-of-matter;['coffein', 'c8h10n4o2', 'kofein'];Vorlage:Infobox Chemikalie/Summenformelsuche vorhanden Coffein as en Alkaloid an sodenang ei üngefeerelk.
amount-of-matter;['sink', 'zn', 'zink'];Sink as en cheemisk element mä det sümbool Zn an det atoomnumer 30.
amount-of-matter;['germaanium', 'germanium', 'г', 'ge'];Germaanium as en cheemisk element mä det sümbool Ge an det atoomnumer 32.
amount-of-matter;['teluur', 'tellur', 'täluur'];Teluur
amount-of-matter;['nianmetal', 'ai-metal', 'nichtmetalle'];Nianmetalen san cheemisk elementen saner eegenskapen faan metalen.
amount-of-matter;['weeder', 'h₂o', 'is', 'saaltweeder', 'swetweeder', 'wasser'];Vorlage:Infobox Chemikalie/Summenformelsuche vorhanden Weeder as en cheemisk ferbinjang faan sürstoof an weederstoof.
amount-of-matter;['argon', 'ar'];Argon as en keemisch elemänt ma sümbool Ar än atoomnumer 18 as en äädelgas.
amount-of-matter;['kloorweederstoof', 'chlorweederstoof', 'hydrogenchlorid'];Vorlage:Infobox Chemikalie/Summenformelsuche nicht möglich Kloorweederstoof as en gas, diar ham lacht uun weeder liaset.
amount-of-matter;['krüptoon', 'krypton', 'kr'];Krüptoon as en böös raar cheemisk element mä det sümbool Kr an det atoomnumer 36.
amount-of-matter;['neon', 'ne'];Neon as en cheemisk element mä det ufkörtang Ne an det atoomnumer 10.
amount-of-matter;['eetjsüren', 'eetj'];Vorlage:Infobox Chemikalie/Summenformelsuche vorhanden Eetjsüren as en süren saner klöör, mä en starken stirem.
amount-of-matter;['kloor', 'cl', 'chlor'];Kloor as en cheemisk element mä det ufkörtang Cl an det atoomnumer 17.
amount-of-matter;['stikstoof', 'stikstuf', 'n', 'stickstoff'];Stikstoof as en cheemisk element mä det atoomnumer 7 an det ufkörtang N. Di nööm hinget diarmä tuup, dat stikstoof ial dääsket.
amount-of-matter;['saccharoos', 'soker', 'röörsoker', 'rööwensoker', 'saccharose', 'zucker'];Vorlage:Infobox Chemikalie/Summenformelsuche vorhanden Mä soker ment am fööraal Saccharoos [zaxaˈroːz].
amount-of-matter;['saalten', 'chlorid', 'chloriden'];Saalten san chemisk ferbinjangen, diar faan positiif kationen an negatiif anionen tuupsaat san.
amount-of-matter;['sulfiid'];Sulfiiden san saalten faan swaawelweederstoof.
amount-of-matter;['technetium', 'techneetsium', 'technetsium'];Techneetsium as en cheemisk element mä det ufkörtang Tc an det atoomnumer 43.
amount-of-matter;['eerdööle', 'ra ööle'];Eerdööle as en natüürelk mineraal, an diar as köölweederstoof uun.
amount-of-matter;['tseerium', 'cer', 'cerium'];Tseerium as en cheemisk element mä det ufkörtang Ce an det atoomnumer 58.
amount-of-matter;['kööber', 'cu', 'cuprum', 'koower'];Kööber (Koower(mo.), lat.
amount-of-matter;['glycerin', 'glycerol', 'glyzerin', 'propan-1,2,3-triol'];Vorlage:Infobox Chemikalie/Summenformelsuche vorhanden Glycerin as di bekäänd nööm för Propan-1,2,3-triol.
amount-of-matter;['hafnium'];Hafnium as en cheemisk element mä det ufkörtang Hf an det atoomnumer 72.
amount-of-matter;['osmium'];Osmium as en cheemisk element mä det ufkörtang Os an det atoomnumer 76.
amount-of-matter;['kroom', 'cr'];Kroom, ualgriichisk chrṓma as en cheemisk element mä det sümbool Cr an det atoomnumer 24.
amount-of-matter;['mangaan', 'mangan', 'mn'];Mangaan [maŋˈɡaːn] as en cheemisk element mä det sümbool Mn an det atoomnumer 25.
amount-of-matter;['koobalt', 'kobalt', 'co', 'cobalt'];Koobalt as en cheemisk element mä det sümbool Co an det atoomnumer 27.
amount-of-matter;['tantaal', 'tantal', 'tantalium'];Tantaal as en cheemisk element mä det ufkörtang Ta an det atoomnumer 73.
amount-of-matter;['nikel', 'ni', 'nickel'];Nikel as en cheemisk element mä det sümbool Ni an det atoomnumer 28.
amount-of-matter;['rääf', 'reef'];Rääf, uk baarnstian (lat.
amount-of-matter;['bismut', 'bismuth'];Bismut as en cheemisk element mä det ufkörtang Bi an det atoomnumer 83.
amount-of-matter;['iriidium', 'iridium'];Iriidium as en cheemisk element mä det ufkörtang Ir an det atoomnumer 77.
amount-of-matter;['wolfraam', 'wolfram'];Wolfraam as en cheemisk element mä det ufkörtang W an det atoomnumer 74.
amount-of-matter;['kööldioksiid', 'kööldioxid', 'co2', 'kohlenstoffdioxid', 'köölstoofdioxid', 'köölsüren'];Vorlage:Infobox Chemikalie/Summenformelsuche vorhanden Kööldioksiid of uk köölstoofdioksiid as en chemisk ferbinjang faan köölstoof an sürstoof mä det formel CO2.
amount-of-matter;['plaatin', 'pt', 'platin', 'platinum'];Plaatin as en cheemisk element mä det ufkörtang Pt an det atoomnumer 78.
amount-of-matter;['uraan', 'u', 'uran'];Dåt uraan (lat.: Uranium) as en rädjelsehaft än ünbekånd metal, dåt da mååste manschne goorai tu siinj foue.
amount-of-matter;['nitroglitseriin'];Vorlage:Infobox Chemikalie/Summenformelsuche vorhanden Nitroglitseriin of Glitseriintrinitraat of Trisalpeetersürenglitseriinester as en ester faan't salpeetersüren.
amount-of-matter;['magneesium', 'magnesium', 'mg'];Magneesium as en cheemisk element mä det ufkörtang Mg an det atoomnumer 12.
amount-of-matter;['kaalium', 'k'];Kaalium as en cheemisk element mä det ufkörtang K an det atoomnumer 19.
amount-of-matter;['beryllium', 'be', 'berülium'];Beryllium as en keemisch elemänt ma sümbool Be än atoomnumer 4.
amount-of-matter;['titan', 'titaan', 'ti', 'titanium'];Titaan as en cheemisk element mä det sümbool Ti an det atoomnumer 22.
amount-of-matter;['polyethyleen'];Polyethyleen es en Könststof.
amount-of-matter;['tsirkoonium', 'zirconium', 'zirkonium'];Tsirkoonium as en cheemisk element mä det ufkörtang Zr an det atoomnumer 40.
amount-of-matter;['antimoon'];Antimoon
amount-of-matter;['terbium'];Terbium as en cheemisk element mä det ufkörtang Tb an det atoomnumer 65.
amount-of-matter;['fosfoor', 'phosphor', 'p'];Fosfoor as en cheemisk element mä det ufkörtang P an det atoomnumer 15.
amount-of-matter;['sürstoof', 'sörstuf', 'o', 'sauerstoff'];Sürstoof as en cheemisk element mä det ufkörtang O an det atoomnumer 8.
amount-of-matter;['jood'];Jood as en cheemisk element mä det ufkörtang I an det atoomnumer 53.
amount-of-matter;['broom', 'brom', 'br', 'bromium'];Broom [broːm] as en cheemisk element mä det sümbool Br an det atoomnumer 35.
amount-of-matter;['wååderstuf', 'weederstoof', 'h', 'wasserstoff'];Wååderstuf (de.
amount-of-matter;['fluor', 'f'];Fluor [ˈfluːoːɐ̯] as en cheemisk element mä det ufkörtang F an det atoomnumer 9.
amount-of-matter;['dna', 'desoxyribonukleinsüren', 'dns'];DNA as det ingelsk ufkörtang för Desoxyribonukleinsüren.
amount-of-matter;['rna', 'mrna', 'ribonukleinsüren', 'ribosomaal-rna', 'rns', 'rrna', 'trna'];RNA as det ingelsk ufkörtang för Ribonukleinsüren.
amount-of-matter;['nukleotid', 'adenosindiphosphat', 'nukleosid'];En Nukleotid of uk Nucleotid as en grünjbaustian faan nukleinsüren, det san Desoxyribonukleinsüren (DNA) an Ribonukleinsüren (RNA).
amount-of-matter;['polystyrool', 'ps', 'poly'];Polystyrool es en Könststof.
amount-of-matter;['polyvinylchlorid'];Polyvinylchlorid es en Könststof.
amount-of-matter;['molybdeen', 'molübdeen', 'molybdän'];Molübdeen as en cheemisk element mä det ufkörtang Mo an det atoomnumer 42.
amount-of-matter;['aktiinium', 'ac', 'actinium', 'aktinium'];Aktiinium as en cheemisk element mä det ufkörtang Ac an det atoomnumer 89.
amount-of-matter;['frantsium', 'francium'];Frantsium as en cheemisk element mä det ufkörtang Fr an det atoomnumer 87.
amount-of-matter;['radoon', 'raadon', 'radon'];Radoon as en cheemisk element mä det ufkörtang Rn an det atoomnumer 86.
amount-of-matter;['tseesium', 'cs', 'caesium', 'cesium'];Tseesium as en cheemisk element mä det ufkörtang Cs an det atoomnumer 55.
amount-of-matter;['strontium', 'strontsium'];Strontsium as en cheemisk element mä det ufkörtang Sr an det atoomnumer 38.
amount-of-matter;['poloonium', 'polonium'];Poloonium as en radioaktiif cheemisk element mä det tiaken Po an det atoomnumer 84.
amount-of-matter;['kuurium', 'cm', 'curium'];Kuurium as en konstelk cheemisk element mä det ufkörtang Cm an det atoomnumer 96.
amount-of-matter;['reenium', 'renium', 'rhenium'];Reenium as en cheemisk element mä det ufkörtang Re an det atoomnumer 75.
amount-of-matter;['ruteenium', 'ruthenium'];Ruteenium as en cheemisk element mä det ufkörtang Ru an det atoomnumer 44.
amount-of-matter;['gallium', 'ga'];Gallium as en böös raar cheemisk element mä det sümbool Ga an det atoomnumer 31.
amount-of-matter;['indium'];Indium as en cheemisk element mä det ufkörtang In an det atoomnumer 49.
amount-of-matter;['kaltsiumkarbonaat', 'kalk'];Vorlage:Infobox Chemikalie/Summenformelsuche vorhanden Kaltsiumkarbonaat of ianfach Kalk as en cheemisk ferbinjang faan Kaltsium, Köölstoof an Sürstoof mä det cheemisk formel CaCO3.
amount-of-matter;['fosfaat', 'phosphat', 'phosphaat'];En fosfaat as en saalt of en ester faan fosfoorsüren.
amount-of-matter;['acetat'];En acetat as det saalt of en ester faan eetjsüren.
amount-of-matter;['karbonaat', 'hydrogenkarbonaat'];Karbonaaten san det saalt faan't köölsüren (H2CO3).
amount-of-matter;['nitraat', 'nitraaten'];Nitraaten san saalten of estern faan't salpeetersüren.
amount-of-matter;['sulfaat', 'naatriumsulfaat', 'sulfaaten'];Sulfaaten san saalten of estern faan't swaawelsüren.
amount-of-matter;['protaktiinium', 'protactinium', 'protaktinium'];Protaktiinium as en cheemisk element mä det ufkörtang Pa an det atoomnumer 91.
amount-of-matter;['alumiinium', 'aluminium', 'al'];Aluminium as en keemisch elemänt ma sümbool Al än atoomnumer 13.
amount-of-matter;['tan', 'sn', 'kassiterit', 'stannum', 'tanstian'];Tan as en cheemisk element mä det tiaken Sn (lat.
amount-of-matter;['ütrium', 'y', 'ytrium', 'yttrium'];Ütrium [ˈʏtri̯ʊm] as en cheemisk element mä det ufkörtang Y an det atoomnumer 39.
amount-of-matter;['naatrium', 'natrium', 'na'];Naatrium as en cheemisk element mä det tiaken Na an det atoomnumer 11.
amount-of-matter;['palaadium', 'palladium'];Palaadium as en cheemisk element mä det ufkörtang Pd an det atoomnumer 46.
amount-of-matter;['kadmium', 'cd'];Kadmium as en cheemisk element mä det ufkörtang Cd an det atoomnumer 48.
amount-of-matter;['niobium', 'nioobium', 'niob'];Nioobium as en cheemisk element mä det ufkörtang Nb an det atoomnumer 41.
amount-of-matter;['luad', 'pb', 'plumbum'];Luad as en cheemisk element mä det tiaken Pb an det atoomnumer 82.
amount-of-matter;['tseesium', 'cs', 'caesium', 'cesium'];Tseesium as en cheemisk element mä det ufkörtang Cs an det atoomnumer 55.
amount-of-matter;['strontium', 'strontsium'];Strontsium as en cheemisk element mä det ufkörtang Sr an det atoomnumer 38.
amount-of-matter;['lithium', 'liitsium', 'li'];Lithium as en keemisch elemänt ma sümbool Li än atoomnumer 3.
amount-of-matter;['baarium', 'barium'];Baarium as en cheemisk element mä det ufkörtang Ba an det atoomnumer 56.
amount-of-matter;['rubiidium', 'rubidium'];Rubiidium as en cheemisk element mä det ufkörtang Rb an det atoomnumer 37.
amount-of-matter;['tuulium', 'thulium'];Tuulium as en cheemisk element mä det ufkörtang Tm an det atoomnumer 69.
amount-of-matter;['üterbium', 'yb', 'ytterbium'];Üterbium as en cheemisk element mä det ufkörtang Yb an det atoomnumer 70.
amount-of-matter;['wanaadium', 'vanadium', 'v'];Wanaadium as en cheemisk element mä det sümbool V an det atoomnumer 23.
amount-of-matter;['toorium', 'thorium'];Toorium as en cheemisk element mä det ufkörtang Th an det atoomnumer 90.
amount-of-matter;['gul', 'aurum', 'gölj'];Gul ((mo.) gölj, komt faan indogermaans ghel: güül) as en cheemisk element mä det tiaken Au (faan lat.
amount-of-matter;['naatronbaas', 'natronbaas'];Wikipedia:Struktuurformel maageVorlage:Infobox Chemikalie/Summenformelsuche nicht möglich Naatronbaas as uun weeder apliaset Naatriumhüdroksiid.
amount-of-matter;['naatriumhüdroksiid', 'natriumhydroxid'];Vorlage:Infobox Chemikalie/Summenformelsuche nicht möglich Naatriumhüdroksiid, NaOH, as en witj polwer, diar ham gud uun weeder apliaset an woort diar tu naatronbaas.
amount-of-matter;['siliitsium', 'silitsium', 'si', 'silicium', 'silizium'];Silitsium as en huulewmetal.
amount-of-matter;['seleen', 'selen', 'se', 'selenium'];Seleen [zeˈleːn] as en cheemisk element mä det sümbool Se an det atoomnumer 34.
amount-of-matter;['düsproosium', 'disprosium', 'dysprosium'];Düsproosium as en cheemisk element mä det ufkörtang Dy an det atoomnumer 66.
amount-of-matter;['holmium'];Holmium as en cheemisk element mä det ufkörtang Ho an det atoomnumer 67.
amount-of-matter;['erbium'];Erbium as en cheemisk element mä det ufkörtang Er an det atoomnumer 68.
amount-of-matter;['luteetsium', 'lutetium'];Luteetsium as en cheemisk element mä det ufkörtang Lu an det atoomnumer 71.
amount-of-matter;['boor', 'b'];Boor unti Borium as en keemisch elemänt ma sümbool B än atoomnumer 5.
amount-of-matter;['heelium', 'helium', 'he'];Helium as en keemisch elemänt ma sümbool He än atoomnumer 2.
amount-of-matter;['arseen', 'arsen', 'as'];Arseen [arˈzeːn] as en cheemisk element mä det sümbool As an det atoomnumer 33.
amount-of-matter;['kaltsium', 'ca', 'calcium'];Kaltsium as en cheemisk element mä det ufkörtang Ca an det atoomnumer 20.
amount-of-matter;['moolk', 'molke', 'sees', 'tjuarel'];Moolk as en witj liasang faan proteinen, moolksoker an moolkfäät uun weeder.
amount-of-matter;['lantaan', 'lanthan'];Lantaan as en cheemisk element mä det ufkörtang La an det atoomnumer 57.
amount-of-matter;['naatriumhüdrogeenkarbonaat', 'natriumhydrogencarbonat'];Vorlage:Infobox Chemikalie/Summenformelsuche vorhanden Naatriumhüdrogeenkarbonaat as det naatriumsaalt faan köölsüren mä det formel NaHCO3.
amount-of-matter;['skandium', 'sc', 'scandium'];Skandium (faan lat.
amount-of-matter;['madeira'];Madeira as en win, diar mä baarnwin fermisket as.
amount-of-matter;['koolestuf', 'karboon', 'köölstoof', 'c', 'kohlenstoff'];Koolestuf (dt.
amount-of-matter;['swoowel', 's', 'schwefel', 'swaawel'];Di swoowel as en keemisch elemänt ma sümbool S än atoomnumer 16.
amount-of-matter;['phosphorsüren'];Vorlage:Infobox Chemikalie/Summenformelsuche vorhanden
amount-of-matter;['bronse', 'määsang'];Bronse as en metal an diar hää at bronsetidj hör nööm faan.
amount-of-matter;['saaltsüren'];Wikipedia:Struktuurformel maageVorlage:Infobox Chemikalie/Summenformelsuche nicht möglich Saaltsüren as uun weeder apliaset Kloorweederstoof, det as ööders en gas.
amount-of-matter;['köölhüdraaten', 'köölhydraaten', 'köölhüdraat', 'laktoos', 'monosaccharid', 'monosaccharide', 'moolksoker', 'muarfachsoker', 'polysaccharid', 'saccharide', 'seluloos', 'taufachsoker'];Köölhüdraaten of uk Sacchariden san di gratst cheemisk dial faan ales labenen üüb a eerd.
amount-of-matter;['raadium', 'radium'];Raadium as en cheemisk element mä det ufkörtang Ra an det atoomnumer 88.
amount-of-matter;['köölweederstoof', 'hydrokarbon', 'koolewååderstuf'];Köölweederstoof (Hydrokarbon) het en skööl faan cheemisk ferbinjangen, huar bluas köölstoof an weederstoof uun as.
amount-of-matter;['oksiid', 'oksiiden'];Oksiiden san sürstoof-ferbinjangen faan en cheemisk element.
amount-of-matter;['lantanoid', 'lantaniiden', 'lantanoiden', 'lanthanid'];En lantanoid as en cheemisk element, diar lantaan liket.
amount-of-matter;['protein', 'aiwitj', 'proteiine'];Protein of aiwitj san grat moleküülen, huar aminosüren uun sat.
amount-of-matter;['metal', 'legiarang', 'swaarmetal'];A miast cheemisk elementen san metalen.
