political-geographic-object;['istanbul', 'konstantinoopel'];Istanbul (türkisk İstanbul) as det gratst stääd uun a Türkei an uk di kulturel madelponkt.
political-geographic-object;['detroit'];Detroit as det gratst steed uun de US-ameerikoons bundesstoot Michigan.
political-geographic-object;['new york city'];New York [nuːˈjɔːɹk] (gans akeroot City of New York) as en gratstääd bi a uastküst faan a Ferianagt Stooten faan Ameerikoo.
political-geographic-object;['karatschi', 'karāchi'];Karatschi as det gratst stääd uun Pakistaan an hoodstääd faan't prowins Sindh.
political-geographic-object;['philadelphia', 'philadelphia county'];Philadelphia as en amerikoonsk stääd an uk en county uun Pennsylvania.
political-geographic-object;['tripolis', 'tripoli'];Tripolis (araabisk ‏طرابلس‎, DMG Ṭarābulus, iar Oea, italjeensk/ingelsk Tripoli faan gr.
political-geographic-object;['brasiilien', 'brasilien'];Brasiilien as efter grate an iinwenertaal at fiftgratst lun üüb a eerd an mä 195 miljuun iinwenern det gratst lun uun Süüd-Ameerikoo, huar't mä 47% knaap a heleft faan iinnamt.
political-geographic-object;['quebec'];Québec of Quebec (fransöösk Québec [keˈbɛk], ingelsk Quebec [kwɨˈbɛk]) as det gratst prowins uun Kanada an det mä di gratst uundial faan lidj, diar fransöösk snaake.
political-geographic-object;['toronto'];Toronto as at hoodsteed faan det Ontario Prowins uun Kanada.
political-geographic-object;['venedig'];Venedig as en stää önj Itaalien.
political-geographic-object;['piemont'];At Piemont as en regiuun uun't nuurdwaasten faan Itaalien mä 4.404.246 iinwenern
political-geographic-object;['pretoria'];Pretoria as at hoodsteed faan Süüdaafrika.
political-geographic-object;['texas'];Texas as en diiljstoot foon da Feriind Stoote.
political-geographic-object;['phoenix'];Phoenix as at hoodsteed an det gratst steed uun det US-ameerikoons bundesstoot Arizona.
political-geographic-object;['denver'];Denver [ˈdɛnvər] as at hoodsteed, det gratst steed an en county faan de US-ameerikoons bundesstoot Colorado.
political-geographic-object;['adelaide'];Adelaide as at hoodsteed faan’t bundesstoot South Australia uun Austraalien.
political-geographic-object;['perth'];Perth as en steed uun a waast faan Austraalien.
political-geographic-object;['attika'];Det Attika Regiuun as ian faan dön 13 regiuunen faan Grekenlun.
practice;['frees', 'frieden'];Frees as en tustant faan rau, fööraal as diarmä det jindial faan kriich mend.
quality;['induktiwiteet'];Induktivität as en eegenskap faan elektroonisk baudialen, föraal faan spuulen.
quality;['woorskiinelkhaid', 'wahrscheinlichkeit'];Woorskiinelkhaid as en miat diarför, wäär en ütjsaag woor as of uk ei.
quality;['grä'];Grä as en klöör mä en laachtens tesken suart an witj, oober saner en bruketen uundial.
quality;['religioon', 'religion', 'religiuun', 'teoloog'];== Religioonen == Krastendoom Juudendoom Islam Buddhismus Daoismus Soroastrismus == Persöönelkhaiden == Ludwig Ingwer Nommensen == Sarken == Frascheschörk St.
quality;['brons'];Brons as en klöör an hää en waagenlengde faan 380 bit 425 nm.
quality;['brün'];Brün as en klöör, oober nian spektraalklöör.
quality;['bne'];w:de:BruttonationaleinkommenDetdiar sidj skal di widjer feer.
quality;['bip', 'brutoinlönjsprodukt'];w:de:BruttoinlandsproduktDetdiar sidj skal di widjer feer.
quality;['ph-wäärs'];Di pH-wäärs as en miat diarför, of en liasang sür of baasisk as.
quality;['soroastrismus', 'zoroastrismus'];A Soroastrismus as det iinbäären monoteistisk an dualistisk religiuun faan Iraan, wat faan a profeet Zarathustra grünjlaanjen wurd.
quality;['sachthaid'];At sachthaid
quality;['ween', 'blau'];Ween as en blai, dåt önj dåt späktrum lait twasche zyan än violät.
quality;['tempratuur', 'temperatuur'];At tempratuur as en grate uun a füsiik.
quality;['islaam', 'islam'];Di islaam as ian faan a grat weltreligioonen, hi gongt turag üüb di profeet Mohammed.
quality;['juudendoom', 'juuden'];Juudendoom as det religion an kultuur faan a Juuden.
quality;['kaamertoon'];Di Kaamertoon es di Toon, hureeđer ali Instrumenti fan en Musiik-Ker stemet uur, dat dānen töhopstemi.
quality;['frei wal', 'freier wille'];Di frei wal as det määcht faan a minsk, ütj flook mögelkhaiden det ian of det ööder ütjtuschüken.
quality;['mase', 'masse'];At mase as en eegenskap faan arke materiool an en grate uun a füsiik.
quality;['green', 'gräin', 'oliif'];Green as en klöör an hää en waagenlengde tesken 520 an 565 nm.
quality;['witj', 'wit'];Witj as det laachtest klöör.
quality;['suart'];Suart as en klöör för flook dingen uun't daielk leewent, so üs det skraft faan diheer artiikel.
quality;['ruad', 'ruusa'];Ruad as en klöör an hää en waagenlengde faan 650 bit 750 nm.
quality;['güül', 'beesj'];Güül as en klöör an hää en waagenlengde faan 565 bit 585 nm.
quality;['krastendoom', 'efangeelsk', 'krastelk', 'krasten', 'krastenduum', 'krastenhaid', 'reformiaret'];At krastendoom as det gratst weltreligioon an amfaadet wel en traaden faan a minsken üüb a eerd.
quality;['neimuun', 'folmuun', 'mounefaase', 'springflud'];Wi haa neimuun, wan a muun tesken eerd an san stäänt.
quality;['hööchde'];Peegel faan AmsterdamDetdiar sidj skal di widjer feer.
quality;['gewicht', 'gewacht'];Det gewicht G → {\displaystyle {\vec {G}}} faan en materiool hinget faan sin mase an det grawitatjuun uf.
region;['sekund', 'sekunde', 'sekunden'];At Sekund – faan lat.
region;['uns'];En uns as en miat för't mase.
region;['pünj'];At pünj
region;['kwadraatmeeter', 'quadratmeter', 'm^2', 'acre', 'ar', 'ha', 'hektaar', 'hektar', 'km', 'kwadrootsentimeeter', 'mi', 'square foot', 'square inch', 'square mile'];Kwadraatmeeter es en Maat fuar di Gurthair fan en Areaal.
region;['si-süsteem', 'iinhäid', 'si', 'si-ianhaid'];Det SI-süsteem (faan't fransöösk : Système international d’unités) as en internatjunaal ferianboorang för füsikaalisk miaten.
region;['cent'];En Cent (ˈ(t)sɛnt, faan latiinsk centum ‚hunert‘) as 1⁄100 faan flook münten.
region;['centavo'];En Centavo as uun föl lunen, huar spoonsk of portugiisk snaaket woort, di hunertst dial faan det münt.
region;['centime'];En Centime ([sɑ̃tˈiːm], faan fransöösk cent „hunert“) as uun föl lunen, fööraal huar fransöösk snaaket woort, det letjst jilstak: di "hunertst dial".
region;['fut', 'foot', 'ft'];Fut as en miat för't lengde an üüb a hialer welt brükt wurden.
region;['nol', 'nul', '0'];Nol as en hial taal tesken ian oner nol an ian.
region;['winkelgraad', 'radiant', 'winkelminüüt'];At Graad (faan latiinsk gradus‚ straal) as en miat uun a matematiik för di winkel.
region;['liter', 'l', 'kubikdesimeeter'];Di Liter as en miat för di rüm an woort mä
region;['ångström'];MeeterDetdiar sidj skal di widjer feer.
region;['kubiksentimeeter', 'cm'];KubikmeeterDetdiar sidj skal di widjer feer.
region;['kubikmeeter', 'm'];En Kubikmeeter es dat Maat fan di Rüm (Dat Woluumen) iin ön en Körper.
region;['kaabel'];SiamiilDetdiar sidj skal di widjer feer.
region;['stünj', 'stunde'];At stünj as di 24.
region;['byte'];En byte as en miat uun a digitaaltechnik för en fulag faan 8 bit.
region;['coulomb'];Coulomb [kuˈlõː] (C) as det SI-ianhaid för't elektrisk lääs.
region;['joule', 'newtonmeeter', 'voltamperesekund', 'wattsekund', 'elektronenvolt', 'erg', 'kilowattstünj', 'kj', 'mev', 'newtonmeter'];Joule [dʒuːl] as en SI-ianhaid för a füsikaalisk gratin energii, werk an waremk.
region;['ohm', 'ω'];Elektrisk wederstantDetdiar sidj skal di widjer feer.
region;['newton', 'n', 'kilopond', 'pond'];Newton [ˈnjuːtn̩] as uun a füsiik det SI-ianhaid för't krääft.
region;['henry', 'h', 'abhenry'];Henry as det ianhaid för induktiwiteet uun't SI-süsteem, an näämd efter Joseph Henry.
region;['tol', 'zoll'];En Zoll jit ön Ameerikaa inch.
region;['tol', 'zoll'];Tol as en miat för't lengde.
region;['miil'];SiamiilDetdiar sidj skal di widjer feer.
region;['yard'];Yard as en miat för't lengde an woort uun ingelskspreegen lunen brükt.
region;['knoot', 'siamiil', 'kn', 'kaabel', 'seemeile'];At siamiil (M, schiisk: sm, ingelsk: NM) as en miat uun a sia- an loftfaard för't lengde.
region;['knoot', 'siamiil', 'kn', 'kaabel', 'seemeile'];SiamiilDetdiar sidj skal di widjer feer.
region;['lumen', 'lm'];At Lumen as det SI-ianhaid för di laachtstruum.
region;['volt'];Volt as det SI-ianhaid för't elektrisk späänang.
region;['watt', 'voltampere', 'kw'];At Watt as det SI-ianhaid för di efekt uun a füsiik.
region;['ps'];PS komt ütj at huuchsjiisk an stäänt för Pferdestärke.
region;['pascal', 'pa'];Pascal as en füsikaalisk ianhaid uun't SI-süsteem för druk.
region;['minüüt', 'minute', 'minüüten'];En minüüt as en ianhaid för't tidj uun't SI-süsteem.
region;['primtaal'];En primtaal as en natüürelk taal mä tau dialern: ian an det primtaal salew.
region;['kilogram', 'hg', 'mg', 'tg', 'gram', 'gramm', 'kg', 'kilogramm', 'ton', 'tonne'];At kilogram as en SI-grünjmiat för't mase.
region;['cgs-süsteem', 'cgs', 'mks-süsteem', 'mksa-süsteem', 'cgs-ianhaid'];Det CGS-süsteem wiar en internatjunaal ferianboorang för ianhaiden uun a füsiik sant 1874.
region;['ampere', 'ampêre'];Ampere [amˈpɛɐ̯] as en ianhaid uun a füsiik mä det tiaken "A", an as näämd efter di fransöösk füsiiker André-Marie Ampère.
region;['meeter', 'm', 'cm', 'kilomeeter', 'km', 'meter', 'nanomeeter', 'nm', 'sentimeeter', 'zentimeter'];Di meeter as en miat an det grünjlaag för't meeden uun't SI-süsteem.
region;['candela'];At Candela as det SI-ianhaid för't laachtmäächt.
region;['britisk pünj', 'gbp', 'pence', 'pfund sterling', 'pünj sterling'];At Britisk Pünj of uk Pünj Sterling as at münt faan't Ferianagt Könangrik.
region;['quetzal'];Di Quetzal as det münt faan Guatemaala.
region;['yen', 'jpy'];Yen (jap.
region;['marokkaans dirham', 'marokkanischer dirham'];Di Marokkaans Dirham
region;['süüdaafrikoons rand', 'krügerrand', 'süüdafrikaans rand', 'süüdafrikoons rand', 'zar'];A Süüdafrikoons Rand as at münt faan Süüdafrikoo.
region;['süüdkoreaans won', 'südkoreanischer won', 'won'];Di Won as det münt faan Süüdkorea.
region;['sweedsk krüün'];At sweedsk krüün as det münt faan Sweeden.
region;['kelvin'];Kelvin (K) as det SI-ianhaid faan a temperatuur uun a termodünaamik.
region;['farad'];Farad as det SI-ianhaid för't elektrisk kapasiteet.
region;['njügen', '0', '9', 'njüügen'];Njügen as en natüürelk taal tesken aacht an tjiin.
region;['seeks', '6', 'sääks'];Seeks as en natüürelk taal twesken fiiw an sööwen.
region;['fiiw', '5', 'fiiw/fe'];Fiiw as en natüürelk taal tesken schauer an sääks.
region;['tjiin', '10', 'tiin'];Tjiin as en natüürelk taal tesken njügen an elwen.
region;['trii', '3'];Trii (3, röömsk III) as en natüürelk taal tesken tau an schauer.
region;['tau', 'twäär tou', '2'];Tau (2, röömsk II) as en natüürelk taal tesken ian an trii.
region;['aacht', '8'];Aacht as en natüürelk taal tesken sööwen an njügen.
region;['sööwen', '7', 'soowen'];Sööwen as en natüürelk taal tesken sääks an aacht.
region;['fjouer', '4', 'fjauer', 'schauer', 'sjauer'];Jü tål fjouer as en natöörlik tål än en numer.
region;['laachtjuar', 'lichtjahr', 'lj'];At laachtjuar as en miat för't lengde.
region;['mol'];Mol (lung ütjspreegen: mool so üs uun sjiisk Mole, ufkört: mol) as det SI-grünjianhaid för't mengde.
region;['atoomnumer', 'atoomtål'];Ark elemänt önj e perioodisch tabäle foon da elemänte heet en äin atoomnumer, deer koon huum ma siinj hü maning elemänte önj e kärn san.
region;['ian', '1', 'jen'];Ian (1, röömsk I) as en natüürelk taal tesken nul an tau.
region;['dai', 'daar', 'söndai', 'süürsdai', 'tag', 'weg'];En dai as en miat för't tidj an hää flook bedüüdangen.
relation;['funktjuun', 'funktion'];En funktjuun as uun a matematiik en relatjuun tesken tau mengdin.
relation;['funktjuun', 'funktion'];En funktjuun as uun a matematiik en relatjuun tesken tau mengdin.
relation;['neutraal element'];At neutraal element as en betiaknang uun a algebra.
relation;['siapeegel'];Peegel faan AmsterdamDetdiar sidj skal di widjer feer.
relation;['nuurd', 'norden'];A Nuurd as ään faan a hemelswaier.
relation;['süüd', 'sööden'];A Süüd as ään faan a hemelswaier.
relation;['uast', 'uasten', 'ååsten'];A Uast as ään faan a hemelswaier.
relation;['süüduast', 'söödååsten'];Süüduast as en hemelswai tesken süüd an uast.
relation;['waagenlengde', 'woogelängde'];Waagenlengde
relation;['parasiit'];En parasiit as en diart of plaant, diar det, wat hat tu't leewent brükt, faan en miast föl grater diart of plaant haalet.
relevant-part;['hardware', 'festplattenlaufwerk', 'prozessor', 'software'];Hardware as en saamelnööm för aal a füüsisk komponenten faan en kompjuutersüsteem.
simple-collection;['stäärbil'];En stäärbil as en regiuun faan a hemel, huar am en münster faan laacht stäären sä koon.
simple-collection;['swaan', 'deneb', 'schwan'];Di Swaan as en stäärbil üüb a nuurdhemel.
simple-collection;['letj waanj', 'kleiner bär', 'letj beer'];Di Letj Waanj of uk Letj Beer, latiinsk Ursa Minor, UMi as en stäärbil üüb a nuurdelk hemel.
simple-collection;['lyra', 'leier', 'wega'];Lyra as en stäärbil üüb a nuurdelk hemel.
simple-collection;['cassiopeia', 'kassiopeia'];Cassiopeia, Cas as en stäärbil üüb a nuurdelk hemel.
simple-collection;['åål', 'at uniwersum', 'uniwersum', 'weltrüm', 'wrålrüm'];Dåt åål unti universoom as åles dåt bestoont, dåt rüm ma åles wat deer önj tu finen as.
simple-collective;['hertooch', 'hertoochdoom'];En hertooch as en aadelstiitel.
simple-collective;['aadel'];Di aadel as en skööl faan minsken, diar at määcht auer en fulk hää, an det määcht bluas uun't aanj famile widjer dää.
simple-collective;['bourgeoisie', 'bourgeois', 'citoyen'];Bourgeoisie [bʊʁʒo̯a'ziː] komt faan't fransöösk an ment det skööl faan wel steld minsken uun en selskap.
situation;['skorbük', 'skorbut'];Skorbük as en kraankhaid, an begant, wan di minsk ei nooch vitamiin C feit, efter tau bit schauer muuner.
situation;['pooken', 'pocken', 'variola virus'];Pooken san en gefeerelk wiiruskraankhaid.
situation;['liknang', 'gleichung', 'liknangen', 'ütjsaagfurem'];En liknang uun a matematiik as en ütjsaag diarauer, dat tau termen likedenang san.
situation;['hebreewsk alfabeet', 'hebreewsk skraft', 'hebreews skraft', 'hebräische schrift'];Det hebreewsk alfabeet (hebreewsk: ‏אָלֶף־בֵּית עִבְרִי‎‎ alef-bet ivri) as det alfabeet faan't hebreewsk spriak.
situation;['pest', 'grat pest'];A pest as en auer a miaten uunsteegen kraankes.
situation;['binomisch formel', 'binomisk formeln', 'binomisch formeln'];A Binomisk Formeln san en wai uun a matematiik, am det moolnemen faan sumen ianfacher tu maagin.
situation;['rümfård', 'rümfaard', 'rümfaart'];Jü rümfård is en begrip for åle manschlike aktiwitäät büten jü jard.
situation;['sküüren'];Sküüren san en piin uun a bük.
situation;['influenza'];OrthomyxoviridaeDetdiar sidj skal di widjer feer.
situation;['kyrilisk skraft', 'kyrilisk', 'serbokroaatisk kyrilisk'];At kyrilisk skraft woort fööraal uun slaawisk spriaken uun Euroopa an Aasien brükt.
situation;['kreeft', 'krääft'];Kreeft (meditsiinsk: neoplasma maligne) es en Kraanker, diar em heer, weđer iin ön di Lif Zellen wuksi, diar töögen di Organismus ön aarberi.
situation;['ruus', 'herpes zoster', 'winjpooken'];At ruus het üüb latiinsk Herpes Zoster an komt faan en wiirus, di a nerfen uungrapt.
situation;['luari', 'luade'];Luari es en Aart en for Metali töhop.
situation;['aksioom', 'aksiom', 'axiom'];En aksiom as en grünjlaag faan an en teorii, huar ales üüb apbaut.
situation;['aksioom', 'aksiom', 'axiom'];En aksiom as en grünjlaag faan an en teorii, huar ales üüb apbaut.
situation;['araabisk alfabeet', 'araabisk skraft', 'araabisk taal', 'arabisches alphabet', 'dmg'];Det araabisk alfabeet (araabisk ‏الأبجدية العربية‎, al-abdschadiyya al-ʿarabiyya) as det alfabeet faan't araabisk spriak an hää 28 buksteewen.
situation;['griichisk alfabeet', 'greks alfabeet', 'greks buksteew', 'greks skraft', 'griichisk buksteew', 'griichisk skraft'];Uun't greks alfabeet woort at greks spriak sant at 9.
situation;['weder', 'regen', 'rin', 'wetter'];Weder as di tustant faan't onerst laag faan a atmosfeere, at troposfeere uun en was steed üüb a eerd.
situation;['kliima', 'klima', 'miatag breetjin', 'miatag kliima', 'subtroopen'];At kliima beskraft det weder, so üs det uun't madel auer flook juaren uflääpt.
social-relationship;['politiik', 'politologii'];Önj e politiik jeeft et ünlike floose foon manschne än jare inträse.
socially-constructed-person;['geoffrey chaucer'];Geoffrey Chaucer
socially-constructed-person;['niccolò machiavelli'];Niccolò di Bernardo dei Machiavelli ​
socially-constructed-person;['jaakob vi. an i.'];Köning Jaakob VI. an I.
socially-constructed-person;['johann sebastian bach'];Johann Sebastian Bach (* 31.
socially-constructed-person;['voltaire'];Voltaire [vɔltɛːʀ]
socially-constructed-person;['johann wolfgang von goethe'];Johann Wolfgang von Goethe
socially-constructed-person;['ludwig van beethoven'];Ludwig van Beethoven (* 17.
socially-constructed-person;['victor hugo'];Victor-Marie Hugo
socially-constructed-person;['frederic chopin'];Frédéric François Chopin of Fryderyk Franciszek Chopin
socially-constructed-person;['johannes brahms', 'brahms'];Johannes Brahms
socially-constructed-person;['émile zola'];Émile Édouard Charles Antoine Zola
socially-constructed-person;['eduard vii.', 'edward vii.'];Eduard VII.
socially-constructed-person;['georg v.'];Georg V.
socially-constructed-person;['marcel proust'];Valentin Louis Georges Eugène Marcel Proust
socially-constructed-person;['winston churchill'];Sir Winston Leonard Spencer-Churchill
socially-constructed-person;['erwin schrödinger'];Erwin Rudolf Josef Alexander Schrödinger
socially-constructed-person;['adolf hitler'];Adolf Hitler (* 20.
socially-constructed-person;['haile selassie i.'];Haile Selassie I.
socially-constructed-person;['eduard viii.', 'edward viii.'];Eduard VIII.
socially-constructed-person;['georg vi.'];Georg VI.
socially-constructed-person;['alexander di grat', 'alexander di grute'];Alexander di Grat uk Alexander III. faan Makedoonien
socially-constructed-person;['karl di grat', 'karl de grat', 'karl der große', 'karl di grutte'];Karl di Grat
socially-constructed-person;['swaampen', 'fungi', 'eurotiomycetes', 'lecanoromycetes', 'sordariomycetes'];Swaampen (lat.
socially-constructed-person;['leonardo da vinci'];Leonardo da Vinci
socially-constructed-person;['william shakespeare'];William Shakespeare
socially-constructed-person;['rené descartes', 'rene descartes'];René Descartes [ʁəˈne deˈkaʁt]
socially-constructed-person;['rembrandt van rijn', 'rembrandt'];Rembrandt Harmenszoon van Rijn
socially-constructed-person;['john locke'];John Locke [dʒɒn lɒk]
socially-constructed-person;['gottfried wilhelm leibniz'];Gottfried Wilhelm Leibniz
socially-constructed-person;['abraham lincoln'];Abraham Lincoln
socially-constructed-person;['carl von linné', 'carl von linne', 'linnaeus'];Carl von Linné (uk Carl Nilsson Linnæus, * 23.
socially-constructed-person;['jean-jacques rousseau'];Jean-Jacques Rousseau [ʒɑ̃'ʒak ʁu'so]
socially-constructed-person;['josef haydn'];Joseph Haydn
socially-constructed-person;['wolfgang amadeus mozart'];Joannes Chrysostomus Lorenz Wolfgangus Michelangelo Theophilus Amadeus Raphael Mozart wus en kompoonist üt Ååstenrik.
socially-constructed-person;['napoleon bonaparte', 'napoléon bonaparte'];Napoleon Bonaparte, üüs Keiser Napoleon I.,
socially-constructed-person;['vincent van gogh'];Vincent Willem van Gogh
socially-constructed-person;['bertrand russell'];Bertrand Arthur William Russell, 3.
socially-constructed-person;['pablo picasso'];Pablo Ruiz Picasso
socially-constructed-person;['franz kafka'];Franz Kafka
socially-constructed-person;['ludwig wittgenstein'];Ludwig Josef Johann Wittgenstein
socially-constructed-person;['elisabeth ii.', 'elisabeth ii', 'elizabeth ii'];Elisabeth II. (* 21.
socially-constructed-person;['george washington'];George Washington [ˈwɒʃɪŋtən]
socially-constructed-person;['theodore roosevelt'];Theodore Roosevelt, Jr.
socially-constructed-person;['william howard taft'];William Howard Taft
socially-constructed-person;['woodrow wilson'];Thomas Woodrow Wilson [ˈtɒməs ˈwʊdɹoʊ ˈwɪlsən]
socially-constructed-person;['warren g. harding'];Warren Gamaliel Harding
socially-constructed-person;['john adams'];John Adams
socially-constructed-person;['herbert hoover'];Herbert Clark Hoover
socially-constructed-person;['franklin delano roosevelt', 'franklin d. roosevelt'];Franklin Delano Roosevelt [ˈfɹæŋk.lɪn ˈdɛlənoʊ ˈɹoʊzə.vɛlt]
socially-constructed-person;['john f. kennedy'];John Fitzgerald „Jack“ Kennedy
socially-constructed-person;['lyndon b. johnson'];Lyndon Baines Johnson
socially-constructed-person;['gerald ford'];Gerald Rudolph Ford, Jr.
socially-constructed-person;['jimmy carter'];James Earl „Jimmy“ Carter Jr.
socially-constructed-person;['thomas jefferson'];Thomas Jefferson
socially-constructed-person;['ronald reagan'];Ronald Wilson Reagan (6.
socially-constructed-person;['bill clinton'];William Jefferson „Bill“ Clinton
socially-constructed-person;['augustus'];Augustus
socially-constructed-person;['hertooch', 'hertoochdoom'];En hertooch as en aadelstiitel.
socially-constructed-person;['hans christian andersen'];Hans Christian Andersen
socially-constructed-person;['charles baudelaire'];Charles-Pierre Baudelaire [ʃaʀl.pjɛʀ bodlɛʀ]
socially-constructed-person;['langobarden'];A Langobarden wiar en germaans fulk an hiard mä tu a Sueben.
socially-constructed-person;['delaware county pa', 'delaware county'];Delaware County as en county uun Pennsylvania uun Ameerikoo mä 550.000 iinwenern (2000).
socially-constructed-person;['onondaga'];Da Onondaga san åån foon da fiiw stame foon da Irokese.
socially-constructed-person;['sierra leone'];Sierra Leone [siˈɛʁa leˈoːnə], amtelk Republiik Sierra Leone, as en stoot uun a waast faan Aafrika.
socially-constructed-person;['jiises krast', 'krast'];Jiises Krast (faan griichisk: Ἰησοῦς Χριστός Iēsous Christos, iɛːˈsuːs kʰrisˈtos, Jiises, di sualewt) as efter't Nei testament Gods sön, di tu a minsken schüürd wurden as, am's tu erliasin.
socially-constructed-person;['dante alighieri'];Dante Alighieri
socially-constructed-person;['francesco petrarca'];Francesco Petrarca
socially-constructed-person;['sokrates'];Sokrates wiar en greks filosoof.
socially-constructed-person;['wikinger'];Wikingern san en skööl faan nuurdgermaans an baltisk fulken, diar bi Nuurd- an Uastsia lewet haa.
socially-constructed-person;['dwight eisenhower', 'dwight d. eisenhower', 'dwight david eisenhower'];Dwight David „Ike“ Eisenhower
socially-constructed-person;['edward lear'];Edward Lear (* 12.
socially-constructed-person;['julius cäsar', 'cäsar', 'gaius iulius caesar', 'gaius julius cäsar', 'julius caesar'];Gaius Iulius Caesar [ˈgaːjʊs ˈjuːlijʊs ˈkae̯sar] (schiisk: Gaius Julius Cäsar. * 13.
socially-constructed-person;['erasmus faan rotterdam'];Desiderius Erasmus faan Rotterdam
socially-constructed-person;['calvin coolidge'];John Calvin Coolidge, Jr.
socially-constructed-person;['harry s. truman'];Harry S. Truman
socially-constructed-person;['john maynard keynes'];John Maynard Keynes, 1.
socially-constructed-person;['charles darwin'];Charles Robert Darwin [tʃɑrlz ˈɹɒb.ət 'dɑː.wɪn]
socially-constructed-person;['siddhartha gautama'];Siddhartha Gautama
socially-constructed-person;['johannes kepler'];Johannes Kepler
socially-constructed-person;['immanuel kant'];Immanuel Kant
socially-constructed-person;['martin luther'];Martin Luther
socially-constructed-person;['euklid'];Euklid faan Alexandria woort miast bluas Euklid näämd.
socially-constructed-person;['galileo galilei'];Galileo Galilei
socially-constructed-person;['jaakob ii.'];Jaakob II.
socially-constructed-person;['chlodwig i.'];Chlodwig I.
socially-constructed-person;['aristoteles'];Aristoteles
socially-constructed-person;['albert einstein'];Albert Einstein (* 14.
socially-constructed-person;['nikolaus kopernikus', 'nicolaus copernicus'];Nikolaus Kopernikus
socially-constructed-person;['anton tschechow', 'anton pawlowitsch tschechow'];Anton Pawlowitsch Tschechow [ˈtʃʲɛxəf]
socially-constructed-person;['wladimir leenin', 'wladimir iljitsch lenin'];Leenin, Wladimir Leenin of Wladimir Iljitsch Leenin
socially-constructed-person;['fjodor michailowitsch dostojewski'];Fjodor Michailowitsch Dostojewski
socially-constructed-person;['joosef staalin'];Joosef Bessarionowitsch Staalin
socially-constructed-person;['john napier'];John Napier, Laird of Merchiston
socially-constructed-person;['miguel de cervantes'];Miguel de Cervantes Saavedra
socially-constructed-person;['neil armstrong'];Neil Alden Armstrong
socially-constructed-person;['bürgermääster', 'bürgemäister', 'bürgermeister', 'bürgermäästerin', 'büürfööger', 'büürfööges', 'boowerbürgermääster'];En bürgermääster stäänt en gemeen of stääd föör.
socially-constructed-person;['richard nixon'];Richard Milhous Nixon
socially-constructed-person;['george h.w. bush', 'george h. w. bush'];George Herbert Walker Bush
space-region;['tiarling', 'dööbel'];Di Tiarling (Uurt kumt fan di Spöli-Tiarling, latiinsk Kubus, (öö.) dööbel), uk likmaatigi Hexaeder [hɛksaˈeːdər], "Soks-Sirer" es en Kwāder, hurön ali Siren lik lüng sen.
space-region;['weederskeel'];At weederskeel as at grens tesken iintoochregiuunen faan struumer.
